[English],101,61,64,4,"September 13, 2011 ",Nice Italian place,"Antwerp, Belgium","We were seated outside, which was nice. Although one of uw was siting on a not so comfortable bench. I took the pasta with truffel and liked it and I now that my partner was also pleased with the ravioli she got. The wine was...More"
[English],101,4,,3,"April 24, 2011 ",Good... if you know what to expect,"Reykjavik, Iceland","Very good Italian food. The portions were large and the courtyard setting was very comfortable on a sunny day. The staff wasn't very helpful though and they were not afraid to show their displeasure when asked for simple things.

Don't miss it on a sunny...More"
[English],101,5,3,5,"March 28, 2011 ",The authentic Italian Food.,"Malmo, Sweden",This Italian restaurant have a special atmosphere so cosy and the pizzeria too. I have been several times since december i really love the lunch so tasty and the pizza is authentic italian the wine and desserts too. The staff  were fast and kind. If...More
[English],101,1,2,2,"January 8, 2011 ",The pizza I tried was really bad.,"Lund, Sweden","This was supposed to be the best pizza in town, so we went there for the pizzas. It's a very small, rather cozy local, in a rather picturesque courtyard (if it's summer).
Unfortunately my choice of pizza - Ventricina was far from a good one....More"
[English],101,11,2,3,"January 1, 2011 ",Very average lunch,"Lund, Sweden",Interesting location. We had lunch at Italia. Service was fast and friendly. But food somehow disappointing.
[English],101,29,18,3,"June 20, 2010 ",Confusing restaurant,Iceland,"This restaurant looks very nice, inside this cosy alley, with lots of rose bushes growing around you. However the restaurant is quite confusing. We sat down at a table, were given the menu. However there were no pizzas on that menu, so we asked for...More"
[English],101,2,2,2,"June 2, 2010 ","Good food, terrible service - stay away",Lund,"Good italian food at reasonable prices. Extremely rude staff though, I will never pay them a visit again. If you want italian food, Gattostretto is a much better choice, for pizza go to V.E.S.P.A."
[English],101,153,155,5,"February 22, 2010 ","Good pizza, nice staff,  cosy little restaurant","Vasteras, Sweden","I had the pizza Generosa, with italian ham and topped with rocket. It was really good, really Italian style. 
The house red wine was good with the pizza.
A good cappucino rounded off the meal.
Recommended!
Note: the restaurant is actually two restaurants: One with...More"
[English],101,35,14,5,"September 27, 2009 ",A hidden gem,Northampton,I came across this restuarant by accident a few years ago and always return each year.  On the latest visit (Sept 09) I discovered that the other entrance is about 1 minute walk from my hotel!!!  Food is excellent along with the service and the...More
[English],101,1,,5,"September 16, 2008 ",Best Italian in Lund,strasbourg,"By far the best local Italian restaurant with excellent pizzas
, well chosen wine-list and superb service, been there twice"
[English],101,,,3,"July 17, 2008 ",Best Pizza in town!,"Lund, Sweden",Best Pizza in town!
[English],101,45,25,2,"June 22, 2008 ",Lacking service and pasta that was far too salty (multiple people at the table commented on this).,,Lacking service and pasta that was far too salty (multiple people at the table commented on this).
[English],101,1,1,3,"January 7, 2008 ","Fantastic pizza, uneatable pasta...","Lund, Sweden","Fantastic pizza, uneatable pasta..."
[English],101,,,3,"November 24, 2007 ",nice!,,nice!
[Swedish],147,7,1,1,1 week ago ,Riktigt dåligt,"Lund, Sweden",Åt lunch tillsammans med vänner. Stuvade morötter o ärtor med pasta var en riktigt dålig lunch. Den andra lunchrätten med...More
[Swedish],147,47,8,5,"December 11, 2018 ",Trevliga pizzor som känns genuina,"Staffanstorp, Sweden","Blir alltid nöjda av deras pizzor, spännande varianter.
Har ett trevligt utbud av öl och vin.
Ganska trång restaurang där...More"
[Swedish],147,163,40,3,"November 26, 2018 ",Okay; men inte så mycket mer,"Malmo, Sweden","Det här är helt okay, men inte så mycket mer.  Traditionella italienska rätter rakt igenom. Dock saknas det där lilla...More"
[Swedish],147,32,3,5,"November 10, 2018 ",Utsökt pizza och bra service,"Genoa, Italy","Utsökt pizza med mycket god botten och topping. Mycket gott husets röda vin, skulle varit lite varmare men annars utsökt....More"
[Swedish],147,45,4,4,"October 28, 2018 ",Rustic,,"Goda pizzor, bra deg, bra råvaror, jag har förvisso ätit bättre men är likväl en återkommande kund. Väl värt ett...More"
[Swedish],147,2,,2,"October 24, 2018 ",Bra service men sämre mat,"Floda, Sweden",För att vara en italiensk restaurang så var då inte pastan i klass med en sådan och skaldjuret bestod av...More
[Swedish],147,88,10,3,"October 16, 2018 ",Tjocka bottnar,"Lund, Sweden","En kombinerad pizzeria och restaurang, med olika bordsplacering beroende på vad man vill äta. Ok, det är inte riktigt som...More"
[Swedish],147,47,16,2,"October 16, 2018 ","Har bytt ägare, eller borde kanske göra det?",Lund,"En restaurang är väl aldrig bättre än vid det senaste besöket, och då var det verkligen inte speciellt bra. Har...More"
[Swedish],147,333,37,4,"October 7, 2018 ",Jättegoda pasta,"Gothenburg, Sweden","Olika jättegoda pastor för hela familjen. Italienskt tillagade utan fusk. Lite omständig servering och betalningen, men fantastisk god mat."
[Swedish],147,35,22,1,"October 3, 2018 ",Uruselt bemötande! :(,"Lund, Sweden",I lördags var vi fyra vänner som tänkte äta myslunch på Italia. Två av oss var på besök i Lund...More
[Swedish],147,47,10,2,"August 24, 2018 ",Bättre förr,"Lund, Sweden","helt okej mat men servicen är inte okej, ägaren kan uppträda direkt otrevligt om man till exempel frågar om man...More"
[Swedish],147,108,12,3,"August 20, 2018 ",Bra familjeresturant,"Stockholm, Sweden","God och vällagad mat samt trevlig innegård som är perfekt för ljumna sommarkvällar. Serveringspersonalen talade inte svenska, vilket är väl...More"
[Swedish],147,93,12,3,"August 14, 2018 ",Ok,"Lund, Sweden",Har ätit här ett antal gånger. Helt ok mat men inte mer än så. Pizzorna är ganska goda och det...More
[Swedish],147,17,1,4,"August 10, 2018 ",Trevlig middag,,"Det bästa är innergården.
Den trevliga miljön kombinerad med god, klassisk italiensk mat ger högt betyg. Fint vinsortiment."
[Swedish],147,1,,2,"August 3, 2018 ",Besviken pizza kväll,,"Pizzas bar bränd och man skulle behöva grill bestick för att komma igenom pizzan
Det var oxå väldigt lite ingredienser...More"
[Swedish],147,7,,1,"July 31, 2018 ",Mycket besvikna!,"Hollviken, Sweden",Såg fram emot en god middag i mysig miljö. Det första vi får reda på när vi kommer är att...More
[Swedish],147,1,,1,"July 31, 2018 ",Extremt besviken. Välj ett annat ställe. ,,Kvällen var en stor besvikelse. Det började med att köket stängde tidigare än vad som stod på hemsidan vilket gjorde...More
[Swedish],147,1,,1,"July 30, 2018 ",Stor besvikelse,,Har ätit hä tidigare och varit mycket nöjd med maten (en annan ägare). Men nu är det mycket dålig mat....More
[Swedish],147,4,1,4,"July 29, 2018 ",Bra restaurang,"Rimbo, Sweden","Välsmakande mat och trevlig servicepersonal. Vi åt trerätters meny med bruchetta, havsaborre och panacotta. Mycket bra mat."
[Swedish],147,2,4,2,"July 29, 2018 ",Besvikna,"Lauderdale by the Sea, Florida",Här ska du inte äta om du kan italienska mat. Trots italienare i personalen så smakar det som en dålig...More
[Swedish],147,54,23,3,"July 24, 2018 ","Trevlig miljö, ordinär mat och lite sämre service",Lund,En varm sommarkväll är det alldeles fantastiskt att sitta på den vackra innergården och äta. Vi beställde trerättersmenyn; det var...More
[Swedish],147,132,21,4,"July 22, 2018 ",Bra lunch i trevlig miljö,Linköping,Vi åt lunch och satt på innergården. Ett fåtal lunchrätter till överkomliga priser. Vi åt pasta resp sallad. Både rätterna...More
[Swedish],147,3,2,4,"July 6, 2018 ",Som att vara i Italien för en stund ,,"Mycket trevlig och vänlig personal. God service. Fantastisk innergård ger en känsla av att vara i Italien, mitt i centrala...More"
[Swedish],147,1,,1,"June 28, 2018 ",Hemskt,"Lund, Sweden",Risotton med svamp var den äckligaste risotton jsg ätit och fick till och med en stor sten i. Sedan fick...More
[Swedish],147,128,33,3,"May 25, 2018 ",Servicen är ett skämt...,"Lund, Sweden","Alltså tyvärr, spricker detta ställe på en sanslöst låg nivå avseende service personalen. Helt enkelt outbildad och det smittar av...More"
[Swedish],147,251,51,3,"May 22, 2018 ",Bra lunchpasta,"Loddekopinge, Sweden","Här serveras i regel bra pasta till lunch. Oftast en med kött och en vegetarisk, eller en ”misto”. Trevlig uteservering...More"
[Swedish],147,3,,2,"May 21, 2018 ",Micrad bolognese,,Beställde en penne bolognese och misstänker att den var micrad eftersom köttfärsen var iskall på vissa ställen och brännhet på...More
[Swedish],147,12,2,4,"May 1, 2018 ",Superbra lunchpasta och fin uteterass,"Solna, Sweden","Riktigt god pasta till bra pris på lunchen, mysig uteservering i lä från vinden. Kommer gärna tillbaka."
[Swedish],147,107,16,4,"March 25, 2018 ",Mysig,"Gothenburg, Sweden",Bra och trevlig restaurang. Maten var god och helt klart prisvärd. Trevligt personalbemötande. Ligger centralt.
[Swedish],147,36,5,4,"December 25, 2017 ",God italiensk mat,"Lund, Sweden",Ett bra italienskt hak som serverar pizza och pasta. Alltid varit nöjd med maten här så återkommer mer än gärna.
[Swedish],147,655,409,5,"December 5, 2017 ",Mycket trevlig överraskning,"Solvesborg, Sweden",Snubblade över denna undangömda Italienska pärla i en av bakgatorna i Lund när vi julshoppade. Det var både gott och...More
[Swedish],147,385,49,4,"October 21, 2017 ",Italia i Lund,"Lund, Sweden","En mycket trevlig italienske restaurang i central Lund. Ligger lite undanskymd inne på en gård.

Mysigt men kanske lite trångt....More"
[Swedish],147,65,11,4,"October 14, 2017 ",Mysigt men  trångt,"Malmo, Sweden",Vi båda åt en pasta och både tyckte det var supergott. Priserna är okej och bra personal. Sitter man två...More
[Swedish],147,2,,1,"October 3, 2017 ",Väntade lääänge på maten... ,"Varberg, Sweden",Vi var två vuxna och en 8- åring som besökte restaurangen i augusti. Vi väntade en kvart innan vi till...More
[Swedish],147,12,4,3,"October 2, 2017 ","Mycket bra middag, sämre lunch","Malmo, Sweden","Bra restaurang för kvällen, sämre till lunch. Underbar restaurang att njuta en middag på. Det är lätt att sedan tro...More"
[Swedish],147,32,5,4,"September 28, 2017 ",Gott och trevligt! ,"Linkoping, Sweden",Bra italiensk meny. Åt Rigatoni som smakade bra. Flera bra viner på glas. Trevlig och uppmärksam service. Inga problem att...More
[Swedish],147,28,3,4,"September 21, 2017 ",Mysigt och romantiskt. ,,Mycket god mat och service. Romantiskt. Vi fick snabbt bord för två. Maten smakade fantastiskt och var mycket välgjort. Ligger...More
[Swedish],147,155,22,4,"September 11, 2017 ",Mycket god italiensk mat,"Akarp, Sweden","Vi var ett större sällskap, och vi åt pasta/risotto. Maten var mycket bra, servicen vänlig och snabb.

Restaurangen ligger på...More"
[Swedish],147,41,6,3,"September 6, 2017 ",God Antipasto och Pizza.,Singapore,Måndag kväll och middag med yngsta dottern. Första gången för mig på denna resturang så blev gatt överraskad av den...More
[Swedish],147,17,1,1,"September 4, 2017 ",Blivit så mycket sämre,"Lund, Sweden","Har gillat Italia tidigare men blev väldigt besviken nu. Pasta som kom en minut efter beställningen, gissar alltså att den...More"
[Swedish],147,41,27,3,"August 16, 2017 ",Nja,"Gothenburg, Sweden",Var där med familjen och inne i restaurangen var det närmast kaos... Personal yrade runt och det var trångt... Sen...More
[Swedish],147,19,6,3,"August 3, 2017 ",Helt ok,,Är väl inte fantastiskt men helt ok lunch med bra pasta. Rent och snyggt med bra övervåning och bra priser....More
[Swedish],147,12,3,2,"July 28, 2017 ","Ok pizza, överkokt pasta, extremt dålig service","Malmo, Sweden","Jag skulle verkligen vilja gilla detta mer än vad jag gör. Deras pizza är helt ok, ligger runt hörnet så...More"
[Swedish],147,11,,5,"July 26, 2017 ",Kanongoda pizzor!,,"Perfekt lagade och serverade pizzor. Kanske lite dyrare än på andra pizzerior, men maten och atmosfären är väl värd den...More"
[Swedish],147,21,17,1,"July 18, 2017 ",Skäms för ert skämda kött,Sweden,Italia var populärt för sisådär 10-15 år sedan när man var ny student i Lund. Då var tillräckligt många omedvetna...More
[Swedish],147,5,,5,"July 11, 2017 ",God mat i innergård mitt o stan,,Italia il Ristorante har Pasta eller pizza som passar alla som gillar italienskt mat mitt i Lund. Mitt i gågatan...More
[Swedish],147,1,1,1,"June 16, 2017 ",Fick aldrig beställa,,"Satt cirka 20 minuter, personalen kom aldrig för att ta vår beställning.  Gick till slut därifrån hungriga och sura"
[Swedish],147,37,16,1,"June 14, 2017 ",Otroligt långsamt ,"Lund, Sweden",Det tog otroligt lång tid att få maten.  Två timmar! När vi påtalade att det dröjde fick vi skäll av...More
[Swedish],147,14,,4,"June 5, 2017 ",God mat och bra servive,,Vi var fyra personer som åt trerätters med husets vin .Antipasto DI vitello mycket god även Rigatoni al filleto di...More
[Swedish],147,1,1,2,"May 22, 2017 ",Dålig service,,Att det ska ta över en timma att få 7 pastarätter serverade är under all kritik. Maten var ganska god.
[Swedish],147,385,49,4,"April 5, 2017 ",En god pasta,"Lund, Sweden","Italia ligger mitt  i Lund, men kanske inte är helt lätt att hitta inne på gården längs gågatan

Maten är...More"
[Swedish],147,63,9,3,"March 8, 2017 ",Enkelt men trevligt ,"Helsingborg, Sweden","Var och åt en middag med vänner innan en föreställning. Snabb servering, kanske pga att vi var i tidigaste laget...More"
[Swedish],147,2,1,2,"February 4, 2017 ",Dåligt bemötande och kall mat,,Har ätit på italia i Lund tidigare och har då gillat det men idag var nog tyvärr sista gången. Personalen...More
[Swedish],147,8,5,5,"January 3, 2017 ",Myskväll med sin livsvän,"Simrishamn, Sweden","Kvällen började bra på Italia il restaurante, började med en 2-rätters, dessa rätter var helt underbara. Lugn miljö på ovanvåningen...More"
[Swedish],147,117,19,3,"December 9, 2016 ",Helt ok lunch,,Restaurangen ligger mycket pittoreskt i centrala Lund. Pastan var lite väl al dente. Mycket  trevlig miljö.
[Swedish],147,509,63,4,"December 2, 2016 ",Mycket god lunch,"Malmo, Sweden",Åt en sen lunch med gamla vänner.  Åt mycket goda lammracks medan mina vänner valde andra rätter som också var...More
[Swedish],147,12,,5,"November 20, 2016 ",Fantastiskt,,Trevlig personal och god mat. Smakar som man var på plats i Italien. Lite många goda rätter så det är...More
[Swedish],147,16,6,4,"October 22, 2016 ",Afterwork,"Lund, Sweden",Åt kvällsmat med mina kollegor. Jag åt risotto med räkor. God smak. Dock tyckte jag att riset var lite för...More
[Swedish],147,12,6,4,"October 18, 2016 ",Alltid bra.,,"Alltid gott, trevligt och väldigt behaglig miljö. Barnens favorit, hit går vi när barnen bestämmer. Trevlig kvarterskrog."
[Swedish],147,35,3,3,"October 6, 2016 ",En pizza med höga förväntningar ,,"Beställde en Parma och en italiensk öl, fick vänta en del då det verkar vara mycket populärt så spänningen steg...More"
[Swedish],147,38,6,4,"October 5, 2016 ","Autentisk italiensk miljö, men långa väntetider","Lund, Sweden","Maten är riktigt god, restaurangmiljön känns genuin med en fin uteservering, möjligen lite dyrt och framförallt långa väntetider på maten....More"
[Swedish],147,7,1,3,"September 24, 2016 ",Middag,,Pizzorna är jättegoda och pastan är god och intressant tillagad. Pastan är dock väldigt gräddig. Vi fick vänta länge på...More
[Swedish],147,16,5,4,"September 22, 2016 ",Bra lunchpizza,,"Detta är en italiensk restaurang som serverar okej pasta men bra pizzor vid lunchtid. Betyget snuddar på en femma, men...More"
[Swedish],147,14,6,1,"September 17, 2016 ",Segt och dåligt kött,"Skottorp, Sweden",För dom pengarna har jag alldrig ätit sämre. Kall mat och dåligt kött. Vi beställde fyra olika huvudrätter och bara...More
[Swedish],147,9,3,5,"September 14, 2016 ",Godomliga smaker av Medelhavet!,"Kavlinge, Sweden","Fantastisk restaurang med mysig omgivning.  Alltid trevlig och proffsig personal som levererar högt standard. Maten av högsta kvalité! 
Boka bord...More"
[Swedish],147,342,161,3,"August 27, 2016 ",Små portioner,Lund,Portionerna kunde vara större. Man blir mätt men det är knappt. Maten är ok men inget speciellt. Al femte pasta...More
[Swedish],147,21,7,5,"August 12, 2016 ",Jättegod mat,,Ett trevligt ställe med jättegod mat och trevlig personal. Vi åt röding och anka som var jättegott. Glass och tiramisu...More
[Swedish],147,3,,5,"August 10, 2016 ",Underbart,"Lund, Sweden",Italia är en restaurang vi ständigt återkommer till. Förutom fantastisk servicekänsla hos personalen är det väldigt mysigt och otroligt god...More
[Swedish],147,53,17,2,"July 20, 2016 ",Medelbra från Medelhavet. ,"Jonkoping, Sweden",Lunch med familjen. Tre olika rätter där den vegetariska var mycket god. De andra saknade salt och peppar men var...More
[Swedish],147,50,11,3,"July 17, 2016 ",Helt OK,"Vasteras, Sweden",Helt Ok restaurang. Maten ok men inte mer. Något ointresserad serveringspersonal. Uteservering på en innergård.
[Swedish],147,187,22,4,"July 9, 2016 ",God och vällagrad italiensk mat.,"Vasteras, Sweden","Maten var vällagad och god vilket vi även hade förväntat oss, men vi blev besvikna på att de tog betalt...More"
[Swedish],147,11,2,4,"June 28, 2016 ",Charmig personal och god mat,"Lund, Sweden",Besökt Italia två gånger. Väldigt trevlig personal och supermysig innergård. Enkla pastarätter som smakar gott men inte wow. Väldigt fin...More
[Swedish],147,50,14,4,"June 19, 2016 ",Vardags mys!,"Lund, Sweden",En stunds avkoppling med god mat och dryck en vanlig tisdag är aldrig fel! Att det dessutom finns glutenfritt att...More
[Swedish],147,64,28,3,"June 18, 2016 ",When a friend leaves.,"Gothenburg, Sweden",Detta är en restaurang som en gång var uppe och snuddade på toppen. Med såväl gastronomiska målsättningar likväl som gediget...More
[Swedish],147,193,21,4,"June 18, 2016 ","God mat, tveksam salldsbuffé","Lund, Sweden",Maten brukar alltid vara bra och var så även vid detta besök. Men samtidigt är 95 kr för dagens bland...More
[Swedish],147,75,13,4,"June 9, 2016 ","Jäktad personal, missad bokning men god mat","Boras, Sweden","Vi var ett sällskap på fyra personer, där två var välkända stamgäster. Man hade bokat, men när vi kom dit...More"
[Swedish],147,3,4,1,"May 29, 2016 ",Morsdag,,Inte nog med att vi blev dåligt bemötta så fick vi en viss tid på oss att äta. Maten var...More
[Swedish],147,86,25,2,"May 22, 2016 ",Den här kvällen var inte bra,"Arboga, Sweden","Vi har ätit här varje gång vi besökt Lund men den här gången blev det ett bottennapp.
Det dröjde en...More"
[Swedish],147,123,23,4,"May 10, 2016 ",Väldigt bra mat i mysig uteservering ,"Kavlinge, Sweden",Vi tog en spontan middag på italia i Lund. De hade enbart ett bord kvar som vi fick en tisdagskväll...More
[Swedish],147,15,4,5,"May 9, 2016 ",Favorit ställe,"Bjuv, Sweden","Jättegod pizza och en helt fantastisk personal! !
Går gärna hit på lunch eller ibland på kvällen. 
Härligt på sommaren...More"
[Swedish],147,226,69,3,"May 4, 2016 ",Enkelt men gott,"Lund, Sweden","Italia serverar god och rustik mat med pasta som återkommande tema. Restaurangen ligger centralt i Lund, borden finns på entrévåningen...More"
[Swedish],147,21,4,2,"May 1, 2016 ",Utsökt och bra service,"Gothenburg, Sweden",Kanonpersonal och utsökt mat. Dock hade jag denna person som bordsgranne och därav det dåliga betyget. En svag tvåa...
[Swedish],147,1,2,2,"April 23, 2016 ",Bortglömd bokning,,"Jag bokade bord ca 4 dagar innan vistelsen, detta via mail med bekräftelse att vi var hjärtligt välkomna. Trots detta...More"
[Swedish],147,123,15,4,"March 20, 2016 ",Italien,"Karlshamn, Sweden","Trevlig restaurang med familjekänsla mitt i Lund. Pastan ljuvlig & efterrätten lika ljuvlig. 
Hade varit trevligt om personalen hade varit...More"
[Swedish],147,4,3,4,"March 16, 2016 ",Klassisk italienare,"Lund, Sweden","Här finns förstås allt man förväntar sig av det italienska köket på menyn, och allt jag ätit har varit gott...More"
[Swedish],147,86,25,4,"March 6, 2016 ",Vänligt,"Arboga, Sweden","Om du bokar tidigt så är det barnvänligt, och kanske även senare. Hyggliga priser och lätt att halvera portionerna."
[Swedish],147,178,33,3,"March 3, 2016 ",Bra lunch.,,Besökte restaurangen på en lunch. God och mycket mat. Ett mindre salladsbord finns som man plockar till lunchen. Prisvärt.
[Swedish],147,23,1,4,"February 10, 2016 ",Bra pasta,"Veberod, Sweden",Var här med sambon och åt 3-rätters. Först av allt så är det ingen stor restaurang och det var mycket...More
[Swedish],147,202,45,2,"February 4, 2016 ",Nix,,Bra service och trevlig miljö på andra våningen. Vi blir väl omhändertagna och får beställa snabbt. Vi tar tre olika...More
[Swedish],147,78,29,4,"January 29, 2016 ",Pasta!! och mycket mer!,Löberöd,Också en av mina favoriter i Lund. Har nog ärit det messta på meny och köket har alltid levererat. Favoriten...More
[Swedish],147,3,1,4,"January 9, 2016 ",Mycket bra restaurang,,Firade födelsedag med ett sällskap på 11 personer och personalen skötte allt exemplariskt. Vi förbeställde maten dock. Något stor förrätt...More
[Swedish],147,64,15,5,"December 27, 2015 ",Italiensk mat med utmärkt service.,"Partille, Sweden","Riktiga italienska pizzor, (ingen kebab eller ananas), med riktigt tunn botten. Riktigt god pasta, men framförallt utmärkt service till ett...More"
[Swedish],147,21,10,4,"December 26, 2015 ","Bra service, bra mat!","Lund, Sweden","Här vet du vad du får. Bra service, klassisk italiensk mat. Dock kan det bero lite på vem som jobbar...More"
[Swedish],147,16,10,4,"December 15, 2015 ",Ätit många gånger både i restaurangen och pizzerian,Sweden,Oftast när jag kommer till Lund går jag och en kollega på pizzerian. Vi har ätit på pizzerian i flera...More
[Swedish],147,4,1,4,"December 14, 2015 ",Bra italienskt,"Lund, Sweden",Stället är uppdelat på en mindre pizzeria och en större restaunrant. Båda delarna har haft bra mat när jag besökt...More
[Swedish],147,7,1,4,"November 15, 2015 ",God och italiensk pizza som kan rekommenderas,"Oslo, Norway","Maten är god, men servitrisen är sen med att ta bort tomma glas, höra om vi vill ha mer att...More"
[Swedish],147,100,50,3,"November 4, 2015 ",Mysig....,"Malmo, Sweden","...innergård, centralt läge! Har ätit pizza ett par gånger...,vågar inte testa pastan!!!
pizzorna var ok, tunna och lagom stora!!! servicen...More"
[Swedish],147,19,7,2,"October 24, 2015 ",Beställ inte Osso buco,,"Osso buco. Köttet var hårt och segt, fullt av senor. När jag påtalade det, sade servitören att Osso buco ska...More"
[Swedish],147,40,11,5,"October 21, 2015 ",Bra pizza i Lund,"Rydeback, Sweden","Goda vällagade pizzor i Lund. Ligger inne på en går. Finns 2 ingångar.
Nu vet jag inte vad jag mer...More"
[Swedish],147,1,4,2,"September 30, 2015 ",Larv i maten,"Lund, Sweden","Åt lunchpastan och hittade en larv i maten. Misstag sker, men när jag visade det för personalen så var bemötandet...More"
[Swedish],147,6,,5,"August 17, 2015 ",Deras pasta frutti di mare....,"Lund, Sweden","Vår favoritrestaurang i Lund och vi är en ganska kräsen italiensk familj. Vi älskar speciellt deras spaghetti frutti di mare,...More"
[Swedish],147,3,,4,"August 14, 2015 ",Lunds bästa pizza,"Lund, Sweden",Italia och Vespa slåss om att göra Lunds bästa pizza. Just nu leder nog Italia. Det här är pizza som...More
[Swedish],147,264,56,4,"August 12, 2015 ",Trevlig pizzeria,"Lund, Sweden","Trevlig pizzeria med goda pizzor med fräscha och förstklassiga råvaror. Samma rörelse är uppdelad i dels restaurang och dels pizzeria,...More"
[Swedish],147,42,6,4,"August 11, 2015 ",Goda pizzor,,Italias pizzor blir man sällan besviken på. Riktigt goda och med tunn botten. Många pizzor att välja på till lunchen...More
[Swedish],147,25,4,3,"August 4, 2015 ",Populär restaurang,"Helsingborg, Sweden",Vi har besökt restaurangen både under lunchtid och kvällstid. Under lunchtid finns där många olika rätter att välja på. Även...More
[Swedish],147,174,27,4,"July 31, 2015 ",Mysigt och gott,"Stockholm, Sweden","Här har jag tidigare ätit en helt okej lunch, den här gången blev det en riktigt god middag. I sällskapet...More"
[Swedish],147,133,18,4,"July 19, 2015 ",Varm och god mat,"Lund, Sweden",Ytterligare en gång har jag varit och ätit här och nöjd igen. Vi var 4 tjejer som delade på 2...More
[Swedish],147,77,14,4,"July 5, 2015 ",Kvalitet,"Skåne Län, Sweden",Varierad meny med något för alla. Typiska italienska rätter med bra vinlista. Ett plus för att många serveras som separata...More
[Swedish],147,10,18,3,"June 24, 2015 ",Kunde varit bättre,"Malmo, Sweden",Trevlig resturang med bra läge i centrala Lund. Tvådelad restaurang med pasta i en lokalen och pizza i en annan...More
[Swedish],147,65,9,5,"May 31, 2015 ",Bästa pizzorna i Lund!,"Lund, Sweden","Goda pizzor och prisvärda pizzor med tanke på att det är lite finare pizzor. Bra råvaror, trevlig personal. Dock har...More"
[Swedish],147,37,16,1,"May 2, 2015 ",Vi blev utslängda och fick sten i maten,,Generellt har de goda pizzor och annan mat men det har hänt för många saker där med servicen som har...More
