[Swedish],147,115,27,4,"April 11, 2015 ",God mat som vanligt,"Dalby, Sweden","Mycket god mat och utomordentligt bra service. Trevlig miljö och mysig restaurang, kanske lite trångt. 
Det som drar ner betyget...More"
[Swedish],147,138,44,3,"March 28, 2015 ",Trångt o tung mat,"Lerberget, Sweden",Maten var väldigt god! Vi valde pasta bägge två. Den smakade mycket men där var tyvärr alldeles för mycket grädde...More
[Swedish],147,9,5,5,"March 16, 2015 ",Utmärkt lunch!,,"Alltid möjlighet till 3 olika rätter, som alla kommer omdelbart och smakar utsökt!
priset är överkomligt."
[Swedish],147,130,17,4,"March 12, 2015 ",Äkta italienskt,"Lund, Sweden",Bra menyer och mycket bra vinlista. Åt lammrostbiff som var perfekt tillagad och i tillräcklig mängd. Perfekt service. Det som...More
[Swedish],147,121,430,5,"March 8, 2015 ",För en riktig italienare,"Lund, Sweden","Mycket trevligt ställe, god mat, äkta italienska varor. Mysigt placerat inne på gården med en liten fontän i mitten och...More"
[Swedish],147,127,41,3,"February 3, 2015 ",Når inte ända fram,"Lund, Sweden","Ligger på innergård i centrala Lund och uteserveringen är mycket trevlig. Menyn är traditionell italiensk, men nivån på maten kunde...More"
[Swedish],147,15,12,4,"November 10, 2014 ",Italienskt så det förslår...,,En underbar pasta till mig samt min middagsgäst. En väl tilltagen portion med utsökt pasta och rikligt med sås så...More
[Swedish],147,23,7,5,"October 20, 2014 ",Mycket gott och väldigt trevligt,,"Än en gång blev konstaterades hur otroligt god italiensk mat det lagas på mysiga Ristorante Il Italia. Ett härligt, vänligt...More"
[Swedish],147,72,12,4,"October 14, 2014 ",God pasta i Lund,,"Vi besökte Italia med familjen. Det bör noteras att pizza serveras på en särskild pizzeria, som inte delas med restaurangen....More"
[Swedish],147,113,56,2,"September 30, 2014 ",Dyr och tråkig pasta,Sweden,Pastarätterna är definitivt inte prisvärda. Rättså dyra och intetsägande. Servicen sisådär. Jag skulle hellre lägga pengarna på en pizza. De...More
[Swedish],147,80,22,3,"August 5, 2014 ",Italienskt i gränden,"Lund, Sweden",Mysig utemiljö och eftersom vi kom tidigt på eftermiddagen var det inga problem att få bord. Vi beställde pasta med...More
[Swedish],147,71,15,4,"July 26, 2014 ",God pasta!,"Norrkoping, Sweden",Vi besökte restaurangen Italia i Lund en kväll i Juli. Vi åt pastarätten Fruti di Mare som var mycket god....More
[Swedish],147,21,10,4,"June 8, 2014 ",Suverän service ok mat!,"Lund, Sweden","Hit går vi gärna! Bra service och bra mat... Precis som det ska vara. Man känner sig speciell, välkommen och...More"
[Swedish],147,86,25,4,"March 6, 2014 ",Trevligt! Och gott,"Arboga, Sweden","Mycket trevligt bemötande. Bra personal. Familjärt!

Maten var väl inte i toppnivå men mer än acceptabelt för det priset.
Vi...More"
[Swedish],147,9,4,5,"January 12, 2014 ",Mycket prisvärt!,,Jättetrevlig restaurang och personal som är service minded. Beställde dagens fisk som var gösfilé med risotto och vitvinssås. Vi behövde...More
[Swedish],147,114,21,4,"January 7, 2014 ",Trevlig miljö och god pizza,"Linkoping, Sweden","Upplevde inte uteserveringen då vi var där i december, men jag tror det kan vara riktigt trevlig där en sommarkväll....More"
[Swedish],147,55,10,5,"November 9, 2013 ",Bra service,"Brämhult, Västra Götaland, Sweden",Vi var på affärsresa i Lund och valde att äta på restaurangen eftersom vi varit där en gång tidigare för...More
[Swedish],147,133,18,4,"October 28, 2013 ",God pizza,"Lund, Sweden","Vi hamnade av här av en slump. Vi blev väl omhändertagna av servitrisen och pizzan kom lagom snabbt, trots att...More"
[Swedish],147,368,138,3,"September 19, 2013 ",Inget speciellt,"Malmo, Sweden","Åt lunch ""Misto di pasta"". Lasagnen var ganska ordinär och den andra pastarätten (fusilli med broccoli och grädde) var inte...More"
[Swedish],147,21,11,3,"August 8, 2013 ",OK Pizza,"Lund, Sweden","Helt ok pizza. Kan ofta bli lite lång väntan på att få maten. Övrig mat är också helt ok, bra...More"
[Swedish],147,133,18,4,"July 22, 2013 ",Gott,"Lund, Sweden","God italiensk mat. Jag åt lammrostbiff som jag verkligen kan rekommendera, det var den godaste jag någonsin ätit, mycket smak...More"
[Swedish],147,158,32,4,"July 5, 2013 ",Bra italiensk restaurang,"Lund, Sweden","Bra italiensk restaurang, en av de bättre i stan, med bra pizza och god annan mat. Rekommenderas klart. Vi går...More"
[Swedish],147,41,32,4,"June 25, 2013 ",Mycket trevlig innergård,,"Trevlig italiensk mat. Jag tycker personligen att köttet är snäppet bättre än pizzan, fisken och de vegetariska. 

Innergården är väldigt...More"
[Swedish],147,175,66,3,"June 22, 2013 ",Bra förrätter,"Lund, Sweden",Förrätterna är rysligt bra... Men besvikelsen är total då man beställer pasta på en italiensk restuarang och det är så...More
[Swedish],147,42,13,4,"May 13, 2013 ",Mumsig mat och lagom informellt,Lund,Det finns alltid något på menyn som faller i smaken. Ett säkert kort i Lund. Det enda problemet är att...More
[Swedish],147,2,,4,"May 7, 2013 ",Mysig italiensk resturang,"Lund, Sweden",God italiensk mat i mysig miljö. Trevlig uteservering på innergården på sommaren. Inte så vansinnigt dyrt.
[Swedish],147,12,1,5,"May 5, 2013 ",Fantastiskt!,"Karlskrona, Sweden",Alltid lika trevlig restaurang att besöka om man gillar italiensk mat. Bra vinlista och förträfflig service!
[Swedish],147,26,10,3,"May 3, 2013 ",Prisvärd pizza,"Kalmar, Sweden",Mysig lokal och äkta italiensk smak på pizzan. Det som drar ner lite är servicen; vi satt en bra stund...More
[Swedish],147,3,1,3,"February 25, 2013 ",Mest värt för lunch!,,"Italia serverar bra mat, men servicen är inte riktigt lika bra. Även om det kan vara jobbigt att vara servitör...More"
[Swedish],147,10,,4,"January 22, 2013 ",Mysig restaurang,"Surfers Paradise, Australia",En mycket mysig restaurang som serverar mycket god mat med tanke på prisklassen. Lite lång väntetid emellanåt är en nackdel.
[Swedish],147,158,49,3,"September 12, 2012 ",Otroligt goda pizzor,"Lund, Sweden","bra läge centralt i Lund, trevlig innergård med stora parasoller, funkar att sitta ute på sommaren även om det renar,...More"
[Swedish],147,71,32,4,"August 9, 2012 ",Mysig och barnvänlig innergård...,Lund,"...med fantastisk pasta och pizza. På sommaren är detta en oas värt en omväg. Även maten håller hög klass, har...More"
[Swedish],147,3,17,2,"August 3, 2012 ",Nonchalant personal och dålig service,,Aldrig upplevt så otrevlig och nonchalant personal på restaurang tidigare! Vi satt i ca 15 minuter innan vi ens fick...More
[Swedish],147,342,161,4,"February 27, 2012 ",Bra lokal up market pizzeria,Lund,"Liten lokal med ca 40 platser med Italienskt stuk. Pizzorna är goda. om än lite salta, med goda tillbehör. Ingen...More"
[Swedish],147,29,13,4,"February 19, 2012 ",fin italiensk mat,"Lund, Sweden","mycket fin italiensk mat, åt lite dyrare hållet.
kan även rekommendera deras dagens fisk!
genomgående fin mat genom hela menyn,...More"
[Swedish],147,10,3,4,"December 14, 2011 ",Bäst pizza!,"Boras, Sweden","Pizzan är alltid jättegott. Lite dyrt, men de använder bra produkter. Åt på restaurangen en gång och var besviken. Service...More"
[French],9,17,2,4,"March 26, 2018 ",Diner,"Chauray, France","Restaurant sympathique ouvert et servant après 20 h...équipe agreable et très serviable.
Nourriture excellente."
[French],9,130,19,4,"February 9, 2017 ",Bonne adresse italienne à Lund,"Chamonix, France",Une terrasse pittoresque avec un bon service. Leurs pizzas sont excellente pas trop cher. Peut-être pas un grands choix du...More
[French],9,229,111,5,"July 20, 2016 ",la vraie cuisine italienne,"Gembloux, Belgium","Il est assez difficile de trouver un restaurant qui fait de la très bonne cuisine italienne, sans la transformer en...More"
[French],9,321,117,4,"April 20, 2016 ",Une bonne surprise,,Un bon italien en Suède. Le soleil est dans les assiettes s il n est pas dehors. Excellentes passa. Pas...More
[French],9,178,46,4,"August 15, 2015 ",Bonne pizzeria pour diner un peu tard à Lund,"Saint-Arnoult-en-Yvelines, France","C'est parfois le souci de la Scandinavie : passé 21h, difficile d'être accueillis dans les restaurants qui ont parfois fermé...More"
[French],9,49,13,4,"June 22, 2015 ",Une halte dîner!,hyeres,"Bon restaurant, visiblement connu des locaux car peu de tables libres! Un accueil pro et un service à la hauteur....More"
[French],9,261,102,4,"June 15, 2015 ",Cuisine italienne de qualité,"Paris, France",Ce restaurant italien du centre de Lund propose une carte intéressante et suffisamment variée de la simple pizza aux viandes...More
[French],9,18,9,4,"April 17, 2015 ",Très bon restaurant Italien,"Huisseau-sur-Cosson, France","Nous y sommes allés deux fois lors de notre séjour à Lund.
Les pâtes sont excellentes et c'est copieux.
Le...More"
[French],9,4,,4,"November 18, 2011 ",Bonnes pizzas,lorraine,"Un bon rapport qualité/ prix, surtout pour la Suède, par contre la serveuse n'est ni accueillante ni serviable. Et dire...More"
[Italian],5,573,221,4,"May 1, 2018 ",Molto buono,"Turin, Italy","Per una cena di lavoro arriviamo in questo ristorante anche se in genere evito di mangiare italiano all'estero, mi sono...More"
[Italian],5,6,3,5,"January 4, 2018 ",Due serate notevoli ,"Genoa, Italy",Siamo arrivati a Lund per seguire un importante torneo di basket. La seconda sera ci siamo imbattuti in questo ristorante...More
[Italian],5,30,6,4,"June 30, 2017 ",Buon rapporto qualità prezzo ,"Reggio Emilia, Italy","Ero già andato qui alcune volte e con diversi colleghi, sempre stranieri, che come molti amano la ns buona cucina....More"
[Italian],5,31,19,5,"February 15, 2016 ",Come in Italia,"Pesaro, Italy","Abbiamo mangiato in questo piccolo ristorante in una sera piovosa di settembre.  Eravamo capitati per caso, abbiamo mangiato un ottima...More"
[Italian],5,118,15,4,"July 16, 2015 ",Tutto bene!,"Central Norway, Norway","Un buon ristorante italiano, con  scelta e buoni ingredienti. E 'assaggiato molto buono, il servizio era molto buono e abbiamo...More"
[Danish],4,2,1,2,"December 27, 2015 ",Pre-made out of the box...,,"Hyggelig beliggenhed, annonym indretning, ligegyldig betjening. Færdiglavede forretter sammensat uden sjæl. Pastaret middel. Fint vinkort med godt udvalg af ""enkelte...More"
[Danish],4,185,35,4,"July 2, 2015 ",Dejlig middag,"Ballerup, Denmark",En dejlig middag. Maden var veltillavet med friskt grønt. Et stort plus er udvalget af vin i glas - man...More
[Danish],4,10,19,4,"March 5, 2015 ",Okay men ikke helt på niveau,"Malmo, Sweden",Ok spise sted men det formår ikke fuldt at levere et virkelig gennemført italiensk køkken. Jeg synes at maden smagte...More
[Danish],4,5,11,2,"September 18, 2011 ","Dårlig betjening, sure tjenere, lang ventetid, gennemsnitligt dårlig mad...","Fredensborg, Denmark","Ventede over 50 minutter på maden, der generelt var af dårlig kvalitet ;-( Det er ingen restaurent men et ""oversize...More"
[Spanish],4,344,121,3,"June 21, 2018 ",No está mal pero no es un auténtico restaurante italiano,"Madrid, Spain","No está mal, pero tampoco lo recomendaría.
Los ingredientes no son malos, pero no es una pizza italiana de verdad....More"
[Spanish],4,336,76,4,"August 29, 2017 ","Comida apetitosa, buen trato y precio razonable","La Coruna, Spain",Uno de los pocos lugares para cenar que hay en Lund hasta latas horas (me refiero sobre las 9 -...More
[Spanish],4,116,78,3,"February 3, 2016 ",Buena opcion en Lund,"Valencia, Spain",Fuimos 2 veces con un grupo de 17 y otro de 11 ... Comida simple pero buena con precios más...More
[Spanish],4,83,13,5,"September 3, 2015 ",Pasta y Pizza italiana,"Lund, Sweden","Visitamos este lugar con mi esposo e hijo. La atención es buena, pero lo destacado son los platos italianos, desde...More"
[German],3,165,41,5,"June 7, 2018 ",Hervorragend,,"Ausgezeichnete Küche. Personal sehr freundlich. Das Menü ist vom Preis für Schweden ok, allerdings sind die Portionen nicht allzu groß."
[German],3,36,4,4,"May 6, 2015 ",Kleine aber feine Pizzeria,"Munich, Germany","Ich war spät Abends dort und es ist in einer kleinen dunklen Seitenstraße. Erster Eindruck war ""oh je, wo bin...More"
[German],3,166,51,5,"May 14, 2013 ",Die Pizzeria: ein Traum,"Freienstein-Teufen, Switzerland","Das Italia ist eigentlich ein zweigeteiltes Restaurant: in einem Teil ist traditionell italienisch und im anderen ""nur"" Pizza. Wir waren...More"
[Norwegian],3,5,,4,"August 26, 2018 ",fantastisk bra itaiensk,"Oslo, Norway","Alltid meget god pasta  MISTO- 2 TYPER  EN VEGETAR OG EN M KJØTT...
LUNDS  BESTE BRØD-  På  nnivå med det...More"
[Norwegian],3,19,6,5,"November 26, 2016 ",Super-god pasta til luch fro 80 kr og beste bröd!,Ås,"Höy kvalitet på all mat, helt speielt godt bröd og fin saltbufe
og huset röde vin er kvalitet!
2 italieske...More"
[Norwegian],3,3,,4,"July 14, 2015 ",God mat - svært hyggelig i fint vær,"Bilitt, Norway","God mat - dette smaker det Italia av!
Vi spiste ute i bakhagen, hyggelig, hadde alle gassvarmerene virket, hadde det...More"
[Portuguese],1,249,79,4,"May 31, 2018 ",Boa pizza ,"Campinas, SP","Dizem que a primeira nunca esquecemos e assim foi com a pizza aqui. Primeira pizza que comi em Lund, logo...More"
