[English],18,274,140,4,"December 31, 2018 ",Pleasant and tasteful,"Lund, Sweden","The occasion was a company dinner, and the Stadsparken Restaurang proved to be an excellent choice, with tasteful dishes and impeccable service. To be considered also for further future occasions."
[English],18,114,13,3,"December 11, 2018 ",OK,"Miami Beach, Florida","Visited with group of colleagues. The restaurant as such offers great ambience but unfortunately the food and service was not fully on par this time. We did not feel particularly well taken care of and the food was just OK, not more."
[English],18,75,22,2,"October 12, 2018 ", Food disappointing,"Lund, Sweden",We had tortellini with chanterelle plus a burger. Just under 200 sek each. The tortellini obviousely not made in restaurant but semifinished. Our table located in back-end area of restaurant which could certainly benefit from some refurbishment and paint.
[English],18,106,48,4,"April 25, 2018 ",Contemporary bar in the park,"Lund, Sweden","Nicely located in the park setting of Stadsparken. This contemporary bar is the place to go if the weather is nice. Not overly pricey for drinks (as Lund goes), a large outdoor area to enjoy the garden sights, and a large indoor area with lots...More"
[English],18,81,3,4,"April 2, 2018 ",a nice restaurant in the park,"Lund, Sweden",The food is good and the surroundings in the park are awesome. This place is perfect for a nice lunch when weather is good.
[English],18,12,4,3,"August 31, 2016 ",Dinner ,"Modena, Italy","The location is very nice, it the city park, with possibility to have a meal outside.
The food is of medium quality and compared to the other restaurants in the town is more expensive.(avg 340 sek each person).
Portions are served in small quantities."
[English],18,215,59,3,"August 18, 2016 ",Give better value to the money!,"Lund, Sweden","The location is nice, the restaurant itself pretty nice and elegant.
But the prices and the food don't match each other.
A sallad shouldn't really cost 125 crowns and a corn soup 95! 
The food is almost all the time pretty ok - however, I...More"
[English],18,52,14,4,"April 16, 2016 ",Great lunch and easy parking ,"Lund, Sweden","Lund is not the easiest place to drive and eat...
Tried this place and have to add it to my list of ""easy-parking-lunch-place"".
Good food with a nice salad and coffee included. Great atmosphere and the very best to take a short stroll in the...More"
[English],18,14,21,5,"November 27, 2015 ",Julbord and brunch,,"We have now come several times in a row. And it is for sure one of the best food levels restaurant I've seen in a long time, internationally. You can tell that the owner really really knows food. That it's a passion. 
The Christmas buffet...More"
[English],18,29,9,4,"July 3, 2015 ",great brunch,,"been a few times for their fantastic brunch. they have plenty of sweet and savoury options as well as both hot and cold food.

never had dinner here though."
[English],18,39,15,4,"May 8, 2015 ",After work in the sun and a fabulous waitress,"Malmo, Sweden","The city park in Lund is so close to the city centre, still these small town people judge it too often to be ""off"" (off the scene of the neon lights - true). 

Today after work, commuting from Malmo, sun was warm & and me...More"
[English],18,89,33,5,"April 15, 2015 ",Yummy brunch,"Lund, Sweden","Been here twice for brunch on Sunday's and it is really good!! A bit meat heavy and the staff vary in service bit otherwise very good!
Nice atmosphere and location as well"
[English],18,512,143,4,"August 13, 2014 ",Great food and nice setting,"Hong Kong, China","Location is a bit off, but parking house just close by.
Lunch is expensive but if on business lunch is well worth it.
Food quality is excellent."
[English],18,13,10,4,"March 13, 2014 ",Great brunch,,Been visiting a couple of weekends a month for brunch for almost a year now. It is by far the best place for brunch in Lund. Very nice during summer to sit outside. Be sure to book a table in advance.
[English],18,7,1,4,"November 30, 2013 ",Great place for lunch,"Lund, Sweden",Lunch of the day is always good. Excellent place to go in summer for great environment and nice food.
[English],18,19,8,5,"October 12, 2013 ",Dinner and a walk in the park,"Lund, Sweden","After an unusually good meal on our first visit to Stadsparkens Café, we had to see if it was a fluke or if the restaurant really was this good. So we have been back a couple more times and had enjoyed our latest visits as...More"
[English],18,19,8,4,"August 30, 2013 ",Probably the best steak I ever had,"Lund, Sweden","I have to admit my expectations weren't high; I mean it's a restaurant next to the city pool in the city park, I expected them to take advantage of their location and captive audience. But I was impressed by the atmosphere, the service was good,...More"
[English],18,173,401,3,"August 27, 2013 ",Long long long queue,"Stockholm, Sweden","Although the park is nice in downtown Lund, the queue to get coffee, beer or ice-cream is too long. The prices are high, but not higher than the rest of Sweden."
[Swedish],75,39,11,3,"October 8, 2018 ",Färgsprakande födelsedagslunch,,"Vi var ett gäng gamla vänner
som firade födelsedagslunch.
Vi var 10 som tog för sig
av olika sallader. Potatissalladen...More"
[Swedish],75,37,,3,"October 3, 2018 ",Ok,,Vi var ett stort sällskap som skulle käka innan handbollsslutspelet. Beställde i en burgare som var helt okej. Inget utöver...More
[Swedish],75,29,8,5,"September 23, 2018 ",Stadsparkens café och restaurang i Lund,"Lomma, Sweden","Åt en fantastisk god brunch på stadsparkens café i Lund .
Kalla rätter , varma rätter, ostar frukt och goda...More"
[Swedish],75,5,,5,"August 25, 2018 ",Mycket god brunch!,"Lund, Sweden",I en fräsch lokal får man avnjuta den stora brunchen. Det finns en stor variation av olika maträtter. Dessutom så...More
[Swedish],75,188,70,2,"August 7, 2018 ",Nej tack,"Lund, Sweden","Lunchmenyn var sådär. Flera rätter med sås, men ingen av dem laktosfri. Sallad utan rå lök blev med rå lök....More"
[Swedish],75,88,12,3,"June 30, 2018 ","God mat, men smutsiga stolar drar ner betyget","Lund, Sweden","Vi åt brunch på Stadsparkens restaurang idag.  Mycket god mat och trevlig betjäning, men väldigt smutsiga stolar som drar ner...More"
[Swedish],75,1,1,1,"May 28, 2018 ",Bemötande av barnfamilj,"Lund, Sweden",Besökte restaurangen med barn och barnbarn och blev mycket avvisande och nonchalant bemött. Vi är mycket besvikna och väljer i...More
[Swedish],75,6,3,2,"May 27, 2018 ",Söndagsbrunch,,Helt OK brunch men inte speciellt prisvärd. Basic mat och juice på juicekoncentrat och vatten. Tråkigt att snåla in på...More
[Swedish],75,59,12,4,"May 19, 2018 ",Bra brunch!,Lund,"Har bara varit här för deras brunch, som är mycket bra! Här dignar borden av olika råvaror och rätter av...More"
[Swedish],75,251,51,4,"May 4, 2018 ",Bra för after eork,"Loddekopinge, Sweden",Trevlig kombination av ute och inne. Stor uteterass där vi njöt av vårsolen och lite att dricka. Efter ett tag...More
[Swedish],75,38,10,4,"January 16, 2018 ",Riktigt bra brunch,"Lund, Sweden",Här kan man finna en av stadens bästa bruncher skulle jag tro. Mycket att välja mellan och man kan lätt...More
[Swedish],75,1,,5,"January 11, 2018 ",supergod mat,"Lund, Sweden","kanon god lunch och tillhörande salladsbuffe och vidunderligt bröd,kommer gå dit som stamgäst,har också prövat brunchen och är lunds bästa"
[Swedish],75,72,20,4,"December 8, 2017 ",Julbord: Så god men åh så fet.,"Lund, Sverige",Besökte Restaurang Stadsparken nyligen för julbord.  Har inte ätit julbord där sedan innan ägarbytet för 2 år sedan.  Man kan...More
[Swedish],75,59,10,4,"November 5, 2017 ",God brunch,"Orebro, Sweden",God brunch-buffé med både kall och varm mat. God efterrättsbuffe efter. I dyraste laget ffa för barnen som betalar 13:-/hur...More
[Swedish],75,212,13,4,"September 2, 2017 ",Mat att njuta av,,"Trevligt läge i stadsparken. Ljus och fantastisk lokal. Men det är maten som briljerar. Välj mellan åtta mellanrätter, alla välgjorda...More"
[Swedish],75,123,15,3,"August 29, 2017 ",Lasagne,"Malmo, Sweden","Tog en lasagne som dagens lunch för 95:-. Den var helt ok, blev varken positivt eller negativt överraskad"
[Swedish],75,60,15,3,"August 13, 2017 ",Lunchen är inte deras grej,,Mot parken är fasaden en röd stuga med vita knutar. Det är kafédelen . Maten serveras i en tillbyggd glaslåda...More
[Swedish],75,59,12,4,"August 13, 2017 ",Bra brunch!,Lund,Restaurangen ligger mysigt till i Stadsparken i Lund. Man kan stanna till för en lätt fika i solen med ett...More
[Swedish],75,15,3,5,"August 9, 2017 ",Middag med vänner,"Lund, Sweden","I en härlig miljö serveras vällagad och välkomponerad middag med ett bra urval av förrätt, huvudrätt och efterrätt. Personalen positiv...More"
[Swedish],75,52,9,4,"July 30, 2017 ",Brunch,Sverige,Åt en något sen brunch. Trots att vi kom rätt sent fylldes det på av allt och det var nästan...More
[Swedish],75,128,33,5,"June 27, 2017 ",Slår ett slag för detta ställe,"Lund, Sweden","Mycket trevligt ställe med bra mysfaktor.
Har god mat och delikatesser till humana priser. Till detta kan man få en...More"
[Swedish],75,232,24,5,"June 2, 2017 ",Mysigt,Sweden,"Mysigt café mitt i idyllen på sommaren.
Dock är solskyddet ganska fult :)

Men god fika löser allt!
Något dyrt...More"
[Swedish],75,15,3,5,"May 16, 2017 ",Lunch,"Lund, Sweden",Bra variation på menyn. Vällagad och dekorativt serverade rätter med variation som tilltalar. Vinlistan välkomponerad så att även den kräsne...More
[Swedish],75,232,24,4,"April 18, 2017 ",Fint,Sweden,"Fint, goda rätter, men lite för dyrt för vad som serveras. 
De är en super mysig miljö på sommaren, men...More"
[Swedish],75,6,2,5,"January 5, 2017 ",En av Lunds bästa restauranger!,,"Fin miljö, fantastisk mat och trevlig personal med känsla för service. Ätit lunch där flera gånger och alltid varit nöjd....More"
[Swedish],75,15,1,5,"November 25, 2016 ",Underbart julbord ,,Detta var något utöver det vanliga med massproduktion av halvdålig mat. Här fick vi mat på utmärkta råvaror. Inte i...More
[Swedish],75,7,,5,"November 25, 2016 ",Julbord,,"Jättegod mat, snyggt upplagt och fint presenterat. Lagom mycket av alla sorter och med löjrom som överraskning."
[Swedish],75,166,36,4,"November 20, 2016 ",Ostbuffe',"Bjarred, Sweden","Utmärkt ostbuffe' med ett rikt urval av ostar, flera VM-vinnare. Trevlig personal. Ganska få gäster efter 20:00."
[Swedish],75,166,36,4,"November 19, 2016 ",Ostbuffe' ,"Bjarred, Sweden",Formidabel ostbuffe' som presenterades med inlevelse och stor kunskap om ostarna. Trevlig och kunnig personal som kunde leverera vettiga vintips....More
[Swedish],75,8,2,4,"October 16, 2016 ",ostbuffé,"Lund, Sweden","Här fanns de absolut godaste ostar med stor variation av både hårdostar och ädelostar
färskostar och mjukostar. tillika gott bröd...More"
[Swedish],75,5,2,1,"September 24, 2016 ","Otrevlig personal, medioker måltid och mycket dyrt. ",,"Otroligt dyrt. Man förväntar sig med de priserna en ursäkt måltid med trevlig personal. 
Maten var av dålig kvalité, sparsamma...More"
[Swedish],75,1,1,5,"September 23, 2016 ",Kund,,"Fantastisk mat och personal!!!
Supernöjda, kunde inte bli en bättre fredagskväll. 
Väldigt mysigt att få sitta i den gamla delen...More"
[Swedish],75,11,6,4,"September 16, 2016 ",Fantastisk ostbuffe!!,"Lund, Sweden",Vi avslutade arbetsveckan med ett besök på Stadsparkscafeet. Lite öl och vin och avslappnat prat på den trevliga uteserveringen med...More
[Swedish],75,61,2,4,"September 13, 2016 ",Överraskande gott!,"Lund, Sweden","Överraskande fantastisk gott! Åt en mellanrätt med kummel och till efterrätt äpplemunk med vaniljglass. Himmelskt gott! Och Kasper, servitören, gjorde...More"
[Swedish],75,17,1,4,"September 8, 2016 ",Brunch,,Vi brukar fira familjedagar med väldigt bra brunch.Härligt med lek i parken efteråt.Nära Centralstationen i Lund.
[Swedish],75,116,32,4,"September 7, 2016 ",Trevlig miljö,"Lund, Sweden","Var här och åt med flera arbetskollegor. Ny meny med mellanrätter, rekommendation var 2-3 stycken. Jag valde 2 pga det...More"
[Swedish],75,13,11,4,"September 5, 2016 ",Trevligt & gott,"Eslov, Sweden",Vi var här i somras med min mans familj & maten var riktigt god & atmosfären mycket trevlig & avslappnad....More
[Swedish],75,46,17,4,"August 29, 2016 ",Söndags brunch,"Lund, Sweden","Godkänd brunch
Det som gjorde stadspark resturang brunchen rekomenderbart var den trevliga personalen och trevlig miljön"
[Swedish],75,72,15,3,"August 10, 2016 ",Otrolig långsam service ,"Staffanstorp, Sweden","Det går inte speciellt fort när man beställer.
Men maten var väl vad man kunde vänta sig.
Kanske kunde de...More"
[Swedish],75,6,2,4,"July 31, 2016 ",Grillmeny,,Är flitig besökare och har smakat det mesta på menyn. När det nu uppdaterades med en ny grillmeny var vi...More
[Swedish],75,47,12,4,"July 25, 2016 ",Miljövänlig miljö,"Stromsnasbruk, Sweden","En härlig fikastund i en helt underbar parkmiljö, finns inte mer att säga om det, bara njut av kaffet eller...More"
[Swedish],75,65,25,3,"July 2, 2016 ",Inget märkvärdigt,"Lund, Sweden",Det var gott men inget märkvärdigt. Den stekta sillen var nog det som såg bäst ut och var det som...More
[Swedish],75,60,4,4,"June 15, 2016 ",Friterad bondost dagens höjdpunkt,"Lund, Sweden",Ypperligt läge i Lunds stadspark. Trevlig personal men ganska konventionell meny som inte är särskilt omfattande. De i vårt sällskap...More
[Swedish],75,264,56,5,"June 12, 2016 ",Fantastisk brunch!!!,"Lund, Sweden","Fräscht och välkomnande. En fantastisk brunch med allt man kan tänka sig. Bra utbud av skinka, salami, rostbiff, ost, sill...More"
[Swedish],75,17,5,2,"June 8, 2016 ",Inte prisvärt,skåne,Trevlig personal. Men maten når definitivt inte upp till det pris som är satt. Fina detaljer som färsk sparris men...More
[Swedish],75,42,20,2,"May 9, 2016 ","Otrevligt, men dyrt",Malmö,"Personalen var inte speciellt engagerad, och till och med lite otrevlig. Maten var inte i närheten att stå i paritet...More"
[Swedish],75,20,3,3,"April 23, 2016 ",Helt ok brunch,,Mysigt läge i parken o trevlig ljus lokal med stora fönster. Trevlig brunch men känner att för 195 spänn som...More
[Swedish],75,4,1,4,"March 8, 2016 ",Fin miljö o god mat,"Lomma, Sweden","Vi går gärna hit. Det är vänlig personal. Lunchen serveras vid borden. Hyfsat pris.
Alltid tillmötesgående vid bokningar"
[Swedish],75,17,1,4,"February 17, 2016 ",Födelsedagsbrunch!,"Lund, Sweden","Åt brunch med familjen när yngsta fyllde 10. Innehållsmässigt standardbrunch fast med viss finess! Goda köttbullar med hemgjort stuk, en...More"
[Swedish],75,41,6,4,"January 6, 2016 ",Trevlig familje resturang,Singapore,Sällskap på 8 personer som åt den fina Brunchen. Traditionell sådan utan att utmärka sig för mycket. Inga speciella rätter...More
[Swedish],75,15,12,4,"December 15, 2015 ",Skaldjursbuffén,,"En verklig festkväll.
Vi sitter i en härlig miljö, nästan som att befinna sig utomhus fast inne. Stora fönsterpartier att...More"
[Swedish],75,106,23,4,"November 1, 2015 ","God mat, skön atmosfär","Lund, Sweden","Kom hit för att äta lunch på en söndag, blev först besviken för att det bara fanns brunch, men vilken...More"
[Swedish],75,25,1,4,"October 27, 2015 ",Bra och trevlig brunch,"Lund, Sweden","Lagom antal och bra urval av brunchrätter. Fräscht, gott och något för allas smak. Var här med barn på 3...More"
[Swedish],75,50,15,4,"October 16, 2015 ",Ett riktigt bra brunchställe,"Lund, Sweden",Lördagar och söndagar serveras en överdådig brunch för ett mycket bra pris. Här finns rätter som passar både gammal och...More
[Swedish],75,1,,5,"September 13, 2015 ",Brunch,"Furulund, Sweden","Åt Brunch med familj. Verkligen smakfullt och hög kvalite' på brunchen. Trevlig personal!
Här lägger man vikt på bra råvaror...More"
[Swedish],75,39,7,4,"August 22, 2015 ",Toppenbrunch,Lund,Ett av Lunds bästa brunchställe. Glöm inte att boka bord i god tid! Fina panoramafönster. Trevlig personal. Mycket alternativ även...More
[Swedish],75,45,2,4,"July 15, 2015 ",Kompisträff!,,"Tyvärr missade man vår bokning...inte kul!! Vi fick dock annat ...Med god ..mkt. god mat, dock ganska durt!"
[Swedish],75,146,45,3,"July 10, 2015 ",Härlig uteplats vid fint väder,"Linkoping, Sweden",I utkanten av stadsparken inte långt från Högevallsbadet och sporthallen ligger restaurang Stadsparken och i andra änden av huset finns...More
[Swedish],75,50,14,3,"July 5, 2015 ",Trevligt!,"Lund, Sweden","Vi kom ett ganska stort sällskap, fick mycket bra  och trevlig service. Portionerna var eleganta och lagom stora men tyvärr...More"
[Swedish],75,2,,2,"May 16, 2015 ",Barnvagn,"Malmo, Sweden","När jag var där förra sommaren kunde man inte köra in med barnvagnen. Det tyckte jag var dåligt, vet inte...More"
[Swedish],75,26,10,3,"April 28, 2015 ",Fint ställe med ok mat.,Barsebäck,En restaurang med bra läge i Stadsparken. Trevlig personal men inte den intressantaste maten i stan. Luncherna ok.  Bra att...More
[Swedish],75,33,15,5,"April 19, 2015 ",Kan det bli bättre ?,"Malmo, Sweden",Vi var 7 grabbar som sökte god mat och bra service. På bra läge i Lund ligger denna pärla. Vi...More
[Swedish],75,360,35,4,"March 28, 2015 ",Lunchbuffé,"Lovestad, Sweden","En riktigt trevlig överraskning. Här fanns något för alla och det med råge. Fantastiska ostar, varmrätter, pålägg i alla de...More"
[Swedish],75,5,2,3,"February 12, 2015 ",Brunch,"Lund, Sweden",Egentligen en ganska bra brunch tror jag. Är dock vegetarian så jag kan inte bedöma det helt och fullt. Det...More
[Swedish],75,17,3,4,"October 7, 2014 ",Söndagsbrunch,"Ludvigsborg, Sweden",Åt söndagsbrunch en vacker oktoberdag på verandan. Trevlig miljö även inomhus. Trevlig personal som snabbt fyllde på buffébordet.
[Swedish],75,188,70,2,"September 28, 2014 ","Billigt, men billigt","Lund, Sweden","Vi ville prova ""vår berömda brunch"". Trevlig miljö tack vare mycket glasytor ut mot grönskan, men solkiga och fläckiga stolsitsar....More"
[Swedish],75,25,10,2,"July 17, 2014 ",Lunchen motsvarade inte förväntningarna,Malmö,"Undertecknad och hustrun besökte Stadsparkens restaurang för att äta dagens lunch, stekt fläsk med löksås. Lunchen var en stor besvikelse....More"
[Swedish],75,1,2,2,"June 28, 2014 ",Hit går vi inte igen,"Hoor, Sweden",Arrogant och otrevlig personal som inte förstått innebörden av ordet service. Maten var helt ok men helhetsintrycket gör att vi...More
[Swedish],75,1,3,2,"June 14, 2014 ",Inte fler gånger,Båstad,En besvikelse. Ingen dietläsk. Små portioner. 35 kr för en vetebulle med kardemumma måste betraktas som stöld. CS ABELIN
[Swedish],75,59,40,1,"May 27, 2014 ",Inte värt besöket,"Lund, Sweden","Har ätit bruncher här många gånger  förut , men senaste tillfället var det inte bra! Kladdigt och äckligt på buffén...More"
[Swedish],75,133,18,3,"November 13, 2013 ",En glad överraskning,"Lund, Sweden","God mat, bra service o trevlig personal, vad kan man mer önska? Jo, att det hade varit någon form av...More"
[Swedish],75,46,8,4,"November 13, 2013 ",Trevligt ställe,"Lund, Sweden","Det är både en lunch- och en kvällsrestaurang i trevlig miljö. Duktig och intresserad personal.

* Lunchen är enkel men...More"
[Swedish],75,33,8,4,"November 10, 2013 ",Söndags brunch,,"Trevlig miljö o trevlig personal. Brunchens utbud var stor och passar de flesta. Flera varma rätter, mycket att välja på,...More"
[Swedish],75,123,23,2,"February 14, 2013 ",Dålig service men ok kök,"Kavlinge, Sweden",Efter 20 min sa vi till om att få beställa dricka. Man kände sig sällan sedd av personalen. Väldigt förvirrade...More
[Swedish],75,158,49,4,"December 16, 2012 ",Utmärkt brunch,"Lund, Sweden","ny regi från 1/12 2012
Många trevlig rätter på brunchbuffén, flera sillsorter, lax, korv, hemmagjorda köttbullar, miniburgare, bacon, våfflor. creme...More"
