[English],240,138.0,39.0,4,"June 3, 2015 ",Nice on a sunny day,"Melbourne, Australia",This is a well used park that combines the botanic research and a public park.  It was a sunny day (although cold at 14C) but the park was full of students and families have picnics as well as catching the sun.
[English],240,50.0,12.0,5,"June 1, 2015 ",Lovely gardens.,"Holt, Michigan",I went on Ascension Day.  It was cool but sunny and blue-skied.  The park was filled with people of all ages having a day out.  Not only was it a chance to see beautiful flowers and landscaping but also to see the Swedes having a...More
[English],240,12.0,,3,"May 20, 2015 ",Average with a (quite romantic) bonus,"Malmo, Sweden","It is a nice place but keep in mind that Lund is a 100000 inhabitants small town. If you have been to botanical gardens in more resourceful towns you might be disappointed. 

Here comes the BUT.
My personal tip: Go there on a nice sunny...More"
[English],240,439.0,104.0,4,"May 15, 2015 ",Nice to walk around in the sun,"Hobart, Australia",We came across these as we were just walking around for the day. The old graveyard next to them was very interesting. Would easily go back and smell the Spring.
[English],240,34.0,17.0,5,"May 14, 2015 ",great place,lund,"A really nice place to spend a day in Lund, the hothouse is open till 3 only, bit sad but never mind. its not Kew but good anyway"
[English],240,34.0,26.0,5,"May 9, 2015 ",Very pretty,"Belfast, United Kingdom",Very pretty park with great facilities! I was here during valborg and despite there being lots of students drinking in the park it was kept immaculate!
[English],240,51.0,15.0,5,"April 16, 2015 ",Beautiful!,"Lund, Sweden","We visit this particular garden quite often. The guided tours in English provided by the authorities are worth a try! Sometimes they have interesting exhibitions too for eg, Once they had Orchid festival. The green houses are worth a visit. The exotic reptiles and amphibians...More"
[English],240,27.0,26.0,5,"April 6, 2015 ",Great place to walk and enjoy nature,"Denver, Colorado",The extensive gardens are located in the city center of lund.  Be sure to check out the graveyard and indoor greenhouse.
[English],240,46.0,49.0,5,"February 24, 2015 ",Great Garden,"New Delhi, India",Great Garden to go with family and friends. have fun guyss and go and eat in places near it . Great fun it will be to go there. You will enjoy it
[English],240,5.0,5.0,5,"February 18, 2015 ",Hidden paradise,"Lund, Sweden",The Botanical Garden in Lund is very popular among particularly students during spring and up to the end of the spring semester when they leave town to do other things than study during the break. And naturally this is the best time of the year...More
[English],240,9.0,2.0,4,"December 10, 2014 ",A piece of the world,"Lund, Sweden","I love how it's always tropically warm and humid inside the greenhouses and that almost every foreign plant is represented, or so it feels! In summer time I love having a picnic with friends, reading a book or just take a stroll in the garden....More"
[English],240,4.0,1.0,5,"December 6, 2014 ",Magical,"Lund, Sweden","One of the most colorful and beautiful places in Lund, especially when everything is bloomed out from April- May until the mid-fall. Probably my favorite walking place !"
[English],240,46.0,8.0,5,"December 4, 2014 ",A must when in Lund,"Lund, Sweden","We come here often in summer to walk, picknick, play and enjoy the greenhouse. Stroll around and just sit under a tree."
[English],240,26.0,19.0,5,"November 7, 2014 ",My favorite place in Lund,"Seoul, South Korea",Was there several times to take a joyful rest during my stay in Lund. Lovely place for couples or friends...Well organized park and full of natural mood. I miss their coffee at the cafe there as well.
[English],240,26.0,11.0,4,"November 4, 2014 ","Nice, calm place for picnic, playing or just wandering about",,"Lots of places for young kids to explore and run around in. Fun with the big tree used as a playground.

The big gardens have plenty of room for play or picnic.

Green houses very exciting and also nice a on a cold winters day."
[English],240,148.0,127.0,5,"October 10, 2014 ","Great, free resource","Houston, Texas",Gardens & greenhouse are well-signed (each small garden has a description in Swedish and English) and very pretty.  Flowers also draw birds and wildlife and make for a great hour or two.  Easy walk from other sites in town.
[English],240,81.0,64.0,5,"October 2, 2014 ",Picnic in the Botanic Garden,"County Dublin, Ireland","I love the Botanic Gardens...I brought a picnic to meet my husband for lunch and we sat on the grass, surrounded by bird song, beautiful herbaceous borders and peace in the city.  Love it :-)"
[English],240,67.0,13.0,4,"September 2, 2014 ",Beautiful,"Athens, Greece","The garden is amazing, especially in spring when everything is in bloom and the place is full of colors. It is ideal for a relaxing stroll on a sunny day."
[English],240,16.0,7.0,5,"August 26, 2014 ",gardens,"Shaftesbury, United Kingdom",The gardens are well worth a a visit and are free. The cafe serves excellent lunches in an ideal setting.
[English],240,179.0,81.0,5,"August 16, 2014 ",Beasutiful for a stroll,"Burnfoot, Ireland","We were staying at the StayAt, and it is a short walk to these wonderful gardens. With the sun shining, this passed a lovely half hour or so, before we retired to dinner!"
[English],240,17.0,6.0,4,"August 16, 2014 ",A discrete oasis,"Eslov, Sweden","This is a great place to wind down, rest, enjoy a picknick in the open with friends and/or discover some fascinating plants and unusual trees. 

Have a nice cup of coffee with a (small) cake, don´t expect big portions nor having a real meal. In...More"
[English],240,512.0,142.0,4,"August 13, 2014 ",Great place for pcitures and a stroll,"Hong Kong, China",It is free to come and a very well kept and romantic garden. Very many rare flowers and plants. Go here with visitors or with your loved one
[English],240,9.0,2.0,4,"August 6, 2014 ",Heaven,"Birkirkara, Malta","A wonderful place where one can sitt and enjoy a good cup of coffee or just walk among all the beautiful plants. It's heaven on earth. Make sure to visit the coffee shop, it's a must."
[English],240,2.0,,4,"August 6, 2014 ",A nice place for a pick nick.,,"The park is the perfect place to bring your own food, a bottle of wine and some good friends. Best place to be on a hot spring day."
[English],240,580.0,341.0,3,"July 3, 2014 ",Pleasant,Columbus OH,Worth a stroll as the flowers and plants were lovely. The greenhouse closes at 3 pm so we missed that. The garden is close to the center of town so is convenient if you have the time.
[English],240,160.0,56.0,5,"June 10, 2014 ","Peaceful, pretty garden","Vancouver, Canada","Being in nature always seems to introduce a sense of awe and wonder, even if the setting is man made. The garden is filled with beautiful blooms this time of year. Whether you want to wander or just sit on the grass taking in the...More"
[English],240,111.0,51.0,5,"June 7, 2014 ",Spend a little time,"Perth, Australia",This is a gentle day wandering around the plants and enjoying the beautiful trees. The displays have a wide variety of plants. They have glasshouses which also hold interesting displays. When you are done the cafe is most welcoming.
[English],240,73.0,13.0,5,"May 28, 2014 ",Place to walk,"Lund, Sweden",Great place to walk with family. Everybody are open to talk during the summer. Quite and a lot of plants to see.
[English],240,5.0,,5,"May 1, 2014 ",Of great horticultural interest,"Retford, United Kingdom",We spent a considerable time walking round the grounds and admiring the display of daffodils and the range of different varieties. The plants in the glasshouses are most interesting and well displayed. We found the café nearby served good snacks and light lunches but the...More
[English],240,3.0,,5,"April 16, 2014 ",Wonderful park and garden area!,"Lund, Sweden","Lund's Botanical Gardens are a great park area with greenhouses, a pond, few small hills and nice paths. I enjoy walking there for hours, or just sitting on a bench and relaxing. There is plenty to see outdoors in the spring, summer and autumn, if...More"
[English],240,19.0,10.0,4,"November 25, 2013 ",Nice Getaway,"Lund, Sweden",This botanical garden is very close to down town Lund. It's a big park with a lot of different kinds of plants both outdoor but also inside in greenhouses. It's nice to stroll around among plants from all over the world. The best time to...More
[English],240,11.0,5.0,5,"October 6, 2013 ",Best park in Lund,"Uppsala, Sweden","Whether you're interested in botanic or just want to spend time in a nice park, the botanical garden is a must. It contains several different sections with their own personality, all cute in their own way. And every season will give you a different atmosphere....More"
[English],240,213.0,158.0,5,"September 24, 2013 ",Fantastic treasure of Lund. Don't miss the little quail birds in the greenhouses,"London, United Kingdom",Free entry drew us there. Great surroundings for a summer walk. We don't know much about botany but appreciated the atmosphere of the place ring a research centre as well as a great leisure park. Loved the greenhouses but note it closes after 3pm
[English],240,10.0,8.0,5,"September 22, 2013 ",Perfect place for a lazy summer afternoon,"Tallinn, Estonia","The Botanical garden is very popular among young people in Lund, just to meet up with friends, have a picnic or enjoy the nature. And there is a good reason for it's popularity- it is as easily accessible as any other park, but is very...More"
[English],240,35.0,22.0,4,"September 21, 2013 ",Beautiful garden,"Dubai, United Arab Emirates",It is a beautiful botanical garden spread over 8 hectare. The botanical gardens is located in the central of the city.  I enjoyed  walking in the gardens and cafe near the lake.It is part of Lund University and every plant is properly tagged. It is...More
[English],240,63.0,17.0,5,"August 22, 2013 ",Beautiful and Peaceful,"Raleigh, NC","Wonderful, well-maintained gardens with plenty of photo opportunities.  A quaint cafe for coffee in the garden is nice as well."
[English],240,240.0,53.0,4,"July 29, 2013 ",Many very beautiful and anusual flowers. :),"Lund, Sweden","The Botanical garden is a nice place to go to if you're in Lund and have some time over.
There are plenty of different and unusual plants and trees, and there is even a indoor spot, where there are a lot of tropical plants, ranging...More"
[English],240,29.0,8.0,4,"July 18, 2013 ",Beautiful gardens.,"Maidenhead, United Kingdom","We got here late on a Saturday so the glasshouses, which are quite extensive, were closed. The gardens are well maintained with some really spectacular border displays, and rare trees and shrubs. There are plenty of benches to perch on and watch the world go...More"
[English],240,79.0,65.0,4,"July 7, 2013 ",Make sure you see the glasshouse!,Ann Arbor,"The Botanical Garden is *not* a zoo--not sure why it's classified as such.  It's a botanical garden, as its name implies.

The outdoor gardens are okay.  The biggest draw here is the glasshouse area and the nearby pond.  The pond is filled with flowering lilies,...More"
[English],240,110.0,45.0,4,"July 4, 2013 ",Summer flowers,Chapel Hill,The garden smells of roses and flowering trees. Very relaxing place to walk. Look for baby ducks by the pond.
[English],240,46.0,19.0,4,"June 20, 2013 ",a green oasis,"New Delhi, India","very lush and green, beautiful flowers and fragrance.. with green houses (not open in the mornings) wish I had more time to linger and enjoy the peace and quiet in such lovely surroundings with only the birds and the occasional walker for company..."
[English],240,112.0,95.0,4,"April 30, 2013 ",Very pretty place,"Surrey, United Kingdom","Stumbled across this while walking around Lund.  Free to enter, there is a cafe which was closed as we were there eafrly and there are toilets.  A few spring flowers were starting to bloom and the gardeners were hard at work.  If you're wandering round...More"
[English],240,61.0,21.0,5,"April 18, 2013 ",Lovely garden,Virginia,Free admission. Lots of variety in flowers and trees-- both outside and inside the green houses. Great place for a walk.
[English],240,36.0,16.0,4,"January 3, 2013 ",Pretty year-round,"Riyadh, Ar Riyad, Saudi Arabia","Great place to take children, regardless of the season. We often took our children there for picnics and they liked the beauty of the area."
[English],240,161.0,81.0,4,"January 3, 2013 ",Interesting,"Hamburg, Germany",Unfortunately we visited the Botanical Gardens in winter and so kept humming the Adam's Family theme as we toured the grounds.  However the joined green houses were spectacular.
[English],240,43.0,39.0,4,"October 8, 2012 ",Calm and colourful,"Glasgow, United Kingdom",The Botanic Gardens provides a lovely calming place to spend an hour or two. People use it as a short cut but not you are not allowed to cycle in it. It was a cold day so we headed for the greenhouses. They had a...More
[English],240,131.0,139.0,3,"September 3, 2012 ",Open space,York,I was disappointed as the gardens looked a bit run down and it was only the end of August. There is a nice place to sit near the cafe overlooking a lake but the greenhouses do not open until late in the morning.
[English],240,19.0,7.0,3,"August 29, 2012 ",Nice park with greenhouses,"Bristol, United Kingdom","Lovely park to hang around in on a sunny day, with lots of interesting and pretty flower beds. The indoor part is merely some joined greenhouses with little text, but worth the visit for the free-living quail!"
[English],240,24.0,16.0,5,"August 13, 2012 ",One of the places - must visit.,"Hafnarfjordur, Iceland","All year round the garden is inviting and beautiful.  Colourful and sweet smelling during summer, sprouting green in the spring, outstanding colours of fall and covered in white carpet in winter."
[English],240,19.0,13.0,5,"July 29, 2012 ",beatiful and educational haven,"Lund, Sweden","a lovely spot and garden for us who live downtown Lund and don´t have a garden of our own. stroll around and read the signs, and learn the names of the plants and flowers you like"
[English],240,6.0,7.0,4,"July 9, 2012 ",Take a rest here!,Drøbak,"Calm retreat in a garden that is well maintained. It's nice to look at all the flowers, and I also took a small nap at a bench, while my husband was reading a book, I must admit. Wonderful, can be recommended :)"
[English],240,69.0,17.0,4,"July 1, 2012 ","Small, old and wonderful","Amsterdam, The Netherlands",We visited the garden in June 2012 and the weather was not optimal. The greenhouse is fantastic due small. There is a big variety of plants and species. The outside garden is worth while to wander through. There also is a vegetable garden. I would...More
[English],240,287.0,99.0,5,"May 28, 2012 ",Great place to relax,"Chengdu, China","To take an hour away from it all, a great place to visit."
[English],240,14.0,6.0,5,"May 18, 2012 ",Fantastic place and atmosphere!,"Lund, Sverige","Nice, calm, peaceful and close to the citycenter! Sometimes there are student´s playing games and stuff so it can be lively sometimes, but it´s big enough for everyone.."
[English],240,29.0,9.0,3,"May 7, 2012 ",Smallish but wonderful little quail in the hothouses,"Glasgow, United Kingdom","Beautiful swathes of tulips in front of the hothouses, and formal beds though many still being planted. Interesting notice board about the origins and history of the university connections. Several families of Chinese painted quails scurrying underfoot in the hothouses cheeping away- charming. Not much...More"
[English],240,425.0,263.0,3,"May 4, 2012 ","Nice place, but maybe not worth a detour",Landskrona,"The Botanical Garden in Lund is a nice stop if you happen to be visiting the city and want to get away from the busy shopping streets.

There are nice places to sit down and relax, also a very nice cafe with decent prices. The...More"
[English],240,99.0,35.0,4,"April 19, 2012 ",The most casual botanical garden I've ever been to,"Montreal, Canada","Most botanical garden do everything in their power to make it seem like a transactional experience. In Lund, the garden is not only free-of-cost, but always provides spaces to sit and have picnics. It's inviting park-like atmosphere make it a truly enjoyable experience to repeat...More"
[English],240,38.0,22.0,5,"April 10, 2012 ",For flower watching and quiet strolls,"Lund, Sweden","The botanical garden is my favourite park in Lund as is is cleaner and better maintained than the bigger and busier Stadsparken (City Park). There is a greenhouse with plants from different climat zones (free entrance, open daily 12-3 pm). You can bring your own...More"
[English],240,7.0,2.0,5,"March 13, 2012 ",Very nice,"Lund, Sweden","Very nice place for recreation. Why not a picnic?
Very nice place for recreation. Why not a picnic?"
[English],240,29.0,16.0,5,"February 1, 2012 ",Lovely gardens,"Lund, Sweden","Beautiful gardens, lovely place to hang out on a sunny day. Cafe does tasty light lunches"
[English],240,24.0,10.0,4,"January 22, 2012 ",The Gardens at KU Life Center,"Philadelphia, Pennsylvania","I like these gardens, I'm judging by the picture these are the ones in Fredriksborg. They're not as large as the botanical garden up near Nørreport, but there's a wonderful cafe near by and if your in the area it's a good place for some...More"
[English],240,486.0,155.0,5,"January 7, 2012 ",a place for all seasons,"Lund, Sweden","The botanical gardens is centrally located and free!  In the warmer months, one can enjoy walking in the gardens and the outdoor cafe.  In the cold, I love to spend time in the greenhouse!"
[English],240,11.0,8.0,4,"January 5, 2012 ",A nice stroll,"Malmo, Sweden",It's always a nice stroll through the botanical gardens. Pretty flowers and joyful smells all over the place.
[English],240,2.0,1.0,5,"December 24, 2011 ",Botanical Gardens Lund,"Chatsworth, CA",Easy walking distance from our hotel and well worth the afternoon spent visiting.
[English],240,173.0,401.0,4,"November 13, 2011 ",Large variety of all kinds of plants,"Stockholm, Sweden","They have from tropical rain forest to tundra plants. I guess it's part of the university, it is well maintained. It is also a very nice walk if the weather is good."
[English],240,143.0,116.0,4,"September 18, 2011 ",A nice walk through the garden with many flowers,"Dallas, Texas","I enjoyed this site the best when visiting Lund.  It's about 10-15 minutes from the cathedral.  There are some signs once you get closer and you'll most likely wander your way there once you're nearby.
There are many different paths that you can follow and...More"
[English],240,1.0,1.0,4,"October 12, 2010 ",that is a lovley and beautiful garden.,"Tabriz, Iran",The garden located in Lund city of Sweden and also include a collection of plants in a large glasshouse for different climates.
[Swedish],166,10.0,4.0,4,3 days ago ,Besök i Botan,"Lund, Sweden","Bästa platsen i Lund.
Växter från hela världen. Små vaktlar som rusar omkring i växthuset. Mycket underhållande.
Bra cafe."
[Swedish],166,26.0,3.0,4,5 days ago ,Trädgården som heter duga ,,"Botaniska trädgården har nog en särskild plats i många Lundabors hjärta. 
Det är en plats många samlas på under bland...More"
[Swedish],166,4.0,,5,"December 13, 2018 ",Botan i Lund!,,En trädgård att fröjdas åt året runt. Upptäcker alltid något nytt och spännande. En lisma för själen.
[Swedish],166,70.0,14.0,4,"December 9, 2018 ",Underbar oss mitt i stan,"Lund, Sweden",Botaniska trädgården I Lund är en sann oss för stans egna innevånare och besökare med sina fantastiska planteringar och många...More
[Swedish],166,14.0,3.0,4,"October 9, 2018 ",Dahlier !,"Lund, Sweden","Lund,9 oktober 2018.Nu är det nog sista chansen att se Dahlierna i hela sin prakt !
Det är öppet i...More"
[Swedish],166,75.0,4.0,4,"October 1, 2018 ",Mysigt besök,"Karlstad, Sweden",Besökte botaniska trädgården i samband med en arbetsresa. Mysigt att vandra runt i växthusen och rekommenderar absolut ett besök
[Swedish],166,52.0,3.0,4,"September 16, 2018 ",Härlig trädgård och intressanta växthus.,,Har besökt trädgården flera gånger och tycker den är vacker och intressant. Skön avkoppling att sitta där och läsa. Denna...More
[Swedish],166,79.0,3.0,4,"August 15, 2018 ",Mycket fint ,,7000 olika sorters växer att kolla på. Fullt med mer eller mindre exotiska träd och växter. Många fina rabatter med...More
[Swedish],166,11.0,1.0,5,"August 6, 2018 ",Blomsterprakt,"Lund, Sweden","Var på platsen en solig och varm försommardag i slutet av Maj månad.
Det var mycket människor där som solade...More"
[Swedish],166,63.0,14.0,4,"August 4, 2018 ",Really good!,"Umea, Sweden","Jättefint och ett otroligt lugn i parken! Bra café och mycket att se på. Helt klart värt ett besök, minst...More"
[Swedish],166,167.0,23.0,5,"July 16, 2018 ",Magisk miljö,"Malmo, Sweden","Så härlig miljö och atmosfär! Här kan man strosa rundor länge, sätta sig vid en damm och mata ankorna. Eller...More"
[Swedish],166,109.0,14.0,5,"July 16, 2018 ",Fantadtidkt,"Karlstad, Sweden",Vi blev rekommenderade att besöka parken och den var verkligen sevärd. Det är fantastiskt att man kan gå omkring där...More
[Swedish],166,9.0,3.0,5,"July 14, 2018 ",Mycket trevligt ,,En härlig oas mitt i Lund. Mysigt café och fantastiska växthus. Verkligen värt ett besök.Den lilla butiken var fin med...More
[Swedish],166,74.0,10.0,5,"July 9, 2018 ",Härlig plats för avkoppling,Sweden,Välskött botanisk trädgård med olika växtavdelningar. Dahliorna är underbara. Växterna varierar efter årstidernas skiftningar. Näsduksträdet är en sevärdhet i sig....More
[Swedish],166,19.0,4.0,4,"July 9, 2018 ",Vacker botanisk trädgård,"Lund, Sweden",En vacker botanisk trädgård med ett café som är bra! Du kan lätt ta med eget fika och en filt...More
[Swedish],166,48.0,6.0,4,"July 9, 2018 ",Växthusen är mest sevärda,"Ystad, Sweden","En skön plats för både upplevelse och avkoppling. En stor park att promenera i med mycket variationsrik flora, passar även...More"
[Swedish],166,380.0,23.0,4,"July 7, 2018 ",Vackert!,"Orebro, Sweden","Fin plats att äta en enkel lunch på. Maten var helt okej, men lite mycket dressing och salt paj. Men...More"
[Swedish],166,4.0,,5,"June 26, 2018 ",Fantastisk sallad och bakverk,"Lund, Sweden",Vi äter här varje vecka. Samtliga sallader smörgåsar och quichen är makalöst goda. Samtliga bakverk och bullar fantastiskt goda. Stora...More
[Swedish],166,14.0,1.0,5,"June 24, 2018 ",Hela världens blommor och blad och Lunds bästa cafe inbäddat i grönskan!,,"Här kan du lägga ut din egen filt på vilken äng du önskar.
Tulpaner, näsduksträd eller doftande kryddträdgård.Cafeet har sommarmöbler...More"
[Swedish],166,88.0,11.0,3,"June 20, 2018 ",Fina promenadvägar i parkmiljö,"Lund, Sweden","Botaniska trädgården har alltid varit en oas för Lundabor och besökare. Tyvärr är parken inte alls så välskött som tidigare,...More"
[Swedish],166,63.0,25.0,5,"June 10, 2018 ",Oas i staden,"Malmo, Sweden",Med årstidernas växling ger trädgården alltid nya upplevelser med sina unika växter. Gården bjuder på både avskildhet och sällskapsliv med...More
[Swedish],166,423.0,69.0,5,"May 12, 2018 ",Avkopplande miljö,"Malmo, Sweden",Mycket vacker plats mitt i stan med en underbart avkopplande miljö att vistas i. Bara skönt att strosa runt och...More
[Swedish],166,28.0,1.0,5,"March 23, 2018 ",Orkideer,"Jarna, Sweden",Härlig trädgård värt besöket  Det fanns några blommande orkidéer i olika dimensioner o utseende inomhus i växthuset
[Swedish],166,14.0,3.0,5,"February 11, 2018 ",Fantastisk trädgård hela året ! Gratis inträde !,"Lund, Sweden","Här kan du strosa runt hela året ute och inne.
Det finns både blommor och djur inne i växthuset.
Ute...More"
[Swedish],166,68.0,38.0,5,"January 20, 2018 ",Avslappnande underbar miljö nästan mitt i Lunds Centrum,"Lund, Sweden",Botaniska trädgården är en viloplats i en Fantastisk miljö. Ta gärna en tur in i växthuset också. Är det fint...More
[Swedish],166,382.0,47.0,5,"November 26, 2017 ",En av mina favoriter i Lund,"Lund, Sweden","Botan i Lund är en favorit sedan 1979.

Spelar ingen roll när på året det är alltid rogivande, vackert och...More"
[Swedish],166,18.0,3.0,5,"November 6, 2017 ",Pärla i Lund året runt,,"Botan en pärla året runt!
Picknick med familjen
Fika med kompisar
Egentid med tankar
Grönska utomhus eller inne i växthuset...More"
[Swedish],166,94.0,5.0,5,"November 3, 2017 ",Vanlig dag ,"Lund, Sweden",En oas i Lund för den med intresse för växter eller bara för den som vill njuta av lugnet i...More
[Swedish],166,16.0,4.0,5,"October 18, 2017 ",Njut av en promenad i vackra Botaniska trädgården,"Lund, Sweden","När du söker både färgprakt, stillhet och en skön promenad, ja då ska du besöka Botaniska trädgården i Lund. Det...More"
[Swedish],166,21.0,2.0,5,"October 8, 2017 ","Till kommande vår, ett måste att få se Näsduksträdet blomma.","Jonkoping, Sweden","Ett verkligt skönt ställe att tillbringa sin tid i. Många vackra och även udda växter men även djur, typ giftgroda...More"
[Swedish],166,12.0,4.0,5,"September 30, 2017 ",Bästa stället i Lund!,"Kokkola, Finland",Mitt favoritställe i Lund! Älskar särskilt växthuset och trädgården med ätbara växter! Ett härligt ställe att sätta sig ner och...More
[Swedish],166,81.0,7.0,5,"September 13, 2017 ",Hela Lunds trädgård ,"Lund, Sweden","Jättehärlig park. Både att hänga med vänner efter skolan, en promenad med dejten eller bara umgås med sin bok i...More"
