[English],240,16.0,,5,1 week ago ,Summer and winter destination,"Washington, DC, United States","The botanical garden in Lund is an oasis 5 minutes walk from downtown. Lots of trees, perennials and annuals. Beautiful outdoor cafe in the summer next to a pond with ducks. And, an ever growing series of greenhouses with tropical climate, perfect for cold or...More"
[English],240,37.0,4.0,5,"October 21, 2018 ",A your-round destination,"Lund, Sweden","There is no wrong time to visit Lund's botanical garden! When the weather is foul you can seek refuge inside the green houses and admire exotic plants from various parts of the world. On a warm summer evening, the gardens is the perfect place to...More"
[English],240,33.0,4.0,5,"October 13, 2018 ",Gives peace of mind,"Oslo, Norway","Lund's beautiful botanical garden gives peace of mind. A lovely place for a walk to clear your mind after a hard day at work. The garden has a very nice café as well, but it is closed during the winter season."
[English],240,45.0,9.0,4,"October 12, 2018 ",Beautiful botanical gardens for walking,"Toronto, Canada","Beautiful botanical gardens for taking a nice and peaceful walk in. Lovely gardens, lovely scenery and lovely water features. This place was really nice to have a stroll through and just sit and relax."
[English],240,3.0,,4,"October 3, 2018 ",Botanical Garden in Lund,"Lund, Sweden",It is a very nice and beautiful botanical garden with lots of old trees. There is a Davidia involucrata. When it blooms it is fantastic.
[English],240,58.0,31.0,4,"September 17, 2018 ",Lovely place to visit ,"Huddersfield, United Kingdom",Out with our grandchildren for the day and visited botanical gardens. It’s very child friendly and there were people showing fruit and vegetables they had grow and the children were able to sample these. Cafe is also very good..
[English],240,12.0,2.0,5,"September 6, 2018 ",More beautiful every year.,"Lund, Sweden","""Botan"" has developed from being a pure botanical garden for students and researchers to becoming more of a pleasure garden with more emphasis on aesthetics. Every year, some part of the garden is developed and every season offers its surprises, so it is both worth...More"
[English],240,37.0,14.0,5,"September 6, 2018 ",So much to see,"The Hague, The Netherlands",Too bad we couldn't stay longer. This is a place you can visit any time and discover something new. Well done!
[English],240,14.0,1.0,4,"August 27, 2018 ",Beautiful Botan!,"Lund, Sweden","This beautiful botanical garden is a must while in Lund during spring, summer and fall. In addition to the large garden, you can have the best lunch or fika in the café, buy seedlings in the shop or just enjoy the greenery. A green heart...More"
[English],240,5.0,,4,"August 27, 2018 ",Paradise in Lund's heart,"Lund, Sweden",A beautifull place for anytime of the year. There is a huge variety of plants all over the world. Specially the indoors green-house is something you must see!
[English],240,684.0,143.0,4,"August 26, 2018 ",Free greenhouse,"Kingston-upon-Hull, United Kingdom",These were great gardens in the city. Loads of interesting buildings within the grounds and lots of different gardens to look at as well. The greenhouse was free to walk around. Loads of different plants to see and they had also provided information about them...More
[English],240,302.0,62.0,5,"August 25, 2018 ","A peaceful, and lovely plave to go for a walk right in the middle of Lund","Diani Beach, Kenya",A beautiful botanical garden right in the middle of Lund.  There is also a lovely little cafe near a lovely pond for a nice cappuccino and a pastry.
[English],240,2.0,,5,"August 6, 2018 ",Wonderful spring flowers,"Lund, Sweden","The botanical garden is always a joy to visit. Extra beautiful in the spring. My favourite park in the city. Nice smell and pretty birds in the orangerie. Almost always calm, only time when there’s a lot of noice is for two weeks when the...More"
[English],240,65.0,22.0,4,"July 19, 2018 ",Beautiful ,,A walk in the Botanical Gardens is absolutely beautiful. Not to mention if one is of course into different plants and flowers then it's a must.
[English],240,58.0,14.0,4,"July 14, 2018 ",Really nice botanical garden,"Helsinki, Finland","The systematic garden with plants in arcs outside, and inside easily accessible greenhouses (free entrance) separate rooms for different climates. Automatic doors make the walking really easy, and there is really lot to see. Highly recommended!"
[English],240,166.0,78.0,3,"July 11, 2018 ",Nice free space in Lund,"Horsham, United Kingdom",The gardens are pleasant and entry is free. A sign says that they've got some financial issues and unfortunately it shows. It looks a bit shabby in parts. If you are used to the quality of botanical Gardens in the UK then you may be...More
[English],240,19.0,6.0,5,"July 2, 2018 ",Lovely gardens,"Barrie, Canada",It has been very dry and hot in May so the flowers and trees did not have a c hence to be at their best.  Lovely selection.  Nice to see so many common flowers that are the same as we have in Canada.
[English],240,199.0,54.0,4,"June 29, 2018 ","Do not visit in winter, but DO! visit in summertime!!","Bunschoten, The Netherlands","Beautifull garden. Bert wellprepared garden, lots of different kinds of flower, trees and Bushes. But whatsapp is most impressie : the atmosphere, relaxed, open and colourfull. Worth a visit and a walk!"
[English],240,142.0,16.0,5,"June 23, 2018 ",Beatifull and quiet garden,"Inverness, United Kingdom",Not very large but very well maintained garden with several flowers distributed along the walk streets. Visit is recommended.
[English],240,34.0,6.0,5,"June 20, 2018 ",Beautiful gardens in the middle of the city,,"Very well kept and beautiful gardens in the middle of Medieval Lund city centre. It was a botanicist from Lund who imported Dahlias in the 18th century, there is a wide selection of varieties on display."
[English],240,14.0,6.0,5,"May 26, 2018 ",A beautiful oasis in the midst of a beautiful city,"Lexington, Kentucky","This lovely educational park restores the weary traveler's senses with colourful flowers, large shady trees and even a greenhouse. Nice for a picnic or a stroll. Free."
[English],240,57.0,28.0,5,"May 24, 2018 ",Family friendly,"Western Australia, Australia","We spent some time admiring the flora. There are around 7000 different varieties located in the grounds. During May many of the flowers were blooming, the Park was busy and it was a truly beautiful place to spend some time. Take a picnic as there...More"
[English],240,808.0,188.0,5,"May 17, 2018 ",A beautiful spot,"Columbia, Maryland",The University’s beautiful botanical gardens sre a wonderful spot to while away the hours and spend time communing with nature. They house an incredibly rich and diverse collection of plants from all over the world displayed in beautiful settings.
[English],240,81.0,3.0,5,"April 15, 2018 ",the beautiful garden of Lund,"Lund, Sweden","this place is so amazing, especially in spring when all students enjoy this nice city oasis. It comes in so many colors and beauty. A must see when in Lund."
[English],240,239.0,55.0,3,"April 8, 2018 ",Nice,"Skanor, Sweden",Beautiful grounds about to explode for spring. Would be better to visit once the warmth has encouraged the bulbs to grow. Glasshouse has very limited open hours so make sure you are there for the 5 minutes they let you in.
[English],240,164.0,15.0,4,"March 31, 2018 ","Small but diverse, good quick visit","Stockholm, Sweden","The grounds are a nice little stroll and the greenhouses are very nice. For the quite small area alotted for this garden, there is an impressive variety of species and biomes represented. Of course, a visit during summer is preferred."
[English],240,68.0,5.0,5,"March 12, 2018 ",Beautiful garden,"Bagsvaerd, Denmark","If you are interested in plants and want to visit a big park this is the place to go in Lund.

The Botanical Garden covers a big area in the city center and is linked to the university of Lund.

It is an amazing garden...More"
[English],240,6.0,2.0,4,"February 8, 2018 ",Impressing,"Lund, Sweden","Very interresting with a lot beautiful arrangemangs of different trees etc.
Indoors there is an impressive arrangement of different floders, as well as
a selection of live butterflyes."
[English],240,37.0,19.0,5,"February 5, 2018 ",Super day out. ,"Lund, Sweden","This is a great day out for kids and adults alike. Lots of interesting plants and tropical of many sorts. 

The grounds are well managed and filled with colorful plants. Its an oasis of life and positivity. 

I would definitely recommend, although it’s best to...More"
[English],240,3.0,2.0,3,"January 13, 2018 ",Maybe not the best time but a great place!,,"This garden is surely meant to be beautiful, but the weather was not on our side, making this an experience with missed potential. I would love to come back in the spring to see all the flowers and plants at their best!!"
[English],240,273.0,139.0,4,"January 9, 2018 ",Colourfully quiet time,"Lund, Sweden","The Lund Botanical Gardens are best visited during the lush spring-to-summer time, where they are at their very best, with an explosion of colours, all the plants around you emanating their fragrances, and the relaxed crowd of visitors that makes for great people-watching. Find a...More"
[English],240,69.0,19.0,4,"October 8, 2017 ",Interesting collections with useful information in English,"Canberra, Australia","Even in October the botanical garden is an interesting place to walk around. There is enough information in English so I was able to appreciate the layout of the gardens and the collections. It's also open early in the mornings, although the indoor gardens don't...More"
[English],240,32.0,5.0,5,"October 5, 2017 ",best garden in Lund,"Lund, Sweden",This garden is plaed in the middle of town and it´s a great place to walk around and don´t forget to walk inside the indoorgarden. funfact! inside the house they have a palm tree that grows so much that they have to raise the roof....More
[English],240,15.0,13.0,5,"October 4, 2017 ",A remarkable and lovely oasis right in the city center,,"Being a local, I've seen the Botanical more than once. However, it's not a place you just happen to end up in or will be accidentally passing through. You have to be aiming at getting here. And by all means, I urge you to do...More"
[English],240,3.0,,5,"October 2, 2017 ",An afternoon stroll among the flowers,"Lund, Sweden",Its simply wonderful when the dahlia is blooming. Make sure you have time for your visit because you might get caught by Its beauty.
[English],240,4.0,,4,"October 2, 2017 ",Absolutely lovely. Great for any season.,"Lund, Sweden","In the winter, spend time in the greenhouse. Look out for the birds in the main room and bring a book so you can sit out among the trees in the citrus room. In the spring, bring a picnic and bask in the sun with...More"
[English],240,4.0,,5,"September 28, 2017 ",Spectacular,,"Beautiful garden, with lots of species of flowers blooming around the month September. Great place to walk, stroll, run, walk a pet. Very well maintained."
[English],240,324.0,86.0,4,"September 15, 2017 ",A walk through the gardens,"St. George, Bermuda",I always enjoy going to the botanical gardens wherever I am visitng and this was no exception. They were well maintained and had a variety of beds with different vegetation in them. Very well cared for.
[English],240,34.0,23.0,4,"September 11, 2017 ",The gardens,"Perth, Australia",What a beautiful area..It is so relaxing strolling through the gardens and hot houses...would recommend this to all
[English],240,347.0,107.0,4,"September 8, 2017 ",A peaceful beautiful garden,"Lund, Sweden",A beautiful botanic garden and no intrance fee. Very peaceful for relaxing and you can learn a lot about the flowers. The garden is a part of Lund University
[English],240,68.0,5.0,5,"September 2, 2017 ",Beautiful botanic garden,"Bagsvaerd, Denmark","It is a beautiful botanic garden which is definitely worth visiting!

If you have a passion for flowers and/or just like walking to look at beautiful things you cannot miss out visiting the garden. And perhaps you get to learn something too 😉

It is...More"
[English],240,138.0,101.0,4,"August 9, 2017 ",Beautiful and relaxing,"Bursa, Turkey","we visit with our 2 sons. lovely, quite and relaxing place. it will be an enjoyable idea for a family walk."
[English],240,12.0,2.0,5,"July 24, 2017 ","Beautiful, educational, and free!",,"Great place to go for a walk to look at the beautiful surroundings and learn about plants; edible and otherwise.

If the weather is nice, I would also recommend lunch or fika att the café."
[English],240,10.0,10.0,5,"July 23, 2017 ",Excellent play area for the children,Sweden,"The garden and greenhouses are in my opinion excellent! The greenhouses with different climate areas are always a pleasure to visit and the play area made up of large tree trunks is fantastic, should be found in every botanical garden."
[English],240,135.0,51.0,5,"July 21, 2017 ",Take a stroll and relax.,"Harrogate, United Kingdom","We visited the wonderfully stocked and cared for garden on a short visit to Lund.
Everything looked so fresh, new and vibrant.
Gardeners were pleasingly taking their time to ensure that the plants were looking their best and putting on a beautiful display.
I am...More"
[English],240,23.0,35.0,5,"July 14, 2017 ",Beautiful Picturesque Gardens,"Caloundra, Australia",One of the best botanical gardens that I have seen. We visited in early August and the colours and array of flowers and plants were gorgeous. There is a small cafe where you can buy food & drinks with seating areas around a large pond....More
[English],240,9.0,,5,"July 3, 2017 ",A must see!,"Potomac, Maryland",My husband was in Lund for a conference so I had quite a bit of time on my own. I loved wandering through the gardens and often just sat with a book. So lovely and relaxing. Make sure to stop by the cafe near the...More
[English],240,8.0,1.0,5,"June 27, 2017 ",Loved the gardens,Indiana,We were here in early June and the rhododendron was amazing. I thoroughly enjoyed strolling through the gardens. Many people were eating or lounging in picnic areas; lots of couples and families. It is a truly lovely spot.
[English],240,20.0,3.0,5,"June 23, 2017 ",One of the... ,"Lund, Sweden",One of the best places in Lund when the flowers are at it. Very beautiful place during the spring and summer. Highly recommended during the season. Don't forget the cafe if the weather is good.
[English],240,120.0,23.0,4,"June 21, 2017 ",Great place for a walk or picnic,"Lund, Sweden","A lovely place in the spring, summer and fall. Just take a walk, have a picninc, or go into the greenhouse to see some intresting and rare plants."
[English],240,39.0,14.0,5,"June 4, 2017 ",Walking at the morning,"Athens, Greece","Botanical Garden it's excelent.
It's a place you can know nore about different flowers and also have a big places to make a pic nic"
[English],240,164.0,49.0,4,"June 3, 2017 ",Small but interesting,"Copenhagen, Denmark","This might not be the biggest botanical garden, but it offers a lot in tense and overwhelming smells and looks. A lot of flowers were blooming when we visited, and a lot of youngsters were celebrating/socializing which made the garden alive and vivid. Definately worth...More"
[English],240,75.0,12.0,4,"June 3, 2017 ",Nice place to relax and picnic,"Lund, Sweden","Nice, well kept garden. Is a little oasis in Lund and a great place to relax, and enjoy the sun (if the weather is nice). Also, a great place to picnic."
[English],240,294.0,41.0,3,"May 27, 2017 ",Nice place to relax,"Buenos Aires, Argentina","Not as impressive as other gardens in other parts of the world, but still a nice place to relax, sunbathe if the weather permits and have a relaxing walk"
[English],240,21.0,10.0,4,"May 24, 2017 ",A place to relax and have a picking,"Malmo, Sweden","Really a nice place to enjoy the environment. Perfekt for a picnic after visiting the old town.
A must for the ones that are interested in rare treas and flowers"
[English],240,59.0,11.0,5,"May 23, 2017 ",Beautiful garden especially at certain spring times,"Lund, Sweden","The botanical garden is a little oasis in Lund. They have some impressive areas and try to design it so that there is always something to discover. Beautiful cherry blossom trees in April, impressive lily collection and dianthus to easter time. Herbs and stone garden....More"
[English],240,163.0,35.0,5,"May 4, 2017 ",Superb Botanical Gardens,Scotland,"The visit was on a bright but chilly April day, and the systemic collections merited study, but the highlight was the diverse garden areas with different layouts and micro-climates. There was much to savour and explore. The small shop was worth a browse, and the...More"
[English],240,172.0,26.0,4,"April 17, 2017 ",Nice way to start the visit of the city,"Bruson, Switzerland","We started the discovery of Lund with the botanical garden, which is very nice. There are thousands of different plants and it is very well maintained. Some greenhouses are also accessible with some exotic plants."
[English],240,163.0,40.0,4,"April 12, 2017 ",lot of different plants,"Glasgow, United Kingdom",A small place for a pleasant walk when the sun comes out. Not a lot to see though there is a cafe there but the gardens contain a huge array of plant species
[English],240,14.0,6.0,4,"April 12, 2017 ",Beautiful and welcoming,"Lund, Sweden","If you can't come up with anything better to do, come here. It's beautiful, accessible and enjoyable. The greenhouse itself is worth a visit so good for rainy days. Interesting plants from orchids to rice. Small birds instead of pesticides keep the pests down. If...More"
[English],240,420.0,229.0,4,"April 8, 2017 ",Small lovely park ,,I usually run through this park during my workout and is beautiful but quite small. It is perfect for a promenade or a picnic in the spring or summertime. There is always people there so don't expect solitude. It's very season based regarding the plant...More
[English],240,17.0,1.0,5,"March 14, 2017 ",Best botanical garden,"Muonio, Finland","Great botanical garden with small quails going around. They are doing such a good work, pay a visit when being at Lund! The inside amazon feeling like forest was enough to make me fall in love. But go summer time to enjoy the great park...More"
[English],240,29.0,5.0,4,"March 1, 2017 ",Beautiful,"Leuven, Belgium",It's one of the most beautiful places to visit when in Lund. They have hundreds and thousands of different varieties of plants. There are path ways where to can talk a walk and enjoy the beauty.
[English],240,19.0,4.0,5,"February 18, 2017 ",Worth a visit,"Holte, Denmark","Must be beautiful in the summer, we spent a wet winter day here but it was very nice to visit the green house with all the plants and even some animals like koi-fish, frogs and chinese quails."
[English],240,3.0,1.0,5,"February 15, 2017 ","Plants, Chinese quails and temperature differences","Lund, Sweden","This is a perfect place to visit both during the summer and during the winter. I was there this February and it was really nice to go into this tropical warmth when it was so cold outside. A different experience during the Swedish winter, and...More"
[English],240,36.0,4.0,4,"February 13, 2017 ","Very pretty, one of the best places on a nice and warm day in Lund","Lund, Sweden",People use to come here to enjoy picnics and the beautiful surroundings of flowers. Specially in late spring to early fall this is one of my favorite places in Lund. At winter it's nice to go into the tropical greenhouse and enjoy a walk in...More
[English],240,76.0,38.0,4,"February 1, 2017 ",Nice walk - and free,"Gothenburg, Sweden","Botanical garden is a nice place to walk and enjoy the day. Depending on the season, it is a completely different place.
They have a greenhouse where you can know about tropical plants. There are also many events happening all the time. Check on their...More"
[English],240,76.0,6.0,5,"January 18, 2017 ",A nice break from the city,,"Even though Lund isn't a big bustling city a break from traffic is always welcome. The botanical gardens are beautiful most of the year and have different flowers for different seasons. 
The botanical house costs a small entrance fee and lets you travel through different...More"
[English],240,29.0,10.0,4,"January 18, 2017 ",A wonderful botanical garden in the heart of Lund. A great place to visit between April and October,"Lund, Sweden","The botanical gardens are well kept and labeled. They are perfect for a stroll or a picnic. There are for example many tropical trees that are extremely unusual for Scandinavia, wonderful slower gardens, bushes --everything you can desire of a botanical park.. Just south of...More"
[English],240,66.0,140.0,5,"December 28, 2016 ",Good Big Garden,"Malmo, Sweden",It is quite a big garden and hosts many biological important plants. It also hosts a green house for various tropical trees found accross the earth. Must for Botany students...
[English],240,4.0,,5,"December 8, 2016 ",Beautiful,"Philadelphia, Pennsylvania",WE had a lovely walk through this free botanical garden while exploring Lund on a warm September day. Many plants and flowers were still in bloom and beautiful. Much larger than I thought. Great spot for a picnic. Free admission. Definitely worth a visit. It...More
[English],240,10.0,5.0,3,"December 4, 2016 ",Nääää,"Lund, Sweden",I have no idea why botanical gardens are so special. I have been there twice but nothing really surprised me.
[English],240,36.0,35.0,5,"November 15, 2016 ",Especially interesting in summer,"Malmo, Sweden","We went there for a walk, but happened to witness an exibition of different pepper types from mini and super chili to the ordinary ones we buy in stores. 
I loved the fact that it has in the inside a few birds I saw for...More"
[English],240,21.0,4.0,5,"November 15, 2016 ",Beautiful in the Spring!,"Lake Kiowa, Texas","Nice place for a picnic on a beautiful spring day!  Nice cafe for coffee and a treat for the picnic, too."
[English],240,14.0,2.0,5,"November 8, 2016 ",Must see in Lund,"Porto Alegre, RS","A really nice botanical garden, it is rather on the small side but it is filled with lots of plants, all very well described. We wanted to know more about a plant so we just asked the people working there and they were able to...More"
[English],240,25.0,9.0,5,"November 5, 2016 ",Nice place to hang out if the weather is nice,"Bangkok, Thailand",I really liked hanging out here when it became a little more sunny. It is a nice place to hang out with friends or take a stroll or even a picnic.
[English],240,116.0,32.0,5,"October 31, 2016 ",Botanical Gardens (Botaniska Tradgarden),"Akarp, Sweden",A nice and well kept garden well worth visiting. The entrance is free and usually you can park just outside. Bring your camera all year round because there is always many beautiful things around.
[English],240,37.0,10.0,4,"October 18, 2016 ","Lovely place, don't miss the greenhouse",,"Beautiful green area in Lund, definitely worth a stop in summertime just to hang out on the grass with a cup of coffee in your hand. Don't miss the greenhouse, there are a couple of different temperatures and humidities with different plants to check out."
[English],240,3.0,,4,"October 18, 2016 ",A place to charge your batteries the year around!,"Lund, Sweden","A palce which offers tranquility, comtemplation and interesting knowledge. A palce for charging your batteries."
[English],240,128.0,46.0,5,"October 17, 2016 ",Beautiful place to wander on a Saturday Morning,"Sheffield, United Kingdom","Wonderful location even this time of year with the Dalias still in bloom ! 
A visit to the glass house which had various sections and interesting plants"
[English],240,8.0,1.0,4,"October 11, 2016 ",Beautiful,,"One of my favorite place to relax and enjoy the nature. it's Beautiful, peaceful which located in the middle of town. There is also a warm house, and a caffe."
[English],240,43.0,7.0,5,"October 2, 2016 ",Romantic walk ,"Mumbai, India","Located near the centre of Lund, this garden boasts of  wide variety of trees and flowers. Specially interesting is the spice garden. A lovely place for your morning walk or just a place to sit among the peaceful paths and watch the squirrels scurry past."
[English],240,250.0,215.0,5,"October 1, 2016 ",A lovely park with beautiful plantins.,"Curitiba, PR",Even in late September this botanical garden is well worth a stroll. Lovely flowers abound everywhere.
[English],240,128.0,15.0,5,"September 23, 2016 ",Just a lovely place,"Stockholm, Sweden","The botanical garden is definitely worthwhile to visit. Every single corner deserves a picture, especially in the green house (please don't miss it!). Solo, friends, couples, family, every type of visit fits into the park concepts."
[English],240,223.0,167.0,3,"September 22, 2016 ",Nice Place to Visit,"Houston, Texas","The garden is large, with a lot of area to walk around.  The greenhouses were interesting, especially with the small birds running around inside - I didn't see any flying birds.  A chili pepper exhibit was featured during my visit."
[English],240,136.0,49.0,4,"September 21, 2016 ",Beautiful garden and green house ,"Ballerup, Denmark","Visited during Culture Night and was not disappointed. The garden was very beautiful with smaller areas with different types of flowers and herbs. The green house was also great with sections for cactuses and mediterranean, and many more."
