[English],240,20.0,7.0,5,"September 15, 2016 ",A little slice of Eden in Lund.,"Lund, Sweden",Perhaps you know the famous botanist Carl von Linné studied in Lund and was theoriginal planner and inspirator for the foliage and other plants found here ... Well treat yourself to a walk in the beautiful botanical garden here- the locals refer to it as...More
[English],240,40.0,12.0,4,"September 13, 2016 ",Picknick,"Lund, Sweden","Quite nice place to bring own foood or have a lunch break at cafe with a petite lake with gold 🐟.
Visit to tropicarium is free and oppet until 15.00."
[English],240,75.0,28.0,4,"September 6, 2016 ",Magnificent ,"Netanya, Israel","Beautiful layout with flowers and a multitude of plants set out in an intelligent way.
The spice garden was thought provoking and will be the basis of studying the medicinal use of the plants.
The greenhouses were closed but we managed to peep in and...More"
[English],240,71.0,31.0,5,"September 5, 2016 ",Lovely displays,"Charleston, South Carolina","We made a day trip from Copenhagen to Sweden. One of our stops was in Lund and rather than visit the cathedral, we opted for the botanical garden. My husband needed to rest so I ventured around the garden. Different types of plants are grouped...More"
[English],240,3.0,1.0,5,"September 4, 2016 ",Best place in Lund,"Lund, Sweden","Quite small but very charming garden. Always something to look at, or just relax in the shade on a warm day. The green house is free of charge and also nice to visit. The cafe is beautifully situated by a pond, prices are a bit...More"
[English],240,227.0,69.0,4,"September 3, 2016 ",Well worth a visit,"Leigh-on Sea, United Kingdom","Visited this place while wandering around Lund. These are extensive mature and well laid out gardens and water features, with the convenience of an on site cafe, serving drinks and snacks. The gardens are free to visit and are well worth spending a few hours...More"
[English],240,46.0,20.0,4,"September 2, 2016 ",Really nice garden,"Dublin, Ireland","Lovely garden,full of lots of beautiful and interesting plants. would recommend for a nice walk around even if only in lund for the day. very central and ideal for bringing a picnic to"
[English],240,101.0,39.0,4,"August 30, 2016 ",A very nice garden,"Torun, Poland",This garden is a nice place to just walk or sit with friends to talk. Lots of interesting trees and plants.
[English],240,2370.0,568.0,4,"August 29, 2016 ",Although it is late in the season is something to watch,"Stockholm, Sweden","Late August,Dahlias bloom in the garden.The greenhouses are open weekdays and weekends between 11:00 and 15:00.Do you just want to roam around the garden is it open to the sun goes down. With over over 7 000 species grown on 8 hectares (20 acres) it...More"
[English],240,7.0,2.0,5,"August 23, 2016 ",Beautiful garden,"Taby, Sweden",Small but excellent botanical garden in the middle of one of Northern Europe's most interesting univeristy cities.
[English],240,64.0,18.0,5,"August 13, 2016 ",Summertime in the botanical garden,"Oslo, Norway","Really pretty flowers, we had a lovely picnick by some benches with many friends. The garden smells lovely in the summer. And you can choose where to go inside or outside. Very nice! Thank you!"
[English],240,76.0,19.0,4,"August 10, 2016 ",Small but lots of interest ,"Colchester, United Kingdom",Lovely gardens near the centre of town with a small glass house at the centre housing a collection of exotic plants. Don't expect Kew but still worth a visit.
[English],240,1.0,,5,"August 5, 2016 ",One of the most impressive and well kept botanical gardens in Western Europe.,,A must to visit for anyone. Both native Swedes and tourists coming to Scania. I've seen many around Europe and Lund is truly in the top.
[English],240,18.0,4.0,5,"August 2, 2016 ",Colour place,,Best time to visit the garden is of course in early summer when all the flowers are in Bloom. It is a romantic place if you are thinking about taking your special someone there.
[English],240,12.0,2.0,5,"August 1, 2016 ",Beautiful place ,,Á large beautiful garden with nice plants and an adorable place to sit down and drink coffee and have a cake.
[English],240,3.0,6.0,4,"July 27, 2016 ",Wonderful park with a great variety,"Guangzhou, China",The botanical gardens are located near the city centre and are easily accessible by foot or bus. Entrance is free and includes both outdoor and indoor areas. The indoor area includes a tropical greenhouse with interesting plants from around the world.
[English],240,8.0,1.0,5,"July 26, 2016 ","Botanical garden, cosy and pretty. Perfect for garden lovers and picknickers.","Lund, Sweden","A little café next to very interesting hothouses. Hothouses boast rooms showing plants and trees from northern to southern climate zone and a rich collection of orchids. The garden has place for picknicking families and souls longing for peace and quiet.
Hothouses and university building...More"
[English],240,148.0,112.0,4,"July 25, 2016 ",Now THIS is a real botanical garden!,Ottawa,"This is for serious botanical garden aficionados. Very well maintained, all plants species meticulously identified. The grounds, as one would expect, are quite peaceful and relaxing. You would be remiss not to spend a few minutes here if you come to Lund."
[English],240,63.0,13.0,5,"July 24, 2016 ",Beautiful in any seazon,"Malmo, Sweden","It is a nice place if you want to go for a quiet walk and want to see a lot of amazing plants, flowers.
It doesn't meter if it is spring or summer......it's always beautiful :D"
[English],240,70.0,17.0,4,"July 13, 2016 ",An oasis in the centre of the city with true educative value,"Lund, Sweden","Just a couple of minutes from the centre, is The Botanical gardens wich offer a fantastic oasis. With the beatiful garden and the greenhouse, wich is a must. Being divided into separate climate zones, a sophisticated climate control system keeps the optimal conditions for each...More"
[English],240,161.0,52.0,5,"July 12, 2016 ",Must do,"Steyning, United Kingdom",Beautifully kept gardens. We took a picnic and sat on the many seats. The glass houses were well stocked and maintained and the variety of flowers and foliage and the smells were lovely.
[English],240,76.0,30.0,4,"July 1, 2016 ",One of the green lungs of Lund,"Lund, Sweden",A much loved meeting place for students in Lund as well as others. Bring your picknick and relax in the shade under the trees or by the little pond. The greenhouse is highly recommended.
[English],240,11.0,2.0,5,"June 27, 2016 ",An oasis in the centre of the city with true educative value,"Lund, Sweden","The Botanical gardens offer a fantastic oasis just five minutes walk from the centre of the city. With the garden being looked after by partly the University Institutions, it is kept in fine shape and the flower beauty in all its colours is as stunning...More"
[English],240,18.0,4.0,4,"June 15, 2016 ",Nice ,"Nagoya, Japan",Good walking around different kinds of plants. Green house is recommended. One can have nice fika at cafeteria nearby the green house.
[English],240,4.0,,4,"June 13, 2016 ",Visit to Lund ,,Nice town to visit for a few hours. Spend some time in the Botanic Gardens. I had lunch in the cafe near the conservatory; skinka & ost in a seeded bun for 67 kr. Tea 27 kr.
[English],240,22.0,,4,"June 1, 2016 ",A lovely mix of a city park and an academical exhibit,"Lund, Sweden",Bring a picknick basket or visit the café and take a seat on the lawns in this city oasis. There is an indoor exhibit and while it might not be worth a specific travel to Lund for it shouldn't be missed when visiting.
[English],240,21.0,13.0,5,"May 29, 2016 ",Oasis in the middle of Lund,"Leiden, The Netherlands","Great botanical gardens in the middle of Lund. Well signed trees and flowers, extended green areas for putting a towel and reading a book when the sun is out, and just beautiful."
[English],240,27.0,6.0,5,"May 21, 2016 ",Best park in lund,,"This use to be our hangout place when we were students in lund. Always quiet, sunny and full of flowers.

Perfect for kids, students, couples, flower lovers and elderly. It is quite big and with a lot to discover. It was a while ago since...More"
[English],240,94.0,23.0,5,"May 20, 2016 ",Beautiful at any season,,This garden is just beautiful no matter when you come. Just take a stroll and discover the different parts! Especially beautiful when the magnolia bloom but also great at any other time of the year.
[English],240,91.0,12.0,4,"May 17, 2016 ",I visit every season,,Beautiful place for a walk or a glass of wine in the sun. They change the arrangements pretty often so a visit every now and then is fun. The greenhouse is great fun as well with a lot of tropical trees and the cutest small...More
[English],240,156.0,37.0,5,"May 5, 2016 ",A must-viti place,"Bologna, Italy","I visited the park in May in a very nice day, sunny and quite warm. There is a large greenhouse with many species of plants. Outside many kinds of flowersm very pleasant, perfect to relax. The location is close to the city center"
[English],240,23.0,6.0,5,"April 21, 2016 ",place to relax,"Tbilisi, Georgia","Nice park, good to walk and relax and to enjoy the nature. Calm and beautiful place. Good for families and friends!"
[English],240,13.0,,5,"April 10, 2016 ",Very relaxing place to visit,"Rockford, Michigan",My girlfriend and I came here yesterday to visit and it was a cool setup. Right down town Lund you can escape the busy streets and take a stroll in a beautiful garden park. The green houses were cool to see and they had plants...More
[English],240,67.0,44.0,3,"April 7, 2016 ",Greenhouses amazing,"Elstree, United Kingdom",We visited at start of April and the gardens themselves were disappointing but the greenhouse in the centre was amazing being split into a number of smaller greenhouses each showcasing plants requiring a different climate
[English],240,72.0,14.0,4,"March 24, 2016 ",Blooming Park in Lund .,"Lund, Sweden","Situated closed to the Center of Lund it is very easy to find.
Just take a walk  east and you will find it. You will find a lot of
rare  flowers and trees from all part of the world in the small
glashouses and of...More"
[English],240,1.0,,5,"March 20, 2016 ",A must-visit place in Lund,,Botanical garden is the coziest and beautiful place in Lund. Perfect for afternoon strolling/jogging in spring and summer time. Highly recommend to visit the green house which is kept warm throughout a year. A cafe right in front if the greemhouse is a must-visit!! :-)
[English],240,5.0,,5,"March 16, 2016 ",It´s a wonderful place with all kinds of plants,"Staffanstorp, Sweden","At this Lovely Place you find a calmness and you even can learn more about plants.
There is also a greenhouse with more exotic plants."
[English],240,23.0,2.0,5,"March 15, 2016 ","Relax, enjoy and learn",,"An oasis of beauty, calm and joy. Beautiful place with old trees to lean on and tap into the earths power. Flowers for all the seasons and all colours. 
A place to teach plants to eat, plants to use for your health and to enjoy...More"
[English],240,382.0,131.0,5,"March 3, 2016 ",Very well kept ,"Landskrona, Sweden",We visited the gardens when they were celebrating their 10th anniversary. Great variety and very well kept place for relaxing time and inspiration.
[English],240,23.0,3.0,4,"February 19, 2016 ",Oasis in the centre,"Lund, Sweden","When you wake up on a wintermorning like today, temperature is minus and you look from the balcony to the other side of the street, it is hard to believe that in 4 weeks there will be an explosion of natural power pushing itself through...More"
[English],240,13.0,2.0,4,"February 17, 2016 ",All plants you can imagine,,"This is a very beautiful garden, at least when weather is nice. It has big green areas and very, very many plants and other groving things from all over the world. Most is outside but there is also an indoor area with orchids, palms and...More"
[English],240,181.0,24.0,5,"February 15, 2016 ",Great garden in the middle of town,"Lund, Sweden","This is a great and relaxing place during much of the year. It is like walking in a nice garden with lots of students hanging out on the lawns talking, drinking a beer or just studying"
[English],240,31.0,8.0,3,"February 4, 2016 ",Indoor is best in winter,"Copenhagen, Denmark",It shouldn't come as a surprise that there isn't much to see in the outdoor part of the Botanical Gardens during December. But maybe that makes the indoor part just that much more impressive and feels like walking into another world. The plants are very...More
[English],240,97.0,23.0,5,"January 26, 2016 ",Beautiful!,"Lund, Sweden","Beautiful botanical garden, locally known as ""Botan"" dating back from 1690 and from 1862 in its current location. On display is a with a wide array of trees, flowers and plants. You also have greenhouses with nine different climate zones. It is open daily and...More"
[English],240,394.0,316.0,4,"January 14, 2016 ",Well maintained and very beautiful!,Stockholm,"The Botanical Garden in Lund is very popular among students and tourists during spring and summer till the end of the autumn. They all like to walk around and enjoy the beauty.

The plants in the gardens and in the greenhouse have all a description...More"
[English],240,5.0,5.0,5,"November 25, 2015 ",A beautiful botanical garden,"Lund, Sweden","This beautiful botanical garden is a special place you have to visit when in Lund. It has a large collection of plants, trees and tropical flowers. Springtime you can see a large amount of early spring flowers and during summer you can enjoy a picnic...More"
[English],240,28.0,9.0,5,"November 18, 2015 ",Swedish scientists' idea of landscaping,"Paris, France","while not the best display of esthetic design, this is a curious garden to walk through with anyone interested in horticulture: everything is labeled, the hothouse is the best part and free to visit, the café is where to go on a dry day (because...More"
[English],240,5.0,1.0,5,"November 17, 2015 ","Beautiful collection of plants, trees & sculpture.","Clonmel, Ireland",Enjoyed a great walk en famille on a bright sunny Sunday afternoon. Great display of autumn colours throughout the gardens. Fabulous variety of plants. Hope to return in early summer when shrubs are in full bloom.
[English],240,111.0,20.0,4,"November 6, 2015 ",Nice but expensive ,,"There were lots of flowers, also tropical ones. As a fan of flowers definitely worth a visit but for others it's maybe more advised to just enjoy the outer garden for free."
[English],240,39.0,14.0,5,"October 14, 2015 ","Botanical Garden in Lund, Sweden","King's Lynn, United Kingdom","I visited the Botanical Gardens in Lund, some great specimens inside and outside, well worth visiting, Cafe on site near a lovely pond where one can relax after the walk around."
[English],240,189.0,35.0,4,"October 7, 2015 ",nice garden,"Bucharest, Romania",Nice garden to walk around and enjoy the beautiful plants. Sadly we were there in March and the majority of plants were not fully grown yet. But still the place is very quiet and peaceful .
[English],240,121.0,54.0,4,"October 2, 2015 ","Beautiful park, much bettr than Stadspark! ","Gokarna, India","Don't miss this little gem of a park, where you can have some sweets and good coffee beside the pond, you can see gorgeous flowers and sample some blackberries (yes, they have over 20 bushes full of awesome berries :). Peace and relaxation, more intimate...More"
[English],240,8.0,2.0,5,"September 29, 2015 ",Wonderful!!,"Santiago, Chile","It's a wonderful place!  It have flowers beautiful, a lagoon with ducks and many green áreas for walk...i recommend it 1000%"
[English],240,7.0,4.0,4,"September 16, 2015 ",Botanical Garden - for relaxasion and scientific discoveries,,"The Botanical Garden in Lund (Botaniska Tradgarden) is situated near city centre, so you can come here whenever you want. The place is really quite even if there are more people than jut you and your friends. I do not know why. Maybe the atmosphere...More"
[English],240,14.0,21.0,4,"September 2, 2015 ",A very beautiful and relaxed place,"Lund, Sweden","There are a lot of trees and beautiful flowers . All with there names in latin and swedish infront of them.
There is also a Greenhouse with plants from al over the wourld and a special Orkidéehous . Nearby you have a pound and a...More"
[English],240,33.0,8.0,5,"September 2, 2015 ",Stunning gardens for a relaxing walk.,,Beautiful gardens to slowly wander through on a nice sunny day. Make sure you explore the greenhouses as they contain not only lots of different varieties of plants but also some wildlife as well.
[English],240,18.0,13.0,4,"September 1, 2015 ","Botanic Park, both used for Science and for evereydayers, a lovely garden","Trosa, Sweden","A beatuful place! Winter or Summer alike. Blossoming or snowcovered treas, in spring and early summer filled with students. A Green house with beautiful plants from various places of our earth. Birds. A Paradise 10 minutes walk from Lund center."
[English],240,16.0,19.0,4,"September 1, 2015 ",Small and lovely,"Santa Fe, New Mexico","Nice strolling, great little cafe for eating outdoors next to the pond and voracious ducks. In the center of Lund so makes for an easy walk to and back."
[English],240,129.0,20.0,4,"September 1, 2015 ","A must, If you love gardening.","Lund, Sweden","At least once a week I walk in this Botanical garden together with my dog. During my walks I learn a lot, get a lot of ideas, see wonderful flowers, trees and planting."
[English],240,146.0,157.0,4,"August 26, 2015 ",Attractive gardens with a good cafe,"Solihull, United Kingdom","Attractive Gardens close to the centre of Lund. We enjoyed a very pleasant stroll around the park-like grounds, and then visit to the cafe. We had our coffee sitting out by the lily pond. Free refills included!"
[English],240,11.0,5.0,4,"August 26, 2015 ",Interesting and nice,,"Good place to chill in a warm summer. It's quite big, with many different plants that are integrated in the park. Lots of places to lay down and sunbath (lots of people actually do that). My recommendation, go with a book in a warm day...More"
[English],240,126.0,60.0,5,"August 23, 2015 ",So very pretty,"Gold Coast, Australia","I get the impression these gardens were designed ""with a delicate hand"". ..not overpowering like some Gardens I've  visited in the past. 

These are delightful with unexpected Vistas  at almost every turn.

The Cafe makes delicious food. ..and eating by the small pond is special...More"
[English],240,12.0,,5,"August 19, 2015 ",Beautiful gardens with fantastic fika!,"Denver, Colorado","These gardens are full of beautiful flowers and plants. For any students living east of the city center, I recommend walking through here rather than along the main road. If you're there between April and October definitely go get fika at the cafe, they have...More"
[English],240,23.0,3.0,4,"August 12, 2015 ",Don't rush,"Lund, Sweden","A winter's visit to CT. Don't let it fool you. The gardens are still full with miracles, to come during spring. It was 18 degrees this week after a cold period, the gardens started to show the beauty to come. Could spend s day. Don't...More"
[English],240,30.0,35.0,5,"August 8, 2015 ",Amazing Gardens,"Chester, United Kingdom",Stunning does not do this place justice. Well cared for. Good information posted with each type of flower or tree. Thanks to the wonderful gardeners
[English],240,29.0,8.0,5,"August 5, 2015 ",A fresh experience!,,I visited Lund botanical garden in summer when it was flooded with different kind of beautiful flowers. It was a fresh experience indeed. Its at the walking distance from Martenstorget so you can take a short walk and you will be there.
[English],240,56.0,3.0,5,"August 5, 2015 ",Hangout!,,"Such a wonderful spot in summer to hang out on blankets, scope out locals doing the same, and enjoy some beautiful ambiance.  You're good to drink and eat, but not too BBQ in the park."
[English],240,14.0,6.0,4,"August 4, 2015 ",Surprisingly interesting,Wetherby,There are so many points of interest but to us the bed given over to different species of corn and a range of vegetables was the most riveting.  A word of warning.; the glass houses are only open for part of the day.
[English],240,59.0,15.0,5,"August 3, 2015 ",Tons of plants and flowers.,"Halmstad, Sweden",Suitable for people who love nature and flower. I find it fascinating that so many plants can be kept in such tiny glass houses. The svärmors kudde ( mother in law's pillow') is so funny name for a cactus. Love the tiny little chickens that...More
[English],240,562.0,157.0,5,"August 2, 2015 ",Beautiful and Enjoyable Garden,"Sonoma, California",I love gardens and this was one of my favorites. They have many color beds and there are many areas of the garden. it is well maintained and there were numerous folks working in the garden. They also have an interesting greenhouse open to the...More
[English],240,113.0,42.0,5,"July 29, 2015 ",Lovely little Botanical Garden,"Berkeley, California",This is a small but wonderful botanical garden. In summer it's alive with blooms of all kinds of interesting plants. It has several small hot houses for desert plants and tropical plants. Very well maintained and not too big to overwhelm.
[English],240,4.0,5.0,4,"July 29, 2015 ",City walk,"Lund, Sweden","A nice place to take a walk when in Lund, bring pick-nick or go to the cafe that is located inside the garden. Silly that you have to write a minimum of 100 characters....."
[English],240,11.0,2.0,5,"July 29, 2015 ",Interesting and beautiful,"Lund, Sweden",Well kept garden where you can enjoy both systematic gardens and get inspiration for your own projects. Plants from all over the world. Visit the green house for exotic plants and to admire the quails that live there. Charming cafe which is open during late...More
[English],240,4.0,,5,"July 22, 2015 ",Can't miss this garden,,Well worth a visit. Don't forget to enter the greenhouses which has a lot of different plants from all over the world.
[English],240,74.0,40.0,4,"July 20, 2015 ","Clean, beautiful, pretty and fragrant","Copenhagen, Denmark","The Lund Botanical Gardens are very well kept, clean and very pretty. Worth a walk through (no bikes allowed). The maps at the entrances are clear and the themed areas are interesting and well thought out. We were there in summer and the blooming flowers...More"
[English],240,20.0,3.0,5,"July 14, 2015 ",Very nice!,Borgå,We visited the gardens in pouring rain and spent most of our time in the green houses. Very nice and absolutely worth visiting.
[English],240,81.0,17.0,4,"July 9, 2015 ",Wonderful small botanisk garden,"Helsingborg, Skåne Län, Sweden",Well worth a visit if you are in Lund. I like it best late spring / early summer egen the tulips are blooming.
[English],240,54.0,19.0,4,"July 9, 2015 ",Beautiful garden,"Jakarta, Indonesia",The garden was really big and have little benches and pond inside. Very nice to spend an hour in the city where everything was green.
[English],240,28.0,1.0,4,"July 9, 2015 ",Nice for a picnic or for a walk or just sitting and chatting,"Munich, Germany","Relaxing place for a walk or just sitting or laying on the grass getting some sun, drinking coffee or eating some food."
[English],240,21.0,5.0,5,"July 3, 2015 ",Beautifully maintained well-used park,"Lexington, Massachusetts","We loved seeing this place on a beautiful June day -- so many flowers and trees were in full bloom.  Families and couples were lounging about on the grass.  There are well-kept flower beds and paths through a variety of trees and shrubs, many with...More"
[English],240,19.0,4.0,4,"June 30, 2015 ","A quiet, peaceful walk through the gardens",,"This was a pleasant visit, and the only thing to make it better is the typical suggestion--to visit it when more plants are at their peak.  We were there in June, and the outdoor plants were just starting to bud and/or bloom."
[English],240,36.0,20.0,5,"June 30, 2015 ",Beautiful garden with a cool greenhouse,"Stockholm, Sweden",In the summer this is a great park to visit. Free entrance and alot of beautiful trees and flowers. The great greenhouse is also free to enter and offers a range of tropical plants for you to see. The cafe in the garden serves nice...More
[English],240,8.0,,5,"June 23, 2015 ","summer or winter, great",Tampa Bay ,"I've been to the gardens twice and the summer is alive with flowers everywhere. Love the wild flower fields. In winter, still very pretty, great greenhouse experience. Baby quail birds running around in the greenhouse. Cute. 
Graveyard next to the gardens is also a nice,...More"
[English],240,48.0,7.0,4,"June 19, 2015 ",A nice garden to spend lazy afternoon time,"Lund, Skåne County, Sweden","Like other botanical garden, we can find interesting plants and flowers here.  Also great for picnic in warm days."
[English],240,411.0,216.0,4,"June 8, 2015 ","Attractive, interesting and free.","Brighton and Hove, United Kingdom","The Lund University Botanical Garden is attractive, interesting and free. The Conservatory is especially interesting with sections devoted to tropical rain forest, desert and the Mediterranean.  Look out for the quail scurrying around the floor
 of the Conservatory."
[English],240,30.0,37.0,4,"June 4, 2015 ",Sweet but relatively small,"Lund, Sweden","This is a sweet little park, but be warned when the sun comes out many will flock here to picnic on the grass, and as its near the university campus the lawn areas get busy. The Cafe Botan is really worth a visit, to get...More"
[English],240,15.0,6.0,4,"June 3, 2015 ",A relaxing place,"Stavanger, Norway",A beatiful place for a stroll. Lots of interesting plants. Maybe not the most intersting place for kids.
