[Swedish],123,44.0,13.0,5,"February 8, 2013 ",Utsökt pasta,"Osby, Sweden",Vi var ett sällskap på 4 pers som njöt av Gattostretto´s fantastiska pasta och av personalen rekommenderat vin. En riktig...More
[Swedish],123,15.0,3.0,4,"February 9, 2016 ",Härlig å fräsch lunch,"Lund, Sweden",Lunchar där ibland. Det finns alltid flera val och det är alltid ett säkert kort att äta pastan där.
[Swedish],123,38.0,10.0,5,"January 16, 2018 ",Min favorit i Lund,"Lund, Sweden",Enlig min uppfattning den bästa restaurangupplevelsen i Lund. Liten men god meny där desserterna och vinerna verkligen sticker ut. Helt...More
[Swedish],123,129.0,20.0,3,"January 20, 2014 ",I Kattesund,"Lund, Sweden","En liten italiensk restaurang  med goda och prisvärda pastarätter, och en hel del annat på menyn. Placeringen mitt i centrala...More"
[Swedish],123,21.0,,3,"January 22, 2015 ",Kvarterskrog i Lund,"Malmo, Sweden","Lunds bästa kvarterskrog i centrala Lund. Italienskt, så klart med det namnet, en genial översättning av Kattesund, som är namnet...More"
[Swedish],123,14.0,1.0,3,"January 22, 2018 ",Äkta italienskt!,,"Fin miljö med gamla italienska foto på väggen. Mycket trevlig personal! Du måste boka bord!
Min favoriträtt är hemlagade Karl-Johanravioli...More"
[Swedish],123,2.0,1.0,5,"January 23, 2018 ",Favorit!,,"Alltid lika god mat, härlig atmosfär och hjärtligt bemötande. Päromknyte är en ständig favorit, men alla rätter rekommenderas."
[Swedish],123,1.0,5.0,5,"January 26, 2013 ",Bästa kvarterskrogen i Lund,"Lund, Sweden",Den trevligaste familjerestaurangen i stan. Serverar prisvärd och god äkta italiensk pasta på ett rättframt och trevligt sätt. Ett måste...More
[Swedish],123,8.0,5.0,5,"January 3, 2017 ",Afterworkmiddag,"Simrishamn, Sweden","När chefen bjuder så blir det bra, tre-rätters meny till alla innan sommarens intåg. Väl tillagade rätter och fräsch omgivning....More"
[Swedish],123,62.0,24.0,4,"January 5, 2017 ",Lunch ,Malmö,"Mysigt ställe med ganska begränsad lunchmeny. Prisvärt! Soppa , pasta 1 veg 1 m bacon, olika focaccia! Helt ok ,vi...More"
[Swedish],123,5.0,3.0,4,"January 8, 2013 ",Pasta,"Lund, Sweden",härlig pasta och trevlig personal! Åt lunch med min lilla dotter och hon trivdes som fisken i vattnet!
[Swedish],123,2.0,2.0,5,"July 10, 2014 ",God mat till ett rimligt pris,Kos,Trevlig restaurang med god atmosfär och vänlig personal. Det fanns mycket att välja på i menyn och allt som vi...More
[Swedish],123,38.0,5.0,4,"July 11, 2017 ",Mysig restaurang,"Lund, Sweden","Vi var tre personer som åt var sin fantastiskt god pasta på denna restaurang, som ligger invid ett promenadstråk centralt...More"
[Swedish],123,166.0,36.0,3,"July 12, 2017 ",Dagens pasta?,"Bjarred, Sweden",Åt kycklingsallad och var het nöjd med den - ganska matig. De andra två i sällskapet valde dagens pasta som...More
[Swedish],123,19.0,4.0,5,"July 13, 2018 ",Gott och trevligt! ,,Extremt god lunchpasta och minst lika god a la carte. Ett måste att testa i Lund. Att ägaren är från...More
[Swedish],123,26.0,2.0,4,"July 17, 2015 ",En mysig smak av Italien i Lund,,Kommit hit flera gånger och ska man äta italiensk mat i Lund är Gattostretto det enda logiska alternativet. Atmosfären och...More
[Swedish],123,14.0,3.0,5,"July 17, 2016 ",Gattostretto,Kävlinge,Mycket trevlig Italiensk restaurang med fantastiskt god mat och bra service mysig atmosfär trevlig personal som är väldigt serviceinriktad !
[Swedish],123,9.0,5.0,4,"July 26, 2016 ",God och prisvärd mat,"Lund, Sweden",Trevlig och mysig restaurang i Lunds centrum. De serverar bl a goda pastarätter till rimliga priser.
[Swedish],123,26.0,13.0,5,"July 31, 2015 ",En av mina favoriter,,"Jag har varit och rest på många ställen men den är restaurangen håller jag varmt om hjärtat. Supermysigt ställe, servicen...More"
[Swedish],123,213.0,29.0,4,"July 5, 2017 ",Bra italiensk mat på italienskt vis,"Trelleborg, Sweden","Efter att ha bott i Italien är jag allergisk mot försvenskad italiensk mat. Men här är det på riktigt. 
Jag...More"
[Swedish],123,33.0,16.0,4,"July 8, 2016 ","Centralt, lugnt och god mat","Kavlinge, Sweden","Gattostretto är lätt att hitta mitt i centrala Lund. God Italiensk mat, inte mycket på menyn men vi hittade snabbt...More"
[Swedish],123,9.0,10.0,4,"July 8, 2017 ","Bra och trevlig service, god mat!","Bromma, Sweden","Droppade in spontant och det ångrar vi inte. Fick ett bra bord direkt, bra förklaring av menyn och bra vintips...More"
[Swedish],123,77.0,14.0,3,"July 9, 2012 ",Klart ok!,"Skåne Län, Sweden","Mycket trevlig och genuin ägare som lagar italiensk mat och desserter från grunden. Ok atmosfär, trångt och inte så mycket...More"
[Swedish],123,19.0,4.0,4,"July 9, 2018 ",måndagsmiddag,"Lund, Sweden","lite förvirrat med fördrink som ej var beställd …. 
När jag bokade fick jag inte frågan om jag ville sitta...More"
[Swedish],123,7.0,7.0,5,"June 14, 2014 ",Vårt favvohak!! ,,"Fantastiskt god mat, mysigt och vänlig samt härlig personal. Vi går hit ca varannan månad och än oftare för att...More"
[Swedish],123,29.0,6.0,4,"June 16, 2013 ",mysig restaurang,"Lund, Sweden","Jag ock flickvännen var där och åt romantisk middag. Min mat var verkligen inte god, åt kalvfile som var lite...More"
[Swedish],123,133.0,18.0,4,"June 19, 2015 ",Gott o bra!,"Lund, Sweden",Har varit här 2 ggr den sista tiden. Första gången var vi ett större sällskap som hade förbeställt mat och...More
[Swedish],123,15.0,3.0,5,"June 19, 2018 ",Vår favoritrestaurang i Lund.,"Lund, Sweden",En familjär mysig restaurang som blivit vår familjs favorit .Pastan är fantastisk och förrätterna håller klass - åt samma färska...More
[Swedish],123,203.0,25.0,3,"June 30, 2018 ",OK!,,"Trevlig personal och maten smakade bra men inget som stack ut tyckte jag, min man var dock väldigt nöjd med...More"
[Swedish],123,8.0,5.0,3,"June 5, 2015 ","Mest bra, lite mindre bra","Lund, Sweden","Vi var 4 st i vårt sällskap, 3 av 4 åt pasta och vi var nöjda! Ett STORT plus att...More"
[Swedish],123,73.0,5.0,3,"June 6, 2017 ",Ok besök ,"Lund, Sweden","Bokade bord samma dag via telefon, tyvärr ingen onlinebokning. Båda valde menyn med förrätt och huvudrätt. Carpaccio var ok och...More"
[Swedish],123,1.0,3.0,5,"March 1, 2013 ",Fantastiskt,"Lund, Sweden","Underbart gott, bäst i Europa! Det bästa mina barn och vänner vet!
Italienskt kök när det är som bäst! Har...More"
[Swedish],123,5.0,5.0,4,"March 13, 2017 ",Det perfekta Efter-bion-stället,,"God mat, härlig miljö och en fantastisk personal. Och allt detta till en högst överkomlig peng. Vad kan man mer...More"
[Swedish],123,11.0,6.0,4,"March 15, 2016 ",Italienskt som bäst,"Lund, Sweden",Bra lunchrestaurang med god och vällagad lunch. Middagen på kvällen är bra och god. Den bra smaker och framförallt ska...More
[Swedish],123,70.0,14.0,4,"March 16, 2016 ",Bra restaurant med utsökt vinlista,"Lund, Sweden",Jag var här med en internationell styrelsegrupp och middagen vi åt var helt superb. Så också vinet. Restauranten erbjuder Italienska...More
[Swedish],123,251.0,51.0,3,"March 16, 2017 ",Ok men inte mer,"Loddekopinge, Sweden",Hade kanske för höga förväntningar men jag blev besviken på maten. En mycket medioker carpaccio som förrätt och sedan en...More
[Swedish],123,11.0,6.0,5,"March 17, 2014 ",Underbar tortellini!,"Bjarred, Sweden",En pärla i lund för den som vill hitta en fantastisk tortellini. För av alla rätter jag provat där så...More
[Swedish],123,4.0,3.0,4,"March 17, 2016 ",Som flyttat direkt från Italien,"Lund, Sweden","Denna trånga och enkla krog har vad många finkrogar längtar efter - feeling!
Man känner sig som i Italien! 
Varken...More"
[Swedish],123,75.0,4.0,2,"March 20, 2018 ","Små portioner, inget speciellt","Karlstad, Sweden",Tilltagen och god förrätt i form av carpaccio på breasola ett plus men varmrättens storlek (beställde in en av pastarätterna)...More
[Swedish],123,97.0,48.0,5,"March 27, 2012 ",Fantastiskt god mat och toppenbra service,,"Kort meny, men riktigt vällagad och god italiensk mat. Oerhört trevlig service och mysig atmosfär. Missa inte den grillade kronärtskockan...More"
[Swedish],123,16.0,13.0,5,"March 27, 2018 ",Underbart,,Vilken restaurang! Mysigt och trevligt. Engagerad personal som är mån om att gästerna ska ha det bra. Maten är fantastiskt...More
[Swedish],123,68.0,20.0,5,"March 9, 2015 ",Magisk pasta med mini dolce som avrundning!,"Stehag, Sweden","Ett mycket bra ställe som överträffade sig själv i form av en enastående tryffelpasta med bresaola, förnämligt ackompanjerad med ett...More"
[Swedish],123,82.0,9.0,5,"May 1, 2016 ",supergott,"Lund, Sweden",Finns inte så många rätter att välja men det är supergott! Vi var ett sällskap på fem personer som åt...More
[Swedish],123,56.0,12.0,4,"May 13, 2017 ",Centralt beläget,"Orebro, Sweden",Jättegod carpaccio till förrätt. Efter det åt jag pasta med karljohansvamp och tryffel. Såå gott. Trevlig servicepersonal. Tog glass till...More
[Swedish],123,386.0,49.0,4,"May 19, 2017 ",Gattostretto levererar,"Lund, Sweden","Gattostretto ligger mitt i stan och är en favorit när det gäller italiensk mat.

Deras pasta med Karl Johan svamp...More"
[Swedish],123,10.0,2.0,4,"May 19, 2018 ","Litet, enkelt och gott!","Rydeback, Sweden",En aning tafflig servitör men annars totalt sett en mycket trevlig upplevelse. Begränsad meny denna efter dag med anledning av...More
[Swedish],123,32.0,26.0,3,"May 24, 2016 ","Gott och familjärt, med en spännande undervåning!.","Stockholm County, Sweden",God italiensk mat med trevlig och familjär personal. Rimliga priser. Missa inte att besöka de gamla kyrkoruinerna i källarvåningen!
[Swedish],123,68.0,20.0,5,"May 27, 2013 ","Vår dagliga dos av Italien, giv oss idag...","Stehag, Sweden","Man kan bli religiös för mindre! Alltid detta komptenta, varma och generösa mottagande. Mat och vin i harmoni på ett...More"
[Swedish],123,48.0,17.0,5,"May 27, 2014 ",Favoritkrog,"Lund, Sweden","Gattostretto blev snabbt vår egen kvarterskrog. Vällagad mat i trevlig miljö, alltid toppenservice och en gemytlig atmosfär där man lätt...More"
[Swedish],123,26.0,10.0,4,"May 27, 2014 ",Fin italienare!,Barsebäck,En trevlig italiensk restaurang med god service! Proseccon är sval och lättdrucken. Pröva att beställa kronärtskockorna till förrätt! Mums! Den...More
[Swedish],123,4.0,4.0,5,"May 3, 2013 ",Gustaf v A,"Lund, Sweden","Fantastisk bra italiensk mat, goda antipaster och goda paster framförallt gorgonzola fyllningar charmigt och  bra vin priser."
[Swedish],123,17.0,7.0,5,"May 3, 2013 ",Riktigt bra!,"Lund, Sweden",Centralt belägen restaurang med riktigt god mat till ordinära priser. Mycket god service.Möjlighet till att sitta ute sommartid. Trots att...More
[Swedish],123,3.0,3.0,5,"May 3, 2013 ",Genuina italienska smaker!,"Lund, Sweden","Underbar restaurang med genuina smaker från Italien tillagade av en äkta italienare! God stämning, toppen service och trevliga priser."
[Swedish],123,1.0,1.0,5,"May 3, 2014 ",Tummen upp,"Malmo, Sweden","Jättefin inredning, härligt italiensk anda över stället.  Maten ger en skön och härlig känsla av mättnad. Jätte trevlig personal. Rekommenderas...More"
[Swedish],123,2.0,1.0,5,"May 30, 2015 ",Mkt god mat och trevlig personal!,"Boras, Sweden",Underbart god och vällagad mat. Trevlig och uppmärksam personal. Ögonkontakt och hej då när vi gick. Vi kommer tillbaka!
[Swedish],123,26.0,5.0,4,"November 10, 2017 ",Enkelt och gott,"Svedala, Sweden",Vi var tre och beställde olika pastarätter och alla var jättegoda. Men här finns något du absolut inte får missa!...More
[Swedish],123,135.0,27.0,5,"November 14, 2013 ",Bra vinlista,"La Cala de Mijas, Spain",Mysig liten italiensk krog med enkel men fantastiskt god mat. Fullsatt och god stämning! Andra gången där och lika nöjd...More
[Swedish],123,86.0,25.0,4,"November 15, 2015 ",Gattostretto,"Arboga, Sweden","I centrala Lund ligger denna välbesökta och något stimmiga och trånga restaurang.
Mycket trevlig personal och hyggliga priser. Ingen plats...More"
[Swedish],123,8.0,2.0,5,"November 29, 2016 ",Vårt favorithak,"Lund, Sweden","Vår favoritrestaurang, bästa pastan, alltid lika bra service, personalen är glad och rolig, här trivs vi."
[Swedish],123,9.0,3.0,5,"November 6, 2018 ",God mat och trevlig familjär restaurang,,God mat och dryck till rimligt pris. Verkligen ett trevligt ställe att ta igen sig på efter en dag på...More
[Swedish],123,4.0,1.0,5,"November 7, 2018 ",bra service ttrevlig personal  omtyckt ställe så man bör boka bord,"Lund, Sweden",mysig liten trattoria med kunnig och omtänksam personal.populärt ställe inte så många bord beställ bord i god tid.
[Swedish],123,79.0,17.0,5,"October 1, 2011 ",Underbar familjerestaurang,"Ostra Tommarp, Sweden",Mycket god mat! Bra trevlig service! Bra prisnivå!
[Swedish],123,4.0,2.0,5,"October 11, 2015 ",Mysigt! Trevlig personal! Bra käk,"Gothenburg, Sweden","Väldigt trevlig italienare, trevliga servitörer. Fantastisk mat. Jag åt pasta med musslor och tjejen en pasta rätt med Karl johanssvamp....More"
[Swedish],123,11.0,2.0,5,"October 12, 2018 ","Gott, prisvärt och snabb service ","Staffanstorp, Sweden",Var här med min man och fick bord direkt. Hade knappt en timme på oss innan bion skulle börja. Vi...More
[Swedish],123,31.0,15.0,5,"October 15, 2015 ",En italiensk pärla mitt i Lund,sweden,"En supermysig restaurang som får en att förflyttas till Italien. Underbart gott italienskt kök, goda viner. Har varit här ett...More"
[Swedish],123,138.0,27.0,4,"October 17, 2013 ",Gott och trevligt,"Lund, Sweden","God mat och mycket trevlig personal. Prisnivån är OK, men de hungriga tonåringarna i sällskapet tyckte att portionerna var lite...More"
[Swedish],123,3.0,2.0,5,"October 18, 2016 ","Bästa pastan jag har ätit, mums:)","Ao Nang, Thailand",Liten och mysig italiensk restaurang med fantastisk god pasta. Var i Lund en helg och gick förbi en fredagskväll. Blev...More
[Swedish],123,59.0,10.0,5,"October 18, 2018 ",God mat och trevlig personal ,"Orebro, Sweden","Mycket god mat, trevlig och kunnig personal. Bra läge centralt. Vi åt trerätters med kött till huvudrätt som var fantastisk!"
[Swedish],123,2.0,3.0,5,"October 2, 2015 ",Vällagad mat och prisvärd upplevelse.,,"Maten är otroligt vällagad. Bred meny, finns även vegetariska- och laktosfria alternativ. Ägaren som själv är från Italien är en...More"
[Swedish],123,75.0,15.0,4,"October 21, 2015 ",God mat och trevlig personal.,"Lund, Sweden","Vi gick hit utan reservation, men personalen var väldigt trevlig och ordnade bord åt oss. Maten var enkelt komponerad med...More"
[Swedish],123,1.0,2.0,5,"October 22, 2016 ",Underbar pasta !,,"Underbar pasta, underbar miljö och underbar personal. Helt enkelt en fantastiskt bra Restaurang. Här blir du aldrig besviken, det kan...More"
[Swedish],123,59.0,21.0,4,"October 28, 2014 ",Prisvärt och trevligt,"Stockholm, Sweden","Mycket trevlig personal, rimliga priser. Trots att de missade lite genom att servera varmrätten innan vi fått förrätten (!) så...More"
[Swedish],123,21.0,7.0,5,"October 29, 2015 ",Mysigt ställe med god mat!,"Malmo, Sweden",Mycket god mat i mysig miljö. Detta är en lite pärla om man vill ha en enkel och god middag...More
[Swedish],123,26.0,5.0,4,"October 5, 2014 ",God italiensk mat på mysigt ställe.,,Vi tog erbjudandet om två rätter: förrätt och första tallriken. Det var riktigt gott. Bressaola med ruccola och parmesanost till...More
[Swedish],123,29.0,13.0,3,"October 7, 2013 ",Mysig lunch på uteserveringen.,,Lunch på uterserveringen i härligt solgass! En sallad och en dagens pasta beställd. Salladen var fin och god. Ganska riklig....More
[Swedish],123,2.0,2.0,4,"October 9, 2012 ","Mycket vällagat, gott och trevligt!","Stockholm, Sweden","Som att gå på kvaterskrog i Italien. God vällagad mat, italuenska viner. Trevlig och uppmärksam servis utan att vara påträngande....More"
[Swedish],123,2.0,7.0,5,"September 1, 2014 ",Dold pärla,,Trevlig liten familjeägd italiensk restaurang som ligger centralt. Mycket god mat och utmärkt service.
[Swedish],123,39.0,11.0,4,"September 11, 2018 ",Långa kattens piazza!   Ovanpå Drottens medeltidskyra!,,"Pasta och Peroni och det bästa till sist en eclair till kaffet om bagaren hunnit med!
Här i solskenet bland...More"
[Swedish],123,14.0,7.0,4,"September 12, 2016 ",Personlig service & mycket god mat,"Lund, Sweden","Då vi missat att boka bord, fick vi plats i uteserveringen. Kvällen var ljum & fin så det gjorde ingenting....More"
[Swedish],123,130.0,34.0,5,"September 12, 2018 ",Fantastiskt god pasta!,"Bredaryd, Sweden","Första besöket åt jag pasta med Karl Johan, vilken njutning! Så det blev ett besök till ett par veckor senare;...More"
[Swedish],123,6.0,7.0,5,"September 14, 2011 ",Letar du efter en bra restaurang i Lund? Gå till Gattostretto,"Lund, Sweden","Lund har allt för få bra restauranger, men Gattostretto är en av dem. Maten är fantastisk, precis som maten vi...More"
[Swedish],123,368.0,138.0,4,"September 19, 2017 ",Enkelt och gott,"Malmo, Sweden","Var här på en after work med jobbet. Åt en färdig trerätters meny bestående av bresaola till förrätt, pastaknyten med...More"
[Swedish],123,12.0,3.0,4,"September 22, 2016 ","Genuint, gott och trevligt","Lund, Sweden","Åt där två gånger samma vecka. Första gången ute med en konferens och andra gången privat. ""rRktig"" Italiensk mat med...More"
[Swedish],123,16.0,3.0,4,"September 24, 2016 ",God mat men lite hög ljudvolym,"Lund, Sweden",Vi kom ett gäng på 6 lite stressade personer till restaurangen och blev väldigt väl bemötta av personalen. Snabbt fick...More
[Swedish],123,37.0,,3,"September 25, 2018 ",Sådär,,Hade hört mycket gott om denna restaurang så vi provade givetvis. Pastan var god men verkligen inget överdådigt. Små portioner...More
[Swedish],123,6.0,9.0,5,"September 26, 2011 ",super!,"Hollviken, Sweden","Mycket trevlig restaurang som jag varmt kan rekommendera. Trevlig, personlig service fantastisk mat och rimliga priser. Hit kommer vi att...More"
[Swedish],123,3.0,2.0,4,"September 4, 2017 ",Äkta italienkänsla ,Gånghester,Vårt besök på Gattostretto visade sig bli vår bästa italienska middag på många år. Gå återvänder gärna dit vid vår...More
