[English],119,81.0,17.0,2,"November 16, 2013 ",Disapointment!,"Helsingborg, Skåne Län, Sweden","What a disapointment! Had lunch, pasta with a tomatosauce. Could have done it a lot better at home. It tasted bland and the pasta like cheap ready-made bought in a store. Will not go back!"
[English],119,20.0,13.0,5,"November 17, 2011 ","Cozy and inviting, nice experience","Merrifield, Virginia",We were seated without a reservation. Service was great and the place was cozy. I had a spaghetti with wild boar tomato source. Very tasty. My wife had mushroom pasta/ravioli.  Also good very rich. Definitely recommend this place for a break from local fish!
[English],119,26.0,14.0,4,"November 20, 2014 ",Great staff & a lovely lunch.,,"Great for an easy lunch - tasty food, the (presumed) owner was so helpful & friendly, the waiting staff were polite & attentive and a nice atmosphere. 
Also there's a nice historical surprise downstairs to look at after eating."
[English],119,4.0,2.0,2,"November 25, 2016 ","Messing the ""Care abut me"" feeling",,Went there with my wife who is gluten intolerant. They offer gluten free pasta. My dish of normal pasta (filled pasta) was over cooked. Fairly ok but boring. My wife pasta was a joke. Watery pasta with shrimps straight from the jar. It was bearly...More
[English],119,6.0,1.0,4,"November 5, 2014 ",Family friendly,"Lund, Sweden","Very family friendly place with real Italian food in Sweden.

During lunch you can get simple pasta dishes and italian sandwiches."
[English],119,1.0,,4,"November 9, 2008 ",A stylish yet cozy place...,"Helsinki, Finland",A stylish yet cozy place that serves very good pasta.
[English],119,317.0,154.0,5,"October 1, 2014 ","Tasty food, delightful waitresses!","England, United Kingdom","A group of five male friends enjoyed the tasty Italian food  here. The menu is pretty conventional, much as you would expect at any Italian restaurant anywhere in the world - which is precisely one of the strengths of Italian cuisine. The food was well...More"
[English],119,16.0,12.0,5,"October 14, 2015 ",Italian flavours!,,"This lovely restaurant is located in one of the small shopping streets to the cathedral in Lund. Modern but cozy interior with a church ruin underneath that can be seen through a glass floor!
Bresaola with parmesan and ruccola sprinkled with olive oil for starters....More"
[English],119,35.0,4.0,4,"October 14, 2018 ",Delicious pasta,"Oslo, Norway","The place is small, situated in Kattesund, in the centre of Lund. All of their pasta dishes are delicious. I have also tried their filet of ox a couple of times. The meat has been served rare both times, exactly as I ordered it. Service...More"
[English],119,6.0,7.0,5,"October 15, 2011 ",Authentic Italian Food,,Excellent food. This place is simply fine Italian cuisine; and the host was extremely friendly.
[English],119,3.0,3.0,5,"October 15, 2014 ",gutted that its taken 7 yrs to find it !,"Lund, Sweden","Having lived in Skåne 7 yrs we have pretty much written off finding a decent restaurant, let alone an Italian, but when my oven broke last week I turned to tripadvisor ,, we took our 2 little girls with us, and took a chance without...More"
[English],119,106.0,43.0,5,"October 15, 2015 ",Eating amazing food in front of the gym,"Tokyo, Japan","My client took us to the dinner.  The restaurant is family owned, and the owner is from Napori.  Pasta was homemade and everything tasted natural and fresh.
After we finish desert, we finally realized there was something underground.  Please visit Gattostretto to have a nice...More"
[English],119,121.0,54.0,3,"October 15, 2016 ","Nothing out of the ordinary, but good homemade pasta","Gokarna, India","I went there for dinner and was rather disappointed. The menu does not offer many options, something I personally like,but what they mostly have is meat. No fish whatsoever. I tried the grilled artichokes for starter and what I got was 2 canned items,salty, oily,...More"
[English],119,166.0,57.0,2,"October 18, 2015 ",The worst minestrone soup I've ever had!,"Eslov, Sweden","We went in as a group of 5 and 3 had paninis and said they were good, but small.  One of our party had the lunch pasta and said it was OK.  I chose the soup of the day and it was not good! TTasted...More"
[English],119,627.0,134.0,5,"October 24, 2016 ",Wonderful Meal,"Boston, Massachusetts","I enjoyed a wonderful meal. Homemade pasta and a great lemon, white wine cream sauce with tiny shrimp. The meal was cooked perfectly and service was excellent.  I gave it 5 because of the service. It was such a friendly staff. I recommend, reservations are...More"
[English],119,214.0,59.0,5,"October 25, 2009 ",Evening Menu,"Lund, Sweden","Since they have opened during the evening, we have been there quite many times . The food is excellent!  The menu has slightly changed during these months, but everything has always been  extremely good. I love the tagliolini with squashes and guanciale, were the guanciale...More"
[English],119,17.0,3.0,3,"October 26, 2014 ",Okay Italian food,Aalborg,"The food was okay, but mostly based on things you could buy in the supermarket. The italian owner was very friendly and recommended some good and atypical desserts."
[English],119,17.0,5.0,5,"October 26, 2017 ",As close to Italy that you can get in smalltown Lund.,,"Excellent litte Italian place in Lund. As any real Italian restaurant it is family run and everything is handmade, Very value for money. Excellent lunch menu at a low pricepoint and even better dinner selection. Varm friendly and down to earth customer service. Very much...More"
[English],119,142.0,72.0,4,"October 30, 2015 ",Grab some Italian food and see an old church!,Sydney,Cheese panini and salad with capuccino for 105 Kr. Tasty and friendly service. Next to fruit and veg market as well as entrance to left inside restaurant to Drotten's church.
[English],119,9.0,4.0,5,"October 30, 2016 ",A Lucky Find,"Boston, Massachusetts, アメリカ合衆国","This is my second visit to Gattostretto.   I stumbled upon it back in September 2016 while walking in Lund around dinner time, looking for a place to eat.   I have since had two great meals here.  The wait staff is attentive, and the food courses...More"
[English],119,70.0,25.0,4,"October 7, 2017 ",A window on Italy,"Mirandola, Italy",Work dinner with my swedish colleagues. Obviously as soon as entered a feeling  was established between us due to our origins and the service was really confortable with Emanuele who joked with us every time. Moreover the dishes are good and also the price were...More
[English],119,35.0,29.0,5,"October 9, 2014 ",Great Italian Cuisine,"Lund, Sweden","I went here with my family who visited me in Lund, since this was one of the top rated places.We were not disapointed! The food was exellent, the staff was very nice and the desserts were amazing. Don't miss the tiramisu!"
[English],119,2.0,7.0,5,"September 1, 2014 ",Hidden gem,,Lovely little family run italian restaurant located in the city centre. Very nice food and excellent service.
[English],119,35.0,30.0,4,"September 10, 2012 ",Second visit,"Norwich, United Kingdom",We went back after a visit to this excellent family run Italian restaurant some 4 years ago and the high standard of food and service has been well maintained. We met the owner out shopping early the next morning. Hard work!
[English],119,22.0,7.0,5,"September 11, 2016 ",Lovely place with good food and service ,,Nice cozy place with few choices on the menu but enough to satisfy any1. Great smiley warm service by all as it seemed we had 3 waiters
[English],119,1.0,2.0,2,"September 12, 2011 ",what a disappointment,"Malmo, Sweden","I was there for lunch and chose an italien sallad, well I thought that in an italian restaurant I would get good mozarella, good bread and good oliv oil... No way, industrial bread, industrial mozarella with no taste and plastic consistance. the rest of the...More"
[English],119,1.0,3.0,5,"September 13, 2011 ",Great Italian Place in Lund,"Lund, Sweden",We had a great dinner in this cozy little italian restaurant in the centre of Lund. Great food and service. Can highly reccomend this restaurant!
[English],119,47.0,9.0,5,"September 22, 2018 ","Genuin Italian food, with some genuin viking history ","Lund, Sweden","We come here to eat when our family long for some Italian feeling but not pizza. Underneath the resturant, one staircase down, you can visit a church ruin where Harald Bluetooths son Sven Tveskägg is buried."
[English],119,10.0,4.0,4,"September 23, 2015 ",Tasty food good price,"Stockholm, Sweden","All pastas are good but 3 formaggio, 3 cheeses, was very delicious. They serve different pastas and  very tasty vegetarian soup. And the coffee, coffee is a must!! Both espresso and cappuccino were fabulous. Also the staff was nice and friendly."
[English],119,26.0,10.0,5,"September 25, 2013 ",Superb!,"Modena, Italy","A great experience of high quality Italian food! The owner is very kind and the place comfortable and pleasant.
We always have dinner at Gattostretto when we pass by Lund!"
[English],119,5.0,4.0,5,"September 25, 2014 ",The best italian restaurant in Skåne,Sweden,"Hi, 
I have bean in gattostretto at least 15 times the last 3 years. 
The food is excellent and they have amazing dessert (chocolate mousse with rosmarin, tiramisu...). 
The owner is really nice and makes us feel at home. 

You have to try it !!!"
[English],119,18.0,10.0,5,"September 26, 2008 ",Restaurant in Lund you don't want to miss,Lund,"Finally there's a place with authentic Italian feeling in Lund! Great coffee, all pastries are made by the chef, simple but hearty pasta dishes and now even evening service with fantastic fresh food! Love it! Don't miss this pearl!"
[English],119,189.0,73.0,5,"September 28, 2016 ",Delicious and friendly ,"Stuston, United Kingdom","Amazing home made pasta, with pears, cheese and walnuts!  Delicious and served by friendly people.  Would definitely go back."
[English],119,47.0,24.0,5,"September 28, 2016 ",Very very good,,First trip to sweden and our friends took us here...homemade pasta and a fabulous pear and bluecheese sauce really good....staff very friendly ..good service so worth a visit .
[English],119,89.0,55.0,4,"September 30, 2014 ",Nice Italian restaurant,"Matlock, United Kingdom","Cosy place - good food and wine reasonably priced. The bonus was finding the ruins of a medieval cathedral on display underneath the restaurant. English menu available, and nearly all Swedes speak perfect English!"
[English],119,11.0,2.0,5,"September 6, 2013 ",Super pasta place,"Lund, Sweden","Best italian restaurant in Skåne. Great if you are having lunch with children and friends. Italian food at its best - simple, well prepared with excellent taste."
[English],119,62.0,36.0,5,"September 8, 2013 ",Fantastic Italian restaurant in Lund!,"Cross Roads, Texas","I dined here a few nights ago with some friends from work that live in Lund. From our starters, to the main course, everything was excellent. I had the carpaccio for my starter and for my main course, I chose the gorgonzola pasta which was...More"
[English],119,52.0,38.0,4,"September 9, 2012 ",Italian,"Lund, Sweden","He have very genuin Italian pasta and other dishes,daytime pasta most every day,but evening a very nice and good  menu and a la carte.Very good cakes to and  espressocoffe"
[Finnish],1,173.0,33.0,4,"July 10, 2018 ",Italia ei ole vain pitsaa,"Lahti, Finland","Oikein hyvä italialainen ravintola. Mukava henkilökunta ja hyvä ruoka. Ruokalista on lyhyehkö, pitsoja listalta on turha etsiä. Carpaccio oli erinomainen,...More"
[French],4,57.0,30.0,5,"August 27, 2015 ",Excellent,"Grenoble, France","Un accueil très sympathique, le repas était excellent.
Ce restaurant vaut vraiment le détour, les pâtes sont faites maison, rien...More"
[French],4,15.0,2.0,5,"July 17, 2012 ","Super accueil, bon petits plats ...",Bricy,"Le patron est une perle et la chef (son épouse) plutôt bonne cuisinière.
Après avoir essuyé un premier refus suite...More"
[French],4,110.0,40.0,5,"May 4, 2014 ",Un parfum d'Italie,"Limoges, France","Acceuil sympatique en français (notre accent nous a trahi !! ) ,et le patron nous a proposé des plats nous...More"
[French],4,19.0,6.0,4,"November 7, 2015 ",Gattostretto,vulbens,"Nous avons été mangé ce midi , patron et personnel sympa. 
Pâte à 1 minute d'être al dente, mais sauce...More"
[German],4,1.0,2.0,5,"August 30, 2013 ",Super!!!!,"Mainz, Germany","Nettes und schickes kleines Restaurant, an dem wir zufällig vorbeikamen. Tolles Lunchangebot. Mega leckeres Essen, wir haben Pasta gegessen. Nette...More"
[German],4,10.0,2.0,4,"July 17, 2012 ",Italienisches Essen in Lund,"Lucerne, Switzerland",In diesem Haus kann man sehr gut italienisch essen - dies zu für Schweden fairen Preisen. Anscheinend wird das Restaurant...More
[German],4,5.0,,5,"June 11, 2017 ",Sehr authentischer Italiener,,"Kleine Karte, durchweg sehr gute Qualität. Sehr authentischer Italiener, aufmerksames Personal. Nicht allzu gross und schick eingerichtet. Zu empfehlen sind...More"
[German],4,26.0,6.0,4,"September 17, 2015 ",Belebter Italiener mit sehr gutes Qualität,,"Das Gattostretto ist ein netter, kleiner Italiener unweit vom Stadtkern. Geführt wird das Restaurant von einem Italiener und alle Bedienungen...More"
[Italian],12,187.0,55.0,4,"April 25, 2016 ",un italiano a Lund,Massanzago,"normalmente all'estero andiamo a mangiare in ristoranti che fanno cucina locale, quest'anno purtroppo la mia compagna ha avuto la dissenteria...More"
[Italian],12,80.0,55.0,4,"August 14, 2013 ",Sembra impossibile ma si puó mangiare italiano anche all'estero,"Palermo, Italy",Classificato su Tripadvisor come secondo ristorante di Lund abbiamo tentato pur essendo scettici poiché all'estero troppi ristoranti si spaccianoitaliani...e invece...More
[Italian],12,1.0,2.0,5,"August 24, 2012 ",grande gatto!,"Lund, Sweden","Premmettendo di essere italiano, sono veramente contento di scrivere una buona recensione su questo accogliente ristorante italiano in Svezia! Abbiamo...More"
[Italian],12,29.0,10.0,4,"December 16, 2018 ",Daje Roma,"Rome, Italy","Essendo originaria di Roma, mi sono trovata subito in sintonia con il proprietario. Gentilezza e disponibilità dello staff non sono...More"
[Italian],12,1755.0,370.0,5,"December 28, 2016 ",Uno strappo alla regola del quale non vi pentirete,"Barcelona, Spain",Settimana a Lund per un corso e l'azienda la prima sera ci ha portato in questo ristorante (eravamo un team...More
[Italian],12,143.0,62.0,5,"February 2, 2016 ",Like being in Italy,"Moglia, Italy",Accompagnato da colleghi svedesi ho trovato un vero italiano che cucina veramente italiano con prodotti italiani e la qualità è...More
[Italian],12,72.0,64.0,5,"July 17, 2015 ",La Cucina Italiana a Lund,"Vicenza, Italy",Per lavoro mi sono recentemente recato a Lund. Il team multietnico di cui facevo parte ha avuto modo di cenare...More
[Italian],12,144.0,72.0,5,"March 29, 2014 ",Ti fa riconciliare con la tavola,"Pescara, Italy","Mi trovo in Svezia per motivi di lavoro insieme ad altri 4 colleghi.
A pranzo panini e la sera necessita...More"
[Italian],12,156.0,46.0,5,"May 20, 2013 ",L'italia a Lund,"Lainate, Italy","Locale carino con una curiositá da visitare (chiesa sotterranea).
Vino ottimo, piatti in linea con la tradizione italiana prevalentemente romana....More"
[Italian],12,17.0,15.0,5,"November 18, 2017 ",Ottimo ristorante italiano in centro,Italy,"Si mangia bene, un italiano trova la qualità che cerca. Il proprietario è cortese e ti accontenta anche nei dettagli,...More"
[Italian],12,14.0,4.0,4,"September 1, 2015 ",Cucina italiana a Lund,"Lund, Sweden","Ottimo il sevizio, Emanuele il proprietario sa consigliarti abbiamo bevuto una birra artigianale eccellente"" Gradisca"" che consiglio vivamente."
[Italian],12,128.0,21.0,4,"September 28, 2016 ",Italiani a lund,"Province of Messina, Italy","Portato da italiani in questo resto di ottima qualità. Accoglienza, cibo e anche un buon Valpolicella che accompagnava bene la...More"
[Japanese],2,54.0,6.0,5,"December 8, 2015 ",気軽に入れて美味しい,"Malmo, Sweden",休日の昼間に立ち寄りました。混雑していましたが、すぐに席を用意してもらえました。料理を食べてみてその盛況ぶりに納得。とて...More
[Japanese],2,138.0,13.0,4,"September 29, 2018 ",量は少なめだが美味,"Malmo, Sweden",駅から徒歩5分、裏路地にある。店内はそれほど広くなく夜は人が賑わっている。パスタを頼んだら量はそれほど多くなかったが美味...More
[Norwegian],1,130.0,7.0,5,"September 11, 2017 ",Hyggelig ;) ,"Gothenburg, Sweden","Denne plassen kan anbefales på det varmeste. Meget god mat, hyggelig betjening, enkle men koselige omgivelser. BONUS : i kjelleren...More"
[Portuguese],3,14.0,2.0,4,"January 2, 2017 ",Jantar entre amigos,,Jantar italiano delicioso! Bons vinhos!! Ambiente delicioso! Atendimento excelente com funcionários atenciosos!! Recomendadíssimo!!
[Portuguese],3,249.0,79.0,4,"March 13, 2018 ",Excelente porém com poucas opções ,"Campinas, SP","A casa é linda, e ainda tem uma “passagem secreta” para umas escavações subterrâneas (na verdade de secreta não tem...More"
[Portuguese],3,5.0,1.0,5,"October 10, 2018 ",My favorite in Lund ,,"Ótimo serviço, boa comida e um ambiente muito agradável!
Recomendo fazer reserva, pois a procura é grande"
[Russian],1,156.0,50.0,5,"November 14, 2014 ",Настоящий итальянский ресторан,"Moscow, Russia","Действительно, итальянский ресторан: шеф-повар - аутентичный итальянец.
Великолепная кухня: томатный суп с чесночными гренками - выше всяких похвал.
Домашняя, насыщенная...More"
[Spanish],2,235.0,74.0,1,"January 30, 2016 ",Unos bordes,"Barcelona, Spain","Fui a las 19.30h de un sábado, y tenían bastantes mesas vacías algunas sin poner los cubiertos. Pero no me...More"
[Spanish],2,83.0,13.0,3,"September 3, 2015 ",Ricos platos pero carta reducida,"Lund, Sweden",Fuimos con mi esposo e hijo a cenar allí en el mes de marzo de 2015. El lugar es pequeño...More
[Swedish],123,58.0,31.0,4,"April 11, 2012 ",En riktig italienare,"Hässleholm, Skåne Län, Sweden",Detta är en riktig italiensk restaurang när den är som bäst - folklig och fullsatt. Vällagad italiensk mat och bra...More
[Swedish],123,34.0,11.0,4,"April 22, 2016 ",Lunds bästa italienska restaurang,"Helsingborg, Sweden",Jag äter lunch här med jämna mellanrum när jag är sugen på vällagad italiensk mat och jag blir aldrig besviken....More
[Swedish],123,41.0,32.0,5,"April 24, 2014 ",Fantastisk pasta,,"Åt fylld pasta. Den var fantastisk. Lagom kokt, välsmakande, bra rekommendation av vin.

Personalen är väldigt trevlig. Kocken var ute...More"
[Swedish],123,48.0,10.0,4,"April 26, 2017 ",En restaurang för alla pasta-lovers!,"Gothenburg, Sweden",Mysig italiensk genuin restaurang med trevlig personal som snabbt fixade ett bord till oss fastän vi ej bokat i förväg....More
[Swedish],123,24.0,5.0,4,"April 27, 2016 ",Italiensk mat som den ska vara,"Bjarred, Sweden","Vi hade en mycket trevlig familjemiddag här, lyckades få plats direkt när dom öppnade för kvällen. Alla fick extremt smakfull,...More"
[Swedish],123,1.0,1.0,5,"April 28, 2018 ",Mysig Italienkänsla,,Mysig resturang med god mat och trevligt personal. Riktigt charmigt ställe! Rekommenderas verkligen.
[Swedish],123,1.0,2.0,5,"April 29, 2017 ",Bästa pastan i Lund ,"Lomma, Sweden",Stammisställe för familjen. Alltid bra service och fantastiskt trevlig personal. Skulle menyn inte passa svänger de ihop något som gör...More
[Swedish],123,93.0,13.0,5,"August 13, 2018 ",Mycket god mat! ,"Lund, Sweden",En riktigt bra italiensk resturang i Lund kan varmt rekommendera den. God mat och bra service. Har testat det mesta...More
[Swedish],123,17.0,8.0,5,"August 21, 2012 ",Haje,"Lund, Sweden","Underbar, tjänstvillig personal och mycket hög kvalité på både mat och dryck.
Intim, familjär känsla."
[Swedish],123,47.0,10.0,4,"August 24, 2018 ",mycket bra,"Lund, Sweden","liten trevlig resturang med mycket trevlig och serviceminded personal. 
Pastan var mycket god och efterrätten likaså, hade önskat fler rätter...More"
[Swedish],123,16.0,10.0,5,"August 27, 2015 ",Nu en av mina favoriter i Lund,Sweden,Åt igår Oxfilé. Bytte ut potatisen mot varma grönsaker. Det var supergott och köttet var helt perfekt stekt (rare/medium) som...More
[Swedish],123,16.0,5.0,5,"August 28, 2016 ",Kommer alltid tillbaka,,"Brukar käka lunch här och vid några tillfällen middag. Som många påpekat är det inte en stor meny, men för...More"
[Swedish],123,37.0,1.0,5,"August 8, 2017 ",Nästan som att vara i Rom,"Lund, Sweden",Trevlig mysig krog med fin mat. Krögaren själv är superb. Frun något svalare och kanske borde le lite mer ofta....More
[Swedish],123,180.0,31.0,5,"August 9, 2014 ",En liten bit Italien,"Lund, Sweden",Favoritkrog med traditionell meny och service i toppklass. Menyn har förnyats med några riktiga höjdare. vilket uppskattas.
[Swedish],123,39.0,7.0,4,"December 1, 2014 ",Bemärkelsedag. ,"Saxtorp, Sweden",En mycket trevlig restaurang.  Verkar mycket populär. Man fick beställa bord. Både service och mat var förträfflig.
[Swedish],123,55.0,9.0,4,"December 10, 2015 ",Lunchmöte,,Åt en riktigt god vegetarisk pasta med gorgonzola och soltorkade tomater. Personalen var dock lite väl ivrig med att plocka...More
[Swedish],123,108.0,51.0,5,"December 11, 2016 ",Skånes bästa,"Malmo, Sweden",Nyligen hemkommen från Bergamo i Lombardiet får man konstatera att Gattostretto är minst lika bra som de bästa restaurangerna i...More
[Swedish],123,15.0,12.0,4,"December 15, 2015 ",Vid ett litet bord mitt i vimlet,,Här är du i Italien..... Små härliga rätter med ett gott glas vin helst vid ett bord under markisen en...More
[Swedish],123,48.0,17.0,5,"December 2, 2014 ",meraviglioso!,"Lund, Sweden",Återigen har vi ätit en underbart god måltid och njutit av den mysiga miljön och den omtänksamma och trevliga personalen!...More
[Swedish],123,28.0,5.0,5,"December 21, 2018 ",Alltid värt ett besök,"Lund, Sweden","Besökte Gattostretto 2 gånger samma vecka, privat o med jobbet. Bra, snabb o trevlig service från personalen. God o vällagad...More"
[Swedish],123,35.0,19.0,4,"December 23, 2012 ",Charmigt och genuint,"Nykoping, Sweden","God, genuint italiensk mat. Få rätter att välja på och menyn verkar inte förnyas särskilt ofta, men det blir mindre...More"
[Swedish],123,2.0,2.0,5,"December 3, 2016 ",Gott och trevligt!,"Hollviken, Sweden",God mat till bra pris i trevlig miljö. I källaren finns ett museum med kyrkruin. Mycket trevligt bemötande.
[Swedish],123,34.0,8.0,5,"December 31, 2014 ",Mycket god Italiensk mat och dryck!,"Duved, Sweden","Har besökt denna restaurang flera gånger när man besökt Lund (Lundaspelen) och aldrig blivit missnöjd. Rekommenderas starkt!
Glöm ej att...More"
[Swedish],123,45.0,19.0,5,"December 7, 2013 ",Riktigt bra,"Varnamo, Sweden",Redan vid telefonförfrågan fick jag ett mycket trevligt och hjälpsamt bemötande och det fortsatte när vi väl var på plats....More
[Swedish],123,14.0,5.0,1,"December 7, 2014 ",Stort besvikelse !!/:,,"Hemsk mat ! Fick en pasta meal med svamp och klumpig , mjölig sås som saknade konsistens ! Inga fräscha...More"
[Swedish],123,55.0,16.0,4,"February 10, 2013 ",Bästa Italienska i Lund,"Lund, Skåne Län, Sweden",Vill du gå på en kvarterskrog och käka god vällagad italiensk mat med god service? Då är detta rätta stället!...More
[Swedish],123,226.0,69.0,4,"February 13, 2017 ",Trivsam miljö,"Lund, Sweden",En liten bit av Italien mitt i Lund där det serveras mestadels traditionell italiensk mat. Man blir sällan besviken men...More
[Swedish],123,18.0,3.0,4,"February 13, 2017 ",Italiensk trattoria,,Vällagat och gott med typiska italienska rätter. Restaurangen ligger ovanpå en ruin som man kan gå ner en trappa och...More
[Swedish],123,35.0,9.0,3,"February 14, 2015 ",Ljudnivå som på en skolcafeteria,Stockholm,När det står tre-fyra barnvagnar utanför så bör man egentligen inte gå in. Lokalen är inte dämpad på ngt vis...More
[Swedish],123,6.0,6.0,5,"February 14, 2017 ",Underbar mat och trevlig personal,Skåne,"Perfekt stekt mediumrare köttbit, underbara tillbehör och fantastisk sås. Riktigt trevlig meny. Rekommenderar verkligen Gattostretto!"
[Swedish],123,21.0,9.0,4,"February 16, 2016 ","Mysigt, gott och prisvärt i Lund!",Stockholm,Detta var tredje gången på denna lilla mysiga italienare i Lund och samma fina upplevelse. Ett mycket säkert kort!
[Swedish],123,135.0,27.0,5,"February 19, 2012 ",Familjärt,"La Cala de Mijas, Spain",Fantastisk mat i en skön och familjär atmosfär. Ägaren tog sig tid att stå vid vårt bord och småprata om...More
[Swedish],123,71.0,32.0,5,"February 24, 2012 ",Säkert kort om och om igen!,Lund,Stammis sedan flera år. Fräsch och trevlig lokal i all sin enkelhet. Maten är också den enkel som Italiensk mat...More
[Swedish],123,13.0,3.0,4,"February 26, 2016 ",Italion stallion,"Sigtuna, Sweden","Som att kliva in i Gud fadern, med att glas golv i matsalen och en kypare med italiensk brytning gör...More"
[Swedish],123,72.0,20.0,5,"February 28, 2017 ",Äkta Italiensk upplevelse,"Lund, Sverige",Vi besökte Gattostretto på en vardagkväll.  Hade ingen bokning men tur var med oss och det fanns ett ledigt bord....More
[Swedish],123,123.0,23.0,4,"February 7, 2014 ",Italiensk perfektion,"Kavlinge, Sweden",Brukar inte vara förtjust i italiensk mat men för denna kvällen var jag sugen. En tre rätters middag med kanonbra...More
