[Danish],1,47,7.0,5,"December 29, 2014 ",Fantastisk mad,"Copenhagen, Denmark","Rigtig god mad, vi prøvede 3 forskellige retter . De var alle sammen fantastiske, også forretten (hvidløgsbrød). Og rigtig god...More"
[English],32,20,1.0,5,"April 1, 2018 ",Birthday dinner,"Lund, Sweden","Our oldest daughter picked Harrys in Lund for her birthday dinner party for the family.
We had a great time, enjoyed excellent food and attentive service for several hours. The youngest participant at 8 years was as happy with his burger as the oldest participant...More"
[English],32,6,14.0,5,"April 13, 2015 ",Excellent!,,"Just dropped in for a drink while waiting and ended up staying for a few more!  Friendly, helpful staff couldn't have made us more welcome, and great atmosphere as well.
We'll be back...."
[English],32,34,20.0,3,"April 14, 2015 ",AW,Sweden,Good place for after work. Happy hour! Nice out door seating area. Attentive and friendly staff. Bookings recommended.
[English],32,5,1.0,4,"April 19, 2015 ",Cosy friendly pub with big welcome,Liverpool,Friendly barmaid who went out of her way to find us a seat in a busy bar. Reasonablly priced drinks for Sweden!
[English],32,17,3.0,4,"April 28, 2018 ",Sweet potato fries and Pilsner are a must,"New Delhi, India",Awesome Sweet potato fries. House Pilsner is really nice and you can easily have 2 drinks. Nice cosy place. Please make sure to reserve your table on the weekend nights.
[English],32,7,1.0,5,"April 5, 2018 ",Awesome expierence for celiacs,,I went there because I read they offer gluten free food. The waiter told me that they could adjust any of the dishes. They also have gluten free bread for the burgers. They are also aware of contamination. My burger was very tasty and also...More
[English],32,75,50.0,5,"April 7, 2016 ",Oh My...Just What Was Needed!!,,"After behaving myself for much of the week that I've been in Skane, I decided that enough was enough...time for a red meat treat!!
I had read the mostly positive reviews of Harry's on TA and determined that this was the place for me. 
To...More"
[English],32,31,35.0,5,"August 2, 2015 ",Our sons birthday,"Chester, United Kingdom","Very friendly staff, British pub with lots of character. Locals were lovely, well worth a stop for a beer"
[English],32,44,5.0,5,"August 26, 2016 ",I Love ,,My mind the burger and The burgers on My mind ! I Dont drink but i sure eat hahahahahahah . Five Star burgers no diggety yall . The Fries are killin The game !
[English],32,75,22.0,3,"August 3, 2018 ",Meatballs and texas chilli burger,"Lund, Sweden","Went for a quick meal, a hot summer afternoon so pretty empty. We had their famous meatballs and a texas chilli burger. Very nice staff, nice presentation of the food which was good but not special. Good selection on beer and wine."
[English],32,91,18.0,3,"December 15, 2015 ",Not a bad night out!,"Lund, Sweden","Cannot complain about the quality of food served - Good portions, good presentation, good selection, good service - maybe a Little over priced but overall good night out."
[English],32,31,2.0,4,"December 17, 2014 ",Nice service and good food,"Malmo, Sweden",The staff was friendly and active and the food was great. There were vegetarian dishes which is important for me. The Toblerone fondue is wonderful to choose at the end.
[English],32,44,5.0,5,"December 19, 2016 ",Hamburguesa con chancho ,,The best freakin burger in the region not speak about the venison Filet plate ! Poor boy can go rich boy in a minute
[English],32,1,,5,"December 29, 2016 ",Amazing food,,I had the best soup ever!!! Il definately come back for more and the stuff was super friendly. Keep up the good work.
[English],32,5,1.0,4,"December 6, 2018 ",Good an solid with good service,,Have Been there 4 times now and as Such texted the menu and was never disappointed. In addition they have a large selection of beer on tap so I can only recommend l.
[English],32,29,2.0,4,"January 24, 2016 ",Good afterwork,,I ate Texas Burger with sweet potatoes fries... Very good option for the ones that like chili pepper. The enviroment was bit noisy though.. since we went in a group of friends in a Friday night. Recommended :)
[English],32,336,65.0,5,"January 31, 2015 ",Fantastic early dinner,"Furulund, Sweden","Harrys is a well known Swedish Pub chain. I always enjoyed their food and the style, whatever the city or the specific restaurant, but this time in Lund they really went beyond expectations. 
Had a great burger, while my wife had some pasta that she...More"
[English],32,31,13.0,2,"July 25, 2016 ",Typical mid range chain restaurant,"Brisbane, Australia","Popular for after work groups, which is understandable since they serve standard pub fare and drinks. But going here for the food is the same as TGI Friday's, Jensen Bøfhus, or any other place that serves pre-made frozen stuff as if it was actually cooked...More"
[English],32,155,94.0,4,"July 27, 2016 ","Good service, fair price","Skane County, Sweden","Having been out on the town all day we got hungry and decided to eat before we got home as neither of us could be bothered to cook when we got home.
Being located right across the street from the train station this place came...More"
[English],32,195,129.0,2,"June 11, 2016 ",you might as well be in any chain restaurant in the states,"Boston, MA","really, it feels like going to friday's, chili's, outback, or some such, or at least how i imagine those places being from their tv ads. appetizer of toast with shrimp salad was quite good, but the swedish meatballs were mediocre at best (maybe that's the...More"
[English],32,1,,5,"June 19, 2016 ",A great choice for any occasion!,,"the staff was super friendly and helpful, the food was delicious ! always a positive vibe in the air!  <3 much love <3"
[English],32,20,3.0,3,"June 23, 2017 ",Good and cozy,"Lund, Sweden",Cozy place near the train station. Okey menu with good food. The same with the drinks. Very popular during the after work hours. Especially in may before the summer.
[English],32,17,2.0,4,"June 5, 2015 ",Good quality,"Lund, Sweden",It is a nice bar. The service is very good and beside the beverages they serve high quality foods. I was there couple of times and all the food that I tried was delicious.
[English],32,38,14.0,4,"March 22, 2016 ",Recommending Dinner and a Movie!,Finland,"The food is just fine, nothing mind-blowing though, but the dinner and a movie combo for 200kr is great value! I've never left disappointed."
[English],32,8,6.0,5,"March 6, 2016 ",Thanks mr. Stanly for a greate dinner and your hospitality,"Malmo, Sweden","Me and my friends were at Harrys 1st of Mars to have dinner, wanne recommend this restaurant for their  delicious and fresh food. 
Also say  thanks to mr. Stanley for his greate hospitality and service, he was absolutely amazing."
[English],32,6,1.0,4,"May 23, 2015 ",Very tasty,,"Had dinner tonight at Harrys and it was very very nice. We had starter main and went for a selection of desserts as we wanted to try the fried cammembert and cloudberry jam. 
Would definitely recommend this place and will be going back ourselves :)"
[English],32,168,50.0,4,"May 4, 2016 ",Very tasty hamburger but pricey!,"Lund, Sweden","I came here after school in the evening. I ate the Texas burger with sweet potatoes. It was very tasty and good, but pricey for a hamburger. However, in Sweden, it's normal price for dinner time."
[English],32,52,11.0,4,"May 5, 2014 ",Great food,"London, United Kingdom","We were very awkward customers, my friends couldn't make their mind up where to sit and then we waited forever for a friend who didn't turn up, but they kept their cool! The atmosphere is great and I love the decoration. Food is very tasty...More"
[English],32,30,12.0,4,"May 8, 2015 ",Good food for a decent price.,"Lund, Sweden","Staff was friendly and arranged a table without much waiting on a packed Friday night, food was good."
[English],32,146,157.0,4,"November 15, 2015 ",Good pub food and atmosphere ,"Solihull, United Kingdom","Good food and beer. Menu in Swedish only, but staff very pleased to translate for us. Avoid the snack Nachos - simply a small bowl of corn chips with 2 uninteresting dips - but everything else we had was great. I especially enjoyed Harrys Köttbullar...More"
[English],32,30,6.0,5,"September 21, 2015 ",Good Pub near the station,,Part of a network of the Swedish Pubs. Good beer and food. Freinfly staff. Quite a bit more expensive than expected. Otherwise fully satisfactory.
[English],32,21,5.0,5,"September 7, 2014 ",Very Good Meat,"Arezzo, Italy","We have just come back from Harrys in central Lund and we are super satisfied...
The food is very tasty and the meat is very good (we come from Tuscany and if we say that the meat is good...it really is!) the waiter was very...More"
[German],2,88,28.0,4,"March 20, 2018 ",Väldigt gott! ,,"Das Restaurant wirkt gemütlich aber gleichzeitig schick, durch die Anordnung auf zwei Ebenen sitzt man angenehm im Raum verteilt aber...More"
[German],2,145,57.0,5,"September 23, 2014 ",Super Burgerrestaurant,Germany,"Wir waren mit einer kleinen Gruppe dort, alle Gerichte ausnahmslos lecker, das Bier süffig und on Top gab's Unterhaltung in...More"
[Italian],1,86,50.0,2,"July 2, 2015 ",Amici,,"Troppo costosa, siamo stati in questo locale a lund, troppa musica quiz e mangiare nn ottimo, no nn mi è...More"
[Norwegian],2,1,,5,"June 16, 2015 ",Verdens beste burger!,,"Harrys leverer hyggelige lokaler, god service og stemning, og ikke minst; fantastisk mat. Verdens beste burger og søtpotetchips. Vi drar...More"
[Norwegian],2,146,50.0,4,"June 30, 2014 ","Super mat og service,","Drobak, Norway",Vi hadde en fin opplevelse med god mat og kjapp og høflig service en mandags kveld i juni. Hyggelig atmosfære...More
[Portuguese],2,22,7.0,4,"May 20, 2015 ",Very good!,,"Bonito ambiente, com bom atendimento, variedade de cervejas e excelente comida. Situado no centro da cidade entre charmosas casas antigas...More"
[Portuguese],2,53,25.0,4,"May 21, 2015 ",Good!,"Recife, PE","Um ambiente bonito, uma variedade enorme de cervejas, boa comida, e bom atendimento. Próximo da estação Lund C, bem no...More"
[Swedish],48,10,,5,"April 10, 2017 ",God mat,,Satt senast på uteserveringen under sommaren och åt en hamburgare! Så gott! Inget slår detta och speciellt inte på sommaren.
[Swedish],48,13,5.0,5,"April 13, 2013 ",Riktigt god mat i bra läge,,Jag känner ju igen Harrys menyn sedan tidigare besök i olika städer. Detta är den tredje gången i Lund och...More
[Swedish],48,1,1.0,5,"April 18, 2018 ",Härlig upplevelse,,"Mycket bra service och väl tillagad mat!
Mycket värt ett besök för de som ännu inte varit där!!
Med sommaren...More"
[Swedish],48,1,,5,"April 25, 2018 ",Mitt favorit ställe i Lund,"Lund, Sweden","Mycket trevlig atmosfär o fantastisk personal som är väldigt uppmärksamma, omhändertagande och alltid förhöjer upplevelsen. Maten är alltid lika bra...More"
[Swedish],48,10,,4,"August 1, 2018 ",Bättre pubmat,,Maten är alltid utsökt. Personalen är fantastikt trevliga. Lunds bästa uteservering om det inte är alltför varmt.
[Swedish],48,147,11.0,4,"August 23, 2018 ",Bra,"Malmo, Sweden","Ett bra ställe centralt i Lund!
Köket öppet till 22.00.
Mycket god och vällagad mat.
Bra och snabb service!
Prisvärt!"
[Swedish],48,73,5.0,4,"August 30, 2015 ",Alltid trevlig personal ,"Lund, Sweden",Har varit där flera gånger och personalen är alltid super. Brukar alltid funka bra med bordsbokningar och uppmärksamhet när man...More
[Swedish],48,37,,4,"August 31, 2018 ",Bra kockar! ,,Älskar Harrys i Lund. Levererar alltid god mat & jag blir aldrig besviken. Väljer ofta att äta här & deras...More
[Swedish],48,73,16.0,5,"August 6, 2015 ",Fantastisk mat och varm service!,"Malmo, Sweden","Jag som vegetarian har bra med möjligheter, finns mycket att ordna utöver den vegetariska rätt som står utskriven på menyn....More"
[Swedish],48,39,9.0,1,"December 14, 2015 ",Max 3 rätter om man är över 10 pers,"Helsingborg, Sweden",Såg fram emot en helkväll på quizen med vänner. Vi var 12 pers som valde 6 olika rätter.  Fick då...More
[Swedish],48,14,5.0,4,"December 18, 2014 ",Fint ställe,,Gott mat för bra pris  .. Det enda som man kan klaga på är väntetid på maten :P men det...More
[Swedish],48,45,19.0,4,"December 7, 2013 ",Över förväntan,"Varnamo, Sweden",Beställde wienerschnitzel och den serverades ihop med rikligt med anjovis och kapris precis som jag vill ha det. Godare än...More
[Swedish],48,3,,5,"February 11, 2017 ",Fantastiskt!,,"Ibland kan man lätt vara lite skeptiskt gentemot ""konceptkrogar"" och kedjor men hos Harrys i Lund märker man att det...More"
[Swedish],48,133,18.0,4,"February 17, 2014 ",God mat,"Lund, Sweden","En After Work-kväll med god mat och trevligt underhållning i form av ett musikquiz.  Fullsatt, men ändå så var servicen...More"
[Swedish],48,4,1.0,5,"February 19, 2015 ",Super!,"Lund, Sweden",Tog emot ett stort sällskap på kort varsel! Jättebra mat till vettigt pris! Bra service och bemötande. Inget att klaga...More
[Swedish],48,71,32.0,4,"January 15, 2017 ",Ett perfekt ställe för familjen!,Lund,"Trots att det är en ""konceptkrog"" håller Harrys i Lund ovanligt bra standard. Har testat ett par andra Harrys, men...More"
[Swedish],48,116,32.0,4,"January 27, 2018 ",Överraskande goot,"Lund, Sweden",Var här med 2 goda vänner för att äta och prata. Vi fick ett bord längst in i restaurangen i...More
[Swedish],48,166,36.0,3,"January 6, 2017 ",Duktig kock och trevlig betjäning,"Bjarred, Sweden",Vi åt ankbröst respektive torskrygg - mycket välsmakande. Betjäningen trevlig och uppmärksam. Jag beställer gärna något att dricka så snart...More
[Swedish],48,1,1.0,5,"July 11, 2015 ",Utmärkt! ,,"Bästa gourmet pub hittills utan tvekan.. Underbar mat, och inte minst varm service. 
Detta är ett ställe som strävar för...More"
[Swedish],48,6,3.0,5,"July 18, 2015 ",Fantastisk mat till väldigt bra priser!,,"En av de bästa restaurangerna i Lund med fantastisk mat och väldigt bra priser. Superbra service och trevlig personal, rekommenderas...More"
[Swedish],48,17,1.0,5,"July 29, 2016 ",Mycket bra service!,"Lund, Sweden",Vi skulle äta en bit innan vi hoppade på flygbussen. Missade att tala om det för personalen som trots det...More
[Swedish],48,1,1.0,5,"July 4, 2015 ",☀️☀️☀️☀️☀️ fem soooolaaarr!!!,,Klart bästa kvarterskrogen! En riktig gourmetpub! Fantastisk god mat som håller hög klass och otroligt trevlig personal som får gästerna...More
[Swedish],48,232,24.0,5,"June 2, 2017 ",Perfekt!,Sweden,"Har ätit här ett flertal gånger med familj, vänner och min partner.
Alla är supernöjda!
Stanly och Danni är också...More"
[Swedish],48,53,6.0,4,"March 10, 2016 ",Gott!,,"Vi åt hamburgare och pasta. Båda var jätte goda och man blir minst sagt mätt! Trevligt ställe, mycket folk, goda...More"
[Swedish],48,5,2.0,5,"March 8, 2016 ",Stans bästa!!!!,,"Helt klart stans bästa gourmetpub! Den kan mäta sig lätt med de ""fina"" restaurangerna! Maten håller väldigt hög klass och...More"
[Swedish],48,115,27.0,4,"May 15, 2013 ",Bra burgare som vanligt,"Dalby, Sweden",Har utmärkta burgare och annan mat. Trevlig och snabb personal. En del trevliga olika ölsorter. Bra priser och härlig miljö.
[Swedish],48,72,20.0,5,"May 3, 2018 ","Trevlig ställe, god mat","Lund, Sverige","Finns ett flertal restauranger av samma sort (amerikansk, SportsBar typ) i Lund som t.ex. O'Learys och Glorias.  Harrys är definitivt...More"
[Swedish],48,17,2.0,4,"November 12, 2015 ",Goda hamburgare,"Angelholm, Sweden","Väldigt goda hamburgare och sötpotatis pommes. Trevlig och mysig stämning. Det var lite dålig service, men i det stora hela...More"
[Swedish],48,2,5.0,2,"November 15, 2016 ",Usch ,,"sämsta skaldjurssoppa, smaka extremt mycket salt, o créme brulée smaka surt efter smak av fisk eller sur mjölk...More"
[Swedish],48,65,14.0,5,"November 2, 2014 ",Toppen!,"Skane County, Sweden",Rustik enkel mat med det lilla extra! Stort plus för service och bemötande. Hamburgare som övertygade mig om att ALDRIG...More
[Swedish],48,1,,4,"November 2, 2016 ",Fantastisk service,,Harrys i Lund är den restaurang man ska åka till om man vill ha trevligt med sina vänner! De erbjuder...More
[Swedish],48,1,,4,"November 2, 2016 ",Exemplarisk service och personal!!,"Bjarred, Sweden","Avnjöt deras favorit hamburgare ""Texas smoked chili burger"" och den var helt suverän, kommer definitivt tillbaka!More"
[Swedish],48,45,6.0,5,"November 5, 2018 ",Här kände man sig verkligen välkommen,"Vastervik, Sweden","Vi stannade till på Harrys i Lund lördagen den 3 november för att ta ett glas vin , men bestämde...More"
[Swedish],48,78,10.0,4,"November 6, 2017 ",Mysig miljö,"Newcastle, Australia",Blev rekommenderad att äta på Harry's om jag ville äta en god hamburgare i mysig miljö i Lund. Bra mat...More
[Swedish],48,25,9.0,2,"October 1, 2017 ",AW ,,Afterwork på Harrys.Tänkte käka lite god mat men fick en vegetarisk hamburgare med en liten bit grillad halloumi vilket brukar...More
[Swedish],48,39,4.0,1,"October 14, 2018 ",Trist,"Jonkoping, Sweden","Tyvärr försämrad service, trevliga människor som byts till?

Kommer inte går dit mer :=(

En gång fanns där vänlighet och...More"
[Swedish],48,37,13.0,3,"October 15, 2015 ",Trevlig personal och roligt musikquiz med tråkigt slut,"Lund, Sweden","Fick höra att Harrys hade musikquiz varje onsdag vilket lät roligt att prova. 
Personalen var trevlig och musikquizen var rolig....More"
[Swedish],48,67,6.0,5,"October 19, 2016 ",Trevligt ställe med god mat och trevlig personal.,"Landskrona, Sweden","God mat, goda och spännande drinkar.
Trevlig personal.
Deras fondue är underbart god.
Kan bara rekommenderas.More"
[Swedish],48,1,,5,"October 20, 2018 ",Trevligt och god mat!,,Supertrevlig personal! Fullbokad kväll men de lyckades ordna bord till oss ändå. Toppen service rakt igenom och väldigt bra mat....More
[Swedish],48,8,,4,"October 21, 2018 ",God mat och mycket trevlig personal!,,Vi hade svårt att hitta bord i Lund och hamnade till slut på Harrys. Där blev vi mycket väl omhändertagna...More
[Swedish],48,3,1.0,3,"October 29, 2015 ",Bra nivå för att vara Harrys,,"Som de flesta Harrys i Sverige, men lite högre standard på maten och på personalen. Ett säkert kort för AW,...More"
[Swedish],48,1,,5,"October 3, 2015 ",Persson Liljekvist,"Lund, Sweden","Super god mat, trevlig personal och atmosfär. Ett stort plus är att kocken kom ut till oss par gånger för...More"
[Swedish],48,11,1.0,4,"October 31, 2016 ",Mycket trevlig personal,"Trollhattan, Sweden","Stannande här för ett snabbt glas innan jag och sambon skulle vidare. Blev förvånad över hur trevlig personalen var, inte...More"
[Swedish],48,14,7.0,3,"October 7, 2014 ",Snabb service,"Lund, Sweden","Mycket snabb service, mat till en rimlig kostnad och bra kvalitet. Minus för tobaksröken som med jämna mellanrum smet in...More"
[Swedish],48,14,9.0,5,"September 1, 2015 ",Prisvärda förrätter kvällstid,MÖLNDAL,"Eftersom vi ätit lite kraftigare under dagen så valde vi att ta in toast skagen, vitlöksbröd och grönmusslor till kvällsmat....More"
[Swedish],48,1,,1,"September 1, 2018 ",Ville ha en drink som skulle hjälpa till med matsmältningen,,Har lärt mig att leva ett nytt liv med mina brister. Går lite haltande och är långsam. Men visste inte...More
[Swedish],48,71,7.0,5,"September 17, 2016 ",Underbar ställe. Personal och mat på topp,"Kavlinge, Sweden",Ett ställe man återvänder ofta till.  Personalen är väldigt trevliga och det är roligt att gå dit.  Stället är mycket...More
[Swedish],48,342,161.0,2,"September 29, 2013 ","Dåligt, inte värt pengarna",Lund,"Faktiskt förvånande nog riktigt dålig mat. Ryggbiffen var seg och av dålig kvalitet. Överstekt trots tillsägelse om ""medium rare"" dessutom...More"
