[Swedish],212,6.0,2.0,4,"November 29, 2015 ",Mysigt ställe & god mat,"Lund, Sweden",Mysig lite mindre restaurang i centrala Lund. God mat & trevliga servitörer! Maten serveras utan direkt väntetid & jag kan...More
[Swedish],212,42.0,13.0,5,"November 30, 2012 ","Trevlig atmosfär, god mat, mysigt",Lund,Det är alltid trevligt att komma till K vin och d. Bra atmosfär och väldigt bra service. Vi kommer tillbaka!
[Swedish],212,226.0,167.0,5,"November 30, 2015 ",Fullständigt lysande till vårt bröllop!,Helsingborg,Jag och min fru anlitade Klostergatans vin och delikatess för att handa maten på vårt bröllop och vi kan inte...More
[Swedish],212,4.0,4.0,3,"November 4, 2016 ",Helt ok,"Djursholm, Sweden","Blev mycket besviken på råbiffen. En tråkig köttklump med de tråkiga klassiska tillbehören - inget nytänk. Smaklöst. Dock goda pommes,...More"
[Swedish],212,26.0,4.0,4,"November 6, 2017 ",Mysigt och trevligt!,"Lund, Sweden","Härlig lokal med trevlig stämning! 
God mat och fin service, rekommenderas! Kan BK ngt hög ljudnivå. Man bör boka bord."
[Swedish],212,31.0,2.0,4,"November 6, 2017 ",Bra lunch med snobbig servering,,Utmärkt mat men trist att möta snäsig service! Verkar mest intresserade av stammisar. Ensamma gäster möts av ointresse. Trist på...More
[Swedish],212,1.0,,5,"November 7, 2018 ",Första men inte sista besöket!,,Vi skulle fira en födelsedag men den utvalda restaurangen var fullsatt så vi fann denna pärla mest av en slump...More
[Swedish],212,50.0,56.0,5,"October 16, 2018 ",Fira födelsedag,"Lund, Sweden","Min make och jag blev bjudna av vänner. Vi hade bokat bord, vilket verkar vara bra idé. Det var fullt!...More"
[Swedish],212,51.0,7.0,5,"October 16, 2018 ",Bra mat och trevlig personal ,"Stockholm, Sweden",Vi var 5 personer och alla var nöjda med maten. Råbiffen var bland den bästa vi har ätit. Priserna är...More
[Swedish],212,45.0,2.0,5,"October 18, 2016 ",LUNDS BÄSTA:::,,"Otroliga smakupplevelser och mycket trevlig lokal både inne och ute.
Men också en av Lunds dyraste, dock väl värt pengarna!!"
[Swedish],212,158.0,32.0,3,"October 19, 2017 ",Besviken,"Lund, Sweden","Jag bor i Lund och har varit här många gånger. Det var ett tag sedan senast, men när jag nu...More"
[Swedish],212,28.0,6.0,4,"October 2, 2017 ",Lunch en lördag,"Lund, Sweden",Du blir aldrig besviken på Klostergatans lunch. Härlig brasseri-känsla med mycket god mat. Hyfsat urval av viner på glas. Trevlig...More
[Swedish],212,1.0,,4,"October 20, 2016 ",God mat och serviceinrktad personal,,"Åt här på en affärsresa. 3-rätters med öl och vin. God mat och trevlig personal. Rimliga priser för en ""bättre""...More"
[Swedish],212,328.0,45.0,4,"October 22, 2018 ",Restaurang i centrum av Lund,"Jonkoping, Sweden",Vi besökte Lund och skulle äta lunch och då valde vi denna restaurang i centrum. Det var bordsservering och vi...More
[Swedish],212,26.0,4.0,5,"October 26, 2015 ",Alldeles förträfflig restaurang!,"Lomma, Sweden",Maten bättre än krog med stjärna i GuideMichelin! Servicen bra och kunnig personal. Kommer gärna hit igen.
[Swedish],212,45.0,4.0,4,"October 28, 2018 ",Bra hak!,,"Jag har besökt restaurangen ca 5 ggr och hitintills sluppit gå hem besviken. Helt ok priser, trevliga rätter som är...More"
[Swedish],212,8.0,,5,"October 28, 2018 ",Utsökt!,,"Disputationsmiddag med mat i toppklass, utsökta viner, perfekt service. Bättra än så här kan man inte fira när dotter disputerat."
[Swedish],212,155.0,22.0,4,"October 3, 2017 ",Lyixgt utan överdåd,"Akarp, Sweden",Servicen på Klostergatan är utmärkt. Vi fick god mat till rimliga priser. Speciellt plus till den trevliga atmosfären. Lokalerna är...More
[Swedish],212,123.0,23.0,4,"October 30, 2015 ",Kanonmat men tappat lite av sin service,"Kavlinge, Sweden",Var här med en vän på en middag en lördagskväll. Vi fick ett bra bord och fick menyerna väldigt snabbt....More
[Swedish],212,9.0,4.0,5,"October 7, 2014 ","A very nice restaurant in French style, close to the Cathedral of Lund.","Lund, Sweden","En förträfflig krog i fransk stil, inrymd i en före detta delikatessaffär vid Klostergatan, Lunds matstråk nr 1. Granne med...More"
[Swedish],212,657.0,161.0,5,"September 1, 2012 ",Härlig lyx!,"Stockholm, Sweden",Vi åt nedan redovisade läckerheter innan vi började färden mot Kista. Där till en mellanöl från Lunds bryggeri. Bra service...More
[Swedish],212,1.0,2.0,5,"September 1, 2014 ",Fantastisk mat och service,,Vill tacka för en superb kväll med mycket god mat och en fantastisk bra service trots en fullsatt restaurang. Verkligen...More
[Swedish],212,7.0,12.0,4,"September 1, 2014 ",Trevlig restaurang ett stenkast från Lunds Domkyrka,"Bjarred, Sweden",Detta är en av mina favoriter I Lund. Den är intim med små bord och man sitter ganska tätt med...More
[Swedish],212,1.0,,5,"September 12, 2011 ",Väldigt god mat,"Lund, Sweden","Mycket bra mat, bra och kunnig service och trevlig atmosfär."
[Swedish],212,21.0,5.0,5,"September 14, 2016 ",Trivsel och mycket god mat!,"Lund, Sweden","Restaurangen ligger mitt i centrala Lund. Det är mycket god mat, bra service och stället är mycket populärt."
[Swedish],212,68.0,17.0,4,"September 15, 2013 ",Mycket bra.,"Malmo, Sweden",En resturang med god mat och väldigt bra service. Prövade deras höstmeny vilken var mycket bra tillagad och välsmakande. Trevlig...More
[Swedish],212,39.0,9.0,5,"September 16, 2017 ",Service!!,"Malmo, Sweden",Här fyller de på vattenglaset när man själv bara anar att man är törstig. Jag har ramlat in här på...More
[Swedish],212,36.0,17.0,3,"September 17, 2014 ",Högt och lågt,"Malmo, Sweden",Det har blivit ett par luncher här nu och det är supergott ibland och mindre bra ibland. Ätit en fantastisk...More
[Swedish],212,221.0,22.0,4,"September 19, 2015 ",Trevlig lunchrestaurang !,"Karlstad, Sweden",Trevlig lunch restaurang med varierat utbud på rätter. Passa på att avsluta med en perfekt espresso efter maten
[Swedish],212,13.0,2.0,5,"September 2, 2017 ",Tusan vad gott! ,"Villajoyosa, Spain",Perfekt lördagslunch med bra råvaror! Prisvärt också! Åt Skagen toast och en sallad med majskyckling. Udda blandning som passade prefekt...More
[Swedish],212,141.0,44.0,5,"September 20, 2013 ",Bästa restaurangen i Lund,"Helsingborg, Sweden","Klostergatan har allt det som man behöver av en restaurang. Mysig miljö, mycket god mat och framför allt väldigt god...More"
[Swedish],212,19.0,5.0,4,"September 21, 2015 ",Kunnig personal,"Landskrona, Sweden",Besökte den här restaurangen den 19/9 2015.min första känsla när jag kom in i restaurangen var den stiliga inredningen.Mina intryck...More
[Swedish],212,220.0,47.0,5,"September 21, 2016 ",Dyrt men gott!,"Kavlinge, Sweden",En av många pärlor bland Lunds restauranger! Maten håller högsta klass och som namnet antyder så är vinlistan inget att...More
[Swedish],212,31.0,2.0,4,"September 22, 2017 ",Vällagad lunch,,Utmärkt lunch för inte helt billiga 109 kr men prisvärt. Har bara provat fisk men den höll måttet för väl...More
[Swedish],212,1.0,,5,"September 24, 2016 ",Trevlig restaurang ,Svedala,"Underbar mat och trevlig personal, mycket bra service. Kommer att besöka detta ställe fler gånger, rekommenderar gärna till fler vänner."
[Swedish],212,114.0,34.0,5,"September 25, 2012 ",Underbart gott i vänlig atmosfär,Malmö,"Kantareller, råbiff, creme bruleé... underbart gott, i gemytlig atmosfär.
Mysig och vänlig personal. Helheten är total."
[Swedish],212,33.0,11.0,5,"September 26, 2015 ",Magnifique!,"Undrom, Sweden",En fantastiskt bra restaurang! Glöm inte att boka bord i god tid om ni ska fira något. Mycket välkomponerade månadens...More
[Swedish],212,13.0,,5,"September 27, 2015 ",Mycket trevligt,"Stockholm, Sweden","Åt lunch här, en fantastisk löjrom med ett mycket gott vin till. Trevligt ställe att slinka in på en lördag,...More"
[Swedish],212,12.0,3.0,5,"September 27, 2017 ","Prisvärt, vällagat, kvalité på råvaror och kunnig service","Malmo, Sweden",Har varit här flera gånger och överraskas alltid av kvalité vs pris. De håller skäliga priser för den mat och...More
[Swedish],212,17.0,1.0,5,"September 4, 2017 ",Alltid on top!,"Lund, Sweden","Som alltid fantastiskt nöjd med mat, dryck och service. Musslor eller oxfilé är mitt tips när ni går hit."
[Swedish],212,7.0,,4,"September 6, 2017 ",Nästan 100 procentigt.,"Loddekopinge, Sweden","Super proffsigt med suverän personal. Åt Råbiff och Oxfilé, båda rätterna oslagbara. Enda smolket var Ostronen där två av sex...More"
[Swedish],212,257.0,42.0,5,"September 6, 2017 ",Topp jobblunch,"Ahus, Sweden","Toppenställe i centrala Lund nära domkyrkan som serverar lunch för omkring 100-150 kr, inkl bröd och sallad. God mat med...More"
[Swedish],212,37.0,8.0,4,"September 7, 2015 ","Stressigt, jäktigt men bra mat och trevlig personal","Hoor, Sweden","Väldigt bra service, dock var vi där när de hade EXTERMT mycket att göra så vi fick sitta i baren...More"
[Swedish],212,141.0,56.0,5,"September 7, 2016 ",Toppen.,"Lund, Sweden","Mycket bra, smakrik vällagad mat. Bra drycker. Trevlig stämning i lokalen. Fullsatt alla dagar i veckan. Personal tillmötesgående med allergier...More"
[Swedish],212,14.0,9.0,4,"September 8, 2015 ",Återkommande besök både lunchtid/kvällstid under flera år,MÖLNDAL,"Ett av de absolut mest prisvärda och kvalitativt bästa restaurangerna i Lund.
Bra klass på vinrekommendationer. Jag älskar en matsedel...More"
