[English],114,283.0,69.0,3,"May 24, 2018 ",brasserie with average quality,"Zurich, Switzerland","Nice ambiance and service acceptable. I took the mussels and probably the worst in the universe (not fresh, re-heated etc... ) very disappointing. The creme brule was over cooked and not a great end to an average evening"
[English],114,181.0,24.0,4,"May 25, 2017 ",Very nice,"Lund, Sweden","Haven't been back in a long time. Relaxed and nice atmosphere, very good food and an ok wine selection. The ventilation is not great and you will smell of grilled meat which is unfortunate."
[English],114,69.0,34.0,4,"May 29, 2012 ","This is only my opinion, but it is the correct one!","Lomma, Sweden","One of the best restaurants in Lund, really recommend it. Very nice prepared food, you can really taste that the meat, vegetables. Top notch. Great service as well."
[English],114,153.0,82.0,4,"May 3, 2013 ",Good dinner in university town,"Ljubljana, Slovenia","I was taken by friends for an early dinner. The place looks neat but informal. It was comfortably full when we arrived and got packed fast. But it was easy to have a conversation, it was not loud at all. The service was quick and...More"
[English],114,46.0,29.0,4,"May 30, 2015 ","Popular, so best to book ahead","Uckfield, United Kingdom","Visited on off chance without reservation, but managed to get seats at the counter.

Good value and imaginative menu. Popular so service was a bit slow, but worth the wait."
[English],114,129.0,31.0,5,"May 5, 2016 ","great local food and cross kitchen , good valur","Paris, France",this restaurant/deli serves local food an scandinavian frech crosskitchen. the staff are always welcoming and This place have never dissapointed me
[English],114,72.0,17.0,5,"May 8, 2017 ",great service and food in an outstanding atmosphere,"Antibes, France","The kitchen delivers exactly what you expect and the only surprises are positive. The staff is great (in short) : attentive  caring and friendly. Do not hesitate to visit, the surprise will be positive!"
[English],114,38.0,15.0,5,"May 9, 2017 ",Excellent inventive cuisine in Lund,"Geneva, Switzerland","I had the opportunity to spend a night at Klostergatans restaurant and i will strongly recommend the place.
The french style cuisine in a Brasserie ambiance was absolutely delicious.
I had a fish perfectly cooked with an excellent creamy sauce. The dark chocolate cake was...More"
[English],114,62.0,44.0,5,"November 10, 2016 ",Lovely restaurant,Montana,"Elegant but not fancy or stuffy. Friendly, professional staff. Excellent food for a full dinner or just wine or coffee. Candles make it so pretty in the dark time of year."
[English],114,16.0,18.0,5,"November 12, 2016 ",French bistro ambience - top food and service,"Hoersholm, Denmark","Excellent food and decent size portions. Cosy atmosphere and nice location in the old part of Lund around the corner from Lunds cathedral. 
Absolutely perfect service from the waiters - good wine by the glas - all at reasonable prices for a classy gourmet restaurant."
[English],114,143.0,33.0,4,"November 15, 2011 ","Good restaurant, not really French food but worth a try.",,"The service, the food and the atmosphere fit well together. Sometimes, you get a good but ridiculous plate, sometimes quite better."
[English],114,49.0,10.0,5,"November 20, 2017 ",Best restaurant of Lund,,"In our opinion the best restaurant of Lund. Fantastic food, nice professional staff, nice atmosphere, no frills, great decoration. Fish eggs and mussel soup were tasty, the meat juicy and the fish fresh. Sauces complemented the dishes well. Wine paring as also nicely done. We...More"
[English],114,29.0,19.0,5,"November 23, 2011 ",Upscale cuisine in Lund,"binghamton, ny",This is a bit of a ritzy cafe joint but very good food if you want a splurge. They are a bit attitudy about reservations...they told us over the phone that we would have to be out by a certain time but then we lingered...More
[English],114,5.0,1.0,5,"November 28, 2014 ",Bistro with Good Food in Lund,,"One of the nicest things about this place is the ambiance. It gives you a sense of being in france, which seems to be exactly what they are going for. We were there for lunch and had the lojrom (hope that is spelled right) and...More"
[English],114,7.0,1.0,5,"November 30, 2013 ",Great food great service,"Lund, Sweden","Two dinners. Always surprised by the great food and warm reception. Great recommendation, always."
[English],114,10.0,1.0,5,"November 30, 2016 ",Excellent!,"Lund, Sweden",Always very good food and excellent service! Unique atmosphere! Nice place both for lunch and dinner.
[English],114,18.0,3.0,5,"November 8, 2012 ",Great good food in a very cozy environment.,"Hollviken, Sweden",Always very good and well done food served with a smile. Not to mention the ability to pick up delicious dishes from a la carte menu when you do not have babysitter - Perfect
[English],114,25.0,3.0,4,"November 8, 2013 ","Excellent service, cosy atmosphere","Copenhagen, Denmark","A nice place in the middle of Lund. Great service, a cosy atmosphere and a great location. Pricy but the service makes it worth."
[English],114,116.0,11.0,5,"November 8, 2017 ",A bit of France - in southern Sweden,"Helsingborg, Sweden","Lovely bistrostyle restaurant with a intimate and cozy atmosphere. Moules, boef Tartar, steak along  with the best fries I have had for a long time. Very friendly and efficient service. Not too expensive. Perfect for a long and relaxed evening"
[English],114,197.0,50.0,4,"October 1, 2011 ",Good choice for dinner in Lund,"San Francisco, California","Nice small restaurant in Lund.  Though the menu is small, they have enough variety to fit most people's preferences.  Portions are decent by European standards, though many Americans will think they are on the small side.  Service was fast and friendly, even with two large...More"
[English],114,55.0,21.0,4,"October 1, 2018 ",Great food and nice place for business dinner,"Hopkins, Minnesota","Limited menu but very nice and great atmosphere for our group of 8 on a business dinner. Service was perfect, attentive, not intrusive. I enjoyed the cold cut board for a starter which had some very tasty salami. Filet with French fries for the main...More"
[English],114,16.0,8.0,4,"October 18, 2015 ","Little space, but good food","Lund, Sweden",This is a restaurant where you will not be able to keep a private conversation very private - the tables are very close and the place is basically packed. But the food and the waiters are excellent.
[English],114,86.0,33.0,4,"October 19, 2016 ","Perfect for an after work, cozy atmosphere",Gävle,"After a long day I stopped here with a colleague for a glass of wine before dinner. We had a really nice glass of Ripasso (considering the inflation in Ripasso causing the standard to drop like in any other trendy wines in Sweden), but I...More"
[English],114,37.0,27.0,4,"October 29, 2014 ",Nice but expensive!,"London, United Kingdom","We wanted to eat fish so were recommended this restaurant by our hotel, was a very nice meal, if you enjoy Nouvelle Cuisine, not really ideal for my 20 year old hungry son!! bit pricy but then it was our first night in Sweden and...More"
[English],114,278.0,215.0,4,"October 29, 2015 ",Delighted,"Chicago, IL","Our hotel recommended this restaurant and we were surprised, mid-week, when upon arrival we were asked if we had booked ! No, never considered we would need to -- but we were early, so they could seat us. The service was exceptionally good (especially as...More"
[English],114,4.0,2.0,5,"September 13, 2012 ",Excellent food & service even on a busy night,"London, United Kingdom","We were there for dinner, and the menu was classic & simple. Quality of food is good, I've had the Foie Gras entre, then choucroutte for mains, whilst other friends ordered fillet mignon which was in perfect doneness as to ordered.

Ambience is comfortable although...More"
[English],114,19.0,15.0,4,"September 16, 2013 ",Simply great,"Madrid, Spain",Excellent food in a relaxed atmosphere. Service was very friendly and our waiter really seemed to know his stuff and was able to make spot on recommendations. Would definitely repeat.
[English],114,98.0,16.0,4,"September 21, 2016 ",Great food in a nice environment,"Lund, Sweden","This is one of the best restaurants in Lund. The food doesn't reach the same levels as some of the top-ranked restaurants (e.g. Mat&Destillat), but Vin&Delikatess makes up for that by great service and a cosy atmosphere. Don't get me wrong though, the food is...More"
[English],114,35.0,9.0,3,"September 25, 2015 ","Good service, quality and ambience but limited by complacency",Sweden,"I have eaten there quite a few times and had expensive but quite good meals. Something was always missing but could not quite put my finger on it. Then, having lunch I took a few sips of my red wine and thought it to be...More"
[English],114,28.0,10.0,5,"September 29, 2016 ","Great food, great service, great place","Balingen, Germany",I was at the restaurant for a business dinner with a pre-ordered three course menu. The food was extremely good. The staff was very friendly and professional. Wine recommendation was good. The restaurant was very busy on a Monday night. I enjoyed the evening very...More
[English],114,59.0,31.0,1,"September 29, 2018 ","Good food, discriminating service.","Santa Rosa, California","Booked a table a day before. Upon arrival, we were seated in front of the door, the worst possible position in the whole establishment. After confronting the waiter, we were eventually moved to another more accommodating table, but under the condition that we dine with...More"
[English],114,35.0,4.0,5,"September 3, 2017 ",Tasteful meal in charming atmosphere,"Oslo, Norway","We very much enjoyed our three course dinner here. The waiter was professional, pleasant and took good care of us. But most of all, we were happy with the food. The scallops in particular were yummy! All meals were perfectly seasoned. No wonder this is...More"
[English],114,29.0,12.0,5,"September 30, 2013 ",Lovely place both for lunch and dinner,"Lund, Sweden","Really nice staff, atmosphere and food. I have no complaints. It's a bit pricy but worth every penny. It's often very busy during lunch hour."
[French],2,6.0,3.0,5,"January 16, 2017 ",Impeccable,,"Le repas était délicieux, très raffiné.
Le personnel est très regardant, souriant et professionnel. 
Ma demande de plat sans gluten...More"
[French],2,50.0,4.0,4,"July 21, 2016 ",Bonne brasserie suédoise (chic),,"Brasserie de type parisienne, mais avec nourriture revue à la suédoise. Si vous cherchez du vraiment traditionnel, ce n'est pas...More"
[German],6,23.0,3.0,5,"August 17, 2017 ",Topp Adresse ,"Ohringen, Germany","Waren jetzt 2 Jahre hintereinander dort zu Mittag. Es ist zwar etwas teurer als ander ""Lunchrestaurants"" aber deutlich besser. Alles...More"
[German],6,127.0,54.0,5,"August 26, 2018 ",Wunderbare Mittagspause,Germany,Was für eine schöne Überraschung. Fantastische Speisen in wunderschöner Umgebung. Unbedingt besuchen wenn man in Lund ist.
[German],6,30.0,4.0,5,"December 30, 2017 ",Geschmackvoll und lecker,,"Topadresse in Lund - gehobene Küche, hervorragender Service von Jakob und Preis/Leistungsverhältnis super. Wir kommen sicher wieder."
[German],6,205.0,96.0,4,"December 5, 2011 ","gutes Essen, nettes Ambiente, immer rappelvoll",Hamburg,"Das Essen war ausgezeichnet, im Mittagstisch inbegriffen ist ein kleines Salat-Buffet. Die Karte ist klein aber fein, und wenn man...More"
[German],6,185.0,71.0,5,"June 18, 2014 ",Originelles Lokal,"Wels, Austria","Haben die Graduierung meiner Tochter hier gefeiert. War ein würdiger Rahmen. Essen ausgezeichnet , Getränkeauswahl sehr gut, personal sehr freundlich,...More"
[German],6,145.0,57.0,5,"September 23, 2014 ",Gehobene Küche,Germany,"Ausgezeichnetes Ambiente, sehr gut zubereitete, leckere Speisen, gute Weine, sowie ein sehr freundlicher, aufmerksamer Service. Absolut empfehlenswert."
[Italian],8,154.0,54.0,4,"April 20, 2015 ",Ottimo locale,,Location molto bello personale gentilene e disponibile.cibo buono e prezzi nella media cucina svedese e francese
[Italian],8,212.0,108.0,4,"April 25, 2013 ",Ristorante elegante e cibo nella media,"Moncalieri, Italy",Bel ristorante ubicato nel centro cittadino e semplice da raggiungere. L'atmosfera è molto elegante e tutto il personale molto gentile....More
[Italian],8,138.0,61.0,5,"April 30, 2018 ",Da provare,"Rome, Italy",Siamo stati in questo locale per una cena organizzata dall'Università di Lund e quindi non abbiamo potuto scegliere ne i...More
[Italian],8,42.0,30.0,4,"August 5, 2017 ",Buona esperienza di cucina svedese in un locale curato e accogliente con un servizio curato e professionale.,"Padua, Italy","In pieno centro, a due passi dalla cattedrale, abbiamo cenato scegliendo piatti tradizionali svedesi e la scelta si è rivelata...More"
[Italian],8,10.0,12.0,4,"January 27, 2018 ",Per caso,"Forte Dei Marmi, Italy","Siamo capitati a caso davanti al locale, avevamo un po’ di appetito e abbiamo mangiato qualcosa, era molto buono e...More"
[Italian],8,163.0,113.0,3,"June 20, 2016 ",Occhio al vino... ,"Rome, Italy","Certamente non è la Svezia il paese dove andare a bere vino, ma altrettanto certamente non è questo il ristorante...More"
[Italian],8,252.0,98.0,4,"September 1, 2017 ",Ottimo Ristorante,"Milan, Italy","Il locale è molto carino ubicano nei pressi della cattedrale di Lund, lo stile ricorda un Bistrot. Ottima carta dei...More"
[Italian],8,69.0,14.0,5,"September 14, 2017 ",Ottimo ristorante,"Turin, Italy","Ottimo ristorante, con cucina fusion franco-svedese.
Bella la location nel centro storico di Lund, dietro la cattedrale.
Personale professionale e...More"
[Norwegian],5,24.0,7.0,4,"April 11, 2015 ",Hastemiddag,"Moss, Norway","Vi hadde ikke bestilt bord, men fikk en time og femten minutter på oss om vi ville spise der. Ok....More"
[Norwegian],5,34.0,2.0,3,"April 15, 2017 ",Grei mat og vin,,"Var her i forbindelse med en jobbmiddag i Lund. Hadde store forhåpninger før vi satte oss til bords, men ble...More"
[Norwegian],5,202.0,31.0,4,"July 17, 2018 ",God service i travel lunsjtid,"Oslo, Norway","De har begrenset meny, men det de serverer er gjennomtenkt og godt. Servitørene er flinke til å se gjestenes ønsker...More"
[Norwegian],5,10.0,2.0,4,"June 11, 2018 ",Bra mat. Medium service,"Rotnes, Norway","Flott middag, med helt grei service. 
Servitøren var lite tilstede, men var oppmerksom. Maten var av ypperste klasse og vel...More"
[Norwegian],5,58.0,24.0,3,"October 9, 2014 ","Velsmakende og hyggelig, men noen trekk","Fredrikstad, Norway","Meget hyggelig sted med litt bistro-aktig interiør, bord av ulike størrelser, og hyggelig og ""varm"" atmosfære.  Vennlig betjening, rask service,...More"
[Portuguese],1,41.0,18.0,4,"November 30, 2016 ",Pequeno e familiar,"Curitiba, PR",Ótimas opções de pratos regionais com preços razoáveis. o cheiro da cozinha se espalha pelo salão por isso cuidado com...More
[Russian],2,107.0,59.0,5,"April 16, 2013 ",Очень уютное место,"Moscow, Russia","Отличное место в центре города. Приятный интерьер, приветливый и расторопный персонал. Но главное - отличная кухня! Не дешево, но и...More"
[Russian],2,126.0,55.0,5,"December 31, 2014 ",Французский ресторан,Stockholm,"Очень хороший французский ресторан, с вкусным грилем. Есть места, за которыми можно поужинать вне ресторана в уютной атмосфере окружающего городского...More"
[Spanish],3,5.0,1.0,5,"May 22, 2018 ",Extraordinario ambiente y deliciosa comida,,La comida es extraordinaria pero el trato tan amable y cálido te enamora. Los sabores de comida tradicional se modernizan...More
[Spanish],3,34.0,6.0,4,"October 17, 2017 ",Una cena deliciosa,,Un lugar muy agradable para una cena tranquila. Para la noche es necesario reservar en fin de semana. Personal muy...More
[Spanish],3,85.0,9.0,4,"October 4, 2017 ",Excelente cena,"Malaga, Spain","Tanto el servicio como la comida fueron exelentes. Completa carta de vinos.
Muy ricos los postres. Conviene reservar."
[Swedish],212,71.0,7.0,5,1 week ago ,Överraskande ställe,"Kavlinge, Sweden",Från gatan ser det inte mycket ut men väl där inne är atmosfären härlig.   Trevlig och kunnig personal som serverade...More
[Swedish],212,60.0,1.0,5,4 weeks ago ,Trevlig stämning och utsökt mat!,"Malmo, Sweden",Ett väldigt trevligt och mysigt ställe i centrala lund för alla som vill ha riktigt god mat. Ostronen vi beställde...More
[Swedish],212,22.0,1.0,3,5 days ago ,Firande,,Vi hade höga förväntningar och en av oss hade förvarnat om allergier. De hade iallafall läst mailet men inte förberett...More
[Swedish],212,214.0,26.0,4,5 weeks ago ,Trevlig fransos,"Sollentuna, Sweden","Ett trevligt ställe med en fransk touch. God vällagad mat, bra utbud av viner på glas förutom den vanliga vinlistan....More"
[Swedish],212,117.0,70.0,4,"April 1, 2014 ",Alltid hög nivå!,"Falsterbo, Sweden",Jag besöker Klostergatans Vin & Delikatess mestadels på lunchen och kan konstatera att de aldrig sviker från sin höga nivå....More
[Swedish],212,12.0,2.0,5,"April 1, 2017 ",Vällagat och gott,Enebyberg,Som alltid vällagat och med innovativa tillbehör. Denna gång en perfekt stekt skrei! Trevlig och kunnig personal som ger goda...More
[Swedish],212,3.0,3.0,5,"April 16, 2015 ",God mat och trevlig atmosfär,,"Har ätit här många gånger, senast i början av april 2015, då jag åt skreitorsk med bl.a. ärtpuré, purjolök och...More"
[Swedish],212,1.0,,2,"April 16, 2016 ",Lever på gammalt rykte - Bättring behövs!,"Lund, Sweden","Får man betala nästan 2000 kr för dagens meny med vinmeny för tre personer förväntar jag mig mer. Lite mat,...More"
[Swedish],212,88.0,13.0,5,"April 18, 2013 ",Ett ställe att besöka,"Lund, Sweden","Detta är ett ställe man bara skall testa, underbar mat och ett häftigt ställe man bara inte får missa.
Underbar...More"
[Swedish],212,11.0,3.0,2,"April 22, 2016 ",Gott men inte prisvärt,fredrik fernberg,"Prisnivå i överkant med anrättningar som inte övertygar.

Fisksoppan var ok med pilgrimsmussla som drunknade i sin ensamhet.

Skrei var...More"
[Swedish],212,4.0,1.0,5,"April 22, 2016 ",Fantastisk mat och service,"Lund, Sweden",Underbar mat och service. Personalens fantastiska leveranser och kvalitets tänk uppnår det bästa på marknaden. En fransk ombonad restaurang som...More
[Swedish],212,11.0,1.0,5,"April 25, 2016 ",Bland det bästa i Lund,"Stockholm, Sweden",Vi intog en trerättersmiddag och kan inte hitta en enda detalj som vi inte var nöjda med. Vi hade tur...More
[Swedish],212,29.0,17.0,5,"April 26, 2016 ",Brasserie som möter förväntningarna ,"Stockholm, Sweden",Mitt i Lund ligger denna trevliga krog. Inredningen påminner om brasserier så som de ofta ser ut i Frankrike och...More
[Swedish],212,11.0,2.0,5,"April 27, 2016 ",Gott!,"Melbourne, Australia",En givet val när man ska ut och äta i Lund. Deras råbiff är helt otrolig samt deras mule frites!...More
[Swedish],212,113.0,15.0,3,"April 30, 2015 ",Ointresserad personal,"Stockholm, Sweden","Vi var ett sällskap om 5 personer som skulle äta lunch. Maten var helt ok, men ingen större hit iförhållande...More"
[Swedish],212,175.0,66.0,2,"April 8, 2012 ",Kostar mer än det smakar,"Lund, Sweden",En liten kladd på tallriken skulle föreställa råbiff för 220 kr. Jag blev inte ens lite mätt... Plus dock för...More
[Swedish],212,14.0,7.0,3,"April 8, 2017 ",Verkade bra,,"Känslan var till en början mycket bra. Trevlig, kunnig servitör och en trevlig miljö. Åt hummer till förrätt den var...More"
[Swedish],212,5.0,,5,"April 9, 2017 ",En mycket lyckad kväll,"Skane County, Sweden",Vi hade inga särskilda förväntningar. Och ändå säger vi att förväntningarna överträffades med råge. En perfekt kväll blev det. Framför...More
[Swedish],212,51.0,20.0,2,"August 10, 2015 ",Besviken,,Jag blev väldigt besviken när jag åt lunch här. Se bilderna - den ena visar en bild som annonserade ut...More
[Swedish],212,9.0,4.0,1,"August 10, 2017 ",Så dyrt! ,"Lund, Sweden","Ingen restaurang för medelsvensson. Dyr och lite mat på tallriken. Åt kantareller och fisk, ingen större upplevelse tyvärr. Personalen var...More"
[Swedish],212,36.0,10.0,4,"August 10, 2017 ",Mycket god mat!,"Lund, Sweden",Vi var ett gäng från jobbet som var här på middag. Då vi var många hade vi redan valt rätt...More
[Swedish],212,9.0,1.0,5,"August 10, 2018 ","Fantastisk mat, proffsig personal!",,"Jag har tidigare ätit middag här och varit väldigt nöjd. Idag åt vi lunch, som var fantastiskt god, och prisvärd...More"
[Swedish],212,60.0,4.0,4,"August 11, 2014 ",Bra mat och trevlig atmosfär,"Lund, Sweden",En nästan full restaurang en måndagskväll bidrog till en trevlig atmosfär. Trevlig personal och god mat. Vi valde månadens meny...More
[Swedish],212,4.0,4.0,2,"August 12, 2016 ",Mysig stämning men dålig mat ,,"Stämningen på restaurangen är trevlig. Bra meny och goda drinkar. Till huvudrätt beställde vi oxfilé. En av köttbitarna var dock,...More"
[Swedish],212,21.0,7.0,1,"August 12, 2016 ",Otroligt nonchalant bemötande,,"Ett ställe med gott vin, men med personal som knappt bryr sig om sina kunder. Lång väntan på att få...More"
[Swedish],212,16.0,2.0,5,"August 13, 2018 ",Mysigt och bra.,"Eslov, Sweden",Middag på fina uteserveringen en vacker kväll i augusti. Testade ostronen med ett glas bubbel. Bra. Jag åt halstrad råbiff...More
[Swedish],212,93.0,13.0,4,"August 14, 2018 ",Bra lunch! ,"Lund, Sweden",Har ätit lunch här ett antal gånger och har alltid varit nöjd med både maten och servicen. Bra ställe!
[Swedish],212,2.0,,4,"August 15, 2016 ",Trivsam middag med mästerlig mat,"Lund, Sweden","Vi gick hit tillsammans med vänner på besök från London. Stämningen var familjär och avslappnad, servicen hjälpsam med översättning av...More"
[Swedish],212,5.0,,2,"August 17, 2018 ",Påver lunch för det priset (110),,Anka som var väldigt seg och okokt potatis. Dåligt med grönsaker. Hade höga förväntningar på vårt första besök men tyvärr...More
[Swedish],212,58.0,3.0,5,"August 18, 2015 ",Lunds godaste restaurang ,"Lund, Sweden",Har varit här många gånger och har aldrig varit missnöjd. Trevligt och mysigt ställe med trevlig personal. Maten har alltid...More
[Swedish],212,87.0,17.0,3,"August 18, 2017 ",Snobbig attityd,"Lund, Sweden",Var  här på lunch med min man. Vi kom fem minuter innan de öppnade. De var väldigt avvisande. Dörren var...More
[Swedish],212,201.0,38.0,5,"August 22, 2018 ","Mycket trevlig bistromiljö, fantastiskt god mat","Bromma, Sweden","Vi åt vegetariskt, torsk resp. oxfilé och alla mycket nöjda. Fisken serverades med rikligt med knapriga ångade grönsaker, filén som...More"
[Swedish],212,127.0,41.0,5,"August 23, 2012 ",Alltid gott och trevligt,"Lund, Sweden",Personalen alltid trevlig. Har varit där många gånger och alltid lika gott. Bara vid något enstaka tillfälle haft anledning att...More
[Swedish],212,123.0,23.0,5,"August 24, 2013 ",Trevlig personal och god mat!,"Kavlinge, Sweden",Hummersoppan var god med sina inslag av chilipuré. Åt sedan hällegflundra som var perfekt tillagad. Allting var gjort med omsorg...More
[Swedish],212,8.0,,5,"August 24, 2016 ",Bästa restaurangen i Lund ,,"En mycket trevlig restaurang med god mat och fantastisk service. Personalen förstår verkligen vad kunderna behöver. 
Inte den billigaste restaurangen,...More"
[Swedish],212,3.0,,5,"August 24, 2016 ",Trevlig kväll med goda vänner,"Lund, Sweden",Mycket god mat och fantastisk service. Trevlig atmosfär.Vi åt månadens trerättersmeny och drack vinmeny.
[Swedish],212,51.0,8.0,4,"August 25, 2016 ",Prisvärt,,Har varit här några gånger och blir alltid nöjd med mitt besök! Mycket kunnig personal som alltid hjälper med bra...More
[Swedish],212,55.0,16.0,4,"August 26, 2012 ",Mysig lyx,"Lund, Skåne Län, Sweden",Kunnig och trevlig personal. Lokalpriducerad mat som var lagad med omsorg. Fransk bistrokänsla och hög mysfaktor.
[Swedish],212,65.0,10.0,4,"August 26, 2017 ",Mycket bra mat!,"Akarp, Sweden","Beställde kantareller och oxfilé samt avslutade med créme brulée, allt var väldigt välsmakande. Bra service och trevlig personal så när...More"
[Swedish],212,4.0,5.0,5,"August 28, 2014 ",Service i toppklass!,"Malmo, Sweden","Jag och mitt sällskap kom ombokade och till en som vi såg fullsatt restaurang, men de topg hand om oss...More"
[Swedish],212,46.0,17.0,5,"August 29, 2016 ",Lunds trevligaste ställe,"Lund, Sweden","God mat ❤️👍
Och Lunds trevligaste personal
Lund näst godaste Crème brûlée
Mycket trevligt och gemytligt resturang, 
rekommenderar det varmt."
[Swedish],212,37.0,12.0,5,"August 3, 2016 ",Romantisk middag med pojkvännen,"Lund, Sverige","Lunds godaste entrecote 
Goda krispiga pommes
God öl
Pojkvännen är ofta kritisk till kött kvalite men här så sa han...More"
[Swedish],212,199.0,24.0,4,"August 3, 2018 ",Trevlig restaurang i Lund,"Gothenburg, Sweden","Trevlig krog mitt i Lund. Bra uteservering, trevlig personal och god service. Kommer gärna tillbaka och äter igen. Kan varmt...More"
[Swedish],212,8.0,1.0,5,"August 30, 2016 ",Utmärkt gott.,,"Utmärkt god mat, trevlig service. Vi kom utan bokning, men fick ett bra bord. Trevlig vinlista och intresserad kypare."
[Swedish],212,37.0,,4,"August 31, 2018 ",Fin råbiff,,Då vi älskar råbiff går vi faktiskt hit endast för råbiffens skull. Fantastiskt klassisk råbiff där man kan välja mellan...More
