[Swedish],212,38.0,7.0,4,"August 4, 2018 ",Bra helhetsupplevelse ,"Lund, Sweden",Klostergatan är snäppet bättre än de flesta restaurangerna i Lund. Det märks speciellt på servicen som är uppmärksam utan att...More
[Swedish],212,12.0,11.0,3,"August 6, 2012 ",Bra o trevlig service men lunchen var märklig.,"Lund, Sweden",Idag till lunch åt jag färskrökt lax i en sallad som mest bestod av paprika...mkt ruckola o en hel del...More
[Swedish],212,21.0,11.0,4,"August 8, 2013 ","Lagom, trevligt och avspänt","Lund, Sweden","Klostergatan bjuder alltid på god mat, i en lagom avspänd miljö, med trevlig personal. En klar favorit att återkomma till...More"
[Swedish],212,37.0,1.0,5,"August 8, 2017 ",Charmig bistro i hjärtat av Lund i fantastiska lokaler,"Lund, Sweden","Boka gärna bord då det ofta är fullsatt. Underbar lokal ger en fin inramning och hög mysfaktor. Vällagad mat, trevlig...More"
[Swedish],212,12.0,28.0,5,"August 9, 2014 ",Levererar alltid!,"Prague, Czech Republic","Jag har ätit här ett par gånger och har alltid varit supernöjd! God mat, duktig personal och trevligt bemötande! Rekommenderas...More"
[Swedish],212,22.0,7.0,5,"August 9, 2017 ",Middag,,"Startade med glas champagne.
Förrätt smörstekta kantareller med karamelliserad lök och vinägercreme. Huvudrätt kalvtartar med buffelmozzarella, cashewnötter  och salsa verde...More"
[Swedish],212,42.0,12.0,4,"December 1, 2015 ",En fullträff på kvällskvisten,,Vi slank in halvhungriga och tog en halv hummer och ett glas vin. Utmärkt. Bra vinlista. Underbar följsam servering. Så...More
[Swedish],212,123.0,23.0,4,"December 11, 2017 ",Servicen har trimmats till med maten ramlat en nivå,"Kavlinge, Sweden",Sist var servicen under lite kritik men denna gången är det maten som faller lite. Soppan till förrätt var precis...More
[Swedish],212,128.0,33.0,4,"December 13, 2017 ",Bra lunch med spets ,"Lund, Sweden","Såja, lunchen riktig bra. Mitt intryck av lunchen bättre än kvällsmenyn.
Bra service, fräscha råvaror!
Lite kyligt att sitta vid...More"
[Swedish],212,14.0,3.0,5,"December 15, 2018 ",Alltid en femma,"Hollviken, Sweden","En av mina favoritställen!! Jättetjusig lokal, bra meny, lite högre priser men som definitivt motsvarar maten. Kan varmt rekommendera både...More"
[Swedish],212,14.0,5.0,5,"December 18, 2014 ",Trevligt ställe !!!,,Mysigt ställe med gott mat och trevliga servitörer ! Fräsch och gott helt enkelt :) !!!!!!!!!!!!!!!!
[Swedish],212,10.0,4.0,1,"December 19, 2016 ","Tråkig personal, smaklös mat","Stockholm, Sweden","Här är maten tråkig, slarvigt serverad och snålt tilltagen oftast. För många gäster, för litet kök. Smaklösaste fisksoppa vi ätit....More"
[Swedish],212,98.0,60.0,4,"December 21, 2014 ",Hit kommer jag gång efter gång,"Limhamn, Sweden",Till Klostergatans Vin & Delikatess återkommer jag gång efter gång. Här får man ordentligt tillagad mat och en fantastisk atmosfär...More
[Swedish],212,8.0,1.0,5,"December 21, 2016 ",Bra barhäng,,"Jag och syrran hängde i baren, drack varsina goda drinkar och beställde sen in en charktallrik som var RIKTIGT bra!...More"
[Swedish],212,12.0,3.0,4,"December 22, 2017 ",Alltid ett bra och säkert kort,"Lund, Sweden",Jag har varit på Klostergatan flera gånger både med vänner och i jobbet och det är ett säkert kort. Maten...More
[Swedish],212,36.0,5.0,3,"December 25, 2017 ",Inte prisvärt ,"Lund, Sweden","Mysig lokal med ”vardagsrums känsla”.
Personalen var kunnig och rekommenderade bra och god dryck till maten. Maten var god men...More"
[Swedish],212,21.0,10.0,3,"December 26, 2015 ",Inte mer än helt ok!,"Lund, Sweden",Efter ett par besök under ett par år tänkte jag nu lämna mitt omdöme som speglar mina erfarenheter över tiden....More
[Swedish],212,14.0,1.0,3,"December 27, 2017 ",Ingem gourmet krog längre,,Mycket trevlig och hjälpsam personal.Vi åt dagens meny och den var slätstruken utan krydda eller eller överraskning. Ej prisvärt
[Swedish],212,64.0,15.0,5,"December 29, 2014 ",Utmärkt  service,"Partille, Sweden","Utmärkt mat, och felfri trevlig service för ett stort blandat sällskap. Låg ljudnivå så det gick att umgås med hela...More"
[Swedish],212,31.0,5.0,5,"December 3, 2016 ",Underbart!,"Lund, Sweden","Har besökt denna restaurang många gånger och blir aldrig besviken. Menyn är lagom stor, finns något för både barn och...More"
[Swedish],212,11.0,1.0,4,"December 3, 2016 ",Mycket trevligt ställe men inte den snabbaste servicen,,Härlig atmosfär. Fullt och stojigt och stimmigt men en stor blandning av folk. Vi åt lunch och maten var mycket...More
[Swedish],212,274.0,52.0,4,"December 6, 2018 ",Lågmält och bra,"Gothenburg, Sweden","Det är inga yviga gester vare sig i lokal, service eller maten, utan en lågmäld framtoning på upplevelsen totalt. Men...More"
[Swedish],212,41.0,13.0,4,"February 1, 2017 ",Gott och smakrikt,"Åhus, Skåne Län, Sweden","Mycket gott och fräscht, åt middag tillsammans med väninnan. 
Mysig atmosfär att sitta och små prata i medan man äter....More"
[Swedish],212,39.0,7.0,5,"February 11, 2017 ",Supergott!,Lund,"Alla i sällskapet var verkligen nöjda med sin mat. Allt var supergott. Jag blev jättemätt, medan min pojkvän, pappa och...More"
[Swedish],212,50.0,14.0,5,"February 12, 2018 ",Ny upplevelse,Lund,Trots boende i Lund aldrig besökt stället. Nu bjöd kollegorna ut mig och vilken upplevelse det blev! Njöt av en...More
[Swedish],212,72.0,9.0,4,"February 13, 2017 ",Bra kött,"Lund, Sweden","Vällagat kött med goda tilltugg, man kan välja att krypa in i ostört hörn eller sitta mitt i smeten med...More"
[Swedish],212,58.0,8.0,5,"February 13, 2017 ",Riktigt bra mat - helt enkelt,Sweden,En mycket bra meny med något för alla smaker. Fisk och skaldjurssoppan är helt klart värt att beställa. Valet mellan...More
[Swedish],212,6.0,6.0,5,"February 14, 2017 ",Bästa restaurangen i Lund,Skåne,Det är hit man går om man vill vara helt säker på att alltid få äta en perfekt måltid och...More
[Swedish],212,1.0,2.0,2,"February 15, 2012 ",bränd hummersoppa,"Lund, Sweden",till förrätt som smakade förfärligt. När det påpekades för servitören nekade han trots att gästerna vid bordet bredvid fick flera...More
[Swedish],212,9.0,1.0,5,"February 15, 2017 ",Romantisk middag för två,"Lund, Sweden","Underbar mat, härlig service och goda viner. Något trångt eftersom restaurangen var fullsatt. Kom ihåg att boka bord! Priset är...More"
[Swedish],212,75.0,15.0,5,"February 18, 2016 ",Fantastisk middag!,"Lund, Sweden","Åt middag här med min fru, och vi är oerhört nöjda. Maten höll mycket hög klass, och likaså servicen. Personalen...More"
[Swedish],212,37.0,8.0,4,"February 20, 2013 ",très bon restaurant,Lund,"En restaurang med hög kvalite på rå varor, personal som vet vad service är och kockarna får ens smaklökar att...More"
[Swedish],212,11.0,10.0,5,"February 23, 2015 ",Underbar atmosfär och mat,"Lund, Skåne Län, Sweden",Underbar mat som är vällagad och en fantastisk atmosfär som gör att jag inte vill gå därifrån. Avslappnat och med...More
[Swedish],212,15.0,1.0,5,"February 26, 2016 ",Vin för alla smaker,"Ystad, Sweden","Åt lördagslunch med lyxkänsla - otroligt trevlig service, riktigt god mat och bra utbud av vin. Värt att besöka Lund...More"
[Swedish],212,55.0,30.0,4,"February 26, 2016 ",Favorit som håller,"Gothenburg, Sweden","Återvänder gärna hit när jag besöker Lund. Trevlig miljö. Effektiv, vänlig och kunnig personal. Genomtänkta och välsmakande menyer samt hyfsad...More"
[Swedish],212,342.0,161.0,3,"February 27, 2015 ",Håller inte riktigt,Lund,"Trevligt bistro med verkligen bra stämning, fullt med glada människor. Man trivs i lokalen och konceptet håller i princip. Trevlig...More"
[Swedish],212,72.0,14.0,5,"February 6, 2017 ",Överraskande pärla i Lund,"Stockholm, Sweden","Trevlig atmosfär, personal och supergod mat. Vi tog en trerättersmeny som var fantastisk med ett gott vi till. Dottern tog...More"
[Swedish],212,31.0,7.0,5,"February 9, 2016 ",Utmärkt lunchställe,"Lund, Sweden","Ett trivsamt ställe, modernt men ändå med lagom ljudnivå. Servicen är vänligt kamratlig, men inte påträngande. Maten är fantasifullt tillagad...More"
[Swedish],212,3.0,,5,"January 1, 2017 ",Intimt,"Malmo, Sweden","Maten är såå god och miljön fantastisk. Det är få restauranger som kan kombinera detta. 
Mycket bra service.
Perfekt för...More"
[Swedish],212,72.0,8.0,5,"January 10, 2018 ",Bästa på länge! ,"Malmo, Sweden",Vi hade bokning kl 6 och åt deras middagsmeny. Det var otroligt gott! Bästa restaurangmaten vi alla fyra hade  ätit...More
[Swedish],212,657.0,161.0,5,"January 18, 2015 ",Trevligt och Gott!,"Stockholm, Sweden","En härlig kväll igen på Klostergatans. Prosecco, en fantastisk löjromsförrätt, oxfilé och reninnerfile med endiver och rotselleri. Därtill en Sancerre...More"
[Swedish],212,2.0,1.0,5,"January 20, 2014 ",Stans bästa restaurang,"Lund, Sweden",Mycket god mat med fransk touch. Kunnig och trevlig personal. Bra dryckessortiment. Bästa restaurangen i Lund.
[Swedish],212,41.0,3.0,5,"January 20, 2014 ",Restaurang med god mat och mycket bra service,,"Jag blev bjuden på lunch med mina f d kollegor. Mycket god lunchmat
Mycket att välja på. Mycket bra personal!"
[Swedish],212,27.0,5.0,4,"January 29, 2016 ",Avslutningsfirande,,"En behaglig miljö, klanderfri betjäning, vettiga priser och en halstrad råbiff som överträffar det mesta. Om man summerar detta kan...More"
[Swedish],212,79.0,4.0,4,"January 3, 2016 ",Sen kväll i Lund,"Solna, Sweden",Tillsammans med sällskap om 10 pers åt vi gott.  Fantastiskt bra oxfilė (285 kr) o vad jag förstod var musslorna...More
[Swedish],212,92.0,20.0,4,"January 6, 2015 ",Hög kvalitet och måttliga priser,"Lund, Skåne Län, Sweden","Man slås av hur allt skapar en helhet: inredning av klassiskt snitt, personal elegant klädda, verserade och effektiva. Går man...More"
[Swedish],212,10.0,,5,"January 7, 2017 ",Fantastik kväll!,Lund,Mycket god mat tillsammans med utomordentlig service med kunnig och trevlig personal är allt du kan begära! Rekommenderas varmt.
[Swedish],212,23.0,7.0,5,"January 9, 2015 ",Trivsamt ställe,"Horby, Sweden","Mat föredömligt tillagad , men portionerna kunde gärna varit lite större , men de kanske är anpassade så för att...More"
[Swedish],212,48.0,17.0,5,"January 9, 2016 ",Den bästa meny jag ätit,"Lund, Sweden",Vi hade något viktigt att fira och det kunde inte ha blivit bättre! En mycket välkomponerad meny med dito vinlista...More
[Swedish],212,29.0,8.0,4,"July 1, 2018 ",Rekommenderas varmt,"Orebro, Sweden","Det här är en mycket, mycket bra restaurang. Trevlig miljö, trevlig personal och maten håller mycket hög klass. Charkbrickan, sparrissoppa,...More"
[Swedish],212,66.0,5.0,4,"July 10, 2018 ",Lunch i Lund. ,"Hoor, Sweden",Jag kan varmt rekommenderar detta.  En mycket god lunch.  Ligger i en bra och lite lugnare ställe.  Väldigt bra servis.
[Swedish],212,164.0,55.0,4,"July 11, 2013 ",Mysig restaurang i centrala Lund,Malmö,Trevlig restaurang med bra service. Maten var god och en trevlig miljö. Mysigt och att rekommendera om man är 2-6...More
[Swedish],212,86.0,169.0,5,"July 14, 2015 ",Alltid bra,"Lund, Sweden",Efter flertalet besök kan jag bara konstatera att det alltid är bra på denna restaurang. Trevlig personal och god mat.
[Swedish],212,26.0,2.0,5,"July 17, 2015 ",Aldrig missnöjd på Klostergatan,,Alltid samma härliga bemötande och alltid samma höga klass på Klostergatan. Har ätit den större delen av menyn och allting...More
[Swedish],212,21.0,5.0,5,"July 17, 2017 ",En bistro av högsta klass,"Stockholm, Sweden",Det här är en ärlig bistro av högsta klass. Ingen missar detaljerna och resultatet blir en ytterst njutbar bistro av...More
[Swedish],212,28.0,15.0,4,"July 18, 2012 ",Goda luncher och fantastiska middagar,"Lund, Sweden","Klostergatan levererar både på lunch och kvällstid. Goda, vällagade och spännande rätter"
[Swedish],212,4.0,4.0,5,"July 19, 2013 ",Mycket fin mat!,Lund,"Åt trerätters här med ett sällskap på 12 personer i samband med ett examensfirande och blev inte besviken.

Kammusslan såg...More"
[Swedish],212,22.0,7.0,5,"July 19, 2016 ",Middag ,,Vi åt en kantarelltoast med getost och picklad rödlök som förrätt -utsökt gott . Till huvudrätt halstrad råbiff. Klostergatans vin...More
[Swedish],212,158.0,49.0,4,"July 2, 2012 ",Exlusivt,"Lund, Sweden","Vårat sällskap åt bla annat råbiff, vilken var alldeles utsökt, plus för att man kunde välja stor eller liten.
Grillad...More"
[Swedish],212,18.0,9.0,4,"July 2, 2016 ",God mat men tålmodig väntan,"Lund, Sweden",Vi fick god mat - oxkind och entrecote - men fick vänta ett bra tag. När vi trodde att förrätten...More
[Swedish],212,115.0,31.0,4,"July 20, 2015 ",Ett besök är ett måste.,"Lund, Sweden",Lokalen är verkligen välgjord för ens själ. Det är en fröjd att sitta och äta eller bara ta en drink...More
[Swedish],212,26.0,7.0,5,"July 25, 2015 ",Det självklara restaurangvalet i Lund,"Lund, Sweden",Lunda favoriten! Varit här både med min familj och med företaget vid flera tillfällen. Vid alla tillfällen har samtliga varit...More
[Swedish],212,115.0,31.0,4,"July 25, 2017 ",Ännu en måltid,"Lund, Sweden",Ännu en måltid på en av stans bästa ställen. Besöken har blivit en del genom åren nu. Anser att Klostergatans...More
[Swedish],212,9.0,5.0,5,"July 26, 2016 ",God och vällagad mat,"Lund, Sweden",God mat såväl för ögat som för gommen. En mysig krog med god mat och trevlig atmosfär som ligger i...More
[Swedish],212,11.0,6.0,5,"July 26, 2017 ",Favoritresturangen,,Fantastisk mat i mysig miljö. Mycket trevlig personal och bra service. Gillar du råbiff ska du testa det här! Glöm...More
[Swedish],212,46.0,5.0,5,"July 26, 2018 ",Alltid gott,"Lund, Sweden",Har ätit här flera gånger. Alltid god mat och trevlig service. Deras 3 rätters meny kan rekommenderas. Oftast mycket folk....More
[Swedish],212,68.0,14.0,5,"July 27, 2018 ",Jättebra rakt igenom,Stockholm,"Besökte med familjen. Jättebra mat rakt igenom serverad på proffsigt, trevligt och korrekt sätt. Kan verkligen rekommenderas!"
[Swedish],212,14.0,6.0,4,"July 28, 2015 ","bra, trevligt och värt ett besök",,"Bland de bättre restaurangerna i Lund. maten är klassisk fransk bistro, bra vinutbud och välsmakande rätter"
[Swedish],212,13.0,4.0,5,"July 30, 2015 ",Ett säkert kort,"Stockholm, Sweden",Klostergatans vin och delikatess är ett måste om man besöker Lund. En klassisk fransk bistro med mycket hög kvalitet och...More
[Swedish],212,22.0,7.0,4,"July 31, 2015 ",Middag,,"Vi har besökt restaurangen ett antal gånger och aldrig blivit besviken.

Åt halstrad  gös med grillad sparris ochcitronbeurreblanc
Tilldesser Jordgubbsparfait...More"
[Swedish],212,34.0,14.0,5,"July 6, 2015 ",Lunds bästa restaurang - i fransk bistrostil,"Siem Reap, Cambodia",Vällagad fransk mat av högsta kvalitet - inget krångel eller fusk. Vi åt deras klassiska meny som börjar med en...More
[Swedish],212,44.0,10.0,5,"July 9, 2015 ",Härligt matställe,"Sodermanland County, Sweden","SÅ härlig miljö, ofta fullt så kom i god tid. 
God mat som överraskar och är varierad.
Trevlig personal.
Bra...More"
[Swedish],212,180.0,31.0,5,"July 9, 2015 ",Lax till lunch smaka mums!,"Lund, Sweden",Som vanligt god lunch och bra service. Dagens lax med dijonsås var kanongod! Finns alltid Toast skagen som ett säkert...More
[Swedish],212,81.0,17.0,4,"June 10, 2016 ",God lunch,"Helsingborg, Skåne Län, Sweden","Trevligt ställe centralt i Lund. Salladsbuffé och bröd, bordservering för maten. Vällagad och god lunch. Personalen lite väl stressad de...More"
[Swedish],212,37.0,12.0,5,"June 12, 2016 ",Lördag kväll med pojkvännen ,"Lund, Sverige","Stans bästa råbiff och entrecote. 

Ett säkert kort, först klassig mat, mysig och romantisk, fransk inredning. Söta och kunniga servitriser....More"
[Swedish],212,812.0,143.0,3,"June 16, 2015 ",Trevligt ställe med bra mat,"Stockholm, Sweden","Trevlig miljö, bra service , varierad meny och mycket god mat till rimligt pris. Centralt läge i Lund.
Vi började...More"
[Swedish],212,12.0,12.0,5,"June 18, 2013 ",Utmärkt,"Kalmar, Sweden","Vi firade vår dotters examen på restaurangen. Vilken lyckad kväll. Fantastisk mat, trevlig miljö och utmärkt service. Verkligen en restaurang...More"
[Swedish],212,3.0,1.0,5,"June 18, 2017 ",Fin och trevlig restaurang,,"En restaurang med fin och välsmakande mat lämplig både för fritid, när man ska ha något extra gott och för...More"
[Swedish],212,33.0,23.0,5,"June 19, 2018 ",Lunds bästa restaurang,Malmö,"Detta är utan tvekan Lunds bästa restaurang!

Jag har besökt restaurangen ett stort antal gånger de senaste åren, främst på...More"
[Swedish],212,15.0,3.0,5,"June 2, 2017 ",Väldigt bra! ,,"Mycket bra mat, bra service och har nog en av södra Sveriges bästa oxfilé. Har en klassisk menyn som skiftar...More"
[Swedish],212,180.0,31.0,4,"June 26, 2017 ","Mat, vin och service","Lund, Sweden","Inledningsvis lite knackig service eftersom många bordsreserveringar var till samma tid. Drinkar, förutbestämd meny och viner levererades sen som på...More"
[Swedish],212,11.0,5.0,5,"June 3, 2018 ",Födelsedagsfirande ,"Kavlinge, Sweden","Mycket god mat och trevlig personal. Härlig miljö och blandad ""publik"", unga och gamla gäster i en skön blandning."
[Swedish],212,97.0,21.0,4,"June 30, 2017 ",Kanonklass,"Orebro, Sweden",Löjromstoast till förrätt och oxfilé till huvudrätt. Båda två var helt perfekta. Hade blivit fem om det inte varit för...More
[Swedish],212,8.0,3.0,4,"June 6, 2016 ",Bra igen,,"Efter kvalitetsproblem i köket i ett år eller så har de äntligen återhämtat sig. Härligt! Så maten är nu felfri,...More"
[Swedish],212,73.0,5.0,4,"June 6, 2017 ",God mat ,"Lund, Sweden","Första besöket, var där med min mamma en lördag kväll i juni. Båda valde det som kändes mest prisvärt, 3-rätters...More"
[Swedish],212,245.0,57.0,5,"March 10, 2014 ",Stans bästa restaurang,"Lund, Sweden","Man blir aldrig besviken på Klostergatan. Bra klassisk franskinspirerad mat och bra service.

Lunchen är populär och alltid bra med...More"
[Swedish],212,7.0,6.0,5,"March 12, 2017 ",God mat i trevlig atmosfär,"Uppsala, Sweden",Mycket bra mat och dryck. Trevlig atmosfär och bra service. Måste säga att deras charkbricka var grym. Väl värt ett...More
[Swedish],212,93.0,17.0,5,"March 15, 2013 ",Ett halleluja moment!,"Staffanstorp, Sweden",Vi var 2 par som besökte denna otroligt mysiga och vänliga restaurang. 3 av oss bestämde oss för deras trerättersmeny...More
[Swedish],212,4.0,3.0,4,"March 16, 2016 ","Trevligt, gott och säkert","Lund, Sweden","Det bästa med Klostergatans är att man mår så bra där, trivseln har flyttat in på något sätt. Mest beror...More"
[Swedish],212,128.0,33.0,3,"March 18, 2017 ",Bra men skjuter lite över målet...,"Lund, Sweden","Mkt trevlig servitör med bra kompetens avseende vi o mat. 
Märks att service ""tunnas"" av efterhand som det kommer mer...More"
[Swedish],212,3.0,1.0,5,"March 22, 2016 ",Perfekt för lunch och middag!,"Stockholm, Sweden","Jättetrevlig personal! Mat och dryck helt perfekt! Vacker inredning utmed lugn gata. 
Kommer gärna tillbaka hit!"
[Swedish],212,245.0,57.0,2,"March 28, 2015 ",Det var bättre förr,"Lund, Sweden","Vi har regelbundet besökt Klostergatan, men något har hänt de senaste månaderna. Maten är enkla lösningar och salladerna som har...More"
[Swedish],212,18.0,8.0,4,"March 28, 2016 ",En finare middag,Lidköping,"Jag och min pojkvän gick hit för att fira hans tenta i höstas, det är absolut god mat och personalen...More"
[Swedish],212,8.0,3.0,4,"March 29, 2014 ",Bra,,"Bra men har märkbart tappat kvalitet i nåt år nu. Lite sämre mat än förr. Personalen som förr var fantastisk,...More"
[Swedish],212,32.0,4.0,5,"March 3, 2017 ",Vilken bra bistro!,"Vaxjo, Sweden","Trevlig fransk bistro med inte bara bra, utan perfekt balanserad mat. Stora, goda ostron till förrätt och till huvudrätt var...More"
[Swedish],212,86.0,25.0,3,"March 6, 2016 ",Konventionell men bra middag,"Arboga, Sweden",Vi var ute i god tid för att boka inför kvällen men placerades tyvärr mitt i draget från ytterdörren trots...More
[Swedish],212,2.0,,5,"March 6, 2016 ",När du inte hinner åka utomlands,"Lund, Sverige","Maten tillreds med fantasi och omsorg, rekommenderat vin passar som hand i handske till maten, Betjäningen är omtänksam och lyhörd....More"
[Swedish],212,12.0,2.0,4,"May 1, 2018 ","Mysigt, god mat och fin service","Solna, Sweden","Varmt, kul och välkomnande. Fin meny med bra urval och superbra råvaror. Personlig service och god vägledning kring både mat...More"
[Swedish],212,5.0,1.0,5,"May 12, 2015 ",Perfekt,"Lund, Sweden","Man äter och dricker gott till rimlig kostnad. Mat, atmosfär och service känns som i Frankrike eller norra Italien."
[Swedish],212,45.0,8.0,5,"May 13, 2018 ",Fantastiskt,"Gothenburg, Sweden",Åt månadens meny tillsammans med vinmenyn och det var verkligen en fullträff. Väl balanserade smaker och perfekt stekt kött. Hit...More
[Swedish],212,35.0,15.0,4,"May 15, 2018 ",Rask middagsvisit!,"Lund, Sweden",Suverän service. Den pocherade rödspättan var tillagad till perfektion & primörerna likaså. En fantastisk smakupplevelse. Rekommenderas varmt!
[Swedish],212,3.0,,5,"May 16, 2018 ",Utsökt,Malmö,"Alltid lika gott, dag som kväll.
En av stans bästa om inte den bästa. 
Smakkombinationer för den kräsne"
[Swedish],212,2.0,4.0,5,"May 20, 2016 ",Anklever och oxfilé ,"Lund, Sweden","Har hittat mitt favoritställe i Lund. Härliga rätter, skön stämning och supertrevlig personal. Tack för att ni finns!"
[Swedish],212,7.0,7.0,5,"May 22, 2013 ",Utmärkta menyer,"Lund, Sweden","Deras menyer är väldigt prisvärda med tanke på kvalitén på maten. Tre rätt för runt 350 kr, där det bjuds...More"
[Swedish],212,1.0,2.0,3,"May 25, 2013 ",Medioker fiskgryta,,Satt vid ett mysigt litet fönsterbord en lördageftermiddag o var hungriga o beställde fiskgryta eftersom vi båda älskar fisk. Grytan...More
[Swedish],212,13.0,5.0,5,"May 25, 2017 ",Nöjda i Lund,"Solvesborg, Sweden","Min son fyllde 40, min dotterdotter fyllde 5 år. Vi hade valt Klostergatans vin och delikatess för att fira de...More"
[Swedish],212,4.0,4.0,5,"May 3, 2013 ",Alltid god mat och service,"Lund, Sweden","Varje gång man kommer dit, blir man alltid väl bemöt av trevliga personaler och mycket goda husmanskoster."
[Swedish],212,24.0,2.0,5,"May 3, 2013 ",Väldigt professionel,"Lund, Sverige","Restaurangen har allt som en bra restaurang ska ha.
Väldig god mat med finess, snabb betjäning,bra stämning, väldig bra kypare...More"
[Swedish],212,131.0,10.0,4,"May 31, 2018 ",God mat och trevlig personal,"Uppsala County, Sweden","Vi testade rödtunga och ankbröst. Båda rätterna kan rekommenderas. Mysig miljö inne, men vi valde ändå att sitta utomhus, eftersom...More"
[Swedish],212,38.0,5.0,3,"November 14, 2018 ",Blandad kompott,"Falsterbo, Sweden",Problemet med riktigt bra krogar är ju att man alltid ställer så höga krav. När så målbilden inte uppfylls så...More
[Swedish],212,142.0,32.0,4,"November 15, 2015 ",Bland dom bästa i Lund,"Malmo, Sweden",Bokade bord en fredag kl 19.30 på denna mysiga restaurang i centrala Lund. Matsalen var nästan fullsatt och man får...More
[Swedish],212,13.0,5.0,4,"November 16, 2018 ",God mat. Bra meny.,"Lund, Sweden","God, alltid vällagad mat. Bra meny. Fin uppläggning. Aldrig besviken på smakupplevelse. Meny, mat, smak ger högt betyg. Det som...More"
[Swedish],212,32.0,7.0,4,"November 18, 2017 ",Familjemiddag en lördag,"Malmo, Sweden","Nästan hela släkten samlades igår för att avnjuta en fantastisk tre rättersmeny.
Musselsoppan var amazing, därefter rådjur som var underbart...More"
[Swedish],212,163.0,40.0,2,"November 18, 2018 ",En besvikelse,"Malmo, Sweden",Besökte krogen en lördag för lunch. Miljön är trevlig med sitt brasseriestuk. Stämning informell. Vårt val föll på Toast Skagen...More
[Swedish],212,33.0,12.0,5,"November 19, 2015 ",Mysig krog att återvända till,"Lund, Sweden",God mat och alltid lika trevlig och professionell personal. Kunniga om vin och mat. Den halstrade råbiffen är alltid ett...More
[Swedish],212,1.0,1.0,3,"November 2, 2015 ",Blandning av bra och dåligt,"Stockholm, Sweden","När vi kom till restaurangen så var det fler som stod och väntade in ""hovmästaren"". Servicen tog hand om första...More"
[Swedish],212,6.0,3.0,4,"November 21, 2016 ",Mycket trevligt liten restaurang,"Lund, Sweden",Mycket trevligt liten restaurang med god kryddrik mat med god dryck till. Bra service med kunnig personal men bokning behövs.
[Swedish],212,5.0,3.0,5,"November 22, 2015 ",Min favorit i Lund,"Lund, Sweden","Trivsamt och informellt. Mycket engagerad  och kunnig personal. Brokig publik i alla åldrar. Enkel och lockande meny, med inrikting på...More"
[Swedish],212,48.0,25.0,4,"November 23, 2014 ",Trevligt och gott!,Rom,Fick dagens som var mycket vällagad och god. Personalen var serviceminded och vi fick in både mat och dryck otroligt...More
[Swedish],212,39.0,16.0,4,"November 23, 2014 ",Mycket flexibel personal o  de fixar nog det flesta önskemål.,,Gott o vällagat. Bra service. Alert men inte påflugen service. Dock usel ventilation o jättevarm lokal.
[Swedish],212,4.0,,4,"November 27, 2014 ",Trevlig atmosfär!,"Malmo, Sweden",Det här stället är alltid lika trevligt. Brukar komma förbi under lunchen ibland och ser alltid fram emot vilka rätter...More
[Swedish],212,72.0,15.0,5,"November 29, 2015 ",Jättegott ,"Staffanstorp, Sweden","Beställt diverse för avhämtning och det håller alltid hög standard.
Personalen är trevlig och tillmötesgående."
