[English],132,4.0,,4,"March 28, 2016 ",Take away,"Lund, Sweden","Had some great take away from here, we had the pasta and it was great, big portions, fresh sallads and some icecreamfor dessert. The best was that the food was still warm when we came back home."
[English],132,23.0,7.0,1,"March 29, 2012 ",Crappy service,"Copenhagen, Denmark","The food is good, but the waitress was so rude, the service was so crappy and the waiting time was so long, that it overweights everything else. The overall experience: they do not want to have customers at all.

Get waitresses that don't act like...More"
[English],132,3.0,1.0,4,"March 30, 2016 ",Delicious pizza!,"Lund, Sweden","Went there for late lunch today. We had two very good pizzas plus an amazing pannacotta at a very affordable price (plus 20% discount because of the hour). The place is nicely decorated, not fancy good atmostphere. Very friendly staff and quick service. To recommend!!"
[English],132,34.0,34.0,3,"May 1, 2010 ",Good pizza but crappy service,"Malmo, Sweden",The guy has an attitude problem..... but the pizza is on of the best!
[English],132,9.0,7.0,3,"May 12, 2008 ",Nice restaurant with good pizza. Like that you can choose regular or wholegrain dough.,"London, United Kingdom",Nice restaurant with good pizza. Like that you can choose regular or wholegrain dough.
[English],132,55.0,8.0,4,"May 12, 2018 ",Pizza and pasta and good,"Stockholm, Sweden",Ate there after a whole day of traveling. Food was delicious the bruschetta entre could have had more tasting tomatoes though. My pizza was excellent and my friends pasta was also great! I really recommend going there.
[English],132,91.0,12.0,4,"May 13, 2016 ",Good pizza,,"Good pizza that is not ally that cheesy and greasy, more Italian style. Only tested take away with a rather fast and very friendly."
[English],132,17.0,5.0,4,"May 17, 2012 ",Best pizza chain in Lund and Malmö,"Copenhagen, Denmark","Expensive and worth it. Always busy, always good food. Great quick bite or evening out."
[English],132,434.0,458.0,4,"May 17, 2014 ","Good pizzas, close to the railway station but noisy inside","Malmo, Sweden","If you like Italian type thin crusty pizzas, and happen to be close to the railway station in Lund, this is a good place to go for lunch or a quick feed at other times of the day. Their pizzas are faultless, with fresh ingredients....More"
[English],132,12.0,4.0,3,"May 17, 2018 ","Nice, crispy pizzas :)",Sweden,"Nice, crispy pizzas. There is a wide variety of pizza offer, and you can always find something for your taste. Pastas are not that creative and tasty, so I would skip them. Also I didn't like the fact that they charge for tap water and...More"
[English],132,14.0,6.0,1,"May 18, 2012 ",Expensive and terrible pizza,"Lund, Sverige","Wet, small and tasteless pizza. Will never go there again."
[English],132,33.0,26.0,4,"May 19, 2015 ",Best pizza in town,"Karlslunde, Denmark","Went there couple of times for dinner. I mostly had pizza for dinner except one time when I tried the ravioli which was disappointing. Undoubtedly, they serve the best pizza in town. If not for anything else go for the pizza and you will not...More"
[English],132,22.0,12.0,4,"May 19, 2015 ","Nice place, pretty proper Italian food ","Amsterdam, The Netherlands","Went here with a group from work for pizzas and pasta. Very nice food, tasty dishes.
Good atmosphere and very friendly staff!"
[English],132,17.0,2.0,4,"May 21, 2015 ",Nice Italian restaurant in Lund,"Lund, Sweden","One of the only real Italian restaurants in Lund.
Pizzas and pastas are very good :)
The place is a bit small but cozy.
It's usually fully booked for dinners, better to have a reservation ;)"
[English],132,2.0,1.0,4,"May 26, 2017 ",Very good pizza!,"Lund, Sweden","Genuine Italian pizza, one of the best ones in Lund. Great lunch offer. Very clean facilities including toilets. Would recommend :)"
[English],132,19.0,5.0,5,"May 27, 2014 ",First class Pizza´s in Lund and Malmö,"Lund, Sverige","Vespa serves really good high quality pizza´s, with deluxe toppings. Price levels are higher than at your local Pizza-Place, but still affordable.  A typical VESPA evening is when I´m tired after a long exhausting workday and make a stop at VESPAS and arrives home a...More"
[English],132,10.0,,5,"May 28, 2015 ",Great pizza,"Lund, Sweden","We ordered a take-away pizza. It was delicious and probably the best pizza I have had in Lund! Will definitely go back and try to dine-in, 'cuz the decor also seemed nice there!"
[English],132,19.0,6.0,3,"November 13, 2015 ",Decent pizza,"Lund, Sweden",This kind of pizza is a lot different than you get at most pizza places in Sweden. If you like prousciotto and that kind of stuff on your pizza it's good but you're paying about twice the amount of regular pizza.
[English],132,7.0,7.0,2,"November 19, 2015 ",Poor service!,,"Good Pizza, reasonable priced. But when I asked the waiter if I could have some chili oil?  she then said it's over there on the other side of the restaurant... so I had to go and get it myself.

Very strange attitude and not to...More"
[English],132,7.0,1.0,4,"November 30, 2013 ",Great location and good food,"Lund, Sweden",We had cheese as stater and one pizza and spaghetti for main course. Very nice food.
[English],132,6.0,1.0,3,"November 5, 2014 ","""italian style"" pizzas","Lund, Sweden","Nice ""italian style"" pizzas and pasta dishes in a warm atmosphere.

They don't allow dogs when you eat out side. We were asked to leave. That was strange and not typical for Sweden.

If you want to try real ""swedish"" pizza choose another place."
[English],132,26.0,19.0,2,"November 7, 2014 ",a bit famous but...,"Seoul, South Korea",I've been there due to good comments at Tripadvisor. But the taste of its pasta was not as good for its price as I expected. Also they had very few selections for lunch time.
[English],132,20.0,5.0,4,"October 18, 2016 ",Really smashing pizzas ,"Helsingborg, Sweden","Hungry? No matter if you're out for a lunch bite or if it's dinner time. This place will make you happy, and satisfied. Italian style pizzas, fresh bread, salad. I can really recommend this joint."
[English],132,33.0,10.0,2,"October 19, 2016 ",Not quite up to par,"Skurup, Sweden","V.e.s.p.a. have a reputation for the best pizzas in town, weather it be Malmö or Lund. A restaurant is only as good as the last meal served, and in this case, there was a sense of disappointment around the table. The waitresses had nothing to...More"
[English],132,2.0,5.0,1,"October 2, 2015 ",Poor and unprofessional service and expensive mediocre food,"Lund, Sweden","I have the experience of eating Lunch, Dinner and take away, without doubt V.E.S.P.A is over priced for its mediocre food. 
When I was there for lunch while the restaurant was nearly empty the wait was more than 40 minutes, the waitress was unmotivated and...More"
[English],132,80.0,17.0,4,"October 22, 2015 ",Best pizza in town,"Akureyri, Iceland",At least I don´t know of a better place for pizza in Lund. I go there regularly and I really like the place. It´s usually very crowded so be sure to make a reservation.
[English],132,22.0,10.0,3,"October 26, 2015 ",Very nice pizza; not too expensive,"Stockholm, Sweden","Very good pizza. Quick service. Table for 1 not a problem. Wine served with water with ice. 

On the negative side - only three red wines by the glass."
[English],132,24.0,3.0,3,"October 28, 2018 ","Good food, poor environment","Vellinge, Sweden","The food here is great, and the service is usually also very good. The problem is that the sound level is way too high due to the total lack of textiles or anything else that absorbs the sound. Another minus is that the tables are...More"
[English],132,33.0,5.0,4,"October 5, 2017 ",Good pizza in a nice place,"Lund, Sweden",The food is good and the restaurant are better than most pizza places. It was a little hard understanding some in the staff but they are friendly. They didn't inform us about the pizza salad and the oils. I ate on a Sunday evening and...More
[English],132,62.0,31.0,3,"September 12, 2012 ",Crowded,"Lund, Sweden","This restaurant has a few good pizzas and pasta dishes made Italian style. You are never disappointed with the food, however you never get surprised either.

The price level is alright and you never leave feeling hungry.

Unfortunately the restaurant is quite small and due...More"
[English],132,116.0,75.0,5,"September 15, 2014 ",Great value...for Sweden,"Bristol, United Kingdom",Was in Lund to visit the university and was a little frustrated with how expensive everything is. I've been to all the Nordic countries so expected this to the case but I wasn't on holiday and my budget was small so really struggled to find...More
[English],132,33.0,11.0,5,"September 2, 2015 ",Excellent pizza and very helpful with allergies,London,"My husband, young daughter and I ate supper here in late August. We all liked the pizza a lot, and the vegetarian pizza in particular was great. My daughter has a number of severe (anaphylactic) food allergies and the staff were excellent and reassuring. We...More"
[English],132,210.0,80.0,5,"September 2, 2015 ",Great pizza,"Burke, Virginia",Great pizza and we also enjoyed the ice cream cups.  We ordered our dinner for take away and it was a very easy process to pick up our order.  Locals recommended this restaurant to us and we would definitely go back again should we return...More
[English],132,20.0,5.0,5,"September 22, 2013 ","Excellent food, good service",Vancouver,"Split salad and pasta with my wife.  Portions were extremely generous, wholesome and tasty as were the servings of wine by the glass.  Service was friendly.  Definitely not upscale, but definitely excellent."
[English],132,36.0,14.0,5,"September 27, 2015 ",Kind of funny place around Italian memoriblia,"San Francisco, California","A traditional pizzeria, with a selection of good Italian food, Nothing amazing and the lack of traditional pizza sallad confuses me."
[English],132,20.0,3.0,5,"September 30, 2014 ",Perfect Italian in Lund,"Lund, Sweden","By not adapting to Nordic food flavour, Vespa managed to preserve Italian taste.
If you know what are you talking about, you can even order some specialties like ""Pappardelle alla Genovese"""
[English],132,30.0,12.0,3,"September 30, 2014 ",Average italian,"Lund, Sweden","This place, that has been in Lund for a long time has to be one of the most overrated places there is in the town. The pizzas are average but rather pricy, the same goes for the pasta dishes, everything feels very mainstream. Service here...More"
[English],132,180.0,88.0,3,"September 4, 2012 ",Ok pizza and good service,"Copenhagen, Denmark","Not bad for pizza in Sweden.  The service was very good, the restaurant cozy and atmosphere nice.  We were a group of 20 people and had to split up into two tables, but no problem."
[English],132,10.0,2.0,5,"September 5, 2014 ",Better than in Italy,"Lund, Sweden","Italian pizzas made by Italians and with a better taste than pizzas you get in Italy. Thin, crispy, higest quality of the ingredienses. Decent pricing and a nice atmosphere"
[English],132,98.0,52.0,5,"September 6, 2017 ","Great food, awesome service ","Sydney, New South Wales, Australia","Located a short 2 minute walk from the Lund train station, Vespa serves up a great assortment of quality, tasty Italian dishes (pasta, pizzas and salads).

The prices are reasonable, the food came out quickly and was really tasty. 

The service here is exceptional. Our...More"
[English],132,5.0,3.0,4,"September 9, 2010 ",Great pizza,"Lund, Sweden","Nice italian atmosphere but slightly overpriced food I think. Not the best service, but once when I had to wait 20 minutes too long for my order for 4 people, I was compensated with two additional main dishes."
[French],1,130.0,48.0,3,"July 19, 2013 ",Restaurant simple,"Gournay-en-Bray, France",Nous avons mangé pour un prix moyen de bonnes pâtes.Propreté moyenne .Service rapide et agréable. Nous n'avons pas aimé les...More
[German],4,13.0,1.0,5,"June 18, 2018 ",Zuvorkommende Bedienung...,,Die Tischreservierung erfolgt per Handy. Das Essen Pizzen + Salat waren sehr lecker und vom Teig her professionell. Die Nachspeisen...More
[German],4,166.0,51.0,4,"May 14, 2013 ","Pizza, Pizza, aber auch Pasta","Freienstein-Teufen, Switzerland","Die Pizza's im V.E.S.P.A. sind fast italienisch, aber sicher sehr nahe dran und wirlkich gut! Genügend gross für einen normalen...More"
[German],4,26.0,4.0,4,"November 2, 2015 ",Sehr leckere Pizza,"Aschaffenburg, Germany",Die Pizza war dünn und qualitativ hochwertig. Habe Pizza Vespa probiert und es war eine gute Eigenkreation. Die Bedienung war...More
[German],4,26.0,4.0,4,"September 20, 2015 ",Delicious Pizza,"Aschaffenburg, Germany","Ich war mit zwei Freundinnen im Vespa und uns hat es sehr gut geschmeckt. Die Pizzen hatten einen dünnen, knusprigen...More"
[Italian],5,47.0,5.0,4,"April 21, 2016 ",Qualche dubbio sulla pasta gluten free,,Sono stata in questo ristorante per una cena. Mi hanno assicurato che la pasta sarebbe stata gluten free. Mi sono...More
[Italian],5,212.0,108.0,3,"April 25, 2013 ",Non male ma la pizza italiana è diversa,"Moncalieri, Italy",Vengo spesso a Lund per lavoro e colleghi del posto mi avevano consigliato questa pizzeria. Beh che dire? Considerando che...More
[Italian],5,72.0,64.0,4,"July 17, 2015 ",Uno scorcio di Italia a Lund!,"Vicenza, Italy",Per lavoro mi sono recentemente recato a Lund. Il team multietnico di cui facevo parte ha avuto modo di cenare...More
[Italian],5,39.0,22.0,4,"May 19, 2013 ",Pizza,"Zevio, Italy",Forse hanno cambiato il pizzaiolo ma trovo che facciano la miglior pizza di Lund. Locale non molto grande ma accogliente....More
[Italian],5,13.0,10.0,3,"November 28, 2015 ",Ristorante normale (per un Italiano).,"Lund, Sweden","Sono stato in questo ristorante con degli amici del mio corso, tutti studenti internazionali da tutto il mondo, io unico...More"
[Norwegian],1,10.0,,5,"July 30, 2018 ",Lille Italia ,"Levanger, Norway","Veldig god pizza, og andre alternativer. Et italiensk preg over hele imaget. Maten er svært god, og kan anbefales som...More"
[Spanish],1,7.0,3.0,4,5 days ago ,Buena opcion para comer italiano,"Malmo, Sweden","Buena comida, raciones muy generosas y atmosfera bastante tranquila! Ubicacion perfecta al lado del tren y muy acogedor todo."
[Swedish],171,368.0,138.0,2,2 weeks ago ,Gör godare pasta själv,"Malmo, Sweden",Var här med jobbet och åt. Vi började med lite kallskuret vilket var helt okej men snålt med ost. Beställde...More
[Swedish],171,10.0,,4,"April 12, 2017 ",Hämt pizza,,"Senast så hämtade vi pizzan istället. Vid avhämtning brukar man få glass till! Mums! Goda pizzor, enda negativa var att...More"
[Swedish],171,16.0,8.0,5,"April 12, 2017 ",Äkta italiens pizza - utan flytande i olja och salt,"Lund, Sweden","Pizza är ingen hälsokost, det är sant. Men om ni någon gång vill prova en som inte flyter i olja...More"
[Swedish],171,11.0,3.0,3,"April 14, 2017 ",Blandad kompott,,"När de lyckas med pizzorna så är de fantastiska, men tyvärr ibland när jag hämtat pizza och kommer hem så...More"
[Swedish],171,21.0,,2,"April 16, 2014 ",Pizza utan kärlek,"Malmo, Sweden",Pizzor lagade utan omtanke och kärlek blir smaklösa och tråkiga att äta i en ljudmiljö som borde avskräcka de flesta.
[Swedish],171,85.0,17.0,4,"April 20, 2016 ",Gemytligt och bra mat,"Kalmar, Kalmar Län, Sweden",Mycket god Pizza och god salladsbuffé. Kunde varit lite mer smak/krydda på pizzan för högsta betyg. Trevligt ställe och personal.
[Swedish],171,13.0,3.0,2,"April 27, 2017 ",Beställde pizza on-line,"Lund, Sweden",Fick vänta i 45 min på pizzorna. När de väl kom hade de missat att packa ner alla och vi...More
[Swedish],171,20.0,1.0,3,"April 29, 2017 ","Varför jkan man inte bara ringa och beställa pizza? Varför krångla till det med registrering, kortbetalning osv?","Lund, Sweden","Jag får ingen lust alls att besöka pizzerian när det är så krångligt att boka online. Bu!
Sånt utgör bara...More"
[Swedish],171,34.0,10.0,3,"April 30, 2013 ",Pizza,"Lund, Sweden",Pizzan är god gjord på som man gör i Italien. Men det saknas det där lilla extra för att jag...More
[Swedish],171,123.0,23.0,2,"April 30, 2018 ","Mindre fyllning, torra pizzor","Kavlinge, Sweden",Beställde hem härifrån som många gånger förr. De måste ändrat något eftersom pizzorna nu är helt annorlunda och rent ut...More
[Swedish],171,1.0,,5,"April 4, 2017 ",Lunds bästa pizza!,,"Supergoda och fräscha pizzor! Lätt att fixa annat om man som jag inte tål gluten och är vegetarian. 
Känns härligt...More"
[Swedish],171,257.0,42.0,4,"April 6, 2016 ",Smaksäkert och trevligt,"Ahus, Sweden",Bra ställe nära järnvägsstationen i centrala Lund. Äter lunch här emellanåt och de erbjuder riktigt bra pizza som känns autentiskt...More
[Swedish],171,175.0,66.0,4,"April 8, 2012 ",Tunn krispig botten och riktigt fina råvaror - Så fräsch en pizza kan bli!,"Lund, Sweden",Helt klart Lunds bästa pizza men tyvärr rysligt dålig service. Personalen är otrevliga och märkliga men laga mat kan dem!...More
[Swedish],171,4.0,2.0,4,"August 1, 2012 ",Lunds bästa pizza,"Lund, Sweden","Det här är nog Lunds bästa pizzeria, även om deras pasta också lockar starkt många gånger. Tyvärr är den så...More"
[Swedish],171,20.0,,3,"August 1, 2018 ","Helt ok mat, god men lite överpris",,"Beställde 4 olika rätter med min familj.
Maten var bra men tycker att det var lite väl högs priser.  
Pizzan...More"
[Swedish],171,163.0,47.0,3,"August 13, 2018 ",Hämtmat efter Malmöfestivalen,"Vallakra, Sweden",Vi var nio personer som beställde hämtmat. Jag beställde en caesarsallad. Såg lite ut när jag öppnade paketet men det...More
[Swedish],171,18.0,8.0,4,"August 14, 2016 ",Fantastisk pasta!,,"5 vänner på vift valde v.e.s.p.a utan några förväntningar alls. Inget koncept som vi kände till tidigare.
Pizza o pasta,...More"
[Swedish],171,93.0,13.0,3,"August 14, 2018 ",Ok,"Lund, Sweden",Helt ok mat men ganska mycket pengar för det som serveras. Trevlig atmosfär och ett trevligt bemötande.
[Swedish],171,36.0,,4,"August 14, 2018 ",Goda pizzor,"Uppsala, Sweden",Pizzan var god utan att vara för fet. Rätt bra utbud även av andra rätter för Dagens Lunch. Lokalen är...More
[Swedish],171,2.0,,3,"August 15, 2016 ",Gott men dyrt,"Lund, Sweden","Hämtade hem pizzor till familjen. Smakerna är milda, i något fall på gränsen till mesiga. Det kostar mer än det...More"
[Swedish],171,24.0,7.0,4,"August 17, 2013 ",Jätte god pasta!!,"Lund, Sweden",Brukar alltid hämta hem maten och då brukar det bli Spaghetti alle vongole och Rigatoni alla cacciatora. Deras pasta är...More
[Swedish],171,6.0,,3,"August 17, 2015 ","Goda pizzor, otrevlig ägare som nu sålt så hoppas det blir bättre!","Lund, Sweden","De har goda pizzor, men tyvärr dras upplevelsen ner av den otrevliga stämningen. Ägaren är otrevlig och de bokar bara...More"
[Swedish],171,58.0,3.0,2,"August 18, 2015 ",God mat men ..,"Lund, Sweden",Maten är ofta väldigt god har varit här ett par gånger men tyvärr är det väldigt litet och borden står...More
[Swedish],171,5.0,,4,"August 20, 2016 ","Fina pizzor, lite långsam service ",,Köper oftast pizza för avhämtning. Tyvärr finns ingen telefonkö. Man behöver ibland ringa upp några gånger innan man lyckas komma...More
[Swedish],171,9.0,1.0,4,"August 21, 2016 ",Väldigt gott!,"Lund, Sweden","Snabbt, gott och trevlig miljö! Har varit här flera gånger, och har blivit nöjd varje gång. Pastan med kyckling och...More"
[Swedish],171,16.0,5.0,4,"August 22, 2015 ",Bra pizza,"Ostersund, Sweden",God pizza på bra botten. Schysst med glass som tillbehör till take away. Saknar bara den lilla extra finessen på...More
[Swedish],171,18.0,4.0,4,"August 23, 2016 ",Lunch med familjen,,"God lunch och fantastisk mat. Kostar lite mer än en vanlig pizza men det är det värt 👍🏼
Lunchpriserna är...More"
[Swedish],171,2.0,1.0,2,"August 25, 2016 ","Maten god, men personalen stressade och otrevliga.",,"Maten god, men personalen stressad och otrevlig. Var tvungen att säga till servitrisen att vara mer tillmötesgående. Såg ut att...More"
[Swedish],171,28.0,1.0,5,"August 3, 2016 ",Lunch med familj och vänner,"Mandelieu-la-Napoule, France",Tre olika sorters pizza serverades. Alla tre avnjöts med stor tillfredsställelse. Kvalitén var i god italiensk stil. Servicen var vänlig...More
[Swedish],171,37.0,12.0,3,"August 3, 2016 ",Lördag ,"Lund, Sverige","Maten är god, lagom mkt att välja emellan, god öl, lite hög volym kanske, serveringen är inte de bästa, har...More"
[Swedish],171,220.0,47.0,4,"August 30, 2016 ",Mopedburet italienskt.,"Kavlinge, Sweden",Vespa är stadens bästa val för en god pizza speciellt om man åker bil. Närheten till en stor oftast ledig...More
[Swedish],171,116.0,32.0,4,"August 5, 2014 ",God mat,"Lund, Sweden",Trevligt ställe med fräscha pizzor och god pasta. Pizzorna blir man mätt på och de är av goda råvaror. Priset...More
[Swedish],171,50.0,14.0,4,"August 5, 2014 ",Super med glutenfritt!,"Lund, Sweden",Som nybliven glutenintolerant var det underbart att få komma hit och äta dessa pizzor! Det är annars inte så lätt...More
[Swedish],171,1.0,,4,"August 5, 2017 ",Italienkänsla!,,Mycket god pizza bianco!  Gott med italiensk öl på fat och trevlig personal.  Skönt att kunna sitta inne när regnet...More
[Swedish],171,37.0,7.0,4,"August 5, 2018 ",Värt ett besök,G,"Litet och överraskande bra besök. God ostbricka och mycket gott vitlöksbröd! Två av beställda pizzor var jättegoda, den tredje var...More"
[Swedish],171,14.0,4.0,4,"August 7, 2016 ",enkelt och gott,,"Bra service, trevlig personal. Mycket goda pizzor och pasta. Man får mycket för pengarna på denna enkla pizzeria. trevlig inredning...More"
[Swedish],171,3.0,,4,"August 8, 2015 ",Bra mat och service men lite trångt!,"Malmo, Sweden","Bra lunchrestaurang, äter där ofta. God pasta och goda pizzor. Trevlig personal, snabb service. Tyvärr lite trångt med relativt små...More"
[Swedish],171,123.0,23.0,4,"December 11, 2017 ","Bra pizza, trång restaurang","Kavlinge, Sweden","Bästa pizzan i stan! men ta takeaway då det är trång och högljud miljö att äta i på plats.
Alla...More"
[Swedish],171,66.0,6.0,4,"December 11, 2018 ",Grymt bra mat,"Lidkoping, Sweden","Gillar Italiensk mat så blev inte besviken, riktigt bra mat och bra service och alla var nöjda i vårt sällskap"
[Swedish],171,27.0,5.0,3,"December 19, 2016 ",Trevlig lunch på uteservering,"Karlstad, Sweden",Bra lunchrestaurang för utomhusservering. Att äta inne är hopplöst ljudligt och ger inte möjlighet att konversera. Pasta och pizza-rätter känns...More
[Swedish],171,6.0,,4,"December 19, 2018 ",Pizza,,Kanske bästa pizzan i Lund. Prissättningen är därefter. Men med tryffelpizza på menyn tycker jag inte man ska klaga! Bra...More
[Swedish],171,56.0,21.0,4,"December 2, 2014 ",Familjevänligt,"Lund, Sweden",En centralt belägen restaurang med bra mysfaktor. Bra ställe för barnfamiljer. Maten absolut helt ok men utan wowfaktor. Trevlig personal...More
[Swedish],171,1.0,,5,"December 21, 2017 ",God mat och trevlig personal!,,Salladen tyckte vi var supergod att blanda tillsammans med en olivolja som hade inlagd vitlök i sig samt vinäger. Jättegod...More
[Swedish],171,9.0,2.0,2,"December 22, 2017 ",Köp av pizza,,"Extremt liten pizza.
Trodde detta var ett ställe med generösa portioner men blev mycket besviken på vad jag fick med...More"
[Swedish],171,2.0,,1,"December 23, 2017 ",Oätbar pizza,,"Beställde pizza för 800 kr levererad hem av hungrig. se. Pizzan var kall, blöt och döbakad...så himla trist då vi...More"
[Swedish],171,36.0,5.0,3,"December 25, 2017 ",Okej men inte bäst,"Lund, Sweden",Helt okej pasta och pizza. Har framförallt ätit deras mat via hemkörning så betyget kan vara lite missvisande då jag...More
[Swedish],171,36.0,10.0,4,"December 29, 2016 ",Älskar deras pizza,"Lund, Sweden",Jag älskar deras pizza med Parma skinka och rucola...alla jag hade bjudit den på var supernöjda ...utom faktiskt förra gången...More
[Swedish],171,31.0,5.0,5,"December 3, 2016 ",Goda pizzor,"Lund, Sweden","Är ingen pizza fantast i vanliga fall, men vespas pizzor är allt annat än strimlad skinka och flottig ost ....More"
[Swedish],171,9.0,,3,"December 5, 2014 ",Trångt men mysigt lunchställe,"Lomma, Sweden",God italienskt alternativ för en lite bättre för lunch i Lund. Försök boka bord först då det fort blir fullt.
[Swedish],171,73.0,13.0,4,"February 13, 2013 ",Bra pizza i Sverige,"Svedala, Sweden",Har inget dåligt att säga om maten på V.e.s.p.a. Prosciutto Pizzan var bland de godare jag ätit i Sverige med...More
[Swedish],171,11.0,8.0,4,"February 18, 2015 ",Pizzzor,"Lund, Sweden","Väldigt goda pizzor. Fräscha och inte så feta. 
Väldigt dålig akustik. Bäst om man kan sitta ute. 
Personalen kan vara...More"
[Swedish],171,37.0,13.0,4,"February 18, 2015 ",Bra pizza och ok pasta,"Lund, Sweden",Har besökt vespa flertalet gånger och det är en vanlig Italiensk restaurang. Inte särskilt märkvärdig men levererar bra mat. Kan...More
[Swedish],171,5.0,3.0,5,"February 20, 2018 ",Kanonbra!,"Malmo, Sweden","Hos V.espa. har jag och min familj haft en trevlig middag i helgen, med bra mat och
personal som ger...More"
[Swedish],171,45.0,2.0,5,"February 21, 2017 ",Pizza,,Väldigt god mat men också väldigt dyr.Deras mat är mycket god och personalen är mycket trevlig. Lätt att hitta nära...More
[Swedish],171,72.0,22.0,4,"February 25, 2013 ",Bästa pizzan i stan,"Mougins, France","Vespa finns även i Malmö, vid Södertull. Gemensamt är att de har de fräschaste pizzorna och snabb uppmärksam service"
