[Danish],2,3.0,,5,"April 29, 2017 ",Fantastisk mad og venlig betjening,"Viborg, Denmark","Intensiv kursus i Lund.... sultne og trætte.... god mad og venlig betjening var det hele værd!!
Kan klart anbefales!!"
[Danish],2,28.0,16.0,4,"February 12, 2015 ",Hyggelig og god mad,"Copenhagen, Denmark","Besøgte stedet med en kollega. 
Typisk italiensk indretning med små borde, måske lidt for små. 
Maden kommer derimod i store...More"
[Dutch],3,14.0,2.0,3,"August 16, 2013 ",Lekker eten maar geduld gewenst,,Een prima maaltijd; maar door de goede reputatie en flinke aanloop kunnen er wachttijden ontstaan. Voor er een plaatsje vrij...More
[Dutch],3,268.0,36.0,4,"August 24, 2017 ",Uitstekend.,"Rosmalen, The Netherlands","Je kunt hier een uitstekende pizza eten, het is er altijd gezellig druk en bediening is snel en vriendelijk. Een...More"
[Dutch],3,24.0,10.0,3,"January 6, 2018 ","Prima, snel en niet duur ","Reeuwijk, The Netherlands",Op kantoor is iedereen lyrisch over deze tent maar het doet me niet super veel. Pasta was lekker maar niet...More
[English],132,38.0,10.0,4,4 weeks ago ,"Nice pizza, kids love it!",,"A great Italian inspired concept with several facilitites around Skåne. The restaurant in Lund is the smaller format CASA. It serves lunch and dinner. The menu holds antipasti, pizzas, salads, pastas and desserts. Our 10 year old totally loved the pizzas! The pizzas are thin...More"
[English],132,38.0,22.0,4,"April 10, 2012 ",Tasty pizzas!,"Lund, Sweden","Thin pizzas with a great choice of toppings. Taste almost like in Italy!  There is also pasta for those who feel like it, but the pizzas are generally better. It is quite popular so it's best to make reservations. Service can be slow."
[English],132,39.0,7.0,4,"April 15, 2014 ",Best pizza in Lund,"Sunnyvale, California",I love this pizza! They use fresh ingredients and real cheese. i definitely recommend this restaurant.
[English],132,12.0,4.0,4,"April 17, 2018 ",Feel like having a tasty pizza? Go to Vespa.,"Gothenburg, Sweden","I've visited the restaurant many times during more than 3 years.
Though I had the impression the quality went down a little, I still recommend the pizza (piccante is one of my favorites) or also the special lunch options. A few times I had pasta...More"
[English],132,14.0,6.0,3,"April 18, 2017 ",Pizza!,"Lund, Sweden",Amazing pizza but I tend to get it to take home as the noice in the restaurant is very loud in peak-hours. And if i take it home i get a little ice-cream for afters :D
[English],132,28.0,9.0,2,"April 19, 2015 ",Poor service okay pizza ,,"The pizzas are okay, but we were disappointed with the poor quality of some of the promised Italian specialties on the pizzas. Even if you like garlic, the pizzas with garlic are too garlicky. Our waitress did not seem to like her job, not even...More"
[English],132,37.0,7.0,3,"April 19, 2017 ",Aggressively Average,"Lund, Sweden","I've had their pizza and it's fine. It has too much cheese, but it's fine. However it costs twice as much as a crappy pizza from across the street of wherever you live, but it doesn't taste better. Vespa has better quality ingredients but somehow...More"
[English],132,8.0,10.0,4,"April 20, 2016 ",Good pizza joint,,"Good location; excellent, friendly service; good pizza; all-you-can eat salad; gets busy (even early 6pm) - suggest booking."
[English],132,95.0,32.0,4,"April 23, 2015 ",Best Pizza in town,"Stockholm, Sweden","I have been to VESPA many times and the Pizzas are super delicious. They have nice, a bit unusual, combinations with fresh veggies etc. 
The pasta dishes are ok, but I would always go for a pizza there. I haven't experienced rude staff at all....More"
[English],132,,,5,"April 24, 2008 ",Best pizza in Lund,,Best pizza in Lund
[English],132,357.0,107.0,2,"April 28, 2017 ",Go to another place,"Lund, Sweden","The restaurant is located close to the railway station, just over the square. Pizza is normal but you have to pay for the tap water, for every person. Service ok"
[English],132,239.0,82.0,3,"April 30, 2016 ",Nice Italian,"Jaipur, India","It’s a nice Italian restaurant located very close to central train station. They have fantastic food – both pizzas and pastas are awesome. They also offer a small salad bar and selection of alcoholic beverages. Service is also good. However, the space is quite limited...More"
[English],132,64.0,34.0,3,"April 7, 2012 ","excellent pizza, poor service","Malmo, Sweden","I had an amazing pizza (disclaimer: I am italian!), well prepared, crunchy and tasty. So I recommend VESPA for the food. However one of the two waitresses was lazy and slow. We had to wait ages to be served. Another waitress was instead very nice...More"
[English],132,44.0,5.0,3,"August 1, 2016 ",High in carbs and fat but keeps a fool hungry,,"Tasty but poor fillings in The pizzas , very good service but unhappy Employees ( not impolite though, rather worn out). They have The means to make it better and more Fancy , but its a franchise feeling ."
[English],132,512.0,143.0,5,"August 13, 2014 ",The best Pizzas in town,"Hong Kong, China","Truly amazing pizzas, a bit expensive though. The pastas are also excellent so are their coffee. Service varies."
[English],132,13.0,7.0,5,"August 15, 2012 ",All the ingredients work,"London, United Kingdom","My favorite pizzeria in the Skane region with nice atmosphere, good pricing, helpful service and excellent pizza choices.  Menu also contains pasta and a few more Italian specialties.  Salad is green (not the pizza-salad we are used to in Sweden)"
[English],132,12.0,,4,"August 19, 2015 ","Nice Italian food, a little pricey","Denver, Colorado","Great pizza and pasta. Pizza is thin crust. They offer a salad bar included in your meal. Right north of the train station, to the east of the city center, so it's great for travelers. A little pricey though."
[English],132,15.0,11.0,3,"August 21, 2008 ","You must test their ""Felino"" pizza. It's just great!",Sweden,"You must test their ""Felino"" pizza. It's just great!"
[English],132,121.0,24.0,4,"August 22, 2017 ",Good italian food,"Lund, Sweden","Good place for dinner, family firendly and good food. A little off the beaten track, but very close to the station."
[English],132,7.0,1.0,5,"August 25, 2012 ",Yummy Pizza,"Lund, Sweden","We ate here in the evening - the pizza is really delicious and much too big for one person, so we took ours home and enjoyed at another time - the price isn't too bad either and they sell a few products inside the restaurant...More"
[English],132,1.0,,3,"August 27, 2013 ",Best Pizza in town,"Lund, Sweden",In my opinion Vespa has the best Pizza in Lund. Their Pizza is more Italian style than the usual Kebab places in Sweden. It is a realy nice casual Pizzeria but nothing to take somone out for a nice date. The service is ok as...More
[English],132,1.0,1.0,1,"August 3, 2010 ",incredibly bad service,"Lund, Sweden","The pizzas where quite good, but since the waitress was so incredibly rude I am never going back there again!"
[English],132,3.0,2.0,2,"August 30, 2017 ","So-so food, bad service","Lund, Sweden","Went with a group of friends for a dinner on a Wednesday night. Ordered, after having to explain the menu to the waiter, a Bellini cocktail.  

Not sure who told this place how to make one, but they really misunderstood it. A proper Bellini is...More"
[English],132,23.0,14.0,4,"August 4, 2010 ",Reasonably priced pizza,"Edinburgh, United Kingdom","It's not the best pizza I've ever tasted but it was perfectly fine. The price is fairly reasonable for eating out in Lund and so I'd recommend it for a cheap bite.

However the service wasn't particularly friendly and there were a lot of large...More"
[English],132,8.0,9.0,4,"August 5, 2014 ",Slow but good!,"Lund, Sweden","I was there on a warm day, and there were no seats outside, and of course, it was extremely warm inside. The pizza was great, but the service was slow, but I guess that is to expected since they make each one fresh!!"
[English],132,56.0,3.0,5,"August 5, 2015 ",Pizza!,,"Best pizza in town.  Reasonably priced, delicious.  Best enjoyed sitting down at the restaurant,  by the spice is not an option."
[English],132,57.0,39.0,3,"August 7, 2014 ",Divine pizzas but cocky service,"Stockholm, Sweden",I would recommend anyone game for a yummy take-out pizza to head here. So did we. Waiting time ca 45 min. Cocky and arrogant staff unfortunately.
[English],132,106.0,69.0,5,"December 16, 2011 ",Very creative delicious pizzas and pasta,"Easton, Maryland","Combining the best of Italian and Swedish tastes, this small restaurant serves pasta and pizza that combine the cuisines.  Fresh seafood, cured meats (prosciutto and sausage) and fresh vegetables and a great pizza crust make this a great place to enjoy  a casual meal in...More"
[English],132,91.0,18.0,3,"December 22, 2017 ",Tasty,"Lund, Sweden",Very tasty food but the service is so appalling that I seriously do not intend to visit it again unless really desperate.
[English],132,,,5,"December 24, 2007 ",Super goda pizzor,,Super goda pizzor
[English],132,37.0,16.0,5,"December 28, 2016 ",Great and cheap pasta,"Frederiksberg, Denmark",Best pizza and pasta I have had in Lund - service is excellent and prices are good  - 10 euro for a pasta meal- and the food onsdag the plate is plenty and you get free salad bar
[English],132,5.0,,3,"December 29, 2014 ","Good pasta, unfriendly straff.",,"The restaurant is nicely decorated and the atmosphere is cosy. We had carpaccio as a starter and two different pastas as main dishes. Everything was delicious, the portions were generous and the price was a bit high but still adequate in terms of food quality....More"
[English],132,,,3,"December 8, 2007 ",nice place,,nice place
[English],132,211.0,137.0,4,"February 1, 2012 ",Authentic pizza,"Lund, Sweden","You are feeling for some 'luxuary' pizza? The Vespa is for you. They only use premium ingredients and their pizzas taste great. Don't bring them home though, they are best when served at the restaurant."
[English],132,78.0,18.0,4,"February 11, 2012 ",Our go to pizza and pasta place,"Lund, Skane Lan, Sweden",We often eat from V.E.S.P.A. since you can get the whole menu take away. The pizzas are best in town and the pasta is very nice. They rarely update their menu but when they do it's for the better. My favourite pizza is the Pecorino...More
[English],132,91.0,22.0,5,"February 18, 2015 ",Great place for family Italian dining in Lund,"Lund, Sweden",By far and away Owen's favorite place in Lund.  It is centrally located (very near the Central Station - at least the one we go to all the time) and serves really nice Italian food and terrific pizzas.  The service is what one should expect...More
[English],132,62.0,27.0,4,"February 18, 2016 ","Two happy, and satisfied guests!","Malmo, Sweden","I brought a friend from Spain to this restaurant: (have been there before); which also offers pizza from a menu containing different types of dishes. Not those places where the menu presenting a minor novel, fortunately, given the hardship and challenges to keeping up a...More"
[English],132,165.0,86.0,4,"February 20, 2012 ",Good thin pizza with fresh ingredients.,"Toronto, Canada","I really like the thin-crusted pizze with really fresh ingredients, especially the quattro stagioni. The pasta dishes are, however, at best,ordinary. Take-out is a good alternative to eating at the restaurant."
[English],132,,,4,"February 24, 2008 ",Best pizza in Lund,,Best pizza in Lund
[English],132,88.0,10.0,3,"February 24, 2017 ",Not quite like Rome,"Lund, Sweden","This is a good place to go if you want a thin crispy pizza. The pasta dishes we’ve tried are ok, but the food is at least twice as expensive as a typical Roman pizzeria. We’ve come here regularly over the years and the service...More"
[English],132,59.0,11.0,2,"February 6, 2016 ",Was good but lost a lot,"Lund, Sweden",They aim to be a premium pizza place with prices double the one for a normal pizza. Used to go there quite a bit. But now the pizzae are soggy and swim with oil. The lax pizza was find the last two times with out...More
[English],132,2.0,1.0,5,"February 6, 2016 ",Where else would you go?,,"Honestly the best pizzeria in all of Lund, great food, great location, great staff and their vegetarian pizza is the single best pizza I've ever had. I'm proud to say that I want to return, even 50 years from now I'd love to return! Keep...More"
[English],132,7.0,3.0,5,"February 7, 2017 ",Friendly service and good foos,"Nottingham, United Kingdom",Had an amazing time at V.E.S.P.A.! The service was really good and friendly and the food was excellent! Highly recommended.
[English],132,11.0,2.0,4,"January 1, 2011 ",Popular pizza place,"Lund, Sweden",Very popular with great pizzas. Can get very crowded.
[English],132,13.0,9.0,5,"January 1, 2012 ",Really tasty foods!!!,"Athens, Greece",Really tasty foods! Very kind stuff!! Take the salmon pasta!!! Hmmm so delicious!!!
[English],132,9.0,12.0,4,"January 14, 2014 ",Really good pizza!,"Lund, Skåne Län, Sweden","It is a bit pricey, but worth it. VESPA pizzas are really delicious and you make the experience of take away pizza a luxury one!"
[English],132,16.0,12.0,2,"January 20, 2014 ",Good food - bad service,Lund,"This place serves quite good pasta and pizza (but expensive). It's a pity that the staff is not more service oriented. We don't understand how the owners and management can allow such attitude and poor attention to details as they do. Not a smile, not...More"
[English],132,97.0,23.0,4,"January 20, 2016 ",Love their pizza!,"Lund, Sweden",Great pizza with various toppings is on the menu as well as pasta. The pizza is prepared fresh and feels authentic with a Swedish twist.
[English],132,18.0,28.0,2,"January 22, 2013 ","Pizza ok, service poor","Lund, Sweden","On one occasion they told us the take away pizza would take 15 mins waiting time. We ended up waiting almost 40 min as out order had apparently less priority than orders from people seated at tables.

Another thing we've noticed that your plates will...More"
[English],132,30.0,3.0,3,"January 24, 2018 ",Used to be amazing,"Veberod, Sweden","Lately our experiences at Vespa have not been on par with their new prices. They used to be more affordable, and the flavors richer, more nuanced, salads rich. Last couple of times only the bill was great."
[English],132,75.0,26.0,4,"January 25, 2018 ",Good pizza for Italian emigrates ,"Copenhagen, Denmark","It isn’t a really Italian pizza from Naples, but is very very good pizza and I love it! I’ve taken tartufo pizza, super recommended!"
[English],132,21.0,11.0,5,"January 26, 2013 ",Nice to be back...,"Lund, Sweden","We were back at VESPA and were a little disappointed not to meet the rude waitress that other reviewers talk about. The place was very busy, both with sitting customers and people waiting for take-away. However, service was quick and kind as on previous visits....More"
[English],132,23.0,6.0,2,"January 26, 2016 ",Pizza ok but the staff is terrible,,"Have been there several times and every time the same problem: Pizza are ok but the staff is just so bad! They are rude and they don't pay attention to you AT ALL! If they don't forget your existence, they are not polite! I don't...More"
[English],132,42.0,23.0,3,"January 4, 2012 ","Average pizza, below average value",Melbourne,"V.E.S.P.A is a chain restaurant. The quality of the food is average. The prices you pay for it, is definitely overpriced! However, with the lack of variety in Lund, this restaurant will still be on the list of places to eat at. The service could...More"
[English],132,1.0,1.0,3,"January 7, 2008 ","Once a favourite, but has become worse.","Lund, Sweden","Once a favourite, but has become worse."
[English],132,52.0,38.0,4,"January 7, 2015 ",Best in Lund,"Lund, Sweden","I have been the several times and it Always very good pizza,you can also taste theirs antipastoplates they are about the best you get in this Town nowdays. The desserts are not many but ok.They also have a good winelist.The location in the center of...More"
[English],132,5.0,1.0,5,"January 7, 2017 ",Great lunch,"Lund, Sweden","Fifteen of us showed up for a ""late lunch"" on a Wedesday, and received a 20% discount for the afternoon timeframe.

Generous portions, friendly service and good quality food.

We are establishing a good tradition for lunch during Lundaspelan- V.E.S.P.A. Relaxed atmosphere, clean, and tasty...More"
[English],132,486.0,156.0,4,"January 8, 2014 ",Good food but noisy and very slow service,"Lund, Sweden",We have eaten at Vespa since it opened.  The food is good but a bit pricy.  The reason we don't eat there as often as we used to is that the service is VERY slow and the wait personnel seemed to be more interested in...More
[English],132,29.0,18.0,3,"July 1, 2010 ","A nice restaurant, no complaints",Iceland,"Wen't to V.e.s.p.a with a group of four. Sat outside and with three ordering pasta and one with pizza. Everyone was happy with the food and service, and it has pretty good prices and offers take away."
[English],132,41.0,32.0,4,"July 1, 2013 ",Nice Italien pizza,,"Probably the best Italian style pizza in Lund. However, I have not tried the other dishes but they look nice. 

The personnel have been very friendly when I've been there."
[English],132,73.0,13.0,3,"July 12, 2016 ",Good pizza,"Lund, Sweden","I guess VESPA is the best pizza around Lund, although is still far from a genuine Italian pizza. The food  and service was better in the past, but the success push the quality donw due the quantity... yes, if is good, everyone wants!!! Hard to...More"
[English],132,43.0,24.0,4,"July 15, 2012 ",Great pizzas!,"Johannesburg, South Africa","Great pizzaz, in a nice location. Friendly staff that understand english. Food is great and quick, just wish that they would cut the pizzas. Highly recommended!"
[English],132,4.0,2.0,3,"July 16, 2015 ","Great ingredients, sloppy value for money ","Lund, Sweden","Whenever I've ordered from Vespa for a takeaway, my bread is always burned on top, greasy on the bottom and lacking in toppings. The toppings you do get are fresh and flavourful, but are let down by thin, lifeless, burned and yet somehow undercooked bread."
[English],132,1.0,,4,"July 17, 2017 ",Nice dinner with my family,"Lund, Sweden","It is not easy to find restaurants with good, fast service and with food that both we and our children (aged 6 and 9) enjoy. But this place is such a place. Really enjoyed the Pizza bianci. Fresh ingredients and good cheese. Friendly staff."
[English],132,27.0,13.0,4,"July 21, 2012 ",the cofoco empire rules,"Malmö, Sweden","fantastic price / quality ratio on pretty much every restaurant in the cofoco empire, this one included"
[English],132,4.0,,4,"July 22, 2015 ",Very good choice for pizza in Lund,,Choose this restaurant if you're looking for great pizza. Have been there a few times (maybe 6 in total) and all of their pizzas I've tried are good. The pasta is nice too.
[English],132,1.0,,3,"July 23, 2012 ","Decent food, bad service","Lund, Sweden","Best Pizza in Lund. Not that it's difficult to have the best pizza in Lund, but there you go. Service isn't great though. The waitresses and the cooks seem to be more interested in gossiping with each other than taking orders. Looking through the receipts...More"
[English],132,19.0,10.0,5,"July 24, 2018 ",Nice food,"Lund, Sweden",Really nice service and their Salmon salad is gorgeous. It's near the central station i Lund and on a quiet street.
[English],132,130.0,68.0,5,"July 25, 2018 ",Great Pizza,,"If you like Italian thin base pizza, then you cannot get much better than here.

Good choice of pizza toppings. I actually had a few extras on mine.

The salads are large and very good, especially the Salmon salad.

We shared an Anti-Pasti as a...More"
[English],132,98.0,16.0,3,"July 26, 2016 ",Tasty pizza,"Lund, Sweden","V.E.S.P.A offers Italian...ish pizzas and most often they taste good. Not the best Italian pizza in Lund but still quite good. The restaurant itself is not that good though. It's often extremely warm inside and the tables are too close to each other. If possible,...More"
[English],132,11.0,2.0,4,"July 29, 2015 ",Italian pizza,"Lund, Sweden","If you like pizza this is the place to go. The restaurant serves both lunch and dinner, and takeout pizzas. Reservations often needed and prepare for a long line if you order pizza on a Friday night."
[English],132,8.0,3.0,4,"July 30, 2012 ",Amazing pizza & good pasta.,,Really great genuine Italian pizza. Best in Lund. Good pasta. Busy during lunch and late dinner. Personnel and service can be a stressed during budy times. But the pizza is worth it.
[English],132,12.0,2.0,4,"July 31, 2016 ",Nice pizzeria,,Good food and quick and friendly service. The only minus is the restaurant is very crowded usually and the tables are very close to each other.
[English],132,30.0,4.0,1,"June 11, 2018 ",Pricey and oily,"Lund, Sweden","I didn't enjoy the pizza here at all - it was very oily and overwhelming, felt sick after eating less than half of my portion. Prices were very high; they even charged for the water! You could get something better for 60kr in other places...More"
[English],132,1.0,,3,"June 16, 2010 ",Goofy,Lund,"Skapliga pizzor, snorkig personal! Ganska typiskt italienskt i atmosfären."
[English],132,23.0,3.0,3,"June 16, 2016 ",Quick and good,"Lund, Sweden","Good pizza's , slightly overpriced but service is good. Sometimes better to eat there then to order and pick up, queues on Friday can be long."
[English],132,47.0,10.0,4,"June 18, 2015 ",One of the best places for Pizza in Lund,,It's a small place with relatively large outside seating area - the pizzas are highly recommended and service was good
[English],132,78.0,46.0,1,"June 19, 2016 ",Substandard,"Lund, Sweden","A pizzeria should bring joy and a good basic piece of food. Unfortunately VESPA does neither. On arrival you are greeted with a delay, the service staff are fully occupied speaking to each other or in the telephone, and despite a 2/3-rds empty restaurant leaves...More"
[English],132,20.0,3.0,1,"June 23, 2017 ",No no no no,"Lund, Sweden",The personal is very nice and you get good service. But the food isn't the best. Well placed nearby the train station.
[English],132,11.0,2.0,4,"June 27, 2016 ",Genuine Italian feeling and really nice food,"Lund, Sweden","The restaurant offers a nice combination of both location near the central station as well as genuine Italian cuisine for those wanting to try good food indeed. 

We visited V.E.S.P.A for celebrating a birthday and we were well served with nice service and great food."
[English],132,28.0,18.0,5,"June 7, 2012 ",Best pizza in town!,"Lund, Sweden","Here you get real italian pizza, which is so delicious! You can eat outside if the weather is good but it's really cosy inside too. They have all kinds of italian pizza, pasta, antipasto and desserts! This is really good food for a reasonable price!...More"
[English],132,201.0,64.0,5,"June 9, 2016 ",Pizza in Lund,"Leamington Spa, United Kingdom","An excellent choice for good quality pizza and pasta in Lund if you get tired of salmon. Friendly and efficient service, seating inside and outside. Very popular spot so get there early."
[English],132,1.0,,1,"June 9, 2018 ",Way too pricey for what you get ,,"Experience was not great at all. Charged 10 crowns per person for one jug of water and food was not the greatest given the price. A lot of better, cheaper and fairer options in Lund you can go instead."
[English],132,14.0,6.0,3,"March 11, 2014 ",It's ok.,Sweden,"It's nice and the food it's good, but it is just pizza and nothing extraordinary about it. The location is good, especially if you need to catch a train. And I saw the Swedish Prince there once."
[English],132,1.0,1.0,3,"March 13, 2014 ",Great in summer,"Lund, Sweden",The food's good but not spectacular - service is quite quick so good if you have a deadline. Nice to sit outside in the summer.
[English],132,178.0,22.0,4,"March 14, 2018 ",Very good pizza,"Lund, Sweden","We dropped by Vespa on Monday after not visiting for some time
Pizza was excellent as I remembered, quite close to pizza I've had in Italy
Service was fast and friendly
Don't let the construction nearby put you off, still a great atmospher"
[English],132,23.0,7.0,5,"March 16, 2016 ",Pizza to go,"Lund, Sweden",Mom and I were tired after a busy days so we did not feel like cooking and we both have had dinned at VESPA before with great experiences. So I found the restaurant on line and looked through the menu. Called in an order and...More
[English],132,7.0,4.0,5,"March 17, 2015 ",Really like this spot for great pizza,"Lund, Sweden",I've been here several times. I've enjoyed their vegetarian pizza with sun dried tomatoes and topped with arugula so much that I've ordered it almost everytime. The staff is nice too. Make sure you get their complimentary salad with your choice of flavored oils and...More
[English],132,89.0,32.0,5,"March 17, 2015 ",Great pizza but in competition with another pizzeria in town,"Lund, Sweden",Many in lund discuss Vespa or .___ (the other place). Personally I love both!  What makes Vespa special is their different style of pizza. They have a great pizza with the smoked mozzarella and a semi sun-dried tomato which is amazing.  I really think both...More
[English],132,41.0,5.0,5,"March 18, 2017 ",Excellent food,Liverpool,"The best pizza in Lund! It's thin and has Italian cheeses and hams. The dessert is great and you should really try the Italian desserts. Staff is also good. The only downside is that this place is quite small, so you need to make reservations...More"
[English],132,1.0,,2,"March 26, 2008 ","Overrated... ""real italian pizza"" - who needs it?","Sheffield, United Kingdom","Overrated... ""real italian pizza"" - who needs it?"
