[Swedish],171,39.0,23.0,5,"February 5, 2015 ",Fantastiska pizzor! ,,"Pizzorna här levererar alltid. Det är hög klass med fantastisk smak. Miljön är mysig när det är lagom fullt, annars...More"
[Swedish],171,2.0,,4,"February 5, 2017 ",En av bästa pizzaställena i lund! ,,Rekommenderas! Super trevlig restaurang med bra service med jättegod pizza! Vina.espresso.s.pizza.a!
[Swedish],171,13.0,9.0,3,"February 6, 2013 ",God pizza och pasta.,,Bra råvaror och goda smaker. Serverar pasta och pizza. Lite i dyraste laget för basmat och lite snåla med pålägget...More
[Swedish],171,59.0,19.0,4,"February 9, 2014 ",God mat men lite högljutt,"Lund, Sweden","Jag åt pasta, barnen pizza. Maten är det stora plusset, god mat till hyfsade priser. Restaurangen är dock liten trång...More"
[Swedish],171,8.0,1.0,5,"January 11, 2013 ",Kanontrvlig restaurang,,Erbjuder en smarrig lunch som kan avnjutas på bästa plats intill den lummiga parken. MAten är enkel och ärlig:-)
[Swedish],171,48.0,25.0,5,"January 11, 2015 ",Ett säkert kort för pizza!,Rom,"Vi har vid flera tillfällen besökt Vespa, det håller alltid högkvalite och alltid ett trevligt och glatt bemötande! Det finns...More"
[Swedish],171,199.0,24.0,4,"January 13, 2016 ",Bästa pizzan,"Gothenburg, Sweden","Absolut bästa pizzan i Lund! Smakar precis som äkta Italiensk pizza. Fina råvaror, bra service och perfekt läge nära centralen...More"
[Swedish],171,1.0,,5,"January 18, 2018 ",Servicen gör att man vill komma tillbaka,,"Hamnade här av en slump när vi var i Lund över dagen. Mycket bra priser, god mat och inte minst...More"
[Swedish],171,59.0,14.0,4,"January 20, 2014 ",Nästan som i Italien,"Lund, Sweden","De som lagar pizzorna är från Italien, och därför smakar det som i Italien, och det går raskt undan utan...More"
[Swedish],171,62.0,10.0,5,"January 20, 2014 ",Stans godaste pizzor,,"Ett säkert kort när du vill ha en pizza med tunt bröd och goda ingredienser, Trevligt att sitta och äta...More"
[Swedish],171,14.0,9.0,4,"January 20, 2016 ",Bästa pizzan i Lund!,"Lund, Sweden","Vi har ätit ett flertal gånger på Vespa genom åren, men mest handlat take away. Pizzorna håller genomgående god kvalitet,...More"
[Swedish],171,1.0,1.0,1,"January 20, 2016 ",Pyton-pasta,,"Beställde pasta carbonara. Jag hade ingen aning om att man kunde misslyckas så med den. 
Smakade bara fett och salt....More"
[Swedish],171,12.0,5.0,4,"January 24, 2015 ",Trångt att sitta men god mat!,"Lund, Sweden",Maten håller högsta klass men tyvärr är lokalen alldeles för liten. För min del kändes det snarare som man satt...More
[Swedish],171,26.0,3.0,4,"January 26, 2014 ",Jättegod Pizza!,"Lund, Sweden","Jättegoda pizzor! Känns genuint italienskt i smak, inredning och stämning. Lite trångt och kan vara svårt att få bord."
[Swedish],171,21.0,,4,"January 28, 2016 ",God och prisvärd pasta,,Bra framför allt lunchrestaurang med god pasta. Inte så många rätter att välja mellan. Rolig inredning
[Swedish],171,79.0,4.0,4,"January 3, 2016 ",Middag,"Solna, Sweden","En av de bästa pizzorna i minne.  Parmaskinka och ruccola.  Mysigt,  lite stökigt o snabb o bra service. Man verkar...More"
[Swedish],171,199.0,24.0,4,"January 5, 2018 ",Bästa pizzan i Lund,"Gothenburg, Sweden","Som vanligt bästa pizzan! Vi åt två utsökta pizzor och det spelar ingen roll vilken pizza man tar, alla är...More"
[Swedish],171,140.0,65.0,4,"January 7, 2012 ",Bästa pizzan i stan men dålig service,"Malmo, Sweden",Här får du riktigt italiensk pizza med italienska råvaror. Pizzorna är mycket likt de man får i Italien och smakar...More
[Swedish],171,128.0,33.0,4,"January 9, 2017 ","Ligger perfekt, god mat trevlig personal!","Lund, Sweden","Verkligen goda sallader, och mycket mat!
Kan vara lite trångt att sitta, men perfekt att avhämta! får man alltid glass...More"
[Swedish],171,158.0,49.0,3,"July 1, 2014 ",Ok,"Lund, Sweden","Som namnet antyder, italienskt, skapliga pizzor och pasta, inte alltför engagerad personal, oftast många och högljudda studenter, inget ställe man...More"
[Swedish],171,46.0,,3,"July 10, 2016 ",God mat men skralt utbud,"Norrkoping, Sweden",Maten var god och servicen bra! Men restaurangen kändes ganska tråkig och utbudet på menyn var väldigt skral och kändes...More
[Swedish],171,15.0,2.0,5,"July 13, 2017 ",Lite smak av Italien,"Landskrona, Sweden","Att äta en pizza här, är lite som att vara i Italien och äta pizza. God smak på maten och...More"
[Swedish],171,10.0,,4,"July 14, 2018 ",Födelsedags firande,,Godaste pizzorna i stan. Tunna goda bottnar. Mycket mat . Fin ren fräsch reseurang. God pasta med.kostar lite mer men...More
[Swedish],171,79.0,23.0,4,"July 16, 2016 ",Italienskt 60-tal,"Lund, Sweden","Restaurangen är inredd i 60-tals anda med vespan som krona på verket. Maten lagas mitt i restaurangen, vid baren, så...More"
[Swedish],171,8.0,,4,"July 16, 2017 ",Lunch,,"Vi var alla väldigt nöjda! Vi åt god pasta Bolognese, carbonara samt gambino? något. Våra barn tyckte det var godaste...More"
[Swedish],171,19.0,6.0,4,"July 17, 2017 ",God mat ,,"Detta blev en fullträff 
På genomresa stannade vi här o blev glatt överraskade. Jätte Trevlig personal och väldigt god pasta....More"
[Swedish],171,28.0,15.0,4,"July 18, 2012 ",God italiensk mat,"Lund, Sweden",En av de bättre italienska restaurangerna i Lund. Fantastiska pizzor och god pasta
[Swedish],171,6.0,,4,"July 18, 2017 ",Bra val för pizza och pasta!,,"Jag fick ett oemotståndligt sug efter pizza, och gick direkt till V.E.S.P.A efter jobbet. Beställde en Tartuffo och ett glas...More"
[Swedish],171,115.0,31.0,2,"July 20, 2015 ",?,"Lund, Sweden","Vad som imponerat på tidigare besökare begriper inte jag. Inget jag blev imponerad av åtminstone. Service? ja, maten hittade ju...More"
[Swedish],171,60.0,120.0,3,"July 23, 2018 ",Oslagbart läge,Sweden,"Under vårt besök i Lund och Malmö tog vi en tur ner till Västra Hamnen. Underbart väder , utsikt över...More"
[Swedish],171,1.0,,3,"July 23, 2018 ","Bra mat, lämnar en del i övrigt att önska.",,"Inget fel på maten, men bedrövlig ljudmiljö inne i restaurangen. Jag förstår inte hur personalen står ut. Tar inte kontanter,...More"
[Swedish],171,11.0,,4,"July 25, 2017 ",Hur gör man en så god pizza,"Flyinge, Sweden","Det var min sons fråga efter att ätit barn vesuvion! Måste hålla med efter att ha provsmakat den. 
Själv åt...More"
[Swedish],171,34.0,2.0,5,"July 26, 2017 ",Bästa pizzan i Lund och godaste glutenfria 💖,"Lund, Sweden",Du får en riktigt god sallad att starta med. Du fixar själv vilken typ av dressing du önskar. Vår stora...More
[Swedish],171,111.0,35.0,3,"July 28, 2014 ",Bra italienare,,Helt okej italienare med bra pizzor i italiensk stil och helt ok pasta. Servicen är bra men inget extraordinärt. Priserna...More
[Swedish],171,5.0,1.0,5,"July 28, 2016 ",Bästa budget-italienska stället i Lund,,Mycket god mat till ett rimligt pris. Gäller samtliga rätter. Ett ställe som funkar både på dag och kväll med...More
[Swedish],171,6.0,2.0,3,"July 28, 2017 ",Service! Ni kan bättre!?,Sweden,Vespa har väldigt god pasta som varmt kan rekommenderas. Däremot är servicen bristfällig. Måste be serveringspersonal att duka av före...More
[Swedish],171,37.0,32.0,3,"July 3, 2014 ",Ok,"Stockholm, Sweden","En ok upplevelse! Min man åt en pasta med bl.a. Karl-Johansvamp, (dock var det kantareller) den var ok, inte så...More"
[Swedish],171,17.0,9.0,4,"July 3, 2014 ",Bra mat i steril miljö. ,"Malmo, Sweden",Bästa glutenfria pizzan i lund!! Goda pizzor och God pasta. Coola italienska öl!! Vi är alltid nöjda. Servicen kan vara...More
[Swedish],171,158.0,32.0,3,"July 5, 2013 ",Ok pizza,"Lund, Sweden","Helt ok pizza och bra service. Trevligt ställe med bra mat, men inget direkt att skriva hem om. Vi går...More"
[Swedish],171,123.0,23.0,3,"July 6, 2015 ",Bra och fräsch mat!,"Kavlinge, Sweden",Har varit på Vespa några gånger nu och de har verkligen god och fräsch mat. Både pizza och pasta. Det...More
[Swedish],171,385.0,25.0,3,"July 6, 2018 ",Svårbedömt,"Orebro, Sweden",Hipp och mysfaktorn var hög. Delibrickan lovade mycket. God öl och gott vin. Pizzorna hade skiftande kvalitet ibland med onödigt...More
[Swedish],171,10.0,4.0,4,"July 7, 2017 ",Bra och dåligt,,"Goda pizzor och pasta till rimliga priset.  Men tycker att pizzorna är godare än pastan.

Det kan bli lite högljutt...More"
[Swedish],171,12.0,3.0,5,"June 1, 2013 ",God mat,"Lund, Sverige",Pizza samt pastarätt var bra. Snygg och fint inomhus. Nära till tågstationen. Finns möjlighet att sitta ute.
[Swedish],171,3.0,1.0,3,"June 10, 2013 ",Godkänt,"Lund, Sweden","Pizzan var bra förutom att en myra hade drunknat i osten. Personalen brydde sig inte nämnvärt.
Helt OK mys-stämning."
[Swedish],171,2.0,1.0,3,"June 12, 2013 ",Extremt otrevlig personal med god mat,,Vi beställde bord ett helt gäng och redan när vi kom dit möttes vi av ett underligt och väldigt otrevligt...More
[Swedish],171,14.0,1.0,5,"June 12, 2018 ",Italien ligger i Lund!,,"Vill du uppleva en riktig Italiens pizza så styr stegen till V.E.S.P.A.
Tunna frasiga bottnar äkta parmaskinka,Parmigiano-Reggiano färska örter och...More"
[Swedish],171,86.0,25.0,3,"June 14, 2015 ",V.E.S.P.A,"Arboga, Sweden","En liten, trevlig restaurang med mycket italiensk atmosfär i centrala Lund
Serverar enbart pizza och pasta till bra priser.
En...More"
[Swedish],171,26.0,9.0,4,"June 14, 2017 ",God pizza!,"Lund, Sweden","God knaprig pizza. Förr var pastan riktigt god, men numera smakar allt ungefär likadant? Tråkigt. Ofta barnfamiljer som gapar i...More"
[Swedish],171,29.0,6.0,4,"June 16, 2013 ",trevligt ställe med god mat och dryck,"Lund, Sweden",Det finns att få det mesta glutenfritt vilket är ett stort plus. Pizzan är fantastisk med färska råvaror och pastan...More
[Swedish],171,191.0,39.0,4,"June 19, 2015 ",Mycket goda pizzor,"Oslo, Norway",Varje gång jag ätit här så har jag varit nöjd med vad de serverar. Pizzan är riktigt god med färska...More
[Swedish],171,1.0,,4,"June 2, 2013 ",Lyxpizza,,"Maten helt klart värd priset (ca 100kr pizzan, lite mer för pastan). Servitriserna gjorde vad de kunde.De kunde som tur...More"
[Swedish],171,6.0,2.0,4,"June 20, 2018 ",Middag,"Sundsvall, Sweden","Mycket goda, genuint italienska, pizzor o superb service. Har också lite ovanliga ölsorter som gick bra ihop med maten. 
Kan...More"
[Swedish],171,45.0,29.0,4,"June 23, 2015 ",Snabb lunch i mysig miljö,Sweden,"Vi åt tre olika pizzor, och var nöjda med alla tre. Extra plus för den glutenfria pizzan. Kaffet var gott,...More"
[Swedish],171,108.0,12.0,4,"June 26, 2018 ",Grym pizza,"Vanersborg, Sweden","Testade deras pizza med salami och pirripirri och den var fantastiskt god. Lagom styrka, god botten. Dessutom trevlig personal mysigt...More"
[Swedish],171,6.0,6.0,2,"June 28, 2016 ",Vespan har havererat,"Lund, Sweden",För 5-10 år sedan kunde man äta en av de finaste pizzorna här: Prosciutto Pizza med rucola och färska tomater....More
[Swedish],171,12.0,4.0,3,"June 6, 2017 ",Sikta på Take Away ,"Malmo, Sweden","Bra mat, ofta lite i överkant salt. Trevlig personal. Lokalen har en störande hög ljudnivå. Kanske bäst för take away."
[Swedish],171,34.0,7.0,4,"March 12, 2016 ",En väldigt god  resturang,"Lund, Sweden",Vespa är en väldigt god italiensk resturang.med saftiga goda pizzor.däremot tycker jag att pastan inte är tillräckligt god annars rekommenderar...More
[Swedish],171,147.0,53.0,4,"March 13, 2016 ",Bra pizzor i dålig lokal,"Staffanstorp, Sweden","Riktigt bra pizzor, lite ovanligare pizzor än de vanliga Vesuvio pizzorna. Tyvärr är lokalen riktigt dålig. Trång och stökig."
[Swedish],171,49.0,43.0,3,"March 15, 2016 ",Trist..,"Lund, Sweden","Det här ser ut som ett ställe som ska ha bra mat. Trevligt inrett. Fräscht. Men pizzorna smakar INGENTING. 
 Jag...More"
[Swedish],171,1.0,,2,"March 16, 2018 ",Avhämtning av pizza ,,"Trist och inte prisvärd pizza. Ätit många gånger tidigare, då har det varit bra! Med tiden har det blivit sämre....More"
[Swedish],171,32.0,6.0,4,"March 23, 2016 ",Gott! ,,Vespa är gott men inte gourmémat men det vill man ju inte alltid ha! God glutenfri pizza och personalen var...More
[Swedish],171,66.0,23.0,5,"March 25, 2015 ","GODA fina pizzor, bra service, trevlig lokal.",Sweden,goda pizzor o fin antipasto. Mysig o enkel lokal. lite trångt o aukustiken inte den bästa. Trevlig och alert kypare!
[Swedish],171,178.0,33.0,4,"March 3, 2016 ",Väldigt god mat.,,"Pizzor som är fräscha, delikata och tunna. Har även testat pastan men, tycker att pizzorna är det som är värt...More"
[Swedish],171,35.0,4.0,3,"March 31, 2017 ","Nja, ok","Malmo, Sweden","Ok, men inte mer. Pizzan ok, men ingen ""fin"" skinka som det verkade.  Pastan var ok, men inte värd priset....More"
[Swedish],171,146.0,171.0,5,"March 9, 2016 ",Rigatoni á la Contadina för hela slanten,Sweden,"V.E.S.P.A. i Lund är visserligen lite trångt, men maten och servicen håller hög klass. Kan personligen rekommendera Rigatoni á la...More"
[Swedish],171,32.0,8.0,4,"May 12, 2016 ",Italienskt á la USA,,En mycket trevlig restaurang med den där rustika 60-tals papier mache känslan av äkthet på ett charmigt vis. Pizzorna är...More
[Swedish],171,34.0,6.0,4,"May 12, 2017 ",En bit av Italien ,"Los Cristianos, Spain","Mycket god pasta och pizzor, smakar som man vore i Italien. 
Återkommer gång på gång. Rekommenderar ett besök!"
[Swedish],171,42.0,13.0,4,"May 13, 2013 ",Fantastiskt god Pizza,Lund,"Prisvärt, trevlig atmosfär, god service och Lunds Bästa Pizza. 
Vespa är bra både på lunchen och på kvällstid. Enda nackdelen...More"
[Swedish],171,98.0,19.0,4,"May 17, 2017 ",Bra pizzor ,"Stockholm, Sweden",Blev välkomnad av trevlig personal. Trots flera gäster fick jag min mat snabbt. Jättegod pizza. Kommer gärna tillbaka
[Swedish],171,63.0,6.0,4,"May 18, 2016 ",Goda pizzor,,"Har både ätit där och köpt med mat, gillar deras pizzor. Trevlig uteservering men inte lika trevligt därinne tycker jag."
[Swedish],171,17.0,1.0,4,"May 23, 2017 ",Riktigt goda pizzor!,"Lund, Sweden","Det här är ett av mina favoritställen vad gäller pizza, och vill jag köpa hämtpizza gör jag det alltid här,...More"
[Swedish],171,1.0,,3,"May 25, 2016 ",Gillar du vitlök?,"Stockholm, Sweden",Då är detta ditt ställe... Oengagerad service och ganska medioker pizza. De har en halv deciliter färsk vitlök på de...More
[Swedish],171,1.0,,4,"May 3, 2013 ",Tina,"Svedala, Sweden","Frächaste pizzorna, tunn botten och fina ingredienser.Trevlig personal o snabb service.Det ända som jag kan klaga på är att det...More"
[Swedish],171,6.0,1.0,3,"May 5, 2014 ",tappat i kvalité,"Malmo, Sweden",Vespa går bra att gå in och dela en pizza.Du får vad du betalar för.Lite kalt för att få en...More
[Swedish],171,15.0,4.0,2,"May 9, 2016 ",Bra pasta men....,"Bjuv, Sweden","Men snorkig och otrevlig personal.  Hit går jag aldrig igen!
Pastan är välgjord och smakar bra. Pizza finns det betydligt...More"
[Swedish],171,2.0,1.0,4,"November 1, 2014 ","Goda pizzor, men ta med öronproppar","Lund, Sweden",Vespa har riktigt goda pizzor och det är ofta mycket folk. Det jag inte begriper är varför de inte sätter...More
[Swedish],171,110.0,13.0,4,"November 11, 2015 ",Italien känsla,"Lund, Sweden",Italien för hela slanten! Ett livligt trångt mysigt ställe vi firade en födelsedag där och hade det riktigt trevligt. Maten...More
[Swedish],171,129.0,20.0,4,"November 11, 2015 ",Lunds godaste pizzor,"Lund, Sweden","När vi vill äta pizza har vi i många år hämtat från Vespa, trots att vi har en bit att...More"
[Swedish],171,5.0,1.0,4,"November 12, 2012 ",Stabilt,"Lund, Sweden",Brukar gå hit i alla fall en gång i månaden. Oavgjort med Italia om bästa pizzan i stan. God pasta...More
[Swedish],171,68.0,17.0,4,"November 17, 2013 ",Fantastisk pizza,"Malmo, Sweden","En av de godaste pizzor jag ätit, mycket bra råvaror förhöjer smaken. Visst, betydligt dyrare än andra pizzerier men väl...More"
[Swedish],171,37.0,,4,"November 18, 2018 ",Bra pizza,,Första gången vi åt i restaurangen. Mycket trevlig personal med bra service. Vi blev rekommenderade dricka & båda blev nöjd...More
[Swedish],171,11.0,1.0,4,"November 2, 2016 ",Mycket högkvalitativ pizzeria,"Lund, Sweden","Det är inte de ""vanliga"" pizzavarianterna man hittar här.
Det är en helt annan upplevelse att käka pizza här.
Hög...More"
[Swedish],171,6.0,2.0,3,"November 21, 2014 ",Stans bästa pizza och otrevligaste service,"Lund, Sweden",Varje gång jag ringt eller varit där har servicen i kassorna behandlat mig som om jag förstört deras dag genom...More
[Swedish],171,39.0,16.0,2,"November 21, 2015 ",Oengagerat bemötande,,Pizzan som skulle vara Lunds bästa bestod av tunn deg(bra) som täckts av tomatröra och mozarella. Därefter in i ugnen....More
[Swedish],171,2.0,,4,"November 21, 2018 ",Mmm,,"Vi var fyra vänner som åt goda pizzor med salami, breasola och skaldjur och vifick bra service. Väl värt ett...More"
[Swedish],171,14.0,7.0,4,"November 25, 2016 ",Trevlig Personal,,Jämn kvalite oavsett vad vi äter här så är familjen nöjd. Mycket trevlig personal. Populärt och ofta mycket folk. Både...More
[Swedish],171,191.0,22.0,5,"November 30, 2013 ",Mycket god pasta,boden,"Ser ganska oansenlig ut från gatan,men pastan var himmelsk ,en av de bästa jag ätit. Kyckling och kantareller,mustig sås. Rekommenderas...More"
[Swedish],171,15.0,12.0,4,"November 5, 2014 ","En ""riktig"" pizza",,"Här på en av ""kungagatorna"" i Lund ligger Vespa. En restaurang med lite ""rå"" inredning. På sommaren finns en liten...More"
[Swedish],171,144.0,40.0,5,"November 5, 2015 ",Utomordentlig lunch!,"Lund, Sweden","Vi var positivt överraskade av både mat och miljö på vespa. Vi tog både a la carte o dagens lunch,...More"
[Swedish],171,269.0,138.0,4,"November 5, 2015 ",Full fart men goda pizzor,Ängelholm,"Kvällsrusningen är stor och ljudnivån  ganska hög, men servicen är utmärkt och pizzorna tunna, smakliga och nästan perfekta."
[Swedish],171,69.0,13.0,5,"November 5, 2016 ",Goda pizzor,,Pizza med genuina råvaror erbjuds. Personalen ser till att du trivs i  den lilla och ofta välfyllda lokalen.
[Swedish],171,6.0,2.0,1,"November 9, 2017 ",Inget för allergiker,Sweden,Restaurangen serverar fel mat och håller inte isär mat  för allergiker och annan mat. Ät inte här! Restaurangen tar ingen...More
[Swedish],171,16.0,2.0,3,"October 15, 2012 ",pasta-pizza ställe,"Örebro, Örebro Län, Sweden","Om du känner för pasta eller pizza i en liten trevlig miljö. Beställde en antipati misto, delat på 2 som...More"
[Swedish],171,14.0,1.0,4,"October 18, 2016 ",Lördagspizza,,Genuin enkel miljö med en avskalad inredning som känns riktigt Italienskt. Pizza med modernt snitt som verkligen tar en till...More
[Swedish],171,37.0,12.0,4,"October 23, 2016 ",Lördagkväll ,"Lund, Sverige","God pizza, trevlig personal, mycket att välja på, maten kom fort
Borden är lite små och inredningen är kanske inte...More"
[Swedish],171,482.0,60.0,4,"October 25, 2014 ",Riktigt goda pizzor,"Malmo, Sweden",Riktigt goda pizzor i en trång med hjärtlig miljö. Trevlig och hjälpsam personal. Våra barn gillade pizzorna och var mycket...More
[Swedish],171,47.0,8.0,4,"October 26, 2015 ",Bra lunchställe,"Helsingborg, Sweden","Ett mycket trevligt och bra lunchställe i Lund. Lunchmenyn är kort och bra!
Råvaror och tillagning är mycket bra.
Det...More"
[Swedish],171,50.0,15.0,3,"October 27, 2014 ",God mat i hemsk miljö,"Lund, Sweden",Här får man troligtvis Lunds bästa pizzor. De är funna välbakade och fyllda med goda tillbehör. Så långt är allt...More
[Swedish],171,5.0,1.0,4,"October 28, 2016 ",Goda pizzor,"Lund, Sweden","Mycket goda pizzor, men stressig miljö med personal som behöver jobba lite på charmen.Trevlig inredning."
[Swedish],171,13.0,5.0,4,"October 5, 2016 ",Välgjord fräsch italiensk pizza.,"Lund, Sweden","Bor i Lund. När jag känner för en god, riktig pizza är det här jag beställer. Fräscha pizzor, ""enkla"" med...More"
[Swedish],171,29.0,12.0,3,"October 7, 2013 ",God pizza men lite trångt och stimmigt,"Lund, Sweden",Vi trillade in på V.e.s.p.a efter söndagspromenaden utan att ha bokat bord och fick direkt ett för två även om...More
[Swedish],171,55.0,18.0,4,"October 7, 2014 ",Supergoda pizzor,"Lund, Skåne Län, Sweden","VESPA är mitt favoritställe när det gäller pizza. Pizzorna är supertunna, fräscha, fina råvaror, många varianter. Pizzorna på VESPA har...More"
[Swedish],171,342.0,161.0,5,"October 8, 2012 ",Bästa pizzan i Lund fortfarande,Lund,Absolut bäst pizza i Lund sedan länge och den håller sin position. Ingen hundpizza som serveras på vanliga ställen utan...More
[Swedish],171,210.0,29.0,4,"September 1, 2017 ",Middag,"Orebro, Sweden",Åt först en bricka med italienska specialiteter o h därefter en kryddstark pasta med svamp och salamisås. Mycket smakfullt och...More
[Swedish],171,5.0,,4,"September 13, 2015 ",Kanonpizza,,Ett läckert ställe med mycket goda pizzor. Riktigt italienskt stuk. Roligt tema: vespa. Trevlig personal. Rekommenderar pizza med 4 salami...More
[Swedish],171,3.0,3.0,4,"September 13, 2016 ",Jättegod mat!,,"Alltid supergod mat och bra service!

Det enda negativa skulle vara att man sitter väldigt tätt tillsammans med andra matgäster...More"
[Swedish],171,8.0,3.0,4,"September 14, 2015 ",Pasta på Vespa,"Molndal, Sweden",Mycket god pastarätt. Trevlig personal. Lugn miljö. Pizzorna såg goda ut men jag valde en pasta och det ångrar jag...More
[Swedish],171,71.0,7.0,4,"September 17, 2016 ",Ok ställe med trevlig personal och god mat,"Kavlinge, Sweden","Litet och trevligt ställe.  Personalen är trevliga och maten kommer in hyfsat snabb.  
Pizzorna smakar utmärkt till ett ok pris....More"
[Swedish],171,10.0,1.0,3,"September 17, 2018 ",Vanlig pizza,"Stockholm, Sweden",Enkelt och smidigt att beställa och betala via nätet för att sedan hämta pizzorna från restaurangen. Smaken var dock alldaglig...More
[Swedish],171,9.0,11.0,2,"September 18, 2016 ",Inte som för!,,"Jag vet inte vad som har gått fel här... men det är verkligen inte som förr!
Stressig personal- lång väntetid...More"
[Swedish],171,15.0,1.0,3,"September 22, 2016 ",Okej italiensk mat,,Helt okej vardagsställe. Pasta bolognesen var väldigt dåligt kryddad (smakade ingenting) men pizzan är helt okej.
[Swedish],171,33.0,3.0,5,"September 22, 2017 ",Godast i Stan,"Lund, Sweden",Fantastiskt goda pizzor och en stor variation. Extra plus att det erbjuds sallad (ingen tråkig pizzasallad) då man tar take...More
[Swedish],171,17.0,1.0,3,"September 24, 2018 ",Gott men saknades sälta ,"Lund, Sweden",Var här tillsammans med min partner. Det första man märker av är att det är otroligt varmt och högljutt inne...More
[Swedish],171,10.0,1.0,4,"September 28, 2015 ",God mat,,Vespa erbjuder både goda pizzor och pastarätter. Går både bra att ta med och äta där. Om man äter där...More
[Swedish],171,5.0,7.0,1,"September 3, 2018 ",Under all kritik ,"Akarp, Sweden",Har hämtat mat på Vespa rätt många år nu men den senaste tiden har det fallerat allt mer och idag...More
[Swedish],171,31.0,37.0,1,"September 4, 2014 ",Dålig service,"Lund, Sweden","Vi kom hit för att äta varsin pizza och det är verkligen inget fel på deras pizzor, de
har fina...More"
[Turkish],2,69.0,56.0,2,"August 23, 2016 ",Zorda kalınmadıkça gidilmez,"Istanbul, Turkey",Lund da güzel bir yemek biraz hayal. Vespa hemen şehrin girişinde. Berbat bir sphagetti ve normal bir pizza margarita yiyip...More
[Turkish],2,25.0,20.0,2,"January 6, 2017 ",İdare eder,"Turkish Aegean Coast, Turkey","Fiyat performans olarak çok altta kalan bir restaurant. Şarapları güzel başarılı ama pizzalar sınıfta kaldı. İtalyan arkadaşlarımla gittik, pizzaya benzetemediler."
