[Swedish],76,50,11,4,"July 17, 2016 ",Välskött park,"Vasteras, Sweden","En mycket fin och välskött park mitt i centrala Lund som är väl värd ett besök. Fin lekpark för barn,...More"
[Swedish],76,72,15,4,"July 15, 2016 ",Ny lekplats,"Staffanstorp, Sweden","Stadsparken har alltid varit trevlig och ett bra ställe att slappna av.
Kanske mata ankorna eller karparna i dammen.
Men...More"
[Swedish],76,19,,5,"July 12, 2016 ",Jättefin lekplats! ,"Kavlinge, Sweden",Jättefin lekplats som passar barn i alla åldrar! Fint läge i parken. Toaletter finns. Centralt läge nära caféer och restauranger.
[Swedish],76,65,26,4,"June 11, 2016 ",Fin park med något för alla,"Malmo, Sweden","Väldigt fin och välskött park. 
Det finns ganska stor och fin lekplats som passar både mindre barn och större barn....More"
[Swedish],76,193,21,4,"June 5, 2016 ",Trevlig stadspark,"Lund, Sweden","Fina blomsterplanteringar, några konstverk, en stor damm med fiskar och fåglar. Fina gräsmattor att ha picknick på eller bara sitta...More"
[Swedish],76,810,142,3,"April 30, 2016 ",Populärt på Valborg,"Stockholm, Sweden",På Valborg är det här tusentals ungdomar samlas för picknick och lyssna till musik. Det är mycket festande och man...More
[Swedish],76,8,3,4,"April 26, 2016 ",Fredagschill,,En av få ställen i Lund som har uteservering med sol efter kl 17. Bra priser. bra viner. God charkbricka...More
[Swedish],76,38,5,4,"April 25, 2016 ",En grön oas mitt i Lund,"Lund, Sweden",En rogivande och skön plats mitt i stan med vackra planteringar. Under vår- och sommarmånaderna spelar många boule eller grillar...More
[Swedish],76,12,,4,"April 25, 2016 ",Välskött park fin miljö,"Lund, Sweden","lugn miljö, bra lekmöjligheter för barn, avkopplande. Lunds kommun lägger stor omsorg på att göra stadsparken attraktiv"
[Swedish],76,93,23,4,"April 8, 2016 ",Fantastisk lekpark,"Vallentuna, Sweden","Väldigt kul och lekfullt utrustad lekpark i Stadsparken. Små och färgglada hus påminner om Lundautställningen 1907. Gungor, klätterställningar och rutschkanor...More"
[Swedish],76,3,,2,"April 4, 2016 ",Ingenting att ha.,"Lund, Sverige","Fruktansvärt dålig park, Inte trevlig alls!!! Cyklister överallt och hundar. Sjön är smutsig och rätt så tråkiga ankor. Icke att...More"
[Swedish],76,11,8,4,"March 24, 2016 ",Stadsparken i Lund,"Lund, Sweden",Stadsparken är en drygt 100-årig park i Lund. Den är vacker och fridfull. Stadsparkscafet rekommenderars. Det har en äldre mysig...More
[Swedish],76,49,42,4,"March 15, 2016 ",En mötesplats för alla.,"Lund, Sweden","Stadsparken är en härlig park som har något för alla. En fontän som de minsta kan plaska i, ankor att...More"
[Swedish],76,81,7,5,"December 22, 2015 ",Bästa ,"Lund, Sweden","Bästa parken! Avslappning mitt i stan med ett gäng ankor och bröd är det bästa som finns. Bland studenter, joggare,...More"
[Swedish],76,129,20,4,"November 11, 2015 ",En oas i staden,"Lund, Sweden","Här har jag varit besökare i 66 år nu. Lekar och skridskoåkning som barn, fester som ung, kaféet och mata...More"
[Swedish],76,210,29,4,"October 18, 2015 ",Parkbesök,"Orebro, Sweden",En fin park med stort utbud av olika växter. Väldigt rogivande miljö. Enda negativa var att växthuset inte var öppet...More
[Swedish],76,50,15,4,"October 16, 2015 ",En vacker och omväxlande park,"Lund, Sweden",Stadspatken är vacker året om. I den stora dammen hittar man mängder ad svaar och andfåglar och då och då...More
[Swedish],76,189,35,5,"October 7, 2015 ",Lugn park,"Bucharest, Romania","Stadsparken är en lugn , vacker oas i Lund. Där man kan ta en kort promenad, läsa, eller bara titta...More"
[Swedish],76,53,8,5,"September 17, 2015 ",Härlig park som passar både unga och gamla.,"Kavlinge, Sweden","Härlig park som passar både unga och gamla.
Parken är full av aktivitet allt från barn som leker på den...More"
[Swedish],76,20,4,5,"September 6, 2015 ",En mysig park med levande musik,"Lund, Sweden",På somrarna är det underbart att sitta ned o lyssna på levande musik. Men parken är härlig året runt. En...More
[Swedish],76,20,6,5,"September 3, 2015 ",En park för hela familjen!,"Skane County, Sweden",En riktigt fin o centralt belägen stadspark där alla kan få sitt lystmäte tillfredsställt! Lummiga promenadstråk utmed fågeldammar o fina...More
[Swedish],76,29,8,4,"August 13, 2015 ",Härlig oas,"Lund, Skåne Län, Sweden","En härlig och lummig oas i Lund, med vackra blommor och ett trevligt café. Dock är servicen på caféet inte...More"
[Swedish],76,12,5,5,"August 6, 2015 ",Grön park med aktivitetsområden,"Lund, Sweden","Stadsparken har något för alla. En jättefin lekplats för barn i alla åldrar, en klättersten, parkourbana, beachvolleybollplan och beachhandbollsplan, utegym...More"
[Swedish],76,26,7,5,"July 25, 2015 ",Park för hela familjen.,"Lund, Sweden","En park med stor lekplats för barnen, volleyboll planer, utomhusgym, klätterväg samt snart en skateboard bana. Perfekt för avkoppling och...More"
[Swedish],76,44,10,4,"July 9, 2015 ","SÅ fin park, och rolig för barn!","Sodermanland County, Sweden","Härlig park att motionera i. Varierat med vatten, fåglar, saker att titta på och en bra lekpark. Mycket varmt rekommenderad."
[Swedish],76,5,2,5,"May 28, 2015 ",Vacker park,"Morbylanga, Sweden",En vacker park att strosa runt i Växthuset är verkligen fint med massa olika växter Den lilla resturangen med den...More
