[English],54,16,,5,5 days ago ,Great summer destination and fall walks,"Washington, DC, United States",The park is beautiful during any season but especially for a summer picnic. Coffee or a bottle of wine with cheese and a blanket was what we did when I was young. Still go there whenever I visit Lund.
[English],54,108,8,5,4 weeks ago ,A place to relax and reflect in the city.,"Modena, Italy",A place to relax and reflect in the city. Only 500 meter from the center. Always full of life. On café and one restaurant.
[English],54,3,,4,"October 3, 2018 ",Stadsparken for families,"Lund, Sweden","Stadsparken is a nice place for families, There is a big playground for children. Next to the park is also a big indoors swimmingpool."
[English],54,302,62,4,"October 3, 2018 ","Lovely park , especially for children, with ducks to feed!","Diani Beach, Kenya","A well maitained child friendly park, good for picnics, feeding the ducks and swans.  It is nce to walk around and then stop at one of the many places to sit and read or play with the children."
[English],54,420,229,4,"October 3, 2018 ",Nice park to visit when the weather is right.,,Stadsparken is a nice park near the city center. Bigger than the botanical garden and it's nice to stroll around or take a run. When the weather is nice you'll see alot of people hanging out here. It is a nice park but nothing more...More
[English],54,12,2,3,"September 6, 2018 ",Botaniska trädgården is much better - and free,"Lund, Sweden","A normal park, a bit gloomy. If I only had time for one park in Lund, I would definitely pick the Botanical Gardens."
[English],54,312,123,5,"September 6, 2018 ",Great Park for walking with beautiful scenery,"Zaventem, Belgium","We arrived by accident here slightly lost so decided to take a walk through the park.  It was great to see groups of students working on their running skills, the plants and grass were well taken care of and the fountains were lovely to look...More"
[English],54,2,,5,"August 27, 2018 ",Wonderful park,"Lund, Sweden","Really nice place to relax or do some exercise. You can do skateboarding or jogging,play beachvolleyball or go to outdoor gym. There is really nice playground for younger kids. Beautiful pond with birds and green trees."
[English],54,684,143,4,"August 26, 2018 ",Great park,"Kingston-upon-Hull, United Kingdom","This park was great! I loved walking around and exploring all the aspects that the park had to offer. There were loads of other people using the park. The pond was great, and used by loads of ducks. Lots to do for children and adults...More"
[English],54,178,22,5,"August 8, 2018 ",Small but jam packed with activities,"Lund, Sweden","We recently took a friend from out of town to see the town park. He was amazed at the diversity of activities and quiet space people can enjoy. People were using the outdoor skatepark, outdoor gym, villeyball courts, groups were having a boule tournament and...More"
[English],54,3,1,5,"June 18, 2018 ",Great place for young children,,"Kids can be kids here, running, jumping and climbing. My children love going here for some outdoor fun."
[English],54,6,3,5,"June 18, 2018 ",Family and children ,,"The park is clean and well-kept up. The playground has lots of different fun items for children. The cafe is nice, but unorganized and under-staffed."
[English],54,56,11,4,"May 24, 2018 ",Good and quiet place,,"Nice place fo relaxing over the grass field, take a walk, run, ride bike, or play Pokémon.

Is close to the Centralstation."
[English],54,81,3,5,"April 2, 2018 ",this park is amazing ,"Lund, Sweden",one of the absolute best experiance in Lund. Go her snd just enjoy the sunshine in the nice spring. This is for sure the best park in lund
[English],54,106,48,4,"December 6, 2017 ",Nice park with good play areas for children,"Lund, Sweden",This is a good big park in the city that has lots of green space and gardens to enjoy. There is are some good play areas for children with lots of equipment. There is a nice fountain in summer. As with all things that are...More
[English],54,646,116,4,"October 20, 2017 ",When you like the nature,"Istanbul, Turkey","If you are in the nature and green and environment, please spend some time at the Stadsparken. You will not regret"
[English],54,36,4,4,"September 7, 2017 ",Perfect for activities!,"Lund, Sweden","Volleyball, sun spotting, skateboarding, slack libeling, bouldering, boul, kids, parkour or other activities!"
[English],54,22,,3,"August 8, 2017 ",The city park of Lund,"Lund, Sweden",It is a largish park for the size of the city. There are areas that student congregate on for mating displays and picknicks. A climbing boulder has been erected at the south end with a rather impressive skatepark attached. In spring the beds are lovely...More
[English],54,4,3,5,"July 29, 2017 ",Great place for the family!,"Lund, Sweden","Stadsparken is one of our favorite places to go. There's a huge playground for kids of all ages, plenty of seating for picnics and grilling out, several gardens, a fountain, running trails, rock climbing, frequent festivals and events, an aviary, and public bathrooms! I love...More"
[English],54,5,3,5,"July 11, 2017 ",Great swimming pool!,,"My grandchildren say this is ""the best swimming pool in the world""!! The adventure pool is certainly worth a visit. The park itself is extensive and has some bird display."
[English],54,62,10,5,"July 7, 2017 ",Definitely a must-visit place!,Sweden,I did my research project in here for a few months with the municipality of Lund. It was more of a fun and relaxing project because of the location. I met lots of Swedes who were so nice and willingly to help me with the...More
[English],54,163,40,4,"April 12, 2017 ",red squirrels and ducks,"Glasgow, United Kingdom",Nice park where families walk. For a UK resident always pleasant to see a red squirral close up cos there are not many left here. Ponds and ducks and goldfish abound. Walked back to town through here after a concert and it felt very safe
[English],54,14,6,4,"April 10, 2017 ",Something for everyone,"Lund, Sweden",If you have children there is an amazing playground and a climbing rock. For a bit older kids place for parcour and skateboards. Newly planted perennial boarders for flowerlovers and a café. Perfect for a summer sunday.
[English],54,347,107,4,"March 15, 2017 ",An oasis in the town,"Lund, Sweden",The park is beautiful and an oasis to stroll around and have picknicks. Just avoid to go there April 30 when more than 20000 youngsters are celebrating that spring has arrived. Unfortunately more or less drunk all of them. But all others days it s...More
[English],54,9,1,4,"December 19, 2016 ",The right night light,"Lund, Sweden",The park is a small but pleasant place at all hours and at any time of the year. Just adjust ambitions and wardrobe. I can recommend to go for a stroll during nighttime. The park has recently been improved with a new system for illumination....More
[English],54,55,27,5,"December 17, 2016 ",Lovely place in Lund - except for 30th April,Asia,"Just walk around, relax, and enjoy all times of the year.

A ""special"" experience is provided on 30th April every year (so called ""sista april"" in Swedish). Several thousand youth (more than 20,000 according to the police one year) - supposed to be mainly university...More"
[English],54,8,17,4,"December 8, 2016 ",Some thing for every one,"Lund, Sweden","Given the right weather, this is the ideal place to spend a couple of hours or a day. One can have a nice stroll, jog or exercise if you feel up to it, or picnic. Have a sit down on a bench or right on...More"
[English],54,88,13,5,"July 25, 2016 ",A perfect place to relax and enjoy your day,"Lund, Sweden","This is the perfect place to enjoy your day, you can walk around and have a nice stroll.
Have a sit in the park and enjoy the beauty off the surroundings, close to the inner city and yet a perfect place to enjoy and relax."
[English],54,91,12,4,"May 13, 2016 ",Best place to celebrate the king of Sweden,,Last of April every year tens of thousands of people get together in the park to celebrate the king of Sweden. Very nice park other days as well.
[English],54,22,6,5,"May 3, 2016 ",Great park with awesome playground!,"Jersey City, New Jersey","I took my 2.5-year-old here while visiting family in Lund. He went crazy for the amazing playground! It has lots of places to climb, slides, swings of all sorts ... There is even a trampoline area. I had to practically drag him away. The park...More"
[English],54,104,35,4,"April 28, 2016 ",Parklife,Sweden,This green oasis in central Lund is great for a run or picnic and there are always plenty of people around. The new playground is fabulous. Bring some food and let the kids run wild for an hour or two.
[English],54,42,5,5,"April 24, 2016 ",Good place,"Cotia, SP","Good place to walk in the spring! It is even better if you are there in April, when there will be lots of people drinking and having fun to celebrate the new season and the warmer weather!"
[English],54,21,4,4,"April 2, 2016 ",Nice place,Sweden,"clean, nice, family friendly, good with the cafe in the park, the negative is that there is no toilet in the park. wonderfully with the pond with birds that you can feed. good for picnics"
[English],54,15,3,4,"March 16, 2016 ",Live nearby,"Lund, Sweden","Walk pass it or around it on a daily basis. Soon there will be a nice skate park too. You can watch birds, there is a new playground for children. In the summer there is many events."
[English],54,11,,4,"March 15, 2016 ",Attractive City park,,"Great calm park, very popular during summer months. Also includes a huge child playground. In summertimes there are sometimes concerts. Also a nice restaurant"
[English],54,178,33,5,"March 7, 2016 ",An oasis in the town.,,"A beatiful and relaxing located in the central of Lund. A place that is suitable for a picnic, a quite stroll or a run. There is a small café/restaurant which can provide a snack or evening dinner or If you just want an ice cream...More"
[English],54,181,24,4,"February 24, 2016 ",Nice park in the middle of town,"Lund, Sweden","This place has something for everyone. Skate park, flowerbeds, birds and fishes to feed. A small restaurant as well as the biggest outdoor party of the year for students on april 30."
[English],54,22,22,5,"January 8, 2016 ",Very good playgrounds for kids and grown ups,"Lund, Sweden","I often take the kids to Stadsparken for the very good recently updated playground. There is also an open-air gym, boulder climbing and parcours for the more adventurous teenagers and grown ups. Highly recommended any day as long as it's not snow or raining."
[English],54,66,11,3,"November 14, 2015 ",Nice area for a stroll,"Stockholm, Sweden",Many students on the lawns and lots of birds in the small lake. During our visit there was a lot of parents with their children in the park.
[English],54,29,10,3,"October 26, 2015 ",city park,"Lund, Sweden","A nice park in the summer, nothing exceptional but restful and calm. There is a fairly good restaurant where you can have lunch or a cup of coffee."
[English],54,165,37,4,"October 13, 2015 ",Great place for a run or for kids to play,Denmark,Nice park near the center of Lund for a run.  There is a nice and new playground for kids as well as an area with excercise equipment.
[English],54,51,15,4,"October 11, 2015 ",Wonderful place,"Lund, Sweden","It is a huge wonderful place to have a walk or a run on a sunny day. Many events of Lund are organized at this place. It has a small region with caged birds for the kids to see. Also, a small lake to feed...More"
[English],54,47,10,5,"September 30, 2015 ",Nice place to relax and let the kids play for a while,,"Located close to the train station, the Park is an ideal place to let youngsters play in a very safe environment - also walking tours around the park are recommended. There is a restaurant/cafe there which is very good as well..."
[English],54,113,56,4,"September 29, 2015 ",A green spot of peace,Sweden,"Nice place, especially spring and summer. Great playgrounds for kids. Nice for them to feed the ducks in the pond. You can buy icecream and coffe. and just relax. A warning: the 30 of april it will be crowded. At least 15 000 students and...More"
[English],54,26,19,4,"September 6, 2015 ",Nice place for children and family in Lund,"Seoul, South Korea","Spacious and peaceful place to refresh yourself, also possible to satisfy your kids at the various playground in it... :)"
[English],54,26,10,5,"September 1, 2015 ",A quiet spot in the middle of the city,Sweden,"The Botanical Garden at Lund University is a must, especially during the spring/summer/fall period. The garden itself is beautiful, with an abundance of everything that grows....and entering the lawns for a picknick or just a rest in the shades is allowed! Don´t miss the exotic...More"
[English],54,29,8,5,"August 6, 2015 ",Soothing green park and a lake,,Stadsparken offers nice greenery with a stunning lake. You can take a stroll on different walkaways around the lake. For me its a daily walk destination which helps me in my walking regime and sooth my eyes with lush green color. There is a also...More
[English],54,562,157,3,"August 3, 2015 ",A very nice walk,"Sonoma, California",A wonderful park for residents and visitors. There is a nice lake with birdlife to watch. There is also a training area and sandy beach volleyball courts. We had a nice morning walk thru the park.
[English],54,21,21,5,"July 25, 2015 ",Great place to hang out - bring a blanket,"Keflavik, Iceland","We love to go to Statsparken to hang out and relax with the kids. We bring a blanket and snacks and stay there for long periods. There are dance lessons every weeknight, a fun playground, beautiful surroundings and places to throw a frisbee, sleep in...More"
[English],54,28,1,4,"July 9, 2015 ",Nice for a walk and getting some sun,"Munich, Germany","If you are going around the city and it's sunny do not miss stadsparken where you can have a walk in the nice park and refreshing nature, sit and drink some coffee or beers that you take with you (only one bar/restaurant is there and...More"
[English],54,486,155,4,"July 8, 2015 ",A great place for a walk or to sit in the sun,"Lund, Sweden",I live in Lund and enjoy the city park very much.  There are birds on the north side of the park and ducks and fish in the lake.  They have recently added a climbing wall and outdoor gym equipment on the south side.  The city...More
[English],54,19,4,5,"June 30, 2015 ",A park not to miss!,,"We visited there with our son, who was completing his graduate work at Lund.  It was a beautiful area of Lund, and quite beautiful!"
[English],54,239,82,4,"June 17, 2015 ",Point of relaxation and celebration,"Jaipur, India","Lund city's park (Stadsparken) lies close to the city centre and quite large. It has remains of the an old city wall, a pond, a performance stage, children amusement rides/swings, small birds exhibits etc. It not only provides opportunities for exercise, running and playing but...More"
[English],54,334,65,5,"May 22, 2015 ",A wonderful park from 1911,"Furulund, Sweden","Built in the wonderful style of early-20th-century parks, Stadsparken is the heart of Lund. Beautiful, with lots of green, wonderful ponds, a fantastic playground, it's really worth visiting. And maybe you'll have the chance to indulge in one of the many cultural happenings that are...More"
[Swedish],76,3,1,5,3 days ago ,Finaste stadsparken i Sverige,,"En park som myllrar av aktivitet och människor året om. Välskött, vacker, spännande och full av överraskningar för hela familjen."
[Swedish],76,26,3,4,5 days ago ,I hjärtat av Lund ,,"I centrala Lund ligger denna utomordentligt välskötta och trevliga park. Parken är perfekt för promenaden, löprundan eller för att slippa...More"
[Swedish],76,3,,4,"December 11, 2018 ",Lugn o cykelfri park.,"Lund, Sweden",Välskött. Fina gräsmattor. Mycket blomster. Lekområde med många olika redskap. Gratis uppträdanden. Promenera och ställ cykeln.
[Swedish],76,70,14,4,"December 9, 2018 ",Underbar lunga mitt i stan,"Lund, Sweden","En stor härlig park med något för alla; stora och små. Här simmar ankor, och här finns härlig lekplats och...More"
[Swedish],76,2,,4,"November 6, 2018 ",Lundabornas oas,"Lund, Sweden","Grönt och skönt, en samlingspunkt helt enkelt. Fin lekplats för barnen men oftast för mycket folk. I närheten finns klättervägg,...More"
[Swedish],76,36,,4,"October 2, 2018 ",Oas i centrala Lund,,"Ett ställe som passar alla, för träning (finns utegym i anslutning till parken), löpning, lek, picknick, promenader eller bara att...More"
[Swedish],76,52,3,4,"September 16, 2018 ",Skön avslutning på helgen i vacker park,,"Mycket välskött park med vackra blommor och fontäner, dammar med fågel och guldfiskar. Trevligt och avkopplande att strosa runt där....More"
[Swedish],76,19,4,3,"July 9, 2018 ",Helt ok,"Lund, Sweden","En stadspark som är lite märkt av tidens tand. Den nyare delen söderut med beachvolley, skatebana etc. är mkt fin....More"
[Swedish],76,88,11,3,"June 30, 2018 ",En helt vanlig park,"Lund, Sweden","En damm, några rejäla gräsytor, några planteringar med blommor, en hel del träd, en stor rejäl lekplats... kort o gott,...More"
[Swedish],76,5,,4,"June 18, 2018 ",Vacker,,Där finns gym vollybollsplan och skateramp där finns även ett bra cafée samt fågelvoljärer och en bra lekplats till dom...More
[Swedish],76,38,10,5,"June 13, 2018 ",Riktigt bra lekplats,"Lund, Sweden","Detta har blivit mycket lyckat efter ändringarna för något år sedan, grym lekplats och snyggt och städat i stördsta allmänhet."
[Swedish],76,67,6,5,"May 20, 2018 ",Perfekt utflyktsställe,"Landskrona, Sweden","Perfekt för alla besökare.
Vi var där med barn i olika åldrar.
Fin lekplats som även är handikappanpassad.
Fina grönytor...More"
[Swedish],76,49,3,5,"April 29, 2018 ",Underbar park,,"Underbar park att motionera, leka och ströva i. Finns något för alla. Utegym, lekplatser och café. När vårsolen tittade fram...More"
[Swedish],76,38,9,3,"February 23, 2018 ",Bra ytor för lek o spring,"Malmo, Sweden","Hängmattor klättervägg ankor o stora gräsmatta : perfekt för familjens

Toaletter och kiosker saknas dock så medtag allt och håll...More"
[Swedish],76,9,2,5,"December 22, 2017 ",Lundabornas vardagsrum,,"Här spelar man boule, skejtar och grillar eller leker på väl tilltagna lekplatser eller äter glass i caféet. Möjligen vilar...More"
[Swedish],76,39,6,3,"November 10, 2017 ",Njut av blomsterprakten men inte av räksmörgåsarna och kakorna!,,"En solskensdag i juli passade vi  - några vänner på att gå till
den lummiga Stadsparken i Lund. Några beställde...More"
[Swedish],76,5,2,5,"November 7, 2017 ",Avkopplande med fröjd för ögat,"Lund, Sverige","Stadsparken kan upplevas på många olika sätt beroende på årstiden, men en behaglig och relaxerande känsla sköljer alltid över en...More"
[Swedish],76,9,3,1,"November 6, 2017 ",Fruktansvärd service,"Lund, Sweden","Har försökt att både äta och dricka vid 3 olika tillfälle, Antingen så skulle dom stänga om 10 minuter eller...More"
[Swedish],76,59,10,4,"November 5, 2017 ",Fin park med rolig lekplats,"Orebro, Sweden","Fin välordnad park. Rolig lekpark för barnen, en klätter-del för de större barnen och en del för de mindre barnen."
[Swedish],76,31,2,4,"September 22, 2017 ",Härlig park,,"Vacker och välordnad park med väl tilltagna grönytor för sport och avkoppling. Blomprakt, fontän och örtträdgård. Trevligt med orientaliska fåglar...More"
[Swedish],76,229,69,4,"July 21, 2017 ",Det fattas något,"Ban Si Thanu, Thailand","Stadsparken är fin att gå i året runt, men det man saknar är minigolf. Lund är nog den största staden...More"
[Swedish],76,6,2,4,"July 11, 2017 ",Trevlig oas i Lund,,"Här kan man gå runt och strosa eller ta med sig en filt eller stolar.
Duka upp med ost och...More"
[Swedish],76,7,,5,"July 11, 2017 ",Mysigaste platsen i Lund,"Lund, Sweden","Hör kan man göra allt ,sola ,vara ensam , titta på folk , fika ,äta ,ha picknick ett ställe att...More"
[Swedish],76,12,,5,"July 11, 2017 ",En lekfull och lummig plats mitt i staden,"Lund, Sweden","Stadsparken bjuder på grusgångar, rosenplanteringar och fontäner, ja till och med en liten musikpaviljong, allt du kan önska dig av...More"
[Swedish],76,7,,4,"July 11, 2017 ",Slappa eller spela,"Lund, Sweden","En av de två oaserna i Lund. Här kan man ha pic-nic, spela boule, hänga i hängmattor, skejta, sitta på...More"
[Swedish],76,46,8,3,"July 4, 2017 ",För alla,"Lund, Sweden",En park som är bra att springa i eller bara promenera. Ligger inte långt ifrån centralen. Finns aktiviteter för barn...More
[Swedish],76,37,1,5,"May 23, 2017 ",Fantastiska unika Lunds stadspark en juvel!,"Lund, Sweden",En magisk plats som förvaltas väl. Det städas och putsas hela tiden. Det finns något för alla åldrar. Hängmattorna är...More
[Swedish],76,45,2,4,"May 1, 2017 ",God mat!,,"Trevlig lokal med god mat och god service. Personalen trevlig och vänlig.
Fina omgivningar i Lunds Stadspark
Lugnt och mysigt...More"
[Swedish],76,10,,5,"April 10, 2017 ",Fin park,,Himla fin park är det. Och stor. Och om sommaren när det är varmt så är parken full av människor...More
[Swedish],76,14,6,4,"April 10, 2017 ",Något för alla,"Lund, Sweden",Om du har barn finns en fantastisk lekplats och en klättersten. För lite äldre barn plats för parcour och skateboardramp....More
[Swedish],76,31,5,4,"February 18, 2017 ",här får du frid,,"I Lunds stadspark kan du få mycket. Inre frid. En natur upplevelse. Möte med medmänniskor. Pratstund med änderna, svan paret...More"
[Swedish],76,8,10,5,"February 13, 2017 ",Vacker allsidighet,"Lund, Sweden","Helt fantastiskt hur man på ett så smakfullt och ""harmoniskt"" sätt kan få in en sådan mångfald av sevärdheter och...More"
[Swedish],76,16,1,5,"February 13, 2017 ",En oas mitt i stan,,"Denna centralt belägna oas har många möjligheter. Picknick, boule, motion både sommar och vinter samt nära till stan, en jättefin...More"
[Swedish],76,21,,4,"February 5, 2017 ",En oas i Lund,"Lund, Sweden",Perfekt ställe för avkoppling en sommardag. Det är här studenterna firar siste april med en gigantisk spontanfest framför vita scenen...More
[Swedish],76,128,32,5,"January 17, 2017 ",Mycket att göra både för barn o vuxen ,"Lund, Sweden","Bästa parken, även på vintern.
Lekpark för barnen är välbyggd och säker. 
Aktivitetsområde för större barn och vuxna samt ett...More"
[Swedish],76,96,12,5,"January 5, 2017 ",Fantastiskt,"Lund, Sweden","Lunds hjärta, ett besök för alla. Finns massor att göra eller bara ligga och njuta av miljön. Ett måste!"
[Swedish],76,7,,4,"December 19, 2016 ",En fantastisk oas i Lund,"Lund, Sweden","Min favoritplats är den lilla dammen med fiskar och alla olika fåglar
Dit kan man gå med barn eller barnbarn,...More"
[Swedish],76,26,10,5,"December 8, 2016 ",Välskött park med många möjligheter !,Barsebäck,"Lunds hjärta! Vacker, välskött med många trevliga delar! Skateboardpark i ena änden och en otroligt trevlig, stor lekplats i en...More"
[Swedish],76,68,38,4,"November 12, 2016 ",Stadsparken är värt ett besök,"Lund, Sweden",Själv Lundabo och besöker parken ofta. Kan verkligen rekommendera ett besök för er som turistar i Lund. Bra att besöka...More
[Swedish],76,17,4,4,"November 4, 2016 ",Perfekt för småbarnsfamiljen,"Lund, Sweden","Perfekta platsen att spendera en dag med småbarnsfamiljen, framför allt under sommarhalvåret. Stor och spännande lekplats, gott om gräsytor, massor...More"
[Swedish],76,120,23,4,"September 8, 2016 ",Trevlig park med både lekplatser och vackra planteringar,"Lund, Sweden","Parken har något för alla, från barnfamiljerna som roar sig på sen stora lekplatsen eller tittar på fåglarna i dammen...More"
[Swedish],76,18,4,5,"September 4, 2016 ",Fantastisk vacker park,"Lund, Sweden","En underbar stadspark, nära city. Parken är stor, vacker, fridfull och perfekt för att strosa runt i eller ta en...More"
[Swedish],76,116,32,5,"August 24, 2016 ",Fantastisk renoverad park!,"Lund, Sweden",Jag har hört mycket om den renoverade Stadsparken i Lund men inte besökt den förrän nu. Jag måste verkligen säga...More
[Swedish],76,48,17,5,"August 23, 2016 ",Underbar park!,"Lund, Sweden","Stadsparken i Lund har allt! Där finns grönytor, dammar med änder som barnen kan mata, en scen för uppträdanden och...More"
[Swedish],76,14,2,5,"July 27, 2016 ","Var och åt i restaurangen i Lunds Stadspark, belägen i ljusa luftiga lokaler i underbar parkmiljö. Med beröm godkännt.","Lund, Sweden",Det är i sig en minnesvärd  upplevelse att strosa runt i välskötta Stadsparken i Lund där man finner platser med...More
[Swedish],76,20,1,4,"July 25, 2016 ",Barnvänlig och välskött park,"Lund, Sweden","En park att strossa runt och koppla av i. Välskött med härliga grönområde, damm med många olika fågelarter. Ett cafe...More"
[Swedish],76,162,47,4,"July 25, 2016 ",Promenad på lunchen,"Vallakra, Sweden",Efter en god lunch gick vi hit för att titta på alla de vackra planteringarna i stadsparken. Verkligen imponerande! Speciellt...More
[Swedish],76,88,13,5,"July 25, 2016 ",En perfekt plats att koppla av och njuta av din dag,"Lund, Sweden","Detta är den perfekta platsen strosa rint och bara njuta av din dag.
Man kan sitta i parken och njuta...More"
[Swedish],76,219,35,4,"July 21, 2016 ",Strosa,World,"Tänk att jag har missa strosa runt i den fina stadsparken.
Härliga grönområden, vackra parkanläggningar, lekplats mm.
Gott om bänkar...More"
[Swedish],76,76,20,4,"July 19, 2016 ",Fin och barnvänlig park,"Aseda, Sweden","Vi var först och matade fåglarna i dammen, det fanns flera olika arter och även fågelungar. Håll även utkik efter...More"
