2011,69,[PDF][PDF] Transport Policy and Evaluation,"K Dziekan, T Gehlert, T Gärling - proceedings.envpsych2011.eu","… Within CIVITAS, cities learn from each other and work with the support of the EC to implement
measures that aim at sustainable urban transport and providing a better quality of life for
all citizens according to the slogan: city – vitality – sustainability … 
",  Related articles All 2 versions  View as HTML 
2011,69,From CIAM to CNU: the roots and thinkers of modern urban design: Fugénie L. Birch,"EL Birch - Companion to urban design, 2011 - taylorfrancis.com","… Ages. They sited low-lot coverage high-rises (often labeled “towers in the park”)
arguing that this building form could improve urban life by capturing the density
required for city vitality while relieving ground-level congestion … 
",  Cited by 9 Related articles  View as HTML 
2011,69,[PDF][PDF] City Logistics for Sustainability: The case of Stockholm,"ΕΓ Μαρούδας-Τσακυρέλλης, EG Maroudas-Tsakyrellis - 2011 - core.ac.uk","Page 1. KUNGLIGA TEKNISKA HÖGSKOLAN – ΕΘΝΙΚΟ ΜΕΤΣΟΒΙΟ ΠΟΛΥΤΕΧΝΕΙΟ Royal
Institute of Technology National Technical University of Athens School of Architecture and the
Built Environment School of Civil Engineering Division of Transportation and Logistics … 
",  Related articles All 2 versions  View as HTML 
2011,69,Making cities smarter than their bankers,"B Cahan - Workshops at the Twenty-Fifth AAAI Conference on …, 2011 - aaai.org","… rates and municipal deficits. Innovative solutions would become coins of the realm:
Transit-oriented development restores inner city vitality, removing blight, traffic
congestion and suburban sprawl. [13] Replanting mangroves … 
",  Cited by 1 Related articles All 2 versions  View as HTML 
2011,69,"From central places to network bases: A transition in the US urban hierarchy, 1900–2000","ZP Neal - City & Community, 2011 - Wiley Online Library","… Notably, in the case of Miami, while these economic relationships provide a foundation for its
status in the functional urban hierarchy, they also induce cultural and immigration flows that
support the city's vitality and authenticity, which in turn generate new and stronger economic … 
",  Cited by 73 Related articles All 5 versions  
2011,69,"[PDF][PDF] Entre échelle locale et communautaire, les nouvelles régulations croisées des politiques de transports urbains","G Pflieger - communication au X e Congrès de l'Association …, 2011 - blogs.sciences-po.fr","… et des transports. Le programme CIVITAS (City-Vitality-Sustainability) a été lancé
en 2000 par la DG TREN en s'adossant aux budgets des 5e, 6e et 7e programmes
cadre de recherche de l'Union européenne. Suite à deux … 
",  Cited by 5 Related articles All 2 versions  View as HTML 
2011,69,Jane Jacobs Revisited: Do Social Service Organizations Have a Place in Redeveloping Communities,"I Hitchcock - U. Balt. J. Land & Dev., 2011 - HeinOnline","… Jacobs felt that in order for a city to be successful, its districts should be diverse.""'6 She laid out
four primary conditions that are required for generating diversity in city streets and districts.""' By
inducing these conditions, the city's vitality would be enhanced.""' The four conditions … 
",  Related articles All 3 versions  
2011,69,Indicatori per la mobilità sostenibile: la Provincia di Napoli,"P D'Amico, F Di Martino, S Sessa - TeMA-Trimestrale del …, 2011 - eprints.bice.rm.cnr.it","… istruzioni e linee guide. CIVITAS (CIty VITAlity-Sustainability initiative) è probabilmen-
te uno degli strumenti più noti per aiutare le città europee ad implementare strategie
per il trasporto urbano integrate e sostenibili. Ci sono state … 
",  Related articles All 4 versions  View as HTML 
2011,69,[PDF][PDF] Improving urban mobility,"P Midgley - Proceedings of AITPM 2011 Natio nal Conference …, 2011 - allinx.eu","Page 1. Improving Urban Mobility Peter Midgley AITPM 2011 National Conference Linking
Communities: Growing liveability and accessibility 10 - 11 August 2011 Page 2. Improving
Urban Mobility Peter Midgley Page 2 of 2 Page 3. Contents … 
",  Cited by 3 Related articles All 3 versions  View as HTML 
2011,69,[PDF][PDF] ZESZYTY NAUKOWE UNIWERSYTETU SZCZECIŃSKIEGO NR 644 PROBLEMY TRANSPORTU I LOGISTYKI NR 14 2011,"E ZAŁOGA, Z KŁOS - PROBLEMY TRANSPORTU I LOGISTYKI …, 2011 - researchgate.net","… dotyczącej transportu z 2001 r., (COM (2006) 314). 6 CIVITAS (City, Vitality,
Sustainability) to inicjatywa dotycząca zrównoważonego roz- woju transportu w
miastach. Z pomocą inicjatywy CIVITAS, Komisja Europejska zamierza … 
",  Related articles All 2 versions  View as HTML 
2011,69,Impact in 3D-Maximizing Impact through Transactional Clinics,"P Kosuri - Clinical L. Rev., 2011 - HeinOnline","Page 1. ""IMPACT"" IN 3D-MAXIMIZING IMPACT THROUGH TRANSACTIONAL CLINICS
PRAVEEN KOSURI* In speaking about ""impact"" clinical legal education, it is almost always
exclusively as litigation-innocence projects, representing … 
",  Cited by 31 Related articles All 8 versions  
2011,69,Análise de não conformidades nos SMTUC,FACF Vitor - 2011 - estudogeral.sib.uc.pt,"… Média Siglas SMTUC - Serviços Municipalizados de Transportes Urbanos de Coimbra MODERN –
MObility Development and Energy use ReductioN CIVITAS – CIty-VITAlity-Sustainability CIVINET –
CIVItas National NETworks NP – Norma Portuguesa EN – Norma Europeia … 
",  Related articles All 4 versions  View as HTML 
2011,69,[PDF][PDF] Planning cities for children,"V McCracken - THE 4 TH KNOWLEDGE CITIES WORLD SUMMIT, 2011 - Citeseer","… In addition, consideration regarding urban consolidation and sustainable urban form has coincided
with a renewed interest in city vitality and liveable communities, epitomised by‗ new urbanism
'in North America (Nelson et al., 2004) and in the UK with the urban renaissance … 
",  Related articles All 5 versions  View as HTML 
2011,69,[PDF][PDF] Wdrażanie rozwiązań transportowych podnoszących bezpieczeństwo użytkowników dróg w miastach na tle społeczno-kulturowych uwarunkowań w …,"E Kasperska, T Heese, A Boguski… - …, 2011 - czasopismologistyka.pl","… realizowany obecnie, lata 2008 – 2012 z VII RPB. Nazwę CIVITAS utworzono od
pierwszych liter słów: CIty, VITAlity, Sustainability (miasto, witalność, stabilność). Z
pomocą inicjatywy CIVITAS Komisja Europejska wspiera wdraŜanie … 
",  Related articles All 4 versions  View as HTML 
2011,69,[BOOK][B] Urban America reconsidered: Alternatives for governance and policy,D Imbroscio - 2011 - books.google.com,"Page 1. Urban America Reconsidered Alternatives for Governance and Policy Page 2. Urban
America Reconsidered Page 3. Page 4. Urban America Reconsidered Alternatives for Governance
and Policy David Imbroscio Cornell University Press Ithaca and London Page 5 … 
",  Cited by 97 Related articles All 5 versions  
2011,69,[PDF][PDF] Cidade e sustentabilidade territorial,"NNP dos Santos - Mercator-Revista de Geografia da UFC, 2011 - redalyc.org","… se o suporte desta sustentabilidade que pode ser exemplificada com alguns casos concretos:
a Rede Portuguesa de Cidades e Vilas Sustentáveis (Centro Civitas); o International Council
for Local Environmental Initiatives (ICLEI) e o CIty-VITAlity-Sustainability - cleaner and … 
",  Cited by 7 Related articles All 5 versions  View as HTML 
2011,69,[PDF][PDF] ENGENHARIA DE SISTEMAS BASEADA EM MODELOS: UM SISTEMA PARA O TRÁFEGO & AMBIENTE MODEL-BASED SYSTEMS ENGINEERING: A …,"AL Ferreira, A Ramos - core.ac.uk","Page 1. Universidade de Aveiro 2011 Departamento de Economia, Gestão e Engenharia
Industrial Ana Luísa Ferreira Andrade Ramos ENGENHARIA DE SISTEMAS BASEADA
EM MODELOS: UM SISTEMA PARA O TRÁFEGO & AMBIENTE … 
",  Related articles  View as HTML 
2011,69,"[PDF][PDF] Environment 2.0: the 9th Biennial Conference on Environmental Psychology, 26-28 September 2011, Eindhoven University of Technology, Eindhoven, The …","A Haans, DAP van Gennip, JRC Ham, YAW de Kort… - 2011 - research.tue.nl","Page 1. Environment 2.0 : the 9th Biennial Conference on Environmental Psychology,
26-28 September 2011, Eindhoven University of Technology, Eindhoven, The
Netherlands Citation for published version (APA): Haans, A … 
",  Related articles All 5 versions  View as HTML 
2011,69,[PDF][PDF] The Psychology of Sustainable Mobiliy,"K Dziekan, T Gehlert, T Gärling - ivp.tu-berlin.de","Page 1. 1 Symposium within 9th Biennial Conference on Environmental Psychology,
26-28 September 2011, Eindhoven / The Netherlands The Psychology of Sustainable
Mobiliy K. Dziekan 1 , T. Gehlert 2 , & T. Gärling 3 1 … 
",  Related articles All 3 versions  View as HTML 
2011,69,[BOOK][B] Globalizing cities: a new spatial order?,"P Marcuse, R Van Kempen - 2011 - books.google.com","Page 1. GLOBALIZING CITIES A NEW SPAIIAL ORDER? Edited by Peter llarruse
and Ronald van Kempen E51 Page 2. Contents List of Figures List of Maps List of
Tables List of Contributors Series Editors' Preface Preface 1 … 
",  Cited by 1271 Related articles All 5 versions  
2011,69,"Urban natural parks in Portland: nature, networks, and community health",JWR Baur - 2011 - ir.library.oregonstate.edu,"Page 1. Page 2. AN ABSTRACT OF THE DISSERTATION OF Joshua WR Baur for the degree
of Doctor of Philosophy in Forest Resources presented on November 28, 2011 Title: Urban
Natural Parks in Portland: Nature, Networks, and Community Health … 
",  Related articles All 2 versions  View as HTML 
2011,69,Urban Revitalization and Eminent Domain: Misinterpreting Jane Jacobs,"SJ Eagle - Alb. Gov't L. Rev., 2011 - HeinOnline","… zoning restrictions limiting the location and illumination of billboards, on the theory that the
restrictions were under- inclusive in not subjecting street advertising to the same rules as
building-side and utility pole advertising."" The court declared: The City's vitality, activity, and … 
",  Cited by 3 Related articles  
2011,69,Medical Manipulation: Public Health as a Political Tool in the 1918-19 Influenza Epidemic in San Francisco,"K Moore - Voces Novae, 2011 - digitalcommons.chapman.edu","Page 1. Voces Novae Volume 3 Article 20 2018 Medical Manipulation: Public Health as a Political
Tool in the 1918-19 Influenza Epidemic in San Francisco Kirsten Moore Chapman University
Follow this and additional works at: https://digitalcommons.chapman.edu/vocesnovae … 
",  Related articles  View as HTML 
2011,69,VIVER--A Sustainable Transport Vision for Germany,"W Schade, A Peters, C Doll, J Koehler… - Available at SSRN …, 2011 - papers.ssrn.com","Page 1. Electronic copy available at: http://ssrn.com/abstract=2375782 Working Paper
Sustainability and Innovation No. S 3/2011 Wolfgang Schade, Anja Peters, Claus Doll, Stefan
Klug, Jonathan Köhler, Michael Krail VIVER A sustainable transport vision for Germany Page … 
",  Cited by 2 Related articles All 5 versions  
2011,68,[PDF][PDF] Going Green: How local authorities can encourage the take-up of lower-carbon vehicles,"C Hanley, SKMC Buchanan - … . org/wp-content/uploads/2017/11 …, 2011 - lingscars.com","Page 1. a Going Green: How local authorities can encourage the take-up of
lower-carbon vehicles Chris Hanley SKM Colin Buchanan November 2011 Page 2.
b The Royal Automobile Club Foundation for Motoring Ltd is a charity … 
",  Cited by 4 Related articles All 3 versions  View as HTML 
2011,68,Développement des espaces logistiques urbains: CDU et ELP dans l'Europe du Sud-Ouest,"A Trentini, J Gonzalez-Feliu, N Malhéné - 2011 - halshs.archives-ouvertes.fr","… and Supply Chain Management) (2000 – 2001). Au cours de l'année 2000, la
Commission européenne a lancé l'initiative CIVITAS (City-VITAlity-Sustainability)
et le programme INTERREG III. L'initiative CIVITAS soutient les … 
",  Cited by 4 Related articles All 7 versions  View as HTML 
2011,68,[BOOK][B] Adaptive reuse of the Seaholm Power Plant: Uniting historic preservation and sustainable practices,E Meltzer - 2011 - search.proquest.com,"Adaptive reuse of the Seaholm Power Plant: Uniting historic preservation and
sustainable practices. Abstract. Current historic preservation regulations and
sustainability systems rarely overlap for a common goal. Historic properties … 
",  Cited by 1 Related articles All 2 versions  
2011,68,"Integrating eco-innovation principles into regional strategy and policy: case of Päijät-Häme region, Finland",E Takhtay - 2011 - lutpub.lut.fi,"… HEI IT IUCN LCA LIFE MABU NIMBY MIMOSA NIS NISP RDS RIS R&D SD SMEs
CIty-VITAlity-Sustainability Department for Environment, Food and Rural Affairs Economic
Sustainability Index European Environment Agency Ecological EU Eco-Management and Audit … 
",  Cited by 1 Related articles All 3 versions  View as HTML 
2011,68,"From production to consumption: Gentrification, preservation, and the uneven (re) development of Pittsburgh's South Side",NJ Holdzkom - 2011 - search.proquest.com,"… 2005). Explanatory theories of gentrification. Perspectives of gentrification range between
“saviour and destroyer of central city vitality,” (Atkinson, 2003, p. 2343) Page 21. 11 depending
on whether one chooses to approach the issue from the perspective of … 
",  Related articles All 3 versions  
2011,68,Classifying proteins into functional groups based on all-versus-all BLAST of 10 million proteins,"N Kolker, R Higdon, W Broomall… - Omics: a journal of …, 2011 - liebertpub.com","<iframe src=""//www.googletagmanager.com/ns.html?id=GTM-5TSRKG"" height=""0"" width=""0""
style=""display: none; visibility: hidden""></iframe> <img height=""1"" width=""1"" src=""https://www.
facebook.com/tr?id=196615734230866&ev=PageView&noscript=1""/> … 
",  Cited by 13 Related articles All 8 versions  
2011,68,[BOOK][B] Smart Cities Initiative: how to foster a quick transition towards local sustainable energy systems,"L Meeus, E DE OLIVEIRA FERNANDES, V LEAL… - 2011 - cadmus.eui.eu","Page 1. Smart Cities Initiative: How to Foster a Quick Transition Towards Local
Sustainable Energy Systems http://think.eui.eu Final Report January 2011 Project
Leader: Eduardo de Oliveira Fernandes Research Coordinator … 
",  Cited by 8 Related articles All 20 versions  View as HTML 
2011,68,In search of mobility services,M Arbouet - 2011 - diva-portal.org,"Page 1. MASTER THES KTH KTH Supervisor: Certu Superviso 2011 Marie Arbouet
[IN SEARCH OF M SERVICES] Guide of usage data collection and potential e ASTER
THESIS IN TRANSPORT SYSTEMS KTH Examiner: Harilaos … 
",  Cited by 3 Related articles  View as HTML 
2011,68,"[PDF][PDF] Mapa tecnológico, ciudades inteligentes”","OT de la Energía - Madrid: Ministerio de Industria, Turismo y Comercio …, 2011 - idae.es","… 13 www.concertoplus.eu Page 18. 20 Figura: Esquema gráfico de la Iniciativa Concerto Ilustración:
www.concertoplus.eu 5.1.2. Iniciativa Civitas (TRAN) CIVITAS - un transporte urbano mejor y
más limpio - significa CIty-VITAlity-Sustainability (CIudad-VITAlidad-Sostenibilidad) … 
",  Cited by 4 Related articles All 5 versions  View as HTML 
2011,68,[PDF][PDF] Deliverable 2.1 State of the Art Report,"M CRES, V Vavakos - polisnetwork.eu","Page 1. Deliverable 2.1 State of the Art Report Coordinator: DTV Consultants, Mr. Johan Janse,
PO Box 3559, 4800 DN, Breda, The Netherlands, +31 76 513 6631 enerqi@dtvconsultants.
nl Author: CRES, Mr. Vassilis Vavakos (external consultant) 19th km … 
",  Related articles All 4 versions  View as HTML 
2011,68,[PDF][PDF] Accessing Cars,"S Cairns, C Harmer - 2011 - racfoundation.org","Page 1. a Accessing Cars Different ownership and use choices Sally Cairns February
2011 Page 2. b The Royal Automobile Club Foundation for Motoring Ltd is a charity
which explores the economic, mobility, safety and environmental … 
",  Cited by 1 Related articles All 2 versions  View as HTML 
2011,68,Placing Reedy Creek Improvement District in Central Florida: A Case Study in Uneven Geographical Development,K Bezdecny - 2011 - scholarcommons.usf.edu,"Page 1. University of South Florida Scholar Commons Graduate Theses and
Dissertations Graduate School 2011 Placing Reedy Creek Improvement District in
Central Florida: A Case Study in Uneven Geographical Development … 
",  Related articles All 3 versions  View as HTML 
2011,68,"Social capital, people's political participation and institutional performance of local government in the north of Thailand.",W Soithong - 2011 - digital.library.adelaide.edu.au,"Page 1. SOCIAL CAPITAL, PEOPLE'S POLITICAL PARTICIPATION AND INSTITUTIONAL
PERFORMANCE OF LOCAL GOVERNMENT IN THE NORTH OF THAILAND Wanlapat Soithong
Thesis submitted for the degree of Doctor of Philosophy in Politics … 
",  Cited by 2 Related articles  View as HTML 
2011,68,[PDF][PDF] MOBILITEITSONDERZOEK BELGIE 2010,S Maerivoet - maerivoet.org,"Page 1. MOBILITEITSONDERZOEK BELGIE 2010 Rapport in opdracht van: NL EVD
International Juliana van Stolberglaan 148 2595 CL Den Haag PO Box 20105 2500
EC Den Haag Nederland 28 Februari 2011 TRANSPORT … 
",  Related articles All 2 versions  View as HTML 
2011,68,"Who are the gentrifiers in new-build gentrification? A study on the''Kop van Zuid''-developments in Rotterdam, the Netherlands.",LAME Bletterman - 2011 - dspace.library.uu.nl,"… Page 18. 18 of central city vitality‟ (p.2343). Through time, a large group of scientists is arguing
that gentrification can be understood in a more expansive way. The extent and meaning of
gentrification changed remarkably (Davidson; Lees; Slater; Smith; Wyly) … 
",  Cited by 2 Related articles  View as HTML 
2011,68,Combinaison des techniques d'optimisation et de l'intelligence artificielle distribuée pour la mise en place d'un système de covoiturage dynamique,M Sghaier - 2011 - theses.fr,"Page 1. 1 N° d'ordre : 174 ECOLE CENTRALE DE LILLE THESE Présentée en vue
d'obtenir le grade de DOCTEUR en Spécialité : Automatique, Génie Informatique,
Traitement du Signal et Image par Manel SGHAIER DOCTORAT … 
",  Cited by 10 Related articles All 4 versions  View as HTML 
2011,68,[PDF][PDF] Voor-en nadelen en logistieke effecten van milieuzones: kansen in Vlaanderen?,"J Maes, C Sys, T Vanelslander - 2011 - repository.uantwerpen.be","Page 1. Beleidspaper Voor- en nadelen en logistieke effecten van milieuzones. Kansen
in Vlaanderen? November 2011 Auteurs: Jochen Maes, Christa Sys, Thierry
Vanelslander Wettelijk depotnummer: D/2011/11.528/5 Steunpunt … 
",  Cited by 4 Related articles All 4 versions  View as HTML 
2011,68,VIVER-Vision für nachhaltigen Verkehr in Deutschland,"W Schade, A Peters, C Doll, S Klug, J Köhler, M Krail - 2011 - econstor.eu","Page 1. econstor Make Your Publications Visible. A Service of zbwLeibniz-
Informationszentrum Wirtschaft Leibniz Information Centre for Economics Schade, Wolfgang
et al. Working Paper VIVER - Vision für nachhaltigen Verkehr in Deutschland … 
",  Cited by 15 Related articles All 11 versions  View as HTML 
2012,50,Methods for Localized Urban Design: A Case Study for the Design Competition Projects of Guangzhou International Financial City [J],"HJWSF Yan - South Architecture, 2012 - en.cnki.com.cn","… Geography;2012-03. 2, Hong Xiangjin Zhu Zhijun Cai Yunnan Li kaimeng;Building
City's Vitality District:Taking Urban Design of Jianshe Road in Tangshan Central Area
for Example[J];South Architecture;2005-05. 3, ZhengMofan … 
",  Cited by 2 Related articles  Cached 
2012,50,[BOOK][B] Integration of information and optimization models for routing in city logistics,J Ehmke - 2012 - books.google.com,"… CPU CRISP CS DBI DLR DM DP EDA EM FA FCD FH FIFO FW GDF GIS GPS HCM ID3 IH ISO
KDD km/h KML KNIME Advanced Traveler Information System BEST Urban Freight Solutions
Classification And Regression Tree Compact Disc City VITAlity Sustainability Central … 
",  Cited by 80 Related articles All 8 versions  
2012,50,Some Issues of Government Audit toward the Good Rule of Government Governance [J],"C SONG, R WANG, Y ZHAO - Journal of Audit & Economics, 2012 - en.cnki.com.cn","… Northern Sichuan Education College;2005-04. 3, Li Renwu;Institutional Innovation
and City Vitality: A Case Study of Building Guangzhou into an Innovative City of
China[J];Urban Insight;2010-04. 4, QIAN Shui-miao(Guanghua … 
",  Cited by 9 Related articles  Cached 
2012,50,Large Livable Neighborhood Planning Strategies In Chongqing [J],"W Facheng, Z Chaolin, Y Ying, F Ying - Planners, 2012 - en.cnki.com.cn","… cityscape,living space,living environment,service facilities requirements.Chongqing central city
livable neighborhoods planning strategies include: low rent housing;diversifying housing
structure;mixed land use and functional aggregation;improving city vitality and transport … 
",  Cited by 1 Related articles  Cached 
2012,50,Vest-pocket Park Case Study and its Illumination [J],"Y Dan - Journal of Green Science and Technology, 2012 - en.cnki.com.cn","… And the appearance of the vest-pocket park alleviate the pressure of the urban high-density central
area well,which create a comfortable,safe and conveniently outdoor 'home' for people.With its
small area,site selecting flexibility,easy to use,improving the city vitality and other … 
",  Cited by 1 Related articles  Cached 
2012,50,Evaluation of environmental impacts of traffic management and control measures,"YY Hu, PJ Zheng, GY Liu… - Advanced Materials …, 2012 - Trans Tech Publ","… The CIVITAS (City-VITAlity-Sustainability) is EC funded initiatives to help European cities to
achieve a more sustainable, clean and energy efficient urban transport system by implementing
and evaluating an ambitious, integrated set of technology and policy based measures … 
",  Cited by 1 Related articles  
2012,50,Sustainable design on urban landscape,"FF Yu, YA Yang, H Li, F Xiang - Advanced Materials Research, 2012 - Trans Tech Publ","… A place with life, culture, exciting activities, naturally it will attract people to go. Thus,
it is easy to realize the venue's value, build cost-effectively; The city's vitality can be
shown up to a certain extent by the citizens' activities. Secondly … 
",  Cited by 1 Related articles  
2012,50,"Application and Analysis of Archetype Coupling in Urban Design—Taking the Special Planning for the Space Layout of Xishui City, Guizhou Province for Example","HY Wei, WT Ding - Advanced Materials Research, 2012 - Trans Tech Publ","… in combination with distribution of urban functions, natural landscapes and regional cultures,
eg Red Army memorial square, tourism landscape park, recreational green corridor, etc., so as
to satisfy selective demands for citizens' life, improving the city's vitality while exhibiting … 
",  Related articles All 2 versions  
2012,50,Discussion on waterfront space design of Pi River in Liu'an,"OUJW Shi-gang - Shanxi Architecture, 2012 - en.cnki.com.cn","… on waterfront space present situation of Pi River in Liu'an,put forward the countermeasures and
suggestions for waterfront space design,helpful for the construction of waterfront space in
Liu'an,so as to improve the city living environment,increased city vitality,created a city style … 
",  Related articles  Cached 
2012,50,Urban Tissue: The Myth of the Organic and the Right to the City in Fictions of the Postdemocratic United States,PW Gallagher - 2012 - search.proquest.com,"Page 1. Urban Tissue: The Myth of the Organic and the Right to the City in Fictions of the
Postdemocratic United States by Patrick W. Gallagher A dissertation submitted in partial
fulfillment of the requirements for the degree of Doctor of Philosophy … 
",  Related articles  
2012,50,[PDF][PDF] Back to Everyday Life: Inspiration for Urban Design in the Continuous Metropolitan Transformation of Hong Kong,"KWM Siu, Y Huang - Constructed Environment, 2012 - researchgate.net","… Qingming Festival. It would be impossible to find another urban space that fit this
special behaviour. Source: Authors These minor practices convey another side of
everyday life that lends the city vitality. However, the government … 
",  Related articles All 5 versions  View as HTML 
2012,50,Retail fragmentation vs. urban livability: Applying ecological methods in urban geography research,"O Rotem-Mindali - Applied Geography, 2012 - Elsevier","… Urban retail development. Discussing urban retail in the context of location and distribution
of shops has become very frequent in this era of consumerism. Retail has always been a
main economic activity affecting city vitality and it continues to be so … 
",  Cited by 33 Related articles All 5 versions  
2012,50,Structure and Performance of Public Governance of Gender Imbalance in China,"Z SHANG, W LI, S YAN - Journal of Xi'an Jiaotong University (Social …, 2012 - en.cnki.com.cn","… University of Technology(Social Science);2010-12. 9, Li Renwu;Institutional Innovation
and City Vitality: A Case Study of Building Guangzhou into an Innovative City of
China[J];Urban Insight;2010-04. 10, Liang Xingzhi;Price Reform of … 
",  Related articles  Cached 
2012,50,Modernism and the Scientific Construction of the Built Environment,"R Lopez - Building American Public Health, 2012 - Springer","… New York City, it may be difficult to walk along Avenue of the Americas between 40th and 50th
streets (near Rockefeller Center), with block after block of drab glass towers fronting on dark
concrete plazas, and not become concerned with Modernism's impact on city vitality.9 To … 
",  Related articles  
