2015,57,The urban complex energy saving effect research,"Y Wang, X Zhang, JF Liu - Applied Mechanics and Materials, 2015 - Trans Tech Publ","… layout. How to effectively renewal for urban, replace and update the idle land
reasonable, realize the city smart growth, make the old city vitality and vigor in, which
is a difficult problem in front of the urban planner and manager … 
",  All 4 versions  
2015,57,Theory Logic and the Realistic Demand on the Rural organization in Social Management,"L Yu-quan - Tianjin Agricultural Sciences, 2015 - en.cnki.com.cn","… 7, Zhang Qing;On the Three-dimensional Construct of Social Management Innovation[J];
Chongqing Social Sciences;2011-09. 8, Li Renwu;Institutional Innovation and City Vitality: A
Case Study of Building Guangzhou into an Innovative City of China[J];Urban Insight;2010-04 … 
",  Related articles  Cached 
2015,57,Civil Organizations: How to Survive and Develop?: A Case Study of “Qing Shao Nian Bao Hu Jia Yuan” Intervening in the Assistance of Special Juvenile,"H Cheng - Sociological Review of China, 2015 - en.cnki.com.cn","… 2011-05. 10, Li Renwu;Institutional Innovation and City Vitality: A Case Study of
Building Guangzhou into an Innovative City of China[J];Urban Insight;2010-04. China
Proceedings of conference Full-text Database, 6 Hits. 1, ;Social … 
",  Related articles  Cached 
2015,57,Research on Efficient Approval System Reform of Enterprise Investment Project——Based on Experience of Keqiao District Shaoxing,"S HU, Y ZHUO, X YE - Journal of University of Electronic Science …, 2015 - en.cnki.com.cn","… Northern Sichuan Education College;2005-04. 4, Li Renwu;Institutional Innovation
and City Vitality: A Case Study of Building Guangzhou into an Innovative City of
China[J];Urban Insight;2010-04. 5, Chen Wei(School of Economics … 
",  Related articles  Cached 
2015,57,ECONOMIC VALUE ANALYSIS OF THE BUSTLE CREATING PROJECTS TOWARD UTILIZATION AND APPLICATION OF STREET SPACE,"H TAKEDA, A KAGA - Journal of Architecture and Planning (Transactions …, 2015 - trid.trb.org","… UTILIZATION AND APPLICATION OF STREET SPACE. 街路空間利活用に向けた
賑わい創出事業に対する経済価値分析. Street spaces are open to everyone, and they
are important factors for indicating the city's vitality to visitors … 
",   Cached 
2015,57,[PDF][PDF] Preparations for the Garden Plot,"A O'Dell - Written By Erin Empey, Pooria Manoochehri, Lydel … - scholarsbank.uoregon.edu","… Page 25. 24 influence it has in building audience relationships within the city. The inclusion of
audience development techniques in an Arts and Culture District will enrich audience-organization
relationships, collaborations, relevance of programming and city vitality … 
",  Related articles All 2 versions  View as HTML 
2015,55,Water-Conserving Design: Contributions of Water Budget Analysis to Resilience in Arid and Semi-arid Regions,"JL Wescoat Jr - South Architecture, 2015 - en.cnki.com.cn","… 2, FANG Li-ming;CHEN Hong;LI Yuan-hang;Jinan City Hero Mountain Scenic Area Management
office;Art School of Shandong Jianzhu University;;Study on Function of Landscape Plants in the
Construction of City Vitality Green Space[J];安徽农业科学;2016-14 … 
",   Cached 
2015,55,"Vibrant, Diverse Central Cities","R Tomalty, A Mallach - America's Urban Future, 2015 - Springer","… Greater income inequality not only works to undermine central-city vitality in itself, but the inequality
between central cities and suburbs in most parts of the United States, particularly in the older regions
of the Northeast and Midwest, is arguably a major factor blocking … 
",   
2015,55,[PDF][PDF] The density dividend: Solutions for growing and shrinking cities,"G Clark, T Moonen - Report from ULI. Retrieved November, 2015 - europe.uli.org","Page 1. The Density Dividend: solutions for growing and shrinking cities October
2015 Authors: Prof Greg Clark Senior Fellow, ULI Europe Dr Tim Moonen Director
of Intelligence at The Business of Cities Ltd Page 2. The Density … 
",  Cited by 8 Related articles  View as HTML 
2015,55,[PDF][PDF] Identity-identification,"I Järnefelt - NA, 2015 - arkitekturforskning.net","… Here Lynch safeguards himself, first stating a highly general validity and then immediately
withdrawing. He then singles out five fundamental dimensions in the good city: vitality, sense,
fit, access and control, as well as two metacriteria: efficiency una justice … 
",  Cited by 1 Related articles  View as HTML 
2015,55,Learning from Canada: Conclusion and Recommendations,"R Tomalty, A Mallach - America's Urban Future, 2015 - Springer","… To foster compact and energy-efficient suburban growth while sustaining and enhancing
central-city vitality, local planning and decision making need to be better integrated with higher
levels of planning and policy making to reflect larger regional and statewide concerns … 
",   
2015,55,Rational Traffic Dispersion,"Y Yangyang - Building Resilient Cities in China: The Nexus between …, 2015 - Springer","… and watercourses as it is, more management and dispersion should be done to
improve the circulating environment. Only by doing so, can traffic flow gallop in the
“blood vein” of city and bring city vitality and vigor. References … 
",  All 3 versions  
2015,55,Do physicists have geography envy? And what can geographers learn from it?,"D O'Sullivan, SM Manson - Annals of the Association of American …, 2015 - Taylor & Francis","… become more interesting when these data are expressed as power law scaling equations
(Bettencourt 2013) that point to a balance between positive effects of social interactions (eg,
economic activity, creativity as measured by patents) that sup- port city vitality and negative … 
",  Cited by 28 Related articles All 7 versions  
2015,55,[PDF][PDF] Sustainable Urban Mobility Plans: Towards a Common European Transport Planning Framework,"P Blyth, M Mladenovic - Journal of Road and Traffic Engineering, 2015 - milosm.info","… A number of web sites also provide guidelines and advice, including KonSULT, ELTIS
portal, the European Platform on Mobility Management, CIVITAS (City-Vitality-Sustainability)
projects such as TELLUS [14], CATALIST and CARAVEL [15] … 
",  Cited by 2 Related articles All 2 versions  View as HTML 
2015,55,Smart Cities—Imposed Requirement or Preferred Life-Style,"D Bērziņa - … Development, Knowledge Society and Smart Future …, 2015 - Springer","… CIVITAS initiative (2002, www.civitas-initiative.org): City-Vitality-Sustainability or
Cleaner and Better Transport in Cities encourages cities to introduce ambitious
transport measures and policies towards sustainable urban mobility; … 
",  Related articles All 4 versions  
2015,55,Toward the sustainable development of urban areas: An overview of global trends in trials and policies,"AM Hassan, H Lee - Land Use Policy, 2015 - Elsevier","Skip to main content … 
",  Cited by 69 Related articles All 6 versions  
2015,56,From the governance of sustainability to the management of climate change: Reshaping urban policies and central–local relations in France,"V Béal, G Pinson - Journal of Environmental Policy & Planning, 2015 - Taylor & Francis","… This involvement really started in the mid-2000 when Nantes integrated transnational municipal
environmental networks and was selected for several programmes such as City-Vitality-
Sustainability (CIVITAS I) (2002– 2006), REVIT (2004–2008) or CONCERTO (2005–2010) … 
",  Cited by 24 Related articles All 4 versions  
2015,56,Developing urban logistics spaces: UCC and PLS in South-Western Europe,"A Trentini, JG Feliu, N Malhéné - 2015 - halshs.archives-ouvertes.fr","… The European Commission launched CIVITAS (City- VITAlity-Sustainability) and the programme
INTERREG III in 2000. The CIVITAS initiative supported cities in the framework of tests of
audacious and novel measures to radically improve urban transport … 
",  Cited by 4 Related articles All 8 versions  View as HTML 
2015,56,Relationship between urban public space and the city vitality,NAN YU - 2015 - politesi.polimi.it,"Abstract Urban public space has been accompanying urban development since the earliest human settlement, but was gradually concentrated on automobile rather than people during the modernism movement, which reduced the city life quality drastically (according to Moshe …",   Cached 
2015,56,首都圏の人口回復地区における土地利用の詳細実態把握,"平山望 - 法政大学大学院紀要 デザイン工学研究科編, 2015 - ci.nii.ac.jp","… This problem has led to an increasing number of vacant houses and vacancies which
finally brings us to a lack of both crime and disaster prevention. As an index of city vitality,
it would be important for each city to maintain its population … 
",  Related articles  Cached 
2015,56,"营造活力空间, 唤醒城市活力——重庆观音桥商业中心区外部空间活力研究","龙梅 - 建筑与文化, 2015 - airitilibrary.com","… 营造活力空间,唤醒城市活力——重庆观音桥商业中心区外部空间活力研究. Forming
active space and awakening city's vitality—— Study on The Outside Space's Vitality
of Guanyinqiao Commercial Center District in Chongqing City … 
",  Related articles All 3 versions  
2015,56,[叫賣聲] 的同與異-評析< 吆喝> 與< 聲音鐘,"黃亦萍 - 中等教育, 2015 - airitilibrary.com","… were analyzed and found the text in the layout began with time as the main two types of lists cries,
but the same in different is this: “Crying” to article focuses on the end is still selling tactics and lines,
while the “Sound Bell” then turn to discuss selling the city's vitality … 
",  Related articles All 2 versions  
2015,56,Canadian Acoustics Cities,"J Lagacé - Canadian Acoustics, 2015 - jcaa.caa-aca.ca","… vibrations going on in Canada. According to the number of articles submitted by teams
and individuals from the research and industrial sectors in Montreal, one can be
convinced of the city vitality and dynamism. In fact, from the … 
",   View as HTML 
2015,56,EV policy compared: an international comparison of governments' policy strategy towards E-mobility,"M van der Steen, RM Van Schelven, R Kotter… - E-mobility in Europe, 2015 - Springer","This paper addresses and explores the different strategies governments
pursue to support the introduction of plug-in hybrid electric vehicles (PHEVs)
and battery electric vehicles (BEVs). This paper...
",  Cited by 28 Related articles All 6 versions  
2015,56,[PDF][PDF] Zrównoważona mobilność miejska jako element planu transportowego,"M MIEJSKA - Logistyka, 2015 - czasopismologistyka.pl","… CIVITAS (ang. City-Vitality-Sustainability). Program oparto na wdrażaniu specjalnych
projektów pilotażowych składają się z kilku, a czasem z kilkunastu działań na rzecz
zrównoważonej mobilności w mieście. Uwzględniając … 
",  Related articles All 5 versions  View as HTML 
2015,56,"Anecdotal History: the New Yorker, Joseph Mitchell, and Literary Journalism","T Katz - American Literary History, 2015 - academic.oup.com","The urban spaces that interest Mitchell become museums of their own history; they permit
us access to their pasts, even as they complicate our relationship to t.
",  Cited by 1 Related articles All 4 versions  
2015,56,From Neighborhoods to Wellbeing and Conservation: Enhancing the Use of Greenspace through Walkability,AA Zuniga Teran - 2015 - repository.arizona.edu,"Page 1. 1 FROM NEIGHBORHOODS TO WELLBEING AND CONSERVATION: ENHANCING
THE USE OF GREENSPACE THROUGH WALKABILITY by Adriana Alejandra Zuniga-Teran … 
",  Cited by 5 Related articles All 2 versions  View as HTML 
2015,56,[BOOK][B] The wonders of light,"M García-Matos, L Torner - 2015 - books.google.com","Page 1. The Wonders of |GH || | MARTA GARCIA-MATOS AND LLUS TORNER Page 2. THE
WONDERS OF LIGHT Discover the spectacular power of light with this visually stunning
celebration of the multitude of ways in which light-based technologies are shaping our society … 
",  Cited by 1 Related articles All 3 versions  
2015,56,Improving Public Understanding of Large-Scale Transit Projects: A case study of the Region of Waterloo's ION,J Bélanger - 2015 - uwspace.uwaterloo.ca,"Page 1. Improving Public Understanding of Large-Scale Transit Projects: A case
study of the Region of Waterloo's ION by Julie Bélanger A thesis presented to the
University of Waterloo in fulfillment of the thesis requirement … 
",  Cited by 1 Related articles All 4 versions  View as HTML 
2015,56,Multi-criteria evaluation method for freight logistics innovations,"A Permala, K Rantasila, M Porthin, V Hinkka… - IET Intelligent Transport …, 2015 - IET","… guidelines [17]. The city-vitality-sustainability or cleaner and better transport in cities
(CIVITAS) initiative was launched in 2002 to support cities in introducing transport
measures and policies towards sustainable urban mobility. During … 
",  Cited by 3 Related articles All 7 versions  
2015,56,[PDF][PDF] Local government transnational networking in Europe: a study of 14 local authorities in England and France,C Huggins - 2015 - core.ac.uk,"… CAQDAS Computer aided qualitative data analysis software CCP Cities for Climate Protection
CEMR Council of European Municipalities and Regions CIVITAS City-Vitality-Sustainability
network CoE Council of Europe CoR Committee of the Regions … 
",  Related articles All 2 versions  View as HTML 
2015,56,[HTML][HTML] L'émergence des politiques de transports urbains durables: le changement en question dans les villes européennes,"D Chabanet, S Coissard, A Lacheret - Revue dEconomie Regionale …, 2015 - cairn.info","… À Toulouse, par exemple, le programme CIVITAS (City – Vitality – Sustainability) a constitué au
début des années 2000 un « catalyseur des changements en cours dans la politique des
transports » (PFLIEGER, 2012), qui a facilité la rupture avec la stratégie de densification … 
",  Cited by 1 Related articles All 8 versions  
2015,56,Assessing the impact of European Union policies on urban transport: a comparative analysis,CM Cavoli - 2015 - discovery.ucl.ac.uk,"… Abbreviations AQAP Air Quality Action Plan AQMA Air Quality Management Area CIVITAS
CIty, VITAlity, Sustainability (EU funding programme) CoM Covenant of Mayors CO2 Carbon
dioxide DECC Department of Energy and Climate Change … 
",  Related articles All 3 versions  View as HTML 
2015,56,A Case Study of Knowledge Transfer. Pedalling for progress with the cargo cycle,"D Jallow, L Johansson - 2015 - gupea.ub.gu.se","… Abbreviations BESTUFS BEST Urban Freight Solutions (EC project) BRT Bus Rapid Transit, a
bus based mass-transit system. CIVITAS CIty-VITality-Sustainability (EC initiative for cleaner and
better transport in cities) CO2 Carbon dioxide DC Distribution Centre … 
",  Cited by 3 Related articles  View as HTML 
2015,56,[PDF][PDF] A Case Study of Knowledge Transfer,"D Jallow, L Johansson - 2015 - handelsradet.se","… Abbreviations BESTUFS BEST Urban Freight Solutions (EC project) BRT Bus Rapid Transit, a
bus based mass-transit system. CIVITAS CIty-VITality-Sustainability (EC initiative for cleaner and
better transport in cities) CO2 Carbon dioxide DC Distribution Centre … 
",  Cited by 2 Related articles  View as HTML 
2015,56,Romaldo Giurgola in Australia and the 'other'modern tradition,SG Schrapel - 2015 - digital.library.adelaide.edu.au,"Page 1. The University of Adelaide Romaldo Giurgola in Australia and the 'Other' Modern
Tradition Stephen G. Schrapel Aldo Giurgola, 2005 by Mandy Martin. Ochre, pigment
and oil on linen. Collection: National Portrait Gallery, Canberra … 
",  Related articles All 2 versions  View as HTML 
2015,55,Urban regeneration and the transformation of the urban waterfront: a case study of Liverpool waterfront regeneration,MMF Hussein - 2015 - eprints.nottingham.ac.uk,"Page 1. Hussein, Mohamed M. Fageir (2015) Urban regeneration and the
transformation of the urban waterfront: a case study of Liverpool waterfront
regeneration. PhD thesis, University of Nottingham. Access from the University … 
",  Cited by 2 Related articles All 2 versions  View as HTML 
2015,55,Progettazione di una bicicletta urbana in legno,JS GARCIA CANO - 2015 - politesi.polimi.it,"Page 1. POLITECNICO DI MILANO Scuola del Design Laurea Magistrale in Design & Engineering
PROGETTAZIONE DI UNA BICICLETA URBANA IN LEGNO Relatrice: Prof. Barbara Del Curto
Correlatore: Prof. Riccardo Gatti Juan Sebastian Garcia Cano (Mat … 
",   View as HTML 
2015,55,Υπολογισμός ανθρακικού αποτυπώματος (carbon footprint) σε στόλο οχημάτων αστικών διανομών της εταιρίας ΑΒ Βασιλόπουλος,Α Ντζούφας - 2015 - dspace.aua.gr,"Page 1. 1 ΓΕΩΠΟΝΙΚΟ ΠΑΝΕΠΙΣΤΗΜΙΟ ΑΘΗΝΩΝ ΤΜΗΜΑ ΑΓΡΟΤΙΚΗΣ ΟΙΚΟΝΟΜΙΑΣ
ΚΑΙ ΑΝΑΠΤΥΞΗΣ ΠΡΟΓΡΑΜΜΑ ΜΕΤΑΠΤΥΧΙΑΚΩΝ ΣΠΟΥΔΩΝ ΟΡΓΑΝΩΣΗ ΚΑΙ ΔΙΟΙΚΗΣΗ
ΕΠΙΧΕΙΡΗΣΕΩΝ ΤΡΟΦΙΜΩΝ & ΓΕΩΡΓΙΑΣ ΣΥΝΕΡΓΑΖΟΜΕΝΟ … 
",  Related articles All 2 versions  View as HTML 
2015,55,[PDF][PDF] DOPRAVA VE MĚSTECH VE VÝUCE ZEMĚPISU: ZAMĚŘENO NA VEŘEJNOU DOPRAVU,MP KAMENÍČEK - theses.cz,"Page 1. UNIVERZITA PALACKÉHO V OLOMOUCI Přírodovědecká fakulta Katedra geografie
Mgr. Petr KAMENÍČEK DOPRAVA VE MĚSTECH VE VÝUCE ZEMĚPISU: ZAMĚŘENO NA
VEŘEJNOU DOPRAVU Rigorózní práce Konzultant: doc. RNDr. Zdeněk Szczyrba, Ph.D … 
",  Related articles  View as HTML 
2015,55,[PDF][PDF] Der Wettbewerb „Südtirol radelt “als er-folgreiche Maßnahme der Radverkehrs-förderung?!,M Belz - d-nb.info,"… BMVI Bundesministerium für Verkehr und digitale Infrastruktur bzgbga Bezirksgemeinschaft
Burggrafenamt CIVITAS CIty-VITAlity-Sustainability (Initiative der EU zur Implementierung
von nachhalti- gem Stadtverkehr) CO2 Kohlenstoffdioxid … 
",  Related articles  View as HTML 
2016,72,"[BOOK][B] The multilingual city: Vitality, conflict and change","L King, L Carson - 2016 - books.google.com","This book is an exploration of the vitality of multilingualism and of its critical importance in and for contemporary cities. It examines how the city has emerged as a key driver of the multilingual future, a concentration of different, changing cultures which somehow manage …",  Cited by 25 Related articles All 3 versions  
2016,72,"A Case Study: Analyzing City Vitality with Four Pillars of Activity—Live, Work, Shop, and Play","M Griffin, BW Nordstrom, J Scholes, K Joncas… - Big data, 2016 - liebertpub.com","This case study evaluates and tracks vitality of a city (Seattle), based on a data-driven approach, using strategic, robust, and sustainable metrics. This case study was collaboratively conducted by the Downtown Seattle Association (DSA) and CDO Analytics …",  Cited by 3 Related articles All 3 versions  
2016,72,[BOOK][B] Caribbean diaspora in the USA: Diversity of Caribbean religions in New York City,B Schmidt - 2016 - content.taylorfrancis.com,"Page 1. Page 2. CARIBBEAN DIASPORA IN THE USA Caribbean Diaspora in the
USApresents a new cultural theory based on an exploration of Caribbean religious
communities in New York City. The Caribbean culture of New … 
",  Cited by 29 Related articles All 4 versions  
2016,72,European plans for the smart city: from theories and rules to logistics test case,"F Russo, C Rindone, P Panuccio - European Planning Studies, 2016 - Taylor & Francis","… reduction of air pollution). However, reviewing CIty, VITAlity and Sustainability initiatives,
some city logistics initiatives have not reached the expected results, due to incomplete
implementing of provided initiatives. The main reason … 
",  Cited by 34 Related articles All 4 versions  
2016,72,[PDF][PDF] The sights and sounds of the multilingual city,"L Carson - The multilingual city: Vitality, conflict and change, 2016 - tara.tcd.ie","Within a short walk of my home beside Dublin Bay, I regularly walk past two park benches on the footpath which seem to be pointing the wrong way. They face away from the road (unlike benches located near bus stops), and instead they are angled towards a stone wall …",  Cited by 3 Related articles  View as HTML 
2016,72,Several Thoughts About the Making of Vitality in Contemporary Cities,"J Difei, L Jingxi - New Architecture, 2016 - en.cnki.com.cn","For the purpose of building public living spaces with vitality and people-oriented environment
in contemporary networked and highly-developed city,this paper analyzes both the concept of
city vitality and three different dimensions on economic,social and cultural aspects.Based … 
",  Cited by 1 Related articles  Cached 
2016,72,Language education in a multilingual city: The case of Limassol,"A Nicolaou, A Parmaxi… - London Review of …, 2016 - ingentaconnect.com","… In Gubrium, JF, and Holstein, JA (eds) Handbook of Interview Research: Context and method.
Thousand Oaks, CA: Sage, 103–20. King, L., and Carson, L. (eds) (2015) The Multilingual
City: Vitality, conflict and change. Bristol: Multilingual Matters … 
",  Cited by 4 Related articles All 3 versions  
2016,72,[PDF][PDF] A FRAMEWORK FOR STRUCTURING CITY LOGISTICS INITIATIVES.,"S Zečević - International Journal for Traffic & Transport …, 2016 - researchgate.net","… In CIVITAS (CIty VITAlity Sustainability) project a large number of innovative city logistics
measures were developed to try to tackle the problems caused by freight deliveries and pickups
in the cities. CIVITAS project has been implemented in four phases … 
",  Cited by 2 Related articles All 3 versions  View as HTML 
2016,72,Selling Smartness Visions and Politics of the Smart City,J Sadowski - 2016 - search.proquest.com,"Selling Smartness Visions and Politics of the Smart City. Abstract. There is much
at stake with the smart city. This urban governance movement is predicated on
infusing information-and-communication technology into nearly … 
",  Cited by 4 Related articles  
2016,72,Comparing French carpoolers and non-carpoolers: which factors contribute the most to carpooling?,"P Delhomme, A Gheorghiu - Transportation Research Part D: Transport and …, 2016 - Elsevier","… First, there are initiatives funded by the European Union such as Increase of Car Occupancy
(ICARO, 1997) and City-VITAlity-Sustainability (CIVITAS, 2002 and 2005) aimed at reducing
the number of cars used and increasing the car-occupancy rate … 
",  Cited by 33 Related articles All 4 versions  
2016,72,Multilingualism and language learning: The Rome city report,"M Menghini - London Review of Education, 2016 - ingentaconnect.com","Page 1. London Review of Education DOI: 10.18546/LRE.14.2.11 Volume 14, Number 2,
September 2016 Multilingualism and language learning: The Rome city report Michela
Menghini* Università degli Studi di Roma Foro Italico (Language Centre) … 
",  Cited by 1 Related articles All 2 versions  
2016,72,[PDF][PDF] “Urban art” as a Landscape Phenomenon in today's Society,"P Adelvand, AS MOUSAVILAR, SA Mansouri - 2016 - academia.edu","… civic life. Urban art by proposing a special image of the cityscape can affect
relationships between the citizens and add a character, uniqueness and quality
to city; moreover, it is able to improve the city vitality. The interpreting … 
",  Cited by 1 Related articles All 6 versions  View as HTML 
2016,72,"The More Stringent, the Better?",JA Bonilla - 2016 - openknowledge.worldbank.org,"Follow World Bank Publications on Facebook, Twitter or Linked-In … 
",  Cited by 4 Related articles  Cached 
2016,72,"On the Subject of Planning----Study on Planning Revision of Junshan Street, Wuhan City","Y Zhu, J Hu - 2016 International Conference on Advances in …, 2016 - atlantis-press.com","… This is exactly the source of city vitality, and it is the nostalgic feelings source to local people.
Furthermore, it is the most important core content to solve the problems, such as consistent
appearance of cities, traffic jams, no room to inhabitants, slums, and cities without context … 
",  Related articles  View as HTML 
2016,72,Correction to: Big Data 2016; 4: 60–66,"M Griffin, BW Nordstrom, J Scholes, K Joncas… - ncbi.nlm.nih.gov","… This corrects the article ""A Case Study: Analyzing City Vitality with Four Pillars of Activity-Live,
Work, Shop, and Play."" on page 60 … 4, no. 1; 60–66), the article ''A Case Study: Analyzing City
Vitality with Four Pillars of Activity—Live, Work, Shop, and Play'' by Griffin et al … 
",  Related articles  
2016,72,City Development in the City of Hämeenlinna: The Views of Locals in Correlation with the Official Strategies,L Särssi - 2016 - theseus.fi,"Page 1. Lari Särssi CITY DEVELOPMENT IN THE CITY OF HÄMEENLINNA The Views of Locals
in Correlation with the Official Strategies Business Economics and Tourism 2016 Page 2.
Avainsanat Kaupunkisuunnittelu, kaupunkistrategia, kansalaisvaikutta- minen … 
",  Related articles All 2 versions  View as HTML 
2016,72,[PDF][PDF] The Power of Place: Evaluating Policies to Transform Distressed Urban Neighborhoods,"L Tach, C Wimer, AD Emory - 2016 - 21stcenturyneighborhoods.org","… Page 10. 21 st Century Neighborhoods Symposium | 3 City Vitality Scores (CVS) … Table 1. City
Vitality Score Components, Top and Bottom 5 Cities in 2010 Population Median Household
Income Employment Rate % of Residents over 25 with BA (or higher) … 
",  Related articles All 3 versions  View as HTML 
