1949,1,Correlation and integration: A study in city building,"AJ Dickson - New Zealand Engineering, 1949 - search.informit.com.au","… They contained slums or advanced decadence, and over wide areas obsolescence was rife.
On main traffic routes congestion frequently was so great as to sap the city's vitality by strangulation.
Authorities seemed to be fighting a losing battle with dis- integrating forces … 
",   
1957,1,The Reconstruction of Warsaw,"S Dziewulski, S Jankowski - Town …, 1957 - online.liverpooluniversitypress.co.uk","… Copyright (c) Liverpool University Press Page 2. 210 THE RECONSTRUCTION OF WARSAW
OCTOBI R of the former population remained. However, the city's vitality gave impetus to
reconstruction. The National Assembly of 165""9 appointed a commission … 
",  Cited by 4 Related articles All 3 versions  
1962,2,Panning the Planners,PA Pfretzschner - 1962 - JSTOR,"… Why, through plan- ning, of course. The sober truth is that Jane Jacobs is a city planner after all.
Only she would do it differently. ""Consider,"" she asks us, ""the kind of goals at which city planning
must begin to aim, if the object is to plan for city vitality."" What are the goals … 
",  Cited by 2 Related articles  
1962,2,The amplitude of design,"EW Strong - Journal of the American Institute of Planners, 1962 - Taylor & Francis","… metropolitan areas. Today we are not competent to do so'' (p. 427). To plan for city vitality
including the “clarifying the visual order of cities,” the planners need to have precise
and thorough knowledge of specific places. “Only supermen … 
",  Cited by 3 Related articles  Library Search 
1964,1,[PDF][PDF] The relationship of traffic attracted to zones in a city's central business district to intrazonal floor space use,PH Wright - 1964 - smartech.gatech.edu,"Page 1. ""In presenting the dissertation as a partial fulfillment of the requirements
for an advanced degree from the Georgia Institute of Technology, I agree that the
Library of the Insti- tution shall make it available for inspection … 
",  Cited by 2 Related articles All 2 versions  View as HTML 
1965,1,[PDF][PDF] Relationships of Traffic and Floor Space Use in the Central Business District,"PH Wright - Highway Research Record, 1965 - onlinepubs.trb.org","… METROPOLITAN POPULATION, THOUSANDS Figure 1. Relationship of retail coefficients
to city population. 4000 Page 7. 160 size. A comparison of certain economic measures of
city vitality seems to mirror the differences noted in the traffic models … 
",  Cited by 3 Related articles All 2 versions  View as HTML 
1970,1,Poetry for Urban Youth: A Selected Booklist of Individual Collections And Anthologies of the 1960's,"LB Hopkins - Elementary English, 1970 - JSTOR","… of the future. Because of my own love for the city, I have cast my vote for revitalizing
these centers of life and growth. Leťs allow young people to catch and appreciate
the city's vitality, spirit, and many moods. Read them a poem … 
",  Cited by 1 Related articles All 2 versions  
1971,1,[BOOK][B] A Selection of Views on the Reorganization of Government in Greater Winnipeg,"L Axworthy, J McNiven, P Wichern, J Cassidy… - 1971 - winnspace.uwinnipeg.ca","… These are the kinds of places that give a city vitality and color. The list could be extended. What
is important is that the above priorities show that a very different kind of local government is
needed in order to give leadership to this community in finding answers for the future … 
",  Cited by 2 Related articles All 2 versions  View as HTML 
1972,2,Urban Dynamics and public policy,"MH Whithed - IEEE Transactions on Systems, Man, and …, 1972 - ieeexplore.ieee.org","… The analysis Banfield develops correlates rather well with that of Forrester in Urban Dynamics
when he suggests that public housing programs for the underemployed only lead to a deterioration
of the city's vitality for all classes, includ- ing the underemployed who were … 
",  Cited by 5 Related articles All 2 versions  
1972,2,[PDF][PDF] Lowell dynamics: preliminary applications of the theory of urban dynamics.,WW Schroeder - 1972 - dspace.mit.edu,"… (7) Toward the end of the nineteenth century, however, the city's vitality, as measured
by the growth in population (Figure 2) began to falter. Even before growth actually
stopped, people in the city were aware that their city was changing … 
",  Cited by 6 Related articles  
1973,1,[PDF][PDF] Quadatt II: a transportation planning tool,ML Schlappi - 1973 - vtechworks.lib.vt.edu,"Page 1. QUADATT II: A TRANSPORTATION PLANNING TOOL . h by ' Mark Lelanci Schlappi _
Thesis submitted to the Graduate Faculty of the Virginia Polytechnic Institute and State University
in partial fulfillment of the requirements for the degree of MASTER or ScTEMcE in … 
",  All 2 versions  View as HTML 
1974,1,Urban Poverty in Varanasi,"R Saxena - Economic Affairs (Calcutta), 1974 - search.proquest.com","… congestion. Because the inter-dependence of different functional areas on which
depends the city's vitality is so much dependent upon a fine and smooth flow of traffic,
the problems of traffic bottleneck need attract particular attention … 
",   
1975,4,[PDF][PDF] Yanaquana the favored spot a humane inner-city habitation,LA Olson - 1975 - ttu-ir.tdl.org,"… 2.10 8.9 SAN ANTONIO RIVER CORRIDOR STUDY The importance of San Antonio's ""downtown"" -
the square mile roughly bounded by the old Ursullne Academy, HemisFalr, La Villita, and the
public market - to the city's vitality and regional role cannot be exaggerated … 
",   View as HTML 
1975,4,Rome (Lazio),"E Brody, C Brook - The Music Guide to Italy, 1975 - Springer","… Saint Peter's stands at its center. The residential sections of Rome-its seventeen
quartieri-stretch around the ancient Aurelian Wall and continue to grow at an impressive
rate, testifying to the city's vitality and ability to survive in today's civilization … 
",   
1975,4,[PDF][PDF] A contextual approach to preservation.,HB Sittler - 1975 - dspace.mit.edu,"Page 1. A CONTEXTUAL APPROACH TO PRESERVATION by HELEN BUSH SITTLER BA,
Wellesley College (1969) SUBMITTED IN PARTIAL FULFILLMENT OF THE REQUIREMENTS
FOR THE DEGREE OF MASTER OF ARCHITECTURE at the … 
",  Related articles  View as HTML 
1975,4,"Censorship and society in Munich, 1890-1914",R Lenman - 1975 - ora.ox.ac.uk,"Page 1. THBSI3 SUBMITTED FO* XHii DEQUES OF DOCTOR UF USIVJ&aSITY OF OXFOitD
CENSOHSHIP AJSfl SOCIETY IK MUNICH, 1890 - 1914. WITH SPECIAL HSFBHJSNOS TO
SIMPLICISSIKUS* AND THE PLAYS OF FHAUK WEDMCIKD HJV Lenman … 
",  Cited by 4 Related articles  View as HTML 
1976,1,On the death of cities,"WC Baer - The Public Interest, 1976 - search.proquest.com","… Neither can meet the mass needs occasioned by poverty, deterioration, and decay. As to a slowing
down of deterioration and decay in the inner city because the suburbs are no longer developing
rapidly and thereby draining off central- city vitality, that is probably a mirage … 
",  Cited by 40 Related articles  
1978,4,"AFRO-AMERICA'S"" FIRST NEW ORLEANS POET""",A Aubert - 1978 - JSTOR,"… The scene emblemizes a central aspect of the city's vitality, of its vulnerability as well; it springs
emblematically out of the city's ceremonial past, reminding us simultaneously of the ease with
which ceremony is co-opted, made captive to materialistic ends … 
",   
1978,4,Growth and Clean Air,"J Heritage - EPA J., 1978 - HeinOnline","… percent sales tax on commercial garage parking. Schneider isn't worried about hurting
the city's growth. ""If we move people better, we'll improve the city's vitality,"" he says.
""With congested streets, the promise of new development … 
",   
1978,4,New York's Crisis--and Washington's,"R Starr - Commentary, 1978 - search.proquest.com","… if not, what the consequences will be. To many serious observers, however, news
of the budget slippage, thlough disconcerting, was by no means the !ast word on
the city's vitality. They pointed out that municipal tax revenues … 
",  Cited by 1 Related articles  
1978,4,Scoring Los Angeles Landscapes: Environmental Education in an Urban Setting.,CL Salter - 1978 - ERIC,"… u-gan!.- zing, recording, accounting, reckoning, orchestrating, tallying, and arranging its elements
to, in essence, evaluate its impact on our lives. As we explore Los Angeles over the course of
this Institute we will establish our own scores for assessing the city's vitality … 
",   View as HTML 
1978,4,"AFRO-AMERICA'S"" FIRST NEW ORLEANS POET""",A Aubert - 1978 - JSTOR,"… The scene emblemizes a central aspect of the city's vitality, of its vulnerability as well; it springs
emblematically out of the city's ceremonial past, reminding us simultaneously of the ease with
which ceremony is co-opted, made captive to materialistic ends … 
",   
1978,4,Growth and Clean Air,"J Heritage - EPA J., 1978 - HeinOnline","… percent sales tax on commercial garage parking. Schneider isn't worried about hurting
the city's growth. ""If we move people better, we'll improve the city's vitality,"" he says.
""With congested streets, the promise of new development … 
",   
1978,4,New York's Crisis--and Washington's,"R Starr - Commentary, 1978 - search.proquest.com","… if not, what the consequences will be. To many serious observers, however, news
of the budget slippage, thlough disconcerting, was by no means the !ast word on
the city's vitality. They pointed out that municipal tax revenues … 
",  Cited by 1 Related articles  
1978,4,Scoring Los Angeles Landscapes: Environmental Education in an Urban Setting.,CL Salter - 1978 - ERIC,"… u-gan!.- zing, recording, accounting, reckoning, orchestrating, tallying, and arranging its elements
to, in essence, evaluate its impact on our lives. As we explore Los Angeles over the course of
this Institute we will establish our own scores for assessing the city's vitality … 
",   View as HTML 
1979,6,[PDF][PDF] The city as metaphor in selected novels of James Purdy and Saul Bellow,YN Singh - 1979 - ecommons.luc.edu,"Page 1. Loyola University Chicago Loyola eCommons Dissertations Theses and
Dissertations 1979 The City as Metaphor in Selected Novels of James Purdy and
Saul Bellow Yashoda Nandan Singh Loyola University Chicago … 
",  Related articles All 4 versions  
1979,6,Urban Noise and Neighborhood Organizations,"M Kottler - EPA J., 1979 - HeinOnline","… the city. Noise is therefore a blighting influence as well as a health problem. City vitality
and noise seem to be prac- tically synonymous. Yet, excessive noise can be harmful to
city residents and serves to inhibit common patterns of behavior … 
",   
1979,6,Urban Pioneers,"RL Burke - EPA J., 1979 - HeinOnline","… This time, there's a better chance that the city's vitality won't fall prey to other historical ironies
and that unlike the first Lowell experiment, this sec- ond one will see economic and environ-
mental needs complementing one another. 0 EPAJOURNAL
",   
1979,6,The Writer in the Crowd: Poe's Urban Vision,"LP Miller - ATQ, 1979 - search.proquest.com","… a pattern, they say, into which Poe fits well, Poe's relationship with the city was seldom so
one-sided.1 Poe did regret the grislier aspects of city life which seemed to undermine both the
American and the human experience; yet he was also charmed by the city's vitality and awed … 
",  Cited by 6 Related articles  
1979,6,Spatial Dimensions of Human Crowding,"Ö Esmer - Human Consequences of Crowding, 1979 - Springer","… More recently, J.Jacobs asserts ""the need for concentration whatever the purpose there
may be there"" and thinks that 100 dwellings per acre (ie 250 dwellings per hectare) will
be found too low to produce city vitality and diversity (Jacobs, 1961) … 
",   
1979,6,[BOOK][B] Music Guide to Italy,"E Brody, C Brook - 1979 - books.google.com","Page 1. º, -º-, Bºbº, - º º_Claire Brook_ſº sº sº 2 º KS º - - Nº º - MACMILLAN REFERENCE
BOOKS Page 2. THEGMUSIC (GUIDE TO GITALY Page 3. GELAINEGBRODY
(CLAIRE9ER(OOK THEGMUSIC (GUIDE TO) GITALY M Page 4 … 
",  Cited by 2 Related articles All 2 versions  
1980,3,World War II: Opening the Home Front,A Saxton - 1980 - JSTOR,"… Page 4. 396 REVIEWS IN AMERICAN HISTORY / September 1980 ""The city's vitality
was further sapped by the ceaseless flight to the suburbs, facilitated now by federally
constructed expressways that led to federally financed factories … 
",  Cited by 1 Related articles  
1980,3,[BOOK][B] Learning from Seattle,"R Brambilla, G Longo - 1980 - books.google.com","Page 1. of which are described in these pages. It is set in a beautiful natural
environment which encourages excellence in that which is man-made and it is
blessed with a tradition of citizen initiative. The city's residents share … 
",  Cited by 9 Related articles  
1980,3,[PDF][PDF] Clllb of Portland,"A Biskar, AM Davis, RJ Frasca, AM Gaylord, J Wiley - 1980 - pdxscholar.library.pdx.edu","Page 1. Portland State University PDXScholar City Club of Portland Oregon Sustainable
Community Digital Library 5-19-1980 A Report on a Vision of Portland's Future City Club of
Portland (Portland, Or.) Let us know how access to this document benefits you … 
",  Related articles All 2 versions  
1981,2,Scotland as the cradle of modern academic geography in Britain,"EN Lochhead - Scottish geographical magazine, 1981 - Taylor & Francis","… philosophical and literary criticism. Edinburgh, in addition, benefited from the presence
of many pro- gressive and innovative thinkers besides the university staff, who
reinforced the city's vitality as an intellectual centre. Much of the … 
",  Cited by 16 Related articles  
1981,2,"[PDF][PDF] The impact of office, retail, and industrial development on neighborhood change: evaluating development alternatives for the Cambridgeport Industrial District",RM Whitman - 1981 - dspace.mit.edu,"… population. First, extreme diversity of the city's population -- ethnically, socially,
racially -- is deemed to be one of Cambridge's most unique and valuable qualities,
one which contributes imensely to the city's vitality. Secondly … 
",  Cited by 1 Related articles All 2 versions  View as HTML 
1982,4,The effect of proposed district centres on Melbourne's central business district,"RA Carter - Urban Policy and Research, 1982 - rsa.tandfonline.com","… residential accommodation. This will encourage the development and maintenance
of service industries in the inner area and contribute far more to inner city vitality
than office blocks that are deserted after 6 pm References … 
",  Cited by 6 Related articles All 2 versions  
1982,4,[BOOK][B] Urban America in the Eighties: Perspectives and Prospects: Report of the Panel on Policies and Prospects for Metropolitan and Nonmetropolitan America,DA Hicks - 1982 - books.google.com,"Page 1. Edited bv ^^^^^H »J0 DA. HICKS URBAN EIGHTIE Perspectives and Prospects
With a new introduction bv Page 2. Page 3. Page 4. Page 5. URBAN AMERICA ill the
EIGHTIES This one W7TQ-RF3-RN5H Page 6. * * * * * PRESIDENTS … 
",  Cited by 6 Related articles  
1982,4,"[PDF][PDF] An Office Building for Independence Center, A Mixed-Use Facility for Charlotte, NC",FE Weaver III - 1982 - tigerprints.clemson.edu,"… functional urban core. On one hand, the city's dynamic skyline, new cultural facilities, retail
and residential renewal efforts and the government center demonstrate the city's vitality and
strength. On the other hand, the unused, obsolete buildings and … 
",  All 2 versions  
1982,4,"[PDF][PDF] A Hotel for Independence Center, A Mixed-Use Facility for Charlotte, NC",JM Williams Jr - 1982 - tigerprints.clemson.edu,"… functional urban core. On one hand, the city's dynamic skyline, new cultural faci 1 ities, retail
and residential renewal efforts and the government center demonstrate the city's vitality and
strength. On the other hand, the unused, obsolete buildings and … 
",  All 2 versions  
1983,1,Consequences of public ownership and subsidies for mass transit: evidence from case studies and regression analysis,"J Pucher, A Markstedt - Transportation, 1983 - Springer","… infra- structure and vehicles. They also estimated that capital subsidies had had
negligible impacts on-transit ridership, central city vitality, roadway congestion, pollution
levels, and mobility of the poor. More recent studies generally … 
",  Cited by 59 Related articles All 4 versions  
1984,6,[PDF][PDF] Beyond the core area initiative: prospects for downtown Winnipeg,EA Levin - 1984 - winnspace.uwinnipeg.ca,"… stagnation; continuing sporadic but unsuccessful attempts to deal with local crises;
continuing ebbing of our city's vitality; and greater and greater intrusion of the
provincial and federal governments into our city's affairs, on the … 
",  Cited by 2 Related articles All 3 versions  View as HTML 
1984,6,Urbanization in the American West,"G Barth - Business History Review, 1984 - cambridge.org","… Page 4. 266 BUSINESS HISTORY REVIEW have contributed to the city's vitality and how Eero
Saarinen's Gateway Arch symbolizes the heritage of the westward migration and the rise of a
""New St. Louis."" The historical forces that swept so vigorously over St … 
",  Cited by 1 Related articles All 8 versions  
1984,6,"Primm, James Neal,"" Lion of the Valley: St. Louis, Missouri""(Book Review)","G Barth - Business History Review, 1984 - search.proquest.com","… Page 4. 266 BUSINESS HISTORY REVIEW have contributed to the city's vitality and how Eero
Saarinen's Gateway Arch symbolizes the heritage of the westward migration and the rise of a
""New St. Louis."" The historical forces that swept so vigorously over St … 
",   
1984,6,"Miner, H. Craig,"" Wichita: The Early Years, 1865-80""(Book Review)","G Barth - Business History Review, 1984 - search.proquest.com","… He effectively assesses both how ethnic groups 266 BUSINESS HISTORY REVIEW have
contributed to the city's vitality and how Eero Saarinen's Gateway Arch symbolizes the
heritage of the westward migration and the rise of a St. Louis … 
",   
1984,6,Ezra Pound's Metamorphosis During his London Years: From Late-Romanticism to Modernism,"W Baumann - Paideuma, 1984 - JSTOR","… We know that he was enthusiastic about the new campanile style sky-scraper architecture
and took some delight in the city's vitality, which had already been immortalized by Walt
Whitman, but his few contacts with artists came to nothing … 
",  Cited by 3 Related articles All 2 versions  
1984,6,Recounting Federal Policy on Transit Operating Assistance,"R Cervero - Journal of Urban Affairs, 1984 - Taylor & Francis","… STATE RESPONSES Increaae business activity and central city vitality- Improve the mobility
of the poor, young, elderly, and handicapped r Conserve enerqy … Increase business activity and
central city vitality Conserve land that would otherwise be used for streets and parking … 
",  Related articles All 2 versions  
1985,6,"The Personality of Cities: Boston, New York, Philadelphia","M Keller - Proceedings of the Massachusetts Historical Society, 1985 - JSTOR","… for the true time, and feels on leaving it as if he had been wound up and regulated anew."" Walt
Whitman took note in i860 of the city's ""heavy, low, musical roar, hardly ever intermitted"" ; and
several gen erations later Richard Watson Gilder celebrated the city's vitality: ""Stream of … 
",  Cited by 2 Related articles  
1985,6,All the city's a stage: a cultural center for Boston,GW Schnee - 1985 - dspace.mit.edu,"… spectacle and observation occur throughout the city at a variety of scales. A city's vitality comes
largely from its great concentration of humanity. When people come together, an expressive
energy usually arises as creativity, ideas. passions. and talents are shared … 
",   Cached 
1985,6,"An Overview of Historic Preservation Practices in Belgium, the Netherlands and the United States","MH Mazey - Journal of Urban Affairs, 1985 - Taylor & Francis","… As a consequence, residences are integrated into commercial areas. It is quite common to find
shop owners residing above their place of business. Therefore, structures serve a dual purpose,
and the dual function maintains inner city vitality in an historical setting. 41 Page 2 … 
",  Related articles All 2 versions  
1985,6,Paestum in a Roman Context,"RE Mitchell - Journal of Aesthetic Education, 1985 - JSTOR","… autonomous Latin set- tlement. A forum, with a portico made of reused Doric columns,
replaced the agora, and markets, shops, and public and sacred buildings surrounded
the area and attested to the city's vitality. Among the earliest … 
",  Related articles All 2 versions  
1985,6,Architecture: building the body politic,"J Kupfer - Social Theory and Practice, 1985 - pdcnet.org","… over the larger, public circumstances of life. In discussing sidewalk contact, Jane
Jacobs points out that the most important factor determining city vitality is casual,
everyday, public interaction. In the course of their daily comings … 
",  Cited by 4 Related articles All 3 versions  
1985,6,"[PDF][PDF] Downtown Trolley Car Station Facility: El Paso, Texas",SA Hadley - 1985 - ttu-ir.tdl.org,"Page 1. TEXAS TECH UNIVERSITY DEPARTMENT OF ARCHITECTURE .^""-J-
DOWNTOWN TROLLEY CAR STATION FACILITY OOWNTOWM CB.O. ELPA ^ ^ E ) ^
SCOTT A. HADLEY ^ ^^^ ^ Page 2. DEDICATIDN THIS PRUGF … 
",  Related articles All 2 versions  View as HTML 
1986,5,Down There on a Visit: Late Nineteenth-Century Guidebooks to the City,"L Hapke - Journal of Popular Culture, 1986 - search.proquest.com","… he is signaling his leader to identify with the prosperous, or a( any rate with those whose
livelihoods are not, like the begrimed ""beggars and laborers,"" dependent on the street.'6 Perhaps
more importantly, there is no sense in the above passage that the city's vitality and beauty … 
",  Cited by 6 Related articles All 2 versions  
1986,5,The Future of Western History: The Third Wave,"JL August - The Journal of Arizona History, 1986 - JSTOR","… The shift from public to private transportation in the early twentieth century facilitated
this process and lifiked rural westerners with the metropolis. Paradoxi- cally, the
automobile carried the city's vitality from its center to the periphery … 
",  Cited by 2 Related articles  
1986,5,[PDF][PDF] Urban Stadium,E Moss - 1986 - surface.syr.edu,"… cities but due to the building's response to site each stadium will be unique —urban stadiums
are legitimized which a. reinstates this building types ability to function as an organizer of city
life and form b. strengthens understanding as team as symbol of a city's vitality c. enriches … 
",  All 2 versions  
1986,5,[HTML][HTML] Marrakech revisitée ou les villes dans la ville,"JF Troin - Méditerranée, 1986 - persee.fr","… But these touristic activities support only a small proportion of the urban dwellers. The main
reason of the city vitality is a heavy and alive handicraft. The «urban explosion» of the town
leads to very contrasted districts, slewing round the overcrowed Medina … 
",  Cited by 4 Related articles All 2 versions  
1986,5,Unvernacular Vernacular: Contemporary American Consumerist Architecture,"J Chase - Design Quarterly, 1986 - JSTOR","Page 1. Unvernacular Vernacular Contemporary American Consumerist Architecture Design
Quarterly 131 Essay and photographs by John Chase This content downloaded from
66.249.79.2 on Wed, 19 Jun 2019 05:45:38 UTC All use subject to https://about.jstor.org/terms … 
",  Cited by 2 Related articles  
1987,3,Street management and city design,"EP Fowler - Social Forces, 1987 - academic.oup.com","… Jacobs' prescriptions for North American cities used concepts which closely paralleled
these characteris- tics of North America's postwar development. Very briefly, her
argument was that a city's vitality is nurtured by physical diversity … 
",  Cited by 51 Related articles All 6 versions  
1987,3,Face as an image of the city: an integrated approach toward city diagnosis,JCS Wang - 1987 - ttu-ir.tdl.org,"… urban economic studies or urban social studies. This dissertation will employ an interdisciplinary
approach in identifying city vitality. b. To establish a more complete and comprehensive city data
bank: A city data bank is indispensable for urban analysis and comparison. City … 
",  All 4 versions  View as HTML 
1987,3,[PDF][PDF] Using concensus (sic) building techniques to assist in dev. of historic...,MLP Elliott - 1987 - smartech.gatech.edu,"Page 1. 14:21:10 OCA PAD INITIATION - PROJECT HEADER INFORMATION 09/22/87 Active
Project #: D-48-807 Ze-ntexT5154-0A0 Contract#: CONT DTD 870909 1 Prime Yh
1B02L22P0801QB1A0 `^' Subprojects ? : N Main project #: Cost share #: Center shr #: Mod # … 
",   View as HTML 
1988,6,American downtowns: Past and present attempts at revitalization,"RJ Carey - Built Environment (1978-), 1988 - JSTOR","Page 1. American Downtowns: Past and Present Attempts at Revitalization ROBERT J. CAREY
The US retail industry left the city with the out-movement of jobs and people in the 1950s and
1960s - and the 'mailing of America' caused major decline in many city centres … 
",  Cited by 21 Related articles All 2 versions  
1988,6,The urban underground space environment and human performance,"H Xueyuan, S Yu - Tunnelling and underground space technology, 1988 - Elsevier","… within 15 m, under the central district. I II Shanghars experience has proven that use
of the underground natural resource can contribute to a city's vitality and vigor. Field
Measurement and Analysis of the Underground Environment … 
",  Cited by 7 Related articles  
