Evikenobi,Dec 2016,5,Great hotel with everything you need!,"I rented the studio for 5 days and it was just wonderful, I loved the design. Since this is a slef service hotel, I didn't see the staff a lot, but the ones I saw were very friendly. The breakfast was a bit repetitive, but still good. On my last night I had some problems with…","Response from Hotel_Lundia, Hotelldirektör at Hotel FinnResponded Dec 11, 2016","Responded Dec 11, 2016","Thank you for the Review and my apologies for the disturbance from your neighbour, I'm glad our staff could assist you.  We hope to see you here again.  Best regards Christian Weste Hotel Manager ",Date of stay: November 2016,"[All, languages]",119
Johannes Venlona,Nov 2016,4,Lund onder de rook van Malmo,Een net hotel onder de rook van Malmo. Voor een lang verblijf geschikt en de studio zijn groot en schoon. Direct in de buurt van restaurants en verschillende mooie golfcourts die in de natuur verscholen liggen. Binnen een half uurtje bent u in het centrum van Malmo.,"Response from Hotel_Lundia, Hotelldirektör at Hotel FinnResponded Dec 11, 2016","Responded Dec 11, 2016","Thank you for taking the time Writing about your stay, I'm glad you enjoyed it here.  Hope to see you soon again.  Best regards Christian Weste Hotel Manager",Date of stay: January 2016,"[All, languages]",119
Анна Н,Nov 2016,4,Отель-робот у трассы,"Если номер будет в сторону трассы - шумно, поскольку по ней курсируют как междугородние автобусы, так и кареты скорой помощи  (или полиция) с сигналкой... Все системы автоматизированы и персонала нет, кроме девушки утром, смахивающей крошки со столиков и подающей что-либо…",,,,Date of stay: November 2016,"[All, languages]",119
HalfLund,Nov 2016,3,"Decent, but not very business travel friendly.","If you need a place to stay with a very flexible check in and check out logistics this is a good place because it's self-checking. That doesn't mean there's no one there to act as reception, but their availability is limited. Some things in the lobby to keep you entertained.…","Response from Hotel_Lundia, Hotelldirektör at Hotel FinnResponded Dec 11, 2016","Responded Dec 11, 2016","Thank you for taking the time reviewing us. I'm sorry to hear that you stay didn't match your expectations, despite Nutella for breakfast.  I'm curious to find out which room you stayed in, just to make sure that our houseman has had a look at the electricity.  Best regards Christian Weste Hotel Manager",Date of stay: September 2016,"[All, languages]",119
Per D,Nov 2016,4,Bra hotell i utkanten av Lund,"Trevligt och enkelt hotell i utkanten av Lund. Enkla, moderna och rena rum. Bra och trevlig personal. Hotellet har också större lägenheter som man kan hyra. Hotellet har enkel men ok frukost. Det finns ingen restaurang på hotellet men en bra pizzeria runt hörnet.","Response from Staff_HotelFinn, Hotellvärdinna at Hotel FinnResponded Nov 13, 2016","Responded Nov 13, 2016","Hej Per,  Tack för att du har tagit dig tiden att lämna ett omdöme, det uppskattar vi. Varmt välkommen fler gånger.  Med vänliga hälsningar, Emelie Jörgensen",Date of stay: November 2016,"[All, languages]",119
Raul_11111,Oct 2016,2,Don't clean the room between days!!,"Coffee machine usually broken or malfunctioning, nobody in the reception during night. If you have a problem, the only way is contacting someone outside by phone.   Poor breakfast, and far from downtown.   Some thermostats are unintentionally blocked, so you cannot change the…","Response from Hotel_Lundia, reception at Hotel FinnResponded Oct 18, 2016","Responded Oct 18, 2016","Dear Raul,  Thank you for taking the time and reviewing us, we appreciate that. That is true, there is no staff at the hotel during nighttime but there is always possible to get in contact with the staff if there would be any problems or doubts. The temperature is set for the whole hotel to be at a convenient temperature for our guets.  We have taken your thoughts into consideration and if you would like to book again, please ontact us directly at info@lundia.se. We have two other hotels, Hotel Lundia and Grand Hotel, they might be a better choise for your needs.  Again, thank you for taking the time and we wish to welcome you back again. Wish you the best,  Best Regards Martina Bergqvist",Date of stay: September 2016,"[All, languages]",119
Gime H,Oct 2016,5,Excelente habitacion!,"Nos quedamos 2 noches en este hotel y nos parecio excelente! De hecho si tenian lugar queriamos cancelar nuestra estadia en Malmo y quedarnos una noche mas (son solo 15 minutos en auto).  La habiatacion era super grande (la mas completa el hotel), tenia una cocina muy bien…","Response from Hotel_Lundia, Receptionist at Hotel FinnResponded Oct 18, 2016","Responded Oct 18, 2016","Dear Gime,  I was very glad to read your review of Hotel Finn, thank you very much for writing so many kind words about us. We really appreciate it.  I am glad to hear that you had a convenience stay and hope to see you again in the furture.   Wish you the best and welcome back to Lund and Hotel Finn.  Best Regards Martina Bergqvist",Date of stay: September 2016,"[All, languages]",119
NTIcedCoffee,Oct 2016,4,Pretty good for a short stay,"Things we liked:  - Full sized sofa bed in our studio room for our child to sleep on. - Free laundry facilities! - Location of the property, both to the Lund central square (15 minutes walking) and to the highways in the local region. - Basic kitchen facilities in the room. -…","Response from Hotel_Lundia, Receptionist at Hotel FinnResponded Oct 18, 2016","Responded Oct 18, 2016","Dear,  Thank you very much for writing such a nice and a accurate review about Hotel Finn, we appreciate that a lot.  I am very glad to hear that you had a convenience stay and wish to welcome you back in the furture.  Best Regards Martina Bergqvist",Date of stay: September 2016,"[All, languages]",119
Jan B,Sep 2016,5,Best place to stay in Lund!,"As I travel to Skåne on a regular basis, it took me a while to find the best place to stay. I have now found it: Hotel Finn in Lund. A great concept of very comfortable apartments, a nice gym, great connections both by car and public transport. My favorite place for sure!","Response from Hotel_Lundia, Hotelldirektör at Hotel FinnResponded Oct 2, 2016","Responded Oct 2, 2016","Dear Jan  Many thanks for your kind words, I'm glad to hear that you are enjoying your time with us. I'll make sure Camilla & Emelie will spread this among our colleagues.  Best regards Christian Weste Hotel Manager",Date of stay: September 2016,"[All, languages]",119
Giulio,Sep 2016,5,Ottimo,"Camere pulite ed insonorizzate. Arredamenti nuovi,  staff cordialissimo e giovane. Palestra funzionale e parcheggio di fronte l'albergo senza costi aggiuntivi. Colazione abbondante a buffet. Ci tornerò sicuramente ","Response from Hotel_Lundia, Receptionist at Hotel FinnResponded Oct 18, 2016","Responded Oct 18, 2016","Dear Giulio,  Thank you a lot for taking your time to review us, that means very much. I am happy that you liked the breakfast and that you had a nice stay.  We wish to welcome you again to Hotel Finn.  Best Regards Martina Bergqvist",Date of stay: September 2016,"[All, languages]",119
LoveHI7782,Sep 2016,5,Einfach perfekt!,"Das Finn ist von außen eher nicht gleich als Hotel zu erkennen, da es in Bürogebäude eingebettet ist. Self Check-In war kein Problem. Wir hatten ein Zimmer im hinteren Teil des Komplexes. Sehr sauber, modern, sehr geräumig mit kleiner Küchenzeile und ruhig. Das Frühstück war gut…","Response from Hotel_Lundia, Receptionist at Hotel FinnResponded Oct 18, 2016","Responded Oct 18, 2016","Dear,  Thank you a lot for taking time and writing a very nice review for Hotel Finn. That mean a lot to us. I am happy to hear that you liked the breakfast, we are very satisfied with it.  We wish to welcome you to us again.  Best Regards Martina Bergqvist",Date of stay: August 2016,"[All, languages]",119
lisacon,Sep 2016,3,Somewhat disappointing,"This is our second stay at Hotel Finn of a week or more.  Many of our friend who visited when we lived here stayed here as well.   Obviously it was good enough to return but it seems things are moving in the wrong direction.  First, the location is great if you want to be in…","Response from Hotel_Lundia, Hotelldirektör at Hotel FinnResponded Oct 2, 2016","Responded Oct 2, 2016","First and foremost, thank you for taking the time writing about your experiences. My apologies for not living up to your expectations this time around. I would very much like to get in touch with you personally and you are most welcome to contact me at christian.weste@lundia.se  Best regards Christian Weste Hotel Manager",Date of stay: September 2016,"[All, languages]",119
Chloé D,Aug 2016,2,Un hôtel déshumanisé...,"Ici, personne pour vous accueillir, vous servir, vous indiquez quoi que ce soit. Comme dit dans un précédent commentaire, vous entrez dans l'hôtel, vous vous retrouvez face à des bornes électroniques qui vous donnent votre carte d'hôtel. Vous vous débrouillez pour trouver votre…","Response from Hotel_Lundia, Receptionist at Hotel FinnResponded Oct 18, 2016","Responded Oct 18, 2016","Dear Cholé,  Thank you for taking time and reviewing Hotel Finn, that means a lot to us. I am glad that the check in and check out went well for you, as you wrote, it is a self-service check-in machine but there is always possible to get help if there would be any doubts or problem.  Again, thank you and we wish to welcome you again to Hotel Finn. Wish you a nice day.  Best Regards Martina Bergqvist",Date of stay: August 2016,"[All, languages]",119
Lovisa S,Aug 2016,2,Sämre än förväntat men helt ok,Hade läst rekommendationer innan jag bokade på Finn men blev besviken när jag kom in i rummet. Hotellet är helt okej och ligger ganska nära centrum. Jag är dock besviken på rummet. Jag bokade ett enkelrum då jag skulle bo själv. Hamnade längst ned (under gatuplan) med ingen…,"Response from Hotel_Lundia, Hotelldirektör at Hotel FinnResponded Oct 2, 2016","Responded Oct 2, 2016","Hej Lovisa  Tack för din recension och jag beklagar att din vistelse inte levt upp till dina förväntningar. Du har troligen bott i våra minsta och mest prisvärda enkelrum. Vi har även andra alternativ, dels större rum med mer utrustning bättre avsedda för lite längre vistelser. Dina synpunkter och förslag har jag tagit till mig, tack för att du tagit dig tiden att dela med dig.  Med vänliga hälsningar Christian Weste Hotelchef",Date of stay: August 2016,"[All, languages]",119
Delphine35,Aug 2016,4,Bon hôtel,"Nous avons passé une nuit en famille (2 adultes + 2 ados) dans cet hôtel. Notre chambre (""studio XL"") était grande, lumineuse et très bien équipée. Le centre ville est assez proche, il y a un supermarché pas loin et on peut cuisiner dans la chambre (cuisine petite mais très bien…","Response from Hotel_Lundia, Receptionist at Hotel FinnResponded Oct 18, 2016","Responded Oct 18, 2016","Dear Delphine,  Thank you very much for reviewing Hotel Finn. We are very glad that you liked our Studio XL, they are nice and spacious.   We wish to welcome you to Hotel Finn again if you will visit Lund again.  Best Regards Martina Bergqvist",Date of stay: July 2016,"[All, languages]",119
timnij,Aug 2016,4,Goed hotel voor lange-termijnverblijven,"Bij aankomst bleek inderdaad dat het inchecken self-service was, wat overigens heel makkelijk was. Onze kamer (studio) voor 2 personen was heel erg ruim en had naast de standaard badkamer en het bed ook een aantal kasten, strijkplank, keuken en koffiezetapparaat. Om deze reden…","Response from Hotel_Lundia, Receptionist at Hotel FinnResponded Oct 18, 2016","Responded Oct 18, 2016","Dear Timnij,  Thank you very much for taking the time to write such a nice review of Hotel Finn. We appreciate that a lot. We hope to welcome you back to Hotel Finn another time.  Best regards Martina Bergqvist",Date of stay: August 2016,"[All, languages]",119
Plopitucus,Aug 2016,4,Modern and Swedish,"We stayed one night at this hotel. The room was very modern with an excellent finish to the decor. It was more of a Studio as it had a fridge, small cooker and a coffee maker. No bath but a very good shower. The bed was good and we had a good night's sleep. Internet was good and…","Response from Hotel_Lundia, Receptionist at Hotel FinnResponded Oct 18, 2016","Responded Oct 18, 2016","Dear Plopitucus,  Thank you for taking your time and review us, we appreciate that very much. We are so glad that you pointed out the very good things at Hotel Finn.  We wish to welcome you again to the hotel.  Best Regards Martina Bergqvist",Date of stay: August 2016,"[All, languages]",119
EP2912,Jul 2016,5,Всем рекомендую!,"Очень современный отель! Шикарные номера со всеми удобствами,включая мини кухню. Соотношение цена/удобства-впечатляет! Неплохой завтрак.Да и вообще обрадовало всё, учитывая,что это гостиница без персонала.Единственное: рядом, в шаговой доступности, не нашли продуктовый…","Response from Hotel_Lundia, Receptionist at Hotel FinnResponded Jul 30, 2016","Responded Jul 30, 2016","Dear,  Thank you for taking the time to share your thoughts about Hotel Finn, we are very glad that you enjoyed your stay and wish to welcome you back to us. Thank you.  Best wishes, Martina Bergqvist",Date of stay: July 2016,"[All, languages]",119
allowade,Jul 2016,5,Gutes Hotel - geräumig und durchdacht,"Das Finn Hotel ist ein von außen eher unscheinbares Hotel, das durch durchdachte Details und Geräumigkeit punkten kann. Die Doppelzimmer sind ca. 20m² groß, das Bad mit eingerechnet. Die Betten sind okay, es gibt eine moderne Küchenzeile, ein Bad mit ebenerdiger Dusche und…","Response from Hotel_Lundia, Hotelldirektör at Hotel FinnResponded Oct 2, 2016","Responded Oct 2, 2016",Vielen herzlichen Dank für Ihren Bericht. Wir hoffen dass Sie uns bald wieder besuchen werden. Mit freundlichen Grüssen Christian Weste Hotel Manager,Date of stay: July 2016,"[All, languages]",119
sharmantah,Jul 2016,4,Prisvärt och fräscht. ,"Lätt att köra dit. Parkera gratis. Smidig automatiskt incheckning  Rent och fräscht. Stort rum. Liten dubbelsäng för två personer, så jag låg på golvet. Bara en uppsättning handukar men det fixades snabbt när jag sa till. Bra med fruki5man kan ta med.","Response from Hotel_Lundia, Receptionist at Hotel FinnResponded Jul 19, 2016","Responded Jul 19, 2016","Hej Sharmantah, Tack så mycket för att du tog dig tid att lämna omdöme för Hotel Finn, vi uppskattar det mycket. Även tack för de fina orden och hoppas att er upplevelse i Lund var till er belåtelse. Vi beklagar upplevelsen med sängen, vi har olika sorters dubbelrum med olika storlekar på sängarna och önskar ni boka igen är jag säker på att vi kan hitta det som passar er bäst. Hjärtligt välkomna till oss igen.  Med Vänliga Hälsningar Martina Bergqvist",Date of stay: July 2016,"[All, languages]",119
ktech2016,Jul 2016,4,bra boende,"hotellet på sidan om,men nära att gå in till stan där det finns fina restauranger och gångvägar.det stora pusset är den lugna placeringen att man även vågar parkera en dyr bil.inge restaurang,frukosten...men det finns småplock så det räcker","Response from Hotel_Lundia, Hotelldirektör at Hotel FinnResponded Jul 6, 2016","Responded Jul 6, 2016",Hej och tack för trevliga ord om oss. Varmt välkommen tillbaka vid ett annat tillfälle.  Med vänliga hälsningar Christian Weste Hotelchef,Date of stay: December 2015,"[All, languages]",119
Critical-Duck,Jun 2016,4,The perfect business hotel,It was a bit surprised after entering the hotel for the first time to have no reception only some monitors where I was able to check in. It was very simple to do and was also surprisingly quick.  The rooms did were a nice size with the little kitchen and the table. The bed was…,"Response from Hotel_Lundia, Hotelldirektör at Hotel FinnResponded Jul 6, 2016","Responded Jul 6, 2016","Dear Critical Duck  I enjoyed reading your review since it's very spot on to what features this mainly self-service hotel has or hasn't. However, we have staff on site every morning up until noon and most evenings between 3PM and 9PM. Outside those hours you can always get in touch with staff at one of our other properties in Lund 24 hours. When it comes to the cleaning you may alert our staff and we'll see to your request. Also due to us being a self-service hotel we provide a lighter breakfast which recently during June was updated, this mainly due to guest feedback and we think it will suit future guests even better. The next time you visit Lund you might perhaps consider our other hotels, have a look at our websites www.lundia.se or www.grandilundia.se to find out more. Should you deside to stay at Hotel Finn again, don't hesitate to contact me beforehand at christian.weste@lundia.se and I'll make sure that we take good care of you.  Best regards Christian Weste Hotel Manager",Date of stay: June 2016,"[All, languages]",119
Thomas M,May 2016,3,A bit too basic,"If you are after convenience and cleanliness, then Hotel Finn is a good place to stay. If you like dealing with a real person at reception and a bedroom with a bit of character, then find somewhere else (My room was basic and didn't have a kitchenette/drink making facilities). …",,,,Date of stay: May 2016,"[All, languages]",119
Mikael L,May 2016,4,Really good,Very nice rooms with a small kitchen and fridge(!) I love that it feels like a small apartment and I can cook my own meals. Small gym if you feel like working out. Nice lounge area. Nice staff. Free parking and wifi. I will be coming back!  Only the breakfast was a little under…,"Response from Hotel_Lundia, Hotelldirektör at Hotel FinnResponded Jul 6, 2016","Responded Jul 6, 2016","Dear Mikael  Thank you for writing this review, I'm glad to see that you enjoyed your stay. Yes, since we are mainly a self-service hotel, the breakfast is a little different from a more traditional hotel. However, we have recently made a few changes which we think will improve the guest experience.  Best regards Christian Weste Hotel Manager",Date of stay: May 2016,"[All, languages]",119
Hartwig P,May 2016,4,Design Hostel mit merkwürdigem Frühstück,"Vorab: Zugang gibts nur mit zugesandter Codenummer oder Nr. der buchenden Kreditkarte. Oder man wartet bis jemand kommt, also ein anderer Gast. Hotel hat eine automatisierte Rezeption zum Einchecken. Personal ist nur morgens beim Frühstück anwesend, dann aber gleich zwei Leute.…","Response from Hotel_Lundia, Hotelldirektör at Hotel FinnResponded Jul 6, 2016","Responded Jul 6, 2016","Sehr geherter Hr Hartwig.  Vielen Dank für die Bewertung über uns.  Beim einchecken gibt es am Eingang ein Intercom, da kommt man in Verbindung mit Personal am Hotel Lundia und die können die Türe aufmachen.  Personal sind jeden Morgen bei der Arbeit bis 12 Uhr. Abends vom 15 bis 20 oder 21 Uhr wieder, Änderungen oder andere Zeiten können vorkommen. Den Frühstück wurde in die letzten paar Wochen etwas umgeändert und verbessert, es gab nämlich auch andere Gäste die sich die Wahlmöglicheit wünschten. Es freut mich das Sie ingesamt einen guten Aufenthalt gehabt haben.  Mit freundlichen Grüssen Christian Weste Hotel Manager  ",Date of stay: May 2016,"[All, languages]",119
Nina A,May 2016,4,Really nice rooms for a good price!,"The rooms have a lot of space, really fresh and new rooms, bathrooms and they also have a kitchen where you can cook your own food.  Really nice hotel room that is not very expensive. Probably because the hotel is a self check in hotel, but it went really smooth and if you have…","Response from Hotel_Lundia, Hotelldirektör at Hotel FinnResponded Jul 6, 2016","Responded Jul 6, 2016","Dear Nina  Many thanks for nice words, I'm glad you enjoyed your stay with us. Welcome back in the near future.  Best regards Christian Weste Hotel Manager",Date of stay: June 2015,"[All, languages]",119
Erdem Emin A,May 2016,4,Really Liked It,"We arrived around 20:00 and when we arrived there was noone at the reception and an old couple staying there opened the door for us. It is almost a no staff hotel and you have to figure it out how to check-in, but they make it quite easy with thorough explanations. They have…","Response from Hotel_Lundia, Hotelldirektör at Hotel FinnResponded Jul 6, 2016","Responded Jul 6, 2016","Dear Erdem  Many thanks for taking the time writing a review. Yes, we are mainly a self-service hotel and hosts are available every AM and with few exceptions most evenings also. You can always get in touch with staff at one of our sister properties by unsing the house phone in the lobby, available 24/7.  Swedish laws regarding alcohol prevents guests from self service in public areas.  We hope to see you here again in the near future. Best regards Christian Weste Hotel Manager ",Date of stay: May 2016,"[All, languages]",119
Tariq B,May 2016,5,Nice experience ,Had to stay & found this place on a short notice. Very friendly place with freedom & all necessary facilities.I would recommend to all.Accommodation is nice & spacious with in house mini kitchen for self catering. 24 hour breakfast facility is special though you have to pay for…,"Response from Hotel_Lundia, Hotelldirektör at Hotel FinnResponded Jul 6, 2016","Responded Jul 6, 2016","Many thanks for your review, I'm glad you enjoyed your stay. Hope to see you back here in the future.  Best regards Christian Weste Hotel Manager",Date of stay: May 2016,"[All, languages]",119
Eleonora Lucia G,Apr 2016,3,Notte a Lund,"Ho soggiornato in questo albergo per una notte, durante l'ultimo viaggio a Lund. C'è la possibilità di fare il check in e check out in autonomia. La stanza è confortevole e colorata, un piccolo monolocale con cucina. Il personale è molto gentile. Scarseggia nelle proposte per la…",,,,Date of stay: April 2016,"[All, languages]",119
Annika D,Feb 2016,5,"Fräscht, rymligt och god frukost",Om man kan tänka sig en kvarts promenad in till centrum så är Hotell Finn ett utmärkt alternativ med gratis parkering precis utanför porten.Vi fick ett stort rum på markplan med pentry och sittgrupp. Rymligt och fräscht. Extra plus för varma croissanter till frukost.,"Response from Staff_HotelFinn, Hotellvärd at Hotel FinnResponded Feb 25, 2016","Responded Feb 25, 2016","Hej Annika D, Tack för du tagit dig tid att skriva om er vistelse hos oss.  Härligt att ni fick ett rum som ni trivdes i och att croissanterna var uppskattade. Hoppas ni kommer och besöker oss igen. Önskar dig en trevlig dag! Med Vänliga Hälsningar, Emelie Jörgensen",Date of stay: February 2016,"[All, languages]",119
Venture624527,Feb 2016,4,Nytt och fräscht,"Städningen var inte helt 100 i badrummet, och toaborsten bada i vatten. Annars fick jag ett bra intryck, fräscht och trevlig personal, med små medel hade receptionsområdet kunnat gjorts lite mysigare...(roligare belysning) Frukosten var bra trots mycket engångsförpackningar,…","Response from Staff_HotelFinn, Hotellvärd at Hotel FinnResponded Feb 10, 2016","Responded Feb 10, 2016","Hej, Tack för att du tagit dig tiden att skriva en recension till oss och för att du valt att bo hos oss.  Städningen av toaletten har tagits upp med städarna och det har setts över.  Tack för tipset om lite roligare belysning, ska ta en titt på ljussättningen och se vad vi kan göra för att göra det mysigare. Än en gång, tack för att du tagit dig tiden, det uppskattas och gör det lättare för oss att utvecklas till det bättre.  Med Vänliga Hälsning, Emelie Jörgensen, Hotellvärd ",Date of stay: February 2016,"[All, languages]",119
SELarsen,Jan 2016,4,Efficient and high standard,"Simple self-service check-in, and large clean family room with modern design and kitchenette. Great lobby area and self-service pay-as-you-take snack.  Breakfast a little chaotic, due small serving area and morning rush.  Overall good value for money.",,,,Date of stay: January 2016,"[All, languages]",119
KatjaKl,Dec 2015,3,"Fint værelse, elendig morgenmad .",Havde 2 overnatninger på Hotel Finn. Man skal lige være forberedt på at al ind- og udcheckning foregår elektronisk og uden betjening. Værelset var fint og rummeligt og med et godt stort badeværelse. Man kan gratis låne cykler på hotellet eller gå de 15 minutter ind til centrum.…,,,,Date of stay: December 2015,"[All, languages]",119
Fegelein,Nov 2015,5,Immaculate operation,"This hotel suits you who want's a clean, modern and quiet place to sleep at. You check-in by yourself at a touch screen computer which then spits out a key card.   I've only stayed in single rooms, which are small but fills it's function, nice beds and very fresh WC/shower.  The…",,,,Date of stay: October 2015,"[All, languages]",119
Rob C,Nov 2015,5,A great place for a long term stay,"We stayed for about two weeks in a suite - bed, bath, kitchenette, sitting area.  The bed was comfortable, the bathroom larger than European norm, and the kitchenette had just enough to get by.    Two highlights: one was the table on wheels in the suite with two chairs allowed…",,,,Date of stay: October 2015,"[All, languages]",119
