N9177OEalessandrap,Oct 2015,3,Nothing special,"The good side of this hotel is the location: ten minutes walking from the city center. All the rest is nothing special, my room was big but there was no writing table nor garderobe, and I was located in the basement, so it was really dark. Breakfast was included, but the free…",,,,Date of stay: September 2015,"[All, languages]",119
MrTryp,Aug 2015,4,Best value-for-money in Lund,"Great hotel with all you need. Clean, great beds, WiFi that works and simple but good breakfast. Free parking right in front of the door. Small gym and spa/sauna in the basement that you can use for free. They have bikes as well if you want to take a ride into town.  ",,,,Date of stay: August 2015,"[All, languages]",119
Johann R,Jul 2015,5,Spacious and convenient,"We travelled by car, two adults and a teenager. Parking was no problem, and the hotel was close to the highway. Reception is self service, which was no problem at all. The hotel seemed to be brand new, clean and high standard of reception area, stairways as well as rooms, beds…",,,,Date of stay: July 2015,"[All, languages]",119
6Ish,Jul 2015,5,Great stay at hotel Finn!,"The hotel location is right on the highway with parking facilty. The room was clean and ambience was great! I loved it, the kitchenette, bathroom were so user friendly and comfortable. The bed was cosy and inviting......i would surely go there again......",,,,Date of stay: July 2015,"[All, languages]",119
Fabio G,Jul 2015,5,Espetacular,"Been there for one night. High profile self-servisse hotel. Structure and place are OK. Good facilities in the room and high finish quality. Not so many places to park around the hotel, so it´s reccomendable to take car of it.",,,,Date of stay: July 2015,"[All, languages]",119
Soccca,Jul 2015,5,Excellent self-service hotel,"A very good self-service hotel. Clean rooms, free parking and Wi-Fi, within walking distance to the town centre (10-15 mins), convenient price. Good breakfast, you can take 5 items and you can eat them there or take them as ""breakfast to go"". Excellent hotel for one night stay.",,,,Date of stay: July 2015,"[All, languages]",119
sstroby,Jul 2015,4,Smidigt och fräscht! ,"Vi anlände ganska sent och den automatiska incheckningen var väldigt smidig! Dock gick det inte att låna cyklar på kvällen då personalen inte fanns på plats.   Rummet var väldigt fräscht och tillhörande kök var välutrustat (induktionshäll, rivjärn, flera kastruller, porslin,…",,,,Date of stay: July 2015,"[All, languages]",119
Ståle K,Jul 2015,2,Rimelig hotell med en del mangler.,"Jeg var på Hotel Finn i 5 dager i begynnelsen av juli 2015 sammen med 2 kamerater. Vi hadde sett mange positive omtaler av dette hotellet på nettet, og dette skapte litt forventninger. Dessverre kan jeg ikke si at alle forventningene ble oppfylt, og jeg kommer tilbake til…",,,,Date of stay: July 2015,"[All, languages]",119
lile_my,May 2015,3,worth the money,"Situated a walking distance from the centre (at least if you have no luggage), the hotel offers cheap accommodation. The satellite rooms are small but comfortable and quiet. The breakfast has limited offering, but everything was tasty and fresh. The only problem was entering the…",,,,Date of stay: May 2015,"[All, languages]",119
Nicolas W,May 2015,5,Good hotel. Be prepared for automatic check-in!,"I chose this hotel mainly since I needed a kitchenette as I stayed for an entire week. The room is large, comfortable and the kitchen is perfect for displaying the needs of a long stay. It's a bit outside the old city center, but easy to get by foot (15 min walk or by bike (only…",,,,Date of stay: May 2015,"[All, languages]",119
Mattias L,May 2015,4,Smart och bekvämt,"Trevligt och fint hotell, Fina rum och sköna sängar!, utmärkt att man har ett eget kök på rummet, Lite ovant att stå och prata med en låda när man vill bli incheckade vid dörren men otroligt smart, det man kan sakna är avsaknaden av personal vi bodde där i 3dagar och såg aldrig…",,,,Date of stay: May 2015,"[All, languages]",119
1959Anders,Feb 2015,5,Kommer att återkomma!,"Bra service, personalen är serviceinriktad, lugnt och skönt, rent och snyggt, hög standard. Lätt att ta sig till hotellet, och bra prisnivå. Att det finns ett litet gym att träna i gillade jag mycket.","Response from Jasmina S, Receptionschef at Hotel FinnResponded Feb 18, 2015","Responded Feb 18, 2015",Tack 1959Anders för ditt inlägg! Det uppskattas! Du är varmt välkommen tillbaka!,Date of stay: February 2015,"[All, languages]",119
olabandoola,Feb 2015,4,Bra rum med parkering,"Rummen är stora med soffa och trägolv, fräscha och billiga (hotels.com 536kr). Positivt är att det finns kylskåp och liten köksdel med micro och vattenkokare och spis. Platt-tv vid fotändan-smart. Enda negativa var den opersonliga check-in-datorn.","Response from Jasmina S, Receptionschef at Hotel FinnResponded Feb 10, 2015","Responded Feb 10, 2015",Hej olabandoola!  Tack för din fina recension! Det uppskattar jag! Personal finns för det mesta under dagtid dock är det obemannat under natten. Du kan alltid lyfta på luren vid incheckningsdatorerna om du har några frågor eller funderingar. Du är hjärtligt välkommen tillbaka!  Med vänliga hälsningar Jasmina,Date of stay: February 2015,"[All, languages]",119
altaskier_ny,Jan 2015,4,"Clean, modern hotel with cooking facilities in the rooms","This is a semi-automated hotel about a 15 minute walk from the train station in Lund (or take the #3 bus, which runs every 10 minutes or so - it brings you right to the hotel).  You can check in just by scanning your passport and credit card, and you don't have to interact with…","Response from Jasmina S, Receptionschef at Hotel FinnResponded Jan 16, 2015","Responded Jan 16, 2015","Dear altaskier_ny,  Thank you for your review! I´m glad to hear that you enjoyed your stay. Thant's a great sum up of Hotel Finn! Hope to see you soon aging  Best regards Jasmina",Date of stay: January 2015,"[All, languages]",119
TobbeO,Dec 2014,4,"Rent, modernt och prisvärt för familjen.","Bodde 2 vuxna + 2 barn två nätter i en Studio L. Fungerade utmärkt till ett rimligt pris. Ett stort rum på baksidan från gatan (=tyst). Nytt och fräscht och välstädat överallt. Hemsidan beskriver hotellet på ett tydligt och ärligt sätt.  Frukosten är enkel men funkar,…","Response from Jasmina S, Receptionschef at Hotel FinnResponded Jan 5, 2015","Responded Jan 5, 2015",Kära TobbeO  Tack för ditt fina inlägg! Det uppskattas verkligen! Ni är hjärtligt välkomna tillbacka och då kan vi självklart ordna fler stolar till er.  Med vänliga hälsningar Jasmina,Date of stay: December 2014,"[All, languages]",119
Grace C,Dec 2014,2,Do not come early,"This hotel was booked by my work. I was not aware that the hotel is rarely staffed, and showed up at 12:45pm to drop off my luggage. I rung the doorbell, knocked for a long time. I was completely stranded and had to desperately use the toilet. If it was not for the beautiful…","Response from Jasmina S, Receptionschef at Hotel FinnResponded Dec 10, 2014","Responded Dec 10, 2014","Dear Grace C,  Thank you for your review!  I'm so sorry to hear that you are not completely satisfied with your stay.  You should have received a SMS with your personal pin code for the entrance the morning of you arrival.   We are staffed Monday- Friday from 7.00 am to 21.00 pm with exception a few hours between lunch and check in time. On Saturday and Sunday we are staffed from 8.00 -12.30. Our sister Hotel is glad to help you during all other time, again I´m very sorry if there has been some technical problems with the door bell during your arrival.  I hope the rest of your stay was pleasant and that you will come back soon again! If you have any other questions please don't hesitate to contact me.   Best regards Jasmina",Date of stay: December 2014,"[All, languages]",119
SteveGas,Dec 2014,5,It works perfectly,"If you travel a lot you'll love this place. All bits you need are good - clean modern room with a decent TV and fast, free WIFI. No fuss breakfast. And a refeshing 15 minute stroll to the centre of Lund... or borrow a bike!  I like htis place and intent to make it my hotel of…","Response from Jasmina S, Receptionschef at Hotel FinnResponded Dec 5, 2014","Responded Dec 5, 2014","Dear SteveGas,  Thank you for a good review, I appreciate it. I'm glad that you liked Hotel Finn so much!   Hope to see you soon again  Best regards, Jasmina",Date of stay: December 2014,"[All, languages]",119
ImOrr,Nov 2014,4,All you need.,"3 night stay.  Bus stops outside the front door.  Easy self check in/out.  Clean, spacious, modern rooms - nice bathrooms.  Our room included a small stove, fridge, microwave & cups, plates etc.  Be prepared to provide for yourself as there isn't cafés/restaurants in the hotel.…","Response from Jasmina S, Receptionschef at Hotel FinnResponded Nov 21, 2014","Responded Nov 21, 2014","Dear ImOrr,  Thank you for your lovely words!  Hope to see you soon!  Best regards Jasmina",Date of stay: November 2014,"[All, languages]",119
Snummy,Nov 2014,5,Отличный отель,"Один из самых лучших отелей европейского уровня! Электронная стойка регистрации с удобным сервисом и голосовыми инструкциями. Просторный холл с камином, разнообразные завтраки. Номер просторный, оформленный в лучших традициях скандинавского минимализма, при этом полностью…",,,,Date of stay: November 2014,"[All, languages]",119
Jan B,Nov 2014,5,Love this place!,"I travel to Lund on a regular basis and ALWAYS stay at this place. Love the concept, the nice spacious rooms, the gym (small but functional) and the location. I can warmly recommend this hotel to others.","Response from Jasmina S, Receptionschef at Hotel FinnResponded Nov 11, 2014","Responded Nov 11, 2014","Dear Jan B  Thank you for your kind words! See you soon   Best regards, Jasmina",Date of stay: November 2014,"[All, languages]",119
funkylittlefrog,Nov 2014,2,Reasonable hotel but poor concept,"Hotel Finn is far from being my favoured option in Lund.  The hotel is staffed only during certain hours, so when I arrived to find only one pillow in my room there was no one available to ask for an extra one (perhaps there was a number I could have called but I didn't feel…","Response from Emelie C, Receptionschef at Hotel FinnResponded Nov 4, 2014","Responded Nov 4, 2014","Dear funkylittlefrog,  Thank you for your feedback! I appreciate it! In our singe rooms we only have one pillow and when your host isn´t present you can always call our sister hotel, Hotel Lundia, via the phone on the check in counter. Do you remember which room number you had?  You can always ask your host to prepare a baguette without ham.   We also have larger Studios with a bigger bed and more pillows. The price difference is about 100-150 SEK. Hope to see you again!  Best regards Jasmina",Date of stay: September 2014,"[All, languages]",119
TozCaz,Sep 2014,4,Good option,"Stayed here for two nights, got a good price for a late booking so i thought it was a good choice compared to that price, with the original price i might have giving it a 3/5.  Anyway, good clean rooms, the whole hotel is run with the idée that staff should have as little as…","Response from Emelie C, Försäljningschef at Hotel FinnResponded Nov 4, 2014","Responded Nov 4, 2014","Dear TozCaz,  Thank you for your feedback! I appreciate it! I will forward the feedback to the guy that answered.  Hope to see you soon again!  Best regards Jasmina",Date of stay: September 2014,"[All, languages]",119
Orhleil,Sep 2014,4,Un hôtel convenable et pratique,"Pour un tarif acceptable, l'hôtel se trouve à proximité du centre-ville (10mn à pied en ligne droite). L'intégralité du séjour peut se faire sans avoir le moindre contact humain avec qui que ce soit pour peu qu'on ait l'habitude. On arrive à la porte, on ouvre avec le code de la…",,,,Date of stay: September 2014,"[All, languages]",119
JanMD73,Aug 2014,5,"Excellent! Modern hotel,spacious room","This is a modern/stylish hotel with no front desk/reception. The check-in and check-out are self -service (see photo), so bear in mind this is perhaps not for everyone? It is a nice 10mn walk from the city center but you can also take the bus which stops just outside the hotel,…","Response from Emelie C, Receptionschef at Hotel FinnResponded Nov 4, 2014","Responded Nov 4, 2014","Kära JanMD73,  Tack för ditt fina omdöme! Det uppskattas verkligen! Vilken fin beskrivning av vårt hotel.  Hoppas vi ses snart igen  Med vänliga hälsningar Jasmina",Date of stay: June 2014,"[All, languages]",119
swedentraveler2000,Aug 2014,3,"Nice hotel, bad temp control","We (my wife and I) stayed at this hotel for one night. Our room was really nice: modern, clean, and big. The bathroom was very nice as well. The only problem we had (which turned out to be quite difficult) was that the room was very warm, which made it very difficult to sleep at…","Response from Emelie C, Receptionschef at Hotel FinnResponded Nov 4, 2014","Responded Nov 4, 2014","Hej swedentraveler2000 ,  Tack för ditt omdöme! Det uppskattas! Kul att ni trivdes hos oss. Jag misstänker att golvvärmen I badrummet har varit igång, det kan bli ganska varmt av den. Be gärna er värd om hjälp så ni kan sova gott!  Hoppas vi ses snart igen!  Med vänliga hälsningar Jasmina",Date of stay: July 2014,"[All, languages]",119
Homayon A,Jun 2014,4,Känns klockrent,Hamnade av slump där och mycket överraskad blev jag när jag klev in i rummet som var till väldigt rimligt pris. Enkelt & smidigt att checka in och ut. Kvalitet behöver inte kosta extra och så är det på Finn.,"Response from Staff_HotelFinn, Hostess at Hotel FinnResponded Jun 13, 2014","Responded Jun 13, 2014","Hej Homayon A,   Tack för din recension om Hotel Finn. Vad roligt att höra att du hade en bra upplevelse hos oss, det gör oss glada!  Vi hoppas att se dig snart igen.   Vänliga hälsningar, Din värd Johanna",Date of stay: May 2014,"[All, languages]",119
mana b,May 2014,3,"Decent hotel, good customer service, but concept is definitely not for every one","first off, we are a young couple from California and we were soo disappointed in the location of this hotel. We should have read the website better but it is farrr from town and the train station, and nobody in town has ever heard of it (making it difficult to get back!).  I'm…","Response from Staff_HotelFinn, Front Office Manager at Hotel FinnResponded May 30, 2014","Responded May 30, 2014","Dear Mana!  Thank you for taking the time to write a review about Hotel Finn on Tripadvisor, we appreciate it a lot! I would like to make some comments regarding your review:  - Like you say, our concept might not be for everyone. Hotel Finn is - like we are clear about on all booking channels - a self service hotel. This suits travellers that don't need traditional hotel services and instead like a more relaxed atmosphere. That's why we for example have made the lobby area into Finn's Livingroom where your can come hang out, play Wii and Foosball, eat a meal, etc.   - It takes about 15 minutes to walk into the centre of Lund and a lot of people appreciate our location because of the convenience of being close to the high way as well as public transportation. I know that you got assistance how to take the bus as well as taxi from our sister hotel in the centre but you decided to walk.   - Since the room you stayed in is an apartments, and a lot of our guests prefer to make their own meals in the room, we have decided to have a lower price and make breakfast optional. This is for the convenience of the guest so that you don't have to pay for anything that you won't use. I would also like to mention that you and your partner received a complementary breakfast.   - In my experience the rooms are not hard to find - or at least I haven't had a complaint about it before since there are signs toward all rooms all the way from the lobby until you are in the correct floor.   - Although we are a self service hotel we do have staff here both in the morning as well as afternoon and night time on weekdays. On Saturdays and Sunday we are here for at least 5 hours each day. If there is a problem or if you have any questions when we are not present there is a phone in the lobby which you simply lift to get assistance 24/7. A phone I know that you used while you were here.   Thank you again and enjoy you day! For another visit to Lund I would recommend our sister hotels Lundia or Grand Hotel where you get a more traditional experience in the centre of the city.   Kind regards, your host Emelie",Date of stay: May 2014,"[All, languages]",119
Claus A,May 2014,3,Nemt og bekvemt,Hotellet ligger tæt på motorvejen og er nemt at finde. Fik dejligt stort og lyst værelse. Der er selv check in og out. Værelset havde the køkken og køleskab. Alt var pænt og rent.  Kan anbefales hvis Malmø hotellerne er fuldt booked.,"Response from Staff_HotelFinn, Front Office Manager at Hotel FinnResponded May 28, 2014","Responded May 28, 2014","Hej Claus A!  Tack för att du tog dig tid att skriva om Hotel Finn, det uppskattar vi mycket!  Med vänliga hälsningar, Din värd Emelie",Date of stay: June 2013,"[All, languages]",119
C0CKR0ACH,May 2014,3,Convenient,"Booking was automatic and so was in-checking. It is a short walk from the city center, very easy to find if you arrive by car, it is only 200m from the freeway off-ramp. The room was well equipped.    The bed sheets did smell like they hadn't been properly washed, especially the…","Response from Staff_HotelFinn, Front Office Manager at Hotel FinnResponded May 28, 2014","Responded May 28, 2014","Thank you for taking the time to evaluate us on Tripadvisor, we appriciate it a lot!  I am sorry to hear that you weren't satisfied with your linen - these are ofcourse changed and washed after every guest.   Incase you have any problem like this in the future - please tell us right away so that we can adjust it for you while you are here.   Thank you again! Kind regards,  Your host Emelie",Date of stay: May 2014,"[All, languages]",119
SarahH1342,Apr 2014,5,"Minimalistic yet cosy, great hotel in a lovely city","My partner and I thoroughly enjoyed our stay at Hotel Finn in Lund - the self check-in system and self-service shop made for a very interesting experience, and made us feel as though we were in complete control of our stay. Large room (we stayed in a 'Studio M' room, which was…","Response from Staff_HotelFinn, Guest Relations Manager at Hotel FinnResponded Apr 25, 2014","Responded Apr 25, 2014","Dear Sarah!  Thank you for your kind words and for taking the time to review our hotel. It means a lot!  We are very glad to hear that you enjoyed your experience. Regarding the curtains - the thicker ones are for you to pull if you want the room darker. We are glad to show you the next time you visit.   Thanks again and welcome back!  Kind regards,  Emelie - Your hostess",Date of stay: April 2014,"[All, languages]",119
inigoalonsocom,Jan 2014,5,Home away from home,"I spend a month at the Finn Hotel, in a Studio M room. Everything was very new and there are a lot of utensils available, from kitchenware to hair drier or iron. Special mention for the small but perfectly functional gym and washing room. Oh, and the Wii downstairs ;)","Response from Staff_HotelFinn, Hostess at Hotel FinnResponded Jan 10, 2014","Responded Jan 10, 2014","Dear inigoalonsocom,  I am so glad you enjoyed your stay and I appreciate you taking the time to review Hotel Finn. Your caption “Home away from home” is exactly what we want our guests to feel. It means a lot.  Best regards, Johanna Nyström Hostess",Date of stay: December 2013,"[All, languages]",119
vinod5380,Dec 2013,5,Awsome experience !!!!,"It was wonderful experience to stay in Hotel Finn , i have stayed there twice , both of them longer durations  during june , july  , august and stayed for more than a month .. Very good hotel, very much safe for the family ... I was very happy with the stay,  both Philip and…","Response from Staff_HotelFinn, Hostess at Hotel FinnResponded Dec 30, 2013","Responded Dec 30, 2013","Dear vinod5380,  Thank you so much for your review and for your kind words about Hotel Finn and the staff, it means a lot to us. We hope to see you soon again!    Best regards, Johanna Nyström Hostess",Date of stay: July 2013,"[All, languages]",119
alainp1974,Dec 2013,4,un exemple...,"super hotel...petit mais bien equipé, salle de sport au rez de chaussée, lounge sympa avec ordinateur, tv, console de jeux, etc...a 5minutes de la ville. chambre équipée d'une petite cuisine bien pratique, avec de la vaisselle tv qui accepte les clés USB...salle de bain sympa et…","Response from Staff_HotelFinn, Hostess at Hotel FinnResponded Dec 16, 2013","Responded Dec 16, 2013","Dear alainp1974,  Thank you so much for your kind words about Hotel Finn. We sincerely hope to see you back soon again!   Best regards, Johanna Nyström Hostess",Date of stay: April 2013,"[All, languages]",119
thr12355,Oct 2013,3,nice but small rooms,"Nice hotel, however the rooms are very small and not with the highest standard of cleanness.  My room had just a window facing a wall (it was in the basement!) Very poor breakfast: limited choices, low quality food and coffee","Response from Staff_HotelFinn, Hostess at Hotel FinnResponded Dec 6, 2013","Responded Dec 6, 2013","Dear Ste9786 - Thank you for your review. The majority of rooms at Hotel Finn are quite large studios. I hope that you will return to our hotel for a longer stay and I would then be delighted to upgrade you to a studio room.  Kind regards, Johanna Nyström Hostess johanna.nystrom@hotelfinn.se",Date of stay: October 2013,"[All, languages]",119
stone651128,Oct 2013,4,good hotel for long stays,The hotel is located in the outskirt of Lund around 20 minutes on foot from the station or 5 minutes with traxi or public transportation. The hotel has a self service check in and self service check out. Rooms are cleaned only every 5 days and have also a small kitchen. They are…,"Response from Staff_HotelFinn, Hostess at Hotel FinnResponded Dec 6, 2013","Responded Dec 6, 2013","Dear Stone651128 -  Thank you for reviewing Hotel Finn - I am happy you enjoyed our facilities. We constantly try to improve our product and your input is of great help.  Kind regards, Johanna Nyström Hostess",Date of stay: October 2013,"[All, languages]",119
irprof,Jun 2013,4,Nice enough hotel,"Nice enough hotel. Rooms are functional, clean, well laid out, although with few extras. Mine did have a fridge and a small stove, if I'd wanted to cook. Its a bit out of town and on an ugly stretch of road, but an easy enough walk into Lund. They will lend you a bicycle, which…",,,,Date of stay: June 2013,"[All, languages]",119
wifah,Jun 2013,4,Good hotel,Had a lovely stay at this hotel. Staff were very kind to me when I came down with a cold. Loved the rooms because they were big and love having a kitchen with a fridge. A few things i would change. Kitchen needs a kettle for tea lovers like myself and sometimes there automated…,,,,Date of stay: June 2013,"[All, languages]",119
Darmonski,May 2013,5,Perfect Hotel for business trip,Not pretentious self service hotel but with all facilities that you need. All is in order to makes you feel at home. Stuff is very pleasant and helpful. Very good value for money. The perfect Hotel for business trip.,,,,Date of stay: March 2013,"[All, languages]",119
Msafiri50,Mar 2013,3,Functional,"Automated check-in and check-out, a self-service 'kitchen'/cafeteria makes it a little antiseptic, although the staff were helpful when called on for assistance.   A definite lack of atmosphere in the lobby as people hardly stopped there, like me making their way to their rooms.…",,,,Date of stay: March 2013,"[All, languages]",119
MichalB_CZ,Mar 2013,3,Automated hotel,"New hotel with different, automated, approach. Most of things are automated, you will meet staff only few times a day. If you need something, you have to use phone at the desk. But the staff is very kind and helpful.  I stayed for few days in single room and there was almost…",,,,Date of stay: February 2013,"[All, languages]",119
Sofie J,Feb 2013,5,Nästan som hemma!,"Bodde på Hotel Finn en natt då vi hade en konferens i Lund. Sov otroligt skönt och jag tyckte att mitt rum var suveränt, kändes nästan som att jag var ”hemma”.  Hade anmält mina allergier med mat och fick både yoghurt och bröd som jag tålde på morgonens frukost – tummen upp!",,,,Date of stay: February 2013,"[All, languages]",119
meraime,Dec 2012,4,Very good value for money.,"I loved Hotel Finn. Me, my sister and my three children had a very nice stay in a spacious Studio L. I had to call them to make the reservation because of us being five instead of four, and both the service and the positive attitude where splendid. The only con were them not to…",,,,Date of stay: July 2012,"[All, languages]",119
Ing-Marie M,Nov 2012,4,Gör det själv!,"Hamnade av en slump på hotellet då Grand Hotel i Lund slarvat bort min bokning. Fint, stort och rent rum. Skön säng. Trevlig kille i receptionen. gillade inte att det är obemannat nattetid när jag reser ensam. För att trivas ska man veta om i förväg att det självservice och en…",,,,Date of stay: November 2012,"[All, languages]",119
