Shicaa,Nov 2012,4,Fair value,"A new hotel jut 10 mins walk from the city center. The self service concept is great. Spacious clean room with everything i needed. There is no restaurant, just a self service shop like area where you can buy drinks/salads/sandwiches etc. Free wifi.",,,,Date of stay: November 2012,"[All, languages]",119
colkirk,Sep 2012,4,Innovative Hotel Concept,"As others have said this is a new ""self service"" hotel concept. However there was a very helpful and friendly staff member on duty who helped us check in using the airport type check-in machines. He readily admitted they were having teething problems as they had only recently…",,,,Date of stay: September 2012,"[All, languages]",119
traveladam2000,Sep 2012,4,I like it.,"Stayed at the Hotel Finn for 4 nights for a work event.  First problem, not theirs, they didn't have a reservation for me, they handled it just fine.  Gave me a room, no problem and said I could sort it out in the morning.  Well handled!  Rooms were big and cozy.  Hot due to the…",,,,Date of stay: August 2012,"[All, languages]",119
Chti_voyageurLille,Jul 2012,4,"Grand confort, bon accueil","A 10 mn à pied du centre ville (à l'est). C'est un hôtel de chaîne, à la déco très moderne, mais, pour un prix acceptable pour la Suède (en tout cas,celui que nous avons obtenu, soit 790 Sk, 96 € mais le prix peut vite monter à 1090 Sk), nous avons eu droit à une grande…",,,,Date of stay: July 2012,"[All, languages]",119
Marjoleine_11,Jul 2012,4,Modern and close to town,This is a very new concept for an hotel. When you enter you see 2 terminals who can help you to check in and out. The design of the place is nice and clean. In the rooms there is a lot of IKEA. The bathroom is spotless and very smart with the shower doors that you can put away…,,,,Date of stay: July 2012,"[All, languages]",119
flying_kiwi120,Jun 2012,4,a really neat concept,"This is a new hotel and it is such a great concept.  I was in Lund visiting my daughter so just had a single room (which was adequate, but not as good as some of the larger rooms sound).  The room was relatively small but perfectly outfitted with IKEA (I imagine), and there was…",,,,Date of stay: April 2012,"[All, languages]",119
eddieCambridge,Mar 2012,5,Very good value.,"This is a new hotel (opened February 2012) and there are a few teething problems, for example the duvet did not quite fit the double bed, but the rooms are like studio apartments with a sofa bed, kitchen area and a big tv at the end of the bed that swivels so that you can watch…",,,,Date of stay: March 2012,"[All, languages]",119
