ReneKraft,Feb 5,4,Aus ParkInn wurde Radisdon Blu,"Sehr gutes Business Hotel, welches stark durch Angestellte der gegenüberliegenden Firma Tetra Pak frequentiert wird. Die Zimmer sind gut und sauber und das Personal ist sehr hilfsbereit. Das Frühstück ist ausreichend zur Verfügung und es wird regelmäßig aufgefüllt. Der…","Response from annablomqvist, Marketing Coordinator  at Radisson Blu Hotel LundResponded 5 days ago",Responded 5 days ago,"Dear ReneKraft,  I would like to thank you very much for your stay at Radisson Blu Hotel Lund and posting your precious comments on TripAdvisor. We are pleased to learn that you had a delighting experience with us.  Feedback as such inspires us to further improve our quality standards and continue to provide excellent service consistently. We certainly hope to welcome you back at Radisson Blu Hotel Lund in the near future and please let us know if we would be of any help to you.  Yours sincerely,  Emilia Hallström ",Date of stay: January 2019,"[All, languages]",421
A TripAdvisor Member,Feb 5,5,Mir Owais Alam,"Absolutely clean and quite rooms. The breakfast was great and the staff was very welcoming. I stayed for three nights, and it was an absolutely trouble free stay at this hotel.The hotel had a gym and a sauna but I did not use it, and hence can not comment.","Response from annablomqvist, Marketing Coordinator at Radisson Blu Hotel LundResponded 5 days ago",Responded 5 days ago," Dear Mir_Owais_Alam  Thank you for taking the time to share your experience.  It is our greatest pleasure to read your compliments about our hotel and about your stay.  I won't miss sharing your feedback with our ambassadors and it will serve as an encouragement as we strive to continuously improve the quality of our services. It is very rewarding to see that our staff was able to meet your expectations.  We look forward to welcoming you back again soon.  Kind regards, Emilia Hallström Marketing Coordinator ",Date of stay: January 2019,"[All, languages]",421
Catherine,Feb 3,5,Weekend,Vi unnade oss en helg i Lund! Fina ytor med tilltalande inredningsdetaljer! Är man en familj kan man med fördel boka anslutande rum som leverera samma kvalitet! Ett stort plus för den trevliga personalen!,"Response from annablomqvist, Marketing Coordinator  at Radisson Blu Hotel LundResponded 5 days ago",Responded 5 days ago,"Hej Cattyr123,  Stort tack för ditt positiva omdöme! Vi uppskattar det jättemycket och blir glada att höra att ni hade det bra här hos oss! Låter som att ni haft en kanonhelg i Lund.  Ni är varmt välkomna åter!  Bästa hälsningar Emilia Hallström Marketing Coordinator  ",Date of stay: February 2019,"[All, languages]",421
A TripAdvisor Member,Feb 2,4,Pulito e si dorme benissimo,1 settimana di lavoro e ho dormito benissimo in una calda cameraBuona la colazioneUn po’ caro ma l’ambiente e’ pulito Questa volta non sono riuscito a sfruttare alla sauna e la piccola palestra sara’ per prox volta,"Response from annablomqvist, Marketing Coordinator  at Radisson Blu Hotel LundResponded 5 days ago",Responded 5 days ago,"Dear Compass58340569104,  I would like to thank you very much for your stay at Radisson Blu Hotel Lund. We are pleased to learn that you had a delighting experience with us.  Feedback as such inspires us to further improve our quality standards and continue to provide excellent service consistently. We certainly hope to welcome you back at the hotel the near future and please let us know if we would be of any help to you.  Yours sincerely, Emilia Hallström Marketing Coordinator  ",Date of stay: January 2019,"[All, languages]",421
A TripAdvisor Member,Jan 2019,5,Absolutely bang on!,"This hotel is excellent. Staff, cleanliness, comfort, facilities, food. It was all perfect. Not a single bad word to say and would stay here again without question. Shout out to Luca who is the best bar/restaurant host I’ve ever encountered ","Response from annablomqvist, Marketing Coordinator  at Radisson Blu Hotel LundResponded 5 days ago",Responded 5 days ago,"Dear Connector55588368540,   Thank you for taking the time to share your experience.  It is our greatest pleasure to read your compliments about our hotel and about your stay.  I won't miss sharing your feedback with Luca. It will serve as an encouragement as we strive to continuously improve the quality of our services. It is very rewarding to see that our staff was able to meet your expectations.  We look forward to welcoming you back again soon.  Kind regards, Emilia Hallström Marketing Coordinator  ",Date of stay: January 2019,"[All, languages]",421
robertL5022WX,Jan 2019,5,Fantastisk service och jättetrevligt bemötande,Familjen tog en tur till Lund och bodde på Radisson Blu hotell. Vi är väldigt nöjda med vår vistelse då rummet och maten i restaurangen höll mycket hög standard. Personalen var väldigt trevlig och det fanns mycket att göra för barnen med olika spel och aktiviteter på hotellet.  …,"Response from annablomqvist, Marknadskoordinator at Radisson Blu Hotel LundResponded 4 weeks ago",Responded 4 weeks ago,"Hej Robert!  Vill rikta dig ett stort tack för att du tagit dig tid att betygsätta vårt hotell och ge oss återkoppling! Det glädjer mig verkligen att läsa dina fina kommentarer. Det låter som att ni haft en kanonvistelse på vårt hotell.  Vi ser fram emot att få välkomna er alla som våra gäster igen!   Önskar dig en trevlig dag.  Med vänlig hälsning,  Emilia Hallström  Marknadskoordinator",Date of stay: December 2018,"[All, languages]",421
A TripAdvisor Member,Dec 2018,5,Top Hotel,"Radisson Blue Lund was a perfect hotel for my business travel.Modern Style, nice rooms, friendly staff, good breakfast and lunch.....People visiting Lund of any reasons, I can highly recommend to go for this hotel.","Response from annablomqvist, Marknadskoordinator at Radisson Blu Hotel LundResponded 3 weeks ago",Responded 3 weeks ago,"Dear Voyage62376191291,   I would like to thank you very much for your stay at Radisson Blu Hotel Lund. We are pleased to learn that you had a delighting experience with us.  Feedback as such inspires us to further improve our quality standards and continue to provide excellent service consistently. We certainly hope to welcome you back at the hotel the near future and please let us know if we would be of any help to you.  Yours sincerely,  Emilia Hallström Marketing Coordinator  ",Date of stay: December 2018,"[All, languages]",421
Baronen,Dec 2018,4,Friday @ Radisson,Man kan nog inte få en sämre start på sin vistelse då jag lastat ut alla barnsaker ur bilen och går för att ställa om den i p-huset varpå jag möts av en av Europarks ilskna och icke-samarbetsvilliga p-lisor som ger mig 600kr i böter. På hotellet bemöts vi däremot ytterst väl och…,"Response from annablomqvist, Marknadskoordinator at Radisson Blu Hotel LundResponded 3 weeks ago",Responded 3 weeks ago,"Hej BaronafSweden,  Tack för att du tagit dig tid att ge oss feedback på er vistelse, vi uppskattar det jättemycket! Vilket toppenbetyg. Det glädjer oss att ni var nöjda med servicen på Radisson Blu Hotel Lund. Vi är glada att höra att ni gillade våra rum och sängar, då hoppas vi ni sov gott! Ledsen att höra att ni var mindre nöjd med parkeringen. Då vi inte äger parkeringen har vi dessvärre svårt att styra över det. Vi hoppas så klart ni vill komma tillbaka till oss igen ändå och vi önskar er varmt välkomna tillbaka !   Bästa hälsningar / Emilia Hallström, Marketing Coordinator ",Date of stay: December 2018,"[All, languages]",421
Excursion65948953002,Dec 2018,4,clean and near to office,I wish the hotel can prepare better breakfast with more variety of food.Not only the same food for breakfast for 11 daysBut room and the bed are clean.However it will be better if they provide tooth paste ,"Response from annablomqvist, Marknadskoordinator at Radisson Blu Hotel LundResponded 3 weeks ago",Responded 3 weeks ago,"Dear Excursion65948953002  Thank you for choosing Radisson Blu Hotel Lund and for sharing your experience with us.  We are glad to learn that your overall staying experience with us was good. Meanwhile, I appreciate your feedback regarding the breakfast buffet. Rest assured, your constructive comments are much valued and are taken into consideration.   We thank you for this and we are looking forward to welcoming you as our guest again!    Yours sincerely,   Emilia Hallström Marketing Coordinator ",Date of stay: November 2018,"[All, languages]",421
Observanten,Dec 2018,3,Weekend i Lund.,"Radisson Park Inn Lund  + för Lättillgängligheten från motorvägen, rent och snyggt på rummet, lugn och skön atmosfär.  - för att det endast fanns ett täcke i dubbelsängen = krig,  ingen interntelefon på rummet,  rummet saknade skohorn.  Men det värsta var ändå att vid frukosten…","Response from annablomqvist, Marknadskoordinator at Radisson Blu Hotel LundResponded 3 weeks ago",Responded 3 weeks ago,"Kära gäst.  Stort tack för att du tagit dig tiden att ge oss värdefull feedback här på TripAdvisor.  Härligt att du uppskattade läget och rummen på vårt fina hotell! Vid nästa tillfälle bara be om ett extra täcke så ordnar vi detta. Mycket tråkig läsning gällande frukosten, så ska det inte självklart inte vara. Vi ber så mycket om ursäkt att ni fått uppleva detta. Frukostutbudet uppdateras kontinuerligt och jag hoppas verkligen att vi ändå får chansen att välkomna er vid nästa besök i Lund. Då hoppas vi att kunna överträffa era förväntningar och ge er en oförglömlig vistelse.  Med vänliga hälsningar Emilia Hallström Marketing Coordinator ",Date of stay: December 2018,"[All, languages]",421
Diego Gervas,Nov 2018,4,"A great choice in Lund,.. for Business",I fully recommend this Hotel in Lund. I had a three nights stay in this hotel and it was OKI fully recommend this Hotel in Lund. I had a three nights stay in this hotel and it was OKIt is the perfect choice in Lund if you've got to be there for businesses. It is at 15 minutes…,"Response from annablomqvist, Informationsansvarig at Radisson Blu Hotel LundResponded Nov 25, 2018","Responded Nov 25, 2018","Dear Diego G,   Wow - Thank you for taking time to share the positive experience of your recent stay with us. I am very pleased to read you had an excellent stay with us and that you find all our staff providing great service. We really care how our guests feel about their stay and it is reviews like yours that give us so much enthusiasm and drive to keep on providing the best possible service. On behalf of our entire staff here at the hotel we would like to thank you for being our guest and we hope to see you again soon!   Kind regards, Emilia Hallström  / Sales and Marketing Department",Date of stay: November 2018,"[All, languages]",421
Explorer02717560646,Nov 2018,4,Very good experience,"Well situated, clean, practical.Functional bathroom. I would appreciate to get a bit warmer floor in the bathroom.I think it is not necessary to have all lights on when entering the room as first thing I domis to turn off 75 percent ..Good ratio between quality and cost","Response from annablomqvist, Marketing Coordinator  at Radisson Blu Hotel LundResponded Nov 20, 2018","Responded Nov 20, 2018","Dear Explorer02717560646,  We very much appreciate your comments regarding your stay at our hotel in Lund.   It is always a pleasure to receive positive feedback. I will share your comments with our team. I am sure that this feedback will serve as an encouragement to all of our staff as we strive to continuously improve the quality of our services.  Thank you again for sharing your experience, and we hope your next visit will be as pleasant as the previous one.  Sincerely, Emilia Hallström  Sales and Marketing Department",Date of stay: November 2018,"[All, languages]",421
Eva L,Nov 2018,4,Konferens,"Trevliga rum ljuda och tilltalande med bra tillgänglighet. Har varit härvid flera tillfällen, bra förbindelser till Malmö. Trevlig personal, maten är ok inte över sig men bra lunchmat, fikorna är ok och rakt utanför dörren. ","Response from annablomqvist, Sales Department at Radisson Blu Hotel LundResponded Nov 6, 2018","Responded Nov 6, 2018","Hej Eva. Vill rikta dig ett stort tack för att du tagit dig tiden att lämna feedback här på TripAdvisor om din vistelse på vår fina mötesanläggning. Det uppskattar vi verkligen! Det glädjer oss mycket att du är nöjd med servicen och maten hos oss.  Vi önskar dig varmt välkomnen tillbaka till oss vid nästa möte i Lund!  Ha en fin dag,  Vänliga hälsningar Emilia Hallström  Sales & MarketingDepartment  ",Date of stay: November 2018,"[All, languages]",421
Penguin888,Oct 2018,5,Great hotel.Perfect combination between business and familiar,"There are FOUR receptionists (You re lucky if you have ONE in Sweden in the night) And all very friendly and attentive. Comfortable flair from entrance to reception, restaurant, rooms. Great breakfast also (I reached too late for dinner) after a really stressy day we found total…","Response from annablomqvist, Sales and Marketing Department  at Radisson Blu Hotel LundResponded Oct 28, 2018","Responded Oct 28, 2018","Dear Penguin888,   WOW!! Thank you very much for sharing your experience in our hotel with us. I am delighted to see that you really enjoyed your stay, the staff, restaurant our room facilities met your highest expectations.  Guest comments are the best way to keep providing wonderful stays to our future guests. I will share your fantastic feedback to the rest of the team!   I hope to have the opportunity to welcome you back to Lund in a near future.  Warmest regards,  Emilia Hallström Sales & Marketing Department ",Date of stay: September 2018,"[All, languages]",421
edmundyeobh,Oct 2018,5,Great Service and Excellent Stay at Park Inn Lund,The rooms are so comfortable. The Reception Staff are friendly and provide great service to my stay in Lund last week. it was my third time staying there and totally enjoyed my stay at Park Inn. The food is great too. Key thing was the friendly staff and good hotel rooms. Thank…,"Response from annablomqvist, Sales Department  at Radisson Blu Hotel LundResponded Oct 23, 2018","Responded Oct 23, 2018","Dear edmundyeobh,  We very much appreciate your comments regarding your stay at our hotel in Lund.   It is always a pleasure to receive positive feedback like yours. I will share your comments with our team. I am sure that this feedback will serve as an encouragement to all of our staff as we strive to continuously improve the quality of our services.  Thank you again for sharing your experience, and we hope your next visit will be as pleasant as the previous one.  Sincerely, Emilia Hallström Sales and Marketing Department ",Date of stay: October 2018,"[All, languages]",421
Enrico L,Oct 2018,5,Good Hotel ,I’ve spent a lots of days in this hotel. The hotel is in a quiet area. The rooms are tidy and clean. The staff is faster and professional. The breakfast is quite good. In general is a good hotel to spend days for work.,"Response from annablomqvist, Sales Department at Radisson Blu Hotel LundResponded Oct 11, 2018","Responded Oct 11, 2018","Dear Enrico L,   Thank you for taking the time to share your experience.  It is our greatest pleasure to read your compliments about our hotel and about your stay.  I won't miss sharing your feedback with our ambassadors and it will serve as an encouragement as we strive to continuously improve the quality of our services. It is very rewarding to see that our staff was able to meet your expectations.  We look forward to welcoming you back again soon.  Kind regards, Emilia Hallström Sales Department  ",Date of stay: October 2018,"[All, languages]",421
kolokasiandria,Oct 2018,5,Ideal choice,It was a great choice for our stay in lund.very friendly and proffesional staff that provide any help and info we ask for.a moden hotel with various facilities for the clients who visit the wonderful city of lund.Value for money.a really nice and quiet place to relax.thank yoy,"Response from annablomqvist, Sales Department  at Radisson Blu Hotel LundResponded Oct 11, 2018","Responded Oct 11, 2018","Dear kolokasiandria,  We very much appreciate your comments regarding your stay at our hotel in Lund.   It is always a pleasure to receive positive feedback. I will share your comments with our team. I am sure that this feedback will serve as an encouragement to all of our staff as we strive to continuously improve the quality of our services.  Thank you again for sharing your experience, and we hope your next visit will be as pleasant as the previous one.  Sincerely, Emilia Hallström  Sales and Marketing Department",Date of stay: October 2018,"[All, languages]",421
Malin B,Oct 2018,3,Sämre för varje gång..,Vi har bott här ett par gånger. Bra parkering även för större fordon. Precis vid motorvägen. Dock hittar typ ingen GPS till adressen.. Bra in/utcheckning o även övrig service kopplat till bokningen. Bra frukost o helt ok rum (superior) även om jag saknar tex vinglas o skohorn…,"Response from annablomqvist, General Manager at Radisson Blu Hotel LundResponded Oct 12, 2018","Responded Oct 12, 2018","Bästa Malin, tack för att du tagit dig tid att recensera vårt hotell. Vi tycker det är jättebra att få reda på vad gästerna tycker, för då har vi ju faktiskt möjligheten att förbättra oss. Kul att du är överlag är nöjd med oss och att ni bott hos oss flera gånger. Men det var ju tråkigt att du inte var nöjd med restaurangen. Vi får vanligtvis mycket beröm för vår restaurang och därför reagerar jag över just detta. Om ni besöker oss igen får ni gärna fråga efter mig, jag hade tyckt det var jättekul att berätta mer för er om vår restaurang och kanske få bjuda på en bit mat.   Varma hälsningar Anna Blomqvist General Manager Park Inn by Radisson Lund ",Date of stay: October 2018,"[All, languages]",421
Jørgen Eggert N,Sep 2018,5,Fremragende. Hotel,"Vi følte os meget velkomne på hotellet. Værelset var meget stilrent og moderne med god smag. Alt var meget rent.  Om aftenen spiste vi i den lille restaurant Aperitivo, hvor vi bestilte plankesteg og kylling. Meget velsmagende og tilpas portion. Stemningen var hyggelig og…","Response from annablomqvist, Sales Department at Radisson Blu Hotel LundResponded Sep 26, 2018","Responded Sep 26, 2018","Hej Jørgen Eggert N,  Wow vilken härlig läsning! Tack för att du tagit dig tiden att skriva så trevligt omdöme om oss, det uppskattar vi mycket. Härligt att ni njöt av en god middag i vår restaurang och fick en bra start på dagen med vår välfyllda frukostbuffé.  Vi hoppas att ni snart kommer och bor hos oss igen!  Må så gott och varmt välkommen åter.  Vänliga hälsningar, Emilia Hallström  Sales and Marketing Department ",Date of stay: September 2018,"[All, languages]",421
ErikZT,Sep 2018,5,Exceptional - and probably the best hotel breakfast in the region,"Just stayed here with my family.  Exceptional value and quality.  forget about the often bland Scandic hotels when traveling Sweden! Park Inn seems the answer to both business and family travelers. Spotless new hotel with great rooms,  large fitness center and sauna, best…","Response from annablomqvist, Sales Department at Radisson Blu Hotel LundResponded Sep 23, 2018","Responded Sep 23, 2018","Dear ErikZT,  WOW!! Thank you for taking time to share the positive experience of your recent stay with us. I am very pleased to read you had an excellent stay with us and that you find all our staff providing great service. We really care how our guests feel about their stay and it is reviews like yours that give us so much enthusiasm and drive to keep on providing the best possible service. On behalf of our entire staff here at the Park Inn we would like to thank you for being our guest and we hope to see you again soon!   Kind regards, Emilia Hallström / Sales and Marketing Department",Date of stay: September 2018,"[All, languages]",421
Pavel M,Sep 2018,5,"Nice place to stay, but quite far away from the center","Park Inn is a first choice, if you are going to Tetra Pak or World Trade center. It's quite calm place. Staff is very pleasant and helpful. My room was clear, spacious, but for me it looks too ""industrial"" (like  hospital ward or VIP prison cell :), not cozy enough. But this is…","Response from annablomqvist, Sales Department at Radisson Blu Hotel LundResponded Sep 18, 2018","Responded Sep 18, 2018","Dear Pavel M,  Thank you for sharing your review on TripAdvisor.  It is really nice to know that you had a good stay with us and that the team made your stay comfortable. We very much appreciate your recognition on the service as well as the overall hotel facilities and it was a pleasure to have you as our guest.  Thank you once again for taking the time to provide us with feedback of your recent stay and we sincerely do hope that we would have the opportunity of welcoming you back again as our guest.  Kind regards,  Emilia Hallström Sales and Marketing Department ",Date of stay: September 2018,"[All, languages]",421
Simme2018,Sep 2018,5,Simon,"Mycket bra helhetsupplevelse! Trevlig personal, bra restaurang (inkl. frukost), moderna, rena och välutrustade rum. Social och trevlig lobbybar med bl.a. biljard och sällskapsspel. Sköna sängar och kuddar. Hade det funnits möjlighet att köpa med sig kuddar hem så hade jag gjort…","Response from annablomqvist, Sales Department  at Radisson Blu Hotel LundResponded Sep 17, 2018","Responded Sep 17, 2018","Hej Simon. Tusen tack för att du tagit dig tiden att lämna feedback här på TripAdvisor om din vistelse på Park Inn by Radisson Lund, det uppskattar vi verkligen! Det glädjer oss mycket att du fick en bra upplevelse och var nöjd med servicen, maten och rummet. Då hoppas vi att du sov gott :) Vi önskar dig varmt välkomnen tillbaka till oss vid nästa besök i Lund!  Ha en fin dag,  Vänliga hälsningar Emilia Hallström / Sales Department ",Date of stay: September 2018,"[All, languages]",421
Jarek S,Sep 2018,5,Super !!!,"It was a business / hard work trip , 6 days 10-14hours of work, returning-to Hotel and to the quiet and clean room was as salvation . Hotel is located nearby highway, about 20 minutes of good walk from town center Lund. Bar and evening restaurant is very nice there but busy…","Response from annablomqvist, Sales Department at Radisson Blu Hotel LundResponded Sep 14, 2018","Responded Sep 14, 2018","Dear Jarek,  I would like to take a chance to thank you for choosing our property and for your time taken to share your travel experience with other travelers on Tripadvisor. It is rewarding to read your lovely comments and to see your high out rating in regards to our comfortable room facilities, service and breakfast buffet. Meanwhile, I appreciate your feedback regarding that you had to wait too long in the restaurant. Rest assured, your constructive comments are much valued and are taken into consideration.  We thank you for this and we are looking forward to welcoming you as our guest again!  Kind regards, Emilia Hallström, Sales Department ",Date of stay: September 2018,"[All, languages]",421
Muath A,Sep 2018,1,Bad hotel ,"Very bad service from the receptionist. They gave you wrong information then other worst receptionist ever I have ever met, she said it is not there mistakes because her colleague is in internship and doesn’t know about their procedures!!!!! ","Response from annablomqvist, General Manager at Radisson Blu Hotel LundResponded Sep 9, 2018","Responded Sep 9, 2018","Dear Muath,  Thank you for taking the time to review your stay with us. We are so sad you are not happy with the service at our reception. We usually hear that we are well-known for our service minded staff. It seems like you've met our trainee Johanna, who just started with us. Johanna is a young girl, 16- years old, who goes to high school. She has the goal of getting a job at a hotel and is really eager to get out and practice and learn how it really works in a hotel reception. As you can understand, Johanna is a beginner, as we have all been, but I can assure you that she is doing her absolute best every day to meet our guests' demands for service. And we teach her as much as we can. I apologize if you think you received poor service from our trainee and I really hope there was nothing serious that happened to you. Hope that we will have the chance to make you feel welcome, please feel free to contact me if you visit us again.   Best regards,  Anna Blomqvist  General Manager Park Inn by Radisson Lund",Date of stay: September 2018,"[All, languages]",421
Rupert U,Sep 2018,5,Great hotel,"The hotel was easy to find and just on the edge of the beautiful little city. The staff were polite, friendly and helpful and the breakfast was great. We booked a family room and got two big adjoining rooms with lots of space. We borrowed the free bicycles and went in to the…","Response from annablomqvist, Sales Department at Radisson Blu Hotel LundResponded Sep 9, 2018","Responded Sep 9, 2018","Dear Rupert. Thank you for choosing to stay with Park Inn by Radisson Lund and taking the time to share your experience on Tripadvisor. We strive to provide all of our guests with a memorable and comfortable stay whilst with us. Therefore it is a pleasure to read your review. We look forward to welcoming you back soon.   Sincerely yours, Emilia Hallström, Sales Department ",Date of stay: September 2018,"[All, languages]",421
