Joash-Herbrink,Aug 2015,5,Very nice hotel,"this is another great example of the class the Rezidor hotel group wants to deliver to it's guests. I stayed here in early August 2015, and the hotel is very very welcoming. a good restaurant and welcoming bar & lobby upon entering the hotel make you feel ""at home"". the rooms…","Response from ParkInnLund, Hotelldirektör at Radisson Blu Hotel LundResponded Aug 5, 2015","Responded Aug 5, 2015","Dear Joash-Herbrink,  So happy to hear you enjoyed staying with us, that you felt at ""home"" and apreciated the service provided.  We very much look forward to welcoming you back soon again!  Kindest Regards, Charlotta Olsson",Date of stay: August 2015,"[All, languages]",421
Viktoria G,Aug 2015,3,Vi blev besvikna.,"Vi läste en reklam, där beskriver att hotel ligger "" stenkast"" från centrum. Hotellet befinns i industri område cirka 4 km från centrum. På en sida en byggplatsen på andra p plats lika grusgrop. Det fins inte något bredvid, överallt man måste åka med bil. Rummet är bra komfort,…","Response from ParkInnLund, Hotelldirektör at Radisson Blu Hotel LundResponded Oct 7, 2015","Responded Oct 7, 2015","Hej Viktoria,  Det är verkligen tråkigt att höra att ni inte var nöjda med er vistelse hos oss. Om ni planerar att komma tillbaka till Lund skulle jag bli väldigt glad om ni kontaktar mig på charlotta.olsson@rezidorparkinn.com så hoppas jag att vi ska kunna uppfylla och överträffa era förväntningar.  Vänliga Hälsningar Charlotta Olsson",Date of stay: August 2015,"[All, languages]",421
StefanLast78,Aug 2015,5,Kurzurlaub in Südschweden ,Wir waren zum Kurzurlaub mit der Familie für 3 Nächte hier und waren super zufrieden.  Die Zimmer sind modern eingerichtet. Es war sehr sauber. Die Angestellten des Hotels waren sehr freundlich und hilfsbereit.  Wir kommen gerne wieder.,"Response from ParkInnLund, Hotelldirektör at Radisson Blu Hotel LundResponded Oct 7, 2015","Responded Oct 7, 2015","Dear Stefan,  Thank you very much for staying at Park Inn by Radisson Lund and for your kind recommendations. It is great to hear you have enjoyed staying with us.  We hope to welcome you back soon again!  Kind Regards, Charlotta Olsson",Date of stay: August 2015,"[All, languages]",421
Ute,Jul 2015,5,"Sauber, gute Zimmer, gutes Frühstück, gutes Preisleistungsverhältnis.","Das Hotel ist noch brandneu, liegt in einem Gewerbegebiet - nur 20 Gehminuten vom alten Zentrum entfernt. Es gibt auch Hotelfahrräder für diejenigen, die nicht laufen mögen. Die Sicht ist oben sehr weitläufig, dennoch ist es halt ein Gewerbegebiet. Das ist jedoch nicht störend,…","Response from ParkInnLund, Hotelldirektör at Radisson Blu Hotel LundResponded Oct 7, 2015","Responded Oct 7, 2015","Thank you very much for staying at Park Inn by Radisson Lund and for your kind recommendations. It makes us very happy you really seem to have enjoyed your stay and that you have taken advantages of the facilities and services we do offer our guests.    We hope to welcome you back soon again!  Kind Regards, Charlotta Olsson",Date of stay: July 2015,"[All, languages]",421
GabrielaR844,Jul 2015,5,Very nice surprise! !!customer service at high level,We arrived late on saturday evening. The reception girl wellcomed us very warm fast and providing all the info needed with A smile. Is not many places where you meet such A Nice staff .  The hotel is New all is shining and the loby is warm decorated they have there games and…,"Response from ParkInnLund, Hotelldirektör at Radisson Blu Hotel LundResponded Aug 5, 2015","Responded Aug 5, 2015","Hej Gabriela,  Tusen tack för er fantastiska feedback! Det är verkligen roligt att höra att ni trivts hos oss och uppskattat vår personal och det bemötande ni fått.  Varmt Välkomna tillbaka!  Vänliga Hälsningar Charlotta Olsson",Date of stay: July 2015,"[All, languages]",421
sturob47,Jul 2015,3,Not too impressed,"Stayed here 2 nights Fri & Sat and was invited to do a room upgrade which I took the opportunity to do for and extra $60. What do I get for my money? a bigger bed and a dressing gown, really not worth the cost. Found the reception and bar staff a little nonchalant and everything…","Response from ParkInnLund, Hotelldirektör at Radisson Blu Hotel LundResponded Aug 5, 2015","Responded Aug 5, 2015",Tack för att du bott hos oss på Park Inn by Radisson Lund. Det är verkligen tråkigt att höra att du inte känt att du fått den service du förväntat dig. Vår fantastiska service och bemötande är annars det våra gäster brukar lyfta fram. Jag hoppas att vi får välkomna dig tillbaka och att du då verkligen ska känna att vi bryr oss om våra gäster.  Varmt Välkommen tillbaka!  Vänliga Hälsningar Charlotta Olsson,Date of stay: July 2015,"[All, languages]",421
Angeliho,Jul 2015,4,Fint och nytt hotell i Lund,Hotellet är så nytt att det nästan känns som ingen bott i rummet före dig. Inredningen är affärsmässigt stilig i brunt och kan uppfattas som lite tråkig. I sitt sammanhang är den ändå helt rätt. Besvikelsen var middagen med en enklare meny och maten var inte vällagad och…,"Response from ParkInnLund, Hotelldirektör at Radisson Blu Hotel LundResponded Aug 5, 2015","Responded Aug 5, 2015","Hej Angeliho,  Tack för att ni bott hos oss på Park Inn by Radisson Lund. Roligt att ni utnyttjade våra cyklar! Jag ber verkligen om ursäkt om maten inte var till belåtenhet och tack för ert överseende. Vi arbetar verkligen med att förbättra vår restaurang.  Varmt Välkomna tillbaka!  Vänliga Hälsningar Charlotta Olsson",Date of stay: July 2015,"[All, languages]",421
Emelie,Jul 2015,5,Super trendigt & jätte mysigt!,Ligger lite utanför själva centrum men perfekt för en lite getaway. Ligger nära motorvägen men man slipper höra trafiken.  Verkligen jätte sköna sängar & täcken.  Det enda som kunde gjort detta outstanding hade varit om där fanns pool/jacuzzi annars är det helt perfekt.…,"Response from ParkInnLund, Hotelldirektör at Radisson Blu Hotel LundResponded Aug 5, 2015","Responded Aug 5, 2015",Tack Emelie för ditt fantastiskt fina omdöme! Vad roligt att ni trivdes hos oss och jag hoppas att vi snart fårvälkomna er tillbaka igen!  Vänliga Hälsningar Charlotta Olsson,Date of stay: June 2015,"[All, languages]",421
Bernd K,Jul 2015,5,Superfreundliches und zuvorkommendes Personal.,"Sehr gute Zimmerausstattung, kostenloser und unkomplizierter Fahradverleih. Qualitativ gutes Frühstücksbuffet. Kostenlose Parkplätze. Schöne Stadt Lund in Innenstadtnähe. Tolle Infrastruktur. Gärten zum erholen in der Nähe. Alles super. Leider kein deutsches Fernsehprogramm!","Response from ParkInnLund, Hotelldirektör at Radisson Blu Hotel LundResponded Jul 9, 2015","Responded Jul 9, 2015","Dear Bernd,  Thank you so much for your kind comments about our staff. I am very happy to hear you had a good stay and enjoyed the city of Lund as well as our breakfast and the bikes.   I hope to welcome you back to Lund again!  Kind Regards, Charlotta Olsson",Date of stay: July 2015,"[All, languages]",421
Lilian P,Jul 2015,5,Weekend ophold.,Ankomst efter 15.  Vi fik værelser kl 12.  Meget venligt personale. Lånte cykel og kørte de ca 2 km til centrum. Boede på 7 etage med fantastisk udsigt over området. Grønne marker og små landbrug. Aircondition og fri internet. Meget skønt værelse med god plads. Kogekande og te…,"Response from ParkInnLund, Hotelldirektör at Radisson Blu Hotel LundResponded Jul 9, 2015","Responded Jul 9, 2015","Hej Lilian,  Tack för ditt fantastiskt fina omdöme! Vad roligt att ni trivdes hos oss.  Jag hoppas att vi får välkomna er tillbaka snart igen.  Vänliga Hälsningar Charlotta Olsson",Date of stay: July 2015,"[All, languages]",421
A TripAdvisor Member,Jul 2015,5,Sehr zu empfehlen,Neues Haus. Gut an der Autobahn gelegen. Trotzdem absolut ruhig. Die Mitarbeiter sind sehr freundlich und komtetent. Etwas schwierig ist die Duschabtrennung im Bad. Das Wasser spritzt ziemlich im Bad rum. Eine Überschwemmung gab es aber nicht. Deutsches TV wäre schön - ist aber…,"Response from ParkInnLund, Hotelldirektör at Radisson Blu Hotel LundResponded Jul 3, 2015","Responded Jul 3, 2015","Dear Rainer,  Thank you for staying with us and for your kind review. It makes me very happy to hear your kind comments about our staff.   Warmly Welcome back!  Kind Regards, Charlotta Olsson",Date of stay: June 2015,"[All, languages]",421
Enrico L,Jun 2015,4,Good Hotel,"The hotel in new and everything is clean and shine. The staff is professional and faster. The room are good and clean, but there aren't windows to open. The breakfast is ok, there is a lot of choice and the quality of the food is good. So at the end is a beautiful hotel.","Response from ParkInnLund, Hotelldirektör at Radisson Blu Hotel LundResponded Jul 3, 2015","Responded Jul 3, 2015","Dear Enrico,  Thank you very much for your feedback! It makes me happy to hear you enjoy staying with us and we hope to see you back soon again.  Kindest Regards, Charlotta Olsson",Date of stay: June 2015,"[All, languages]",421
A TripAdvisor Member,Jun 2015,5,"Elegant, friendy and professional",I have stayed at the hotel several times and have always been received in a very professsional and friendly way by the staff. The hotell has an elegant and relaxed atmosphere. Excellent parking facilities just outside the hotel. I can strongly recommend it.,"Response from ParkInnLund, Hotelldirektör at Radisson Blu Hotel LundResponded Jul 3, 2015","Responded Jul 3, 2015","Dear Gunnar,  Thank you for your strong recommendations! It is always a pleasure to welcome you back and we hope to see you in Lund soon again.  Kindest Regards, Charlotta Olsson",Date of stay: June 2015,"[All, languages]",421
Huzefa,Jun 2015,4,"the smell of ""brand new""","late night taxi into the hotel, prompt checkin at the reception... the cool feature is the online checkin system they have, rarely seen that for hotels.  Crisp clean room, good wifi connection, ample bathroom, very modern straight-lines look to the hotel and the rooms. …","Response from ParkInnLund, Hotelldirektör at Radisson Blu Hotel LundResponded Jul 3, 2015","Responded Jul 3, 2015","Thank you for staying with us and for your good review. Great to hear you took advantage of the online self check-in. It is very convenient.  Hope to see you back soon again!  Kind Regards, Charlotta Olsson",Date of stay: June 2015,"[All, languages]",421
anniwaltraud,Jun 2015,3,Enttäuschender Besuch mittels einer Minikreuzfahrt.,Der neuartige Hotelklotz liegt direkt neben der Autobahn. In der Nachbarschaft des Hotels finden ausgiebige Bauarbeiten statt. Der hoteleigene Parkplatz ist demgemäß ein staubiges Provisorium. In der Nähe liegt die bekannte schwedische Firma Tetra Pak. Zum Stadtkern von Lund…,,,,Date of stay: June 2015,"[All, languages]",421
Lise J,Jun 2015,4,Hotell i tiden,"Strategisk plassert rett ved siden av motorveienn, er dette hotellet perfekt hvis du skal besøke Malmö eller Lund. Parkerin rett utenfor uten ekstra kostnad er en ekstra bonus. Rent og pent i minimalistisk stil med meget prisverte rom på over 20 m2 finner du inget bedre i Lund…","Response from ParkInnLund, Hotelldirektör at Radisson Blu Hotel LundResponded Jul 3, 2015","Responded Jul 3, 2015","Hej Lise,  Tusen tack för din fantastiskt fina feedback! Vad roligt att höra att ni har trivts hos oss.   Jag hoppas att vi får välkomna er tillbaka snart igen.  Vänliga Hälsningar Charlotta Olsson",Date of stay: June 2015,"[All, languages]",421
A TripAdvisor Member,Jun 2015,5,New and elegant hotel,Great service and excellent with bikes for free renting - nice to visit the centre of Lund with bike. Very comfortable beds and pillows. Quiet rooms with very nice colors of furniture and walls. The breakfast had many nice ingredients.,"Response from ParkInnLund, Hotelldirektör at Radisson Blu Hotel LundResponded Jul 3, 2015","Responded Jul 3, 2015","Thank you for your very kind review. It is great to hear you enjoyed the rooms as well as the breakfast and service and that you took the advantage to lend our bikes.   We wish you warmly welcome back!  Kind Regards, Charlotta Olsson",Date of stay: June 2015,"[All, languages]",421
EmmanuelMTX,Jun 2015,4,"Overnighting comfortably, but culinaristically modestly","We have stayed here twice now, one year apart and we have been very happy with the rooms. Comfy beds, clean and neat all around. The parking area is perhaps not as safe as we would hope for a family car full of travellers stuff and the food (dinner in the evening and breakfast)…","Response from ParkInnLund, Hotelldirektör at Radisson Blu Hotel LundResponded Jul 3, 2015","Responded Jul 3, 2015","Dear Emmanuel,  Thank you for staying at Park Inn by Radisson Lund and for your feedback. It is always a pleasure to welcome our guests back. I do apologize the food was not satisfying and really hope you will find it better cooked at your next visit.   We hope to welcome you back soon again and please do not hesitate to contact myself our my colleagues if there is anything we can do to assist.   Kind Regards, Charlotta Olsson",Date of stay: June 2015,"[All, languages]",421
Alleirbag18,Jun 2015,5,Superfräscht!,"Vi var här och firade vår bröllopsdag. Blev väl mottagna, fint rum med en hälsning, sängen var superskön, allt var rent och fint, vi fick rum på 10e våningen men en trevlig utsikt genom de stora fönstren. Frukosten var bra och mycket god! Väldigt nöjda med helheten:) enda…","Response from ParkInnLund, Hotelldirektör at Radisson Blu Hotel LundResponded Jul 3, 2015","Responded Jul 3, 2015",Vad roligt att ni trivdes hos oss och att ni valde att fira er bröllopsdag Park Inn by Radisson Lund. Jag hoppas att ni hade en underbar dag!  Varmt Välkomna tillbaka!  Vänliga Hälsningar Charlotta Olsson,Date of stay: June 2015,"[All, languages]",421
A TripAdvisor Member,Jun 2015,5,Very good,It was a perfect hotell. Good location with many parkingplaces. The room was clean and nice. No disturbing noice. The service was excelent especially when we checked in. Breakfast good. We had nothing to complain about.,"Response from ParkInnLund, Hotelldirektör at Radisson Blu Hotel LundResponded Jul 3, 2015","Responded Jul 3, 2015",Tack Lennart för din fantastiskt fina recension.  Vi ser fram emot att välkomna er tillbaka till Lund snart igen!  Vänliga Hälsningar Charlotta Olsson,Date of stay: June 2015,"[All, languages]",421
A TripAdvisor Member,Jun 2015,5,great place to stay,"Clean hotel, great service, great food. Bicyles available, close bike ride to city center. Great atmosphere and helpful staff. Rooms are good size, clean. Internet worked really well. I often travel for work in the Lund area - I will definately stay at thois hotel again.","Response from ParkInnLund, Hotelldirektör at Radisson Blu Hotel LundResponded Jul 3, 2015","Responded Jul 3, 2015","Thank you very much for your fantastic feedback!  We look forward to welcome you back soon again!  Kind Regards, Charlotta Olsson",Date of stay: June 2015,"[All, languages]",421
Eskil1965,Jun 2015,4,Fräscht hotell med trevlig och hjälpsam personal,"Skulle tillbringa en natt I Malmö, men fick ett erbjudande på detta nybyggda hotel i Lund. Rent och fräscht rum och en väldigt trevlig lobbybar/restaurang som var mycket trevligt inredd. Personalen var väldigt hjälpsamma och trevliga. Frukosten var av lite enklare karaktär och…","Response from ParkInnLund, Hotelldirektör at Radisson Blu Hotel LundResponded Jul 3, 2015","Responded Jul 3, 2015","Hej Eskil,  Vad roligt att höra att ni trivdes hos oss på Park Inn by Radisosn Lund och att ni passade på att bo i Lund istället. Det är ju ett väldigt bra alternativ nära Malmö.   Varmt Välkomna tillbaka!  Vänliga Hälsningar Charlotta",Date of stay: May 2015,"[All, languages]",421
A TripAdvisor Member,May 2015,5,Toppen Hotel,"Ett toppen fint hotel, jätte trevlig personal som verkligen för en att känna sig välkommen, god frukost, bra restaurang.  Att det ligger lite utanför city gör inget då man kan låna cykel och det tar bara 5min in till city. Hit återkommer jag gärna igen.","Response from ParkInnLund, Hotelldirektör at Radisson Blu Hotel LundResponded Jul 3, 2015","Responded Jul 3, 2015","Hej Claus,  Tack för din fantastiskt fina feedback!  Vi ser fram emot att välkomna dig tillbaka till Lund snart igen och vill även passa på att önska dig en trevlig sommar.  Vänliga Hälsningar Charlotta Olsson",Date of stay: May 2015,"[All, languages]",421
Atrejseera,May 2015,2,Noisy ventilation,"For a nice hotel at the usual Radisson standard, it was a great disappointment, because of noise from ventilation. Kitchen is on the other hand excellent. Reception aloof and a bit standoffish. Maybe it's the scandinavian mentality..","Response from ParkInnLund, Hotelldirektör at Radisson Blu Hotel LundResponded Jul 3, 2015","Responded Jul 3, 2015","Thank you for staying at Park Inn by Radisson Lund! It is great to hear you enjoyed the food served in the restaurant. I will make sure we have a look at the ventilation.  Kind Regards, Charlotta Olsson",Date of stay: May 2015,"[All, languages]",421
Frederico M M,May 2015,3,Good Hotel,"Bom custo benefício! Bem localizado. Apartamentos simples, mas bonitos e confortáveis. Um cama muito boa, e banho excelente. Na recepção e linda ambiente, com bom atendimento. No restaurante, boas comidas com atendimento simpático ...","Response from ParkInnLund, Hotelldirektör at Radisson Blu Hotel LundResponded Jul 3, 2015","Responded Jul 3, 2015","Dear Frederico,  Thank you very much for your kind feedback. It is great to hear you enjoyed staying with us.  Hope to welcome you back soon again!  Kind Regards, Charlotta Olsson",Date of stay: May 2015,"[All, languages]",421
Brivette42,May 2015,4,Correct,"Hotel tout neuf localisé dans une zone d'affaires. En fait juste en face au siège mondial de Tetrapak. Donc la grande majorité de clients de l'hôtel sont soit des employés, soit fournisseurs, soit clients... Un peu loin du centre de Lund pour y dîner par exemple. ","Response from ParkInnLund, Hotelldirektör at Radisson Blu Hotel LundResponded Jul 3, 2015","Responded Jul 3, 2015","Thank you very much for staying at Park Inn by Radisson Lund!  We hope to welcome you back at your next visit to Lund.  Kind Regards, Charlotta Olsson",Date of stay: May 2015,"[All, languages]",421
Fred M,May 2015,3,Bom hotel!,"Bem localizado, fácil acesso, tarifas econômicas. Os apartamentos são simples, mas muito confortáveis. Cama excelente, apartamento aquecido, um chuveiro muito bom. Na recepção tem-se atenção a toda hora, um bar/restaurante que serve boa comida e variadas bebidas. O hotel possui…","Response from ParkInnLund, Hotelldirektör at Radisson Blu Hotel LundResponded Jul 3, 2015","Responded Jul 3, 2015","Dear Fred,  Thank you for staying at Park Inn by Radisson Lund and for your very kind review. I am happy to hear you took advantage of and enjoyed our facilities and especiallyt the service received by the staff.  We hope to welcome you back soon again!  Kind Regards, Charlotta Olsson",Date of stay: May 2015,"[All, languages]",421
A TripAdvisor Member,May 2015,4,Fräscht hotell hyfsat nära centrum,"Modernt, fräscht och praktiskt. Komplett frukost med kalla och varma rätter. Beläget en bit från centrum. Bygge pågår på granntomten, men väl ljudisolerade rum borgar för en god nattsömn. Välstädat med nykänsla.","Response from ParkInnLund, Hotelldirektör at Radisson Blu Hotel LundResponded Jul 3, 2015","Responded Jul 3, 2015","Hej Peter,  Tack för din fina recension.  Varmt Välkommen tillbaka snart igen!  Vänliga Hälsningar Charlotta Olsson",Date of stay: May 2015,"[All, languages]",421
Ingritf,May 2015,4,Trevlig hotell,"Ett väldig trevlig hotell. Ren och fräsch. Tyckte om att det var jättebra att man hade vattenkokare på hotellet, för vid förkylning kunde man göra lite mer extra te. Hade väldig fin läge från centrum. Personalen var trevlig och hjälpsam. Lite rörligt på lördag morgon vid…","Response from ParkInnLund, Hotelldirektör at Radisson Blu Hotel LundResponded Jul 3, 2015","Responded Jul 3, 2015",Tack för att du bott hos oss på Park Inn by Radisson Lund och för din fina rekommendation.  Vi har sedan några veckor tillbaka utökat vår frukost med fler gluten- och laktosfria alternativ. Vore roligt att få välkomna dig tillbaka och höra vad du tycker.   Vänliga Hälsningar Charlotta Olsson,Date of stay: May 2015,"[All, languages]",421
A TripAdvisor Member,May 2015,4,MODERNE ET PROPRE,"Hotel en bord de voie express mais parfaitement insonorisé . Loin du centre ville , sans voiture le restaurant de l'hotel ne propose que très peu de choix au menu . Accueil très bon , et petit dejeuner très complet","Response from ParkInnLund, Hotelldirektör at Radisson Blu Hotel LundResponded Jul 3, 2015","Responded Jul 3, 2015","Merci d'avoir choisi notre hôtel et pour vos recommandations.  On espère de vous revoir chez nos.  Amitiés, Charlotta Olsson",Date of stay: May 2015,"[All, languages]",421
Chriscoelho1978,May 2015,4,Hotel muito bom para viagens a trabalho,"O hotel é novo e apresenta excelentes serviços. A única desvantagem é ficar um pouco distante do centro, que no entanto fica próximo. O café da manhã é muito bom. O quarto é bem espaçoso. O atendimento dos recepcionistas ficou a contento e o restaurante do hotel tem um cardápio…","Response from ParkInnLund, Hotelldirektör at Radisson Blu Hotel LundResponded Jul 3, 2015","Responded Jul 3, 2015","Thank you for staying at Park Inn by Radisson Lund and for your kind review. I am happy to hear you have enjoyed our facilities and the service. Next time, use one of our bikes when going to the city centre. It is an easy way to get there in a few minutes.    Looking forward to welcome you back soon again!  Kind Regards, Charlotta Olsson",Date of stay: May 2015,"[All, languages]",421
A TripAdvisor Member,May 2015,4,Very solid hotel,"I'm staying there almost everytime I'm in Lund. Everything is on a high level: rooms, staff, food, ... I don't like the fact in this survey that I have to put 200 chars minimum ... I hope this is enough now ...","Response from ParkInnLund, Hotelldirektör at Radisson Blu Hotel LundResponded Jul 3, 2015","Responded Jul 3, 2015","Dear Christian,  It is always a pleasure to welcome you back to Lund!  We wish you a great summer and hope to see you soon again.   Kind Regards, Charlotta Olsson",Date of stay: May 2015,"[All, languages]",421
PumaNana,May 2015,4,Отель со всеми удобствами,"Отель расположен немного в стороне от центра города, но до центра - всего минут 10-15 пешком.  Очень хороший бизнес отель, построен совсем недавно и большинство проживающих - это сотрудники компании Тетра Пак.","Response from ParkInnLund, Hotelldirektör at Radisson Blu Hotel LundResponded Jul 3, 2015","Responded Jul 3, 2015","Thank you very much for your friendly comment about our staff.   We hope to welcome you back soon again!  Kind Regards, Charlotta Olsson",Date of stay: April 2015,"[All, languages]",421
A TripAdvisor Member,May 2015,5,Great Hotel in Lund,"Hotel in Lund near historic city centre and Ideon Science Park As the only hotel in this developing area of the city, the Park Inn by Radisson Lund is an ideal accommodation for guests who wish to stay near the Ideon Science Park, home to several high-tech headquarters.","Response from ParkInnLund, Hotelldirektör at Radisson Blu Hotel LundResponded Jul 3, 2015","Responded Jul 3, 2015","Thank you very much for your kind review!  We hope to welcome you back at your next visit to Lund.  Kind Regards, Charlotta Olsson",Date of stay: May 2015,"[All, languages]",421
Zercules,May 2015,4,Sehr gutes Hotel,"Das Hotel ist nagelneu (Baujahr 2014 glaube ich) sehr modern und hell. Das Personal war super freundlich und mein Zimmer war sehr sauber und groß.  Mein Zimmer war trotz Autobahn sehr ruhig und leise (guter Schallschutz)  Das Hotel Restaurant ist gut, allerdings gab es für mich…","Response from ParkInnLund, Hotelldirektör at Radisson Blu Hotel LundResponded Jul 3, 2015","Responded Jul 3, 2015","Dear Zercules,  Thank you for staying at Park Inn by Radisson Lund and for your kind review. I am happy to hear you have enjoyed our facilities and the service.   We hope to welcome you back soon again!  Kind Regards, Charlotta Olsson",Date of stay: February 2015,"[All, languages]",421
ahseekT,May 2015,4,Oasis!,"Very nice, trendy, high spec Hotel. We had the luxury of playing the piano, chess or pool in the lounge, plus the option to hop on a bicycle into the city - a mere 5mins away! Comfortable beds, lovely bathrooms, coffee/tea facilities in our bedroom and breakfast was good too, a…","Response from ParkInnLund, Hotelldirektör at Radisson Blu Hotel LundResponded Jun 7, 2015","Responded Jun 7, 2015","Dear Keesha,  Thank you so much for your kind review and for staying with us at Park Inn by Radisson Lund. It is great to hear you enjoyed both our games in the lobby and the bicycles.  We hope to welcome you back soon again and please do not hesitate to contact myself or my colleagues if there is anything we can do to assist.   Kind Regards, Charlotta Olsson",Date of stay: May 2015,"[All, languages]",421
