Pierre H,Aug 2016,5,Top Modern Hotel!,"Great Hotel situated just near the motorway exit coming from Malmö. The hotel is quite new, and very modern. The rooms are spacious and really well equipped.  Fitness, Sauna all in house! Breakfast is good and rich in variety!  Parking available at the Park House next door, for…","Response from ParkInnLund, General Manager at Radisson Blu Hotel LundResponded Oct 31, 2016","Responded Oct 31, 2016","Dear Pierre,  Thank you very much for your super kind review! It is great to hear you have enjoyed staying with us.  Warmly Welcome back!  Kind Regards, Charlotta Olsson ",Date of stay: August 2016,"[All, languages]",421
A TripAdvisor Member,Aug 2016,5,Uitstekend hotel,"Prima hotel met een goed prijs/kwaliteitverhouding. Ligging is zeer gunstig bij gebruikmaking van een auto. Parkeren in parkeergarage direct naast het hotel, tegen redelijke prijs. Ook gratis fietsen. Afstand tot centrum Lund is ongeveer 3 km.","Response from ParkInnLund, General Manager at Radisson Blu Hotel LundResponded Aug 5, 2016","Responded Aug 5, 2016","Dear Wim,  Great to hear you enjoyed your stay and thank you so much for your fantastic review! We look much forward to welcome you back again.  Kind Regards, Charlotta Olsson ",Date of stay: August 2016,"[All, languages]",421
Michel,Jul 2016,5,Prima hotel,"We hebben zowel op de heen- als de terugweg hier overnacht als tussenstop op onze road trip naar Noorwegen. Het hotel ligt vlak bij de afrit van de snelweg. Parkeren kan voor 50 kroon per dag in de naastgelegen parkeergarage. De kamers zijn schoon en modern, en het ontbijt en…","Response from ParkInnLund, General Manager at Radisson Blu Hotel LundResponded Aug 5, 2016","Responded Aug 5, 2016","Thank you so much for your fantastic review! It is good to hear you had a great stay.  Kind Regards, Charlotta Olsson ",Date of stay: July 2016,"[All, languages]",421
ushibanova,Jul 2016,4,Холодно,Отель неплохой. До центра около 1 км. Напротив завода тетра пак. Тихо.  Хороший воздух.  Бегает вокруг  местный кролик Завтраки отличные! Очень вкусные.  Номер нормальный. Чистенько удобный.  Но нет тапочек. Нет халата. Было очень холодно.  Как ни настраивай кондиционер на…,"Response from ParkInnLund, General Manager at Radisson Blu Hotel LundResponded Aug 5, 2016","Responded Aug 5, 2016","Thank you very much fpr staying with us and it is great to hear you liked the breakfast!  Warmly Welcome back again!  Kind Regards, Charlotta Olsson ",Date of stay: March 2016,"[All, languages]",421
Bo H,Jul 2016,5,Ferie ,Super godt hotel og skønt personale flinkt og hjælpsomt og skønne værelser og morgenmaden er super god der mangler ikke noget her og skønt sted til en billig penge tumps up 👍👍👍👍👍 og ligger et par km fra Lund by som er en smuk og utrolig hyggelig by med en masse gode…,"Response from ParkInnLund, General Manager at Radisson Blu Hotel LundResponded Aug 5, 2016","Responded Aug 5, 2016","Hej Bo,  Vad roligt att höra att ni har haft det bra hos oss, att ni uppskattade vår personal och tyckte om vår frukost och våra rum. Visst är Lund en söt stad. :)  Vänliga Hälsningar Charlotta Olsson ",Date of stay: July 2016,"[All, languages]",421
Anders S,Jul 2016,5,Ett mycket bra hotell,"Hotellet är nybyggt , ett hotel med standard över det genomsnittliga  . Dom har bra frukost , mycket bra rum . Skulle jag rekommendera dig att bo här ? Ja , självklart det är riktigt bra hotel med fantastisk personal som verkligen hjälper dig . Ett annat plus är deras cyklar du…","Response from ParkInnLund, General Manager at Radisson Blu Hotel LundResponded Aug 5, 2016","Responded Aug 5, 2016","Hej Anders,  Tusen tack för dina fantastiskt fina rekommendationer! Vad roligt att höra att ni hade det bra hos oss. Vi vill så gärna att våra gäster ska trivas.  Varmt Välkomna tillbaka!  Hälsningar Charlotta Olsson ",Date of stay: July 2016,"[All, languages]",421
Fritz H,Jul 2016,5,Fantaschtisch,Waren 3 Nächte im Park Inn. Wir wurden herzlich empfangen. Die erste Frage war in welchem Stock bzw auf welche Seite wir unser Zimmer wollen. Zimmer im 9. Stock mit grandioser Aussicht. Frühstücksbüffet  war sehr reichhaltig.  Kommen wieder ,"Response from ParkInnLund, General Manager at Radisson Blu Hotel LundResponded Aug 4, 2016","Responded Aug 4, 2016","Dear Fritz,  Thank you very much for staying with us and I am very happy to hear you felt warmly welocme.  We hope to see you soon again!   Kind Regards, Charlotta Olsson ",Date of stay: July 2016,"[All, languages]",421
famengels2016,Jul 2016,5,Schitterend,"Propere kamer, grote familiekamer, modern ingericht, verzorgd gezond ontbijt,,perfecte prijs/kwaliteit. Absolute aanrader voor gezinnen met kids. Omgeving werd niet echt door ons bezocht, was een doorreishotel en is nieuw gebouwd (stond niet op onze gps)","Response from ParkInnLund, General Manager at Radisson Blu Hotel LundResponded Aug 4, 2016","Responded Aug 4, 2016","Thank you very much for your kind review! We are happy to hear you had a great stay and we hope to welcome you back soon again.  Kind Regards, Charlotta Olsson ",Date of stay: July 2016,"[All, languages]",421
Claus H,Jul 2016,5,Ett kärt återbesök,"Det är som att komma hem, blir så väl mottagen av repan känner oss så välkomna. Detta är en pärla i Lund, ett snyggt och stilfullt hotell, ljusa fräscha rum, bra matsal, bra service och en frukostbuffé som inte gör någon besviken. Låna cyklar kan man göra om man så önskar och…","Response from ParkInnLund, General Manager at Radisson Blu Hotel LundResponded Aug 4, 2016","Responded Aug 4, 2016","Hej Claus,  Alltid lika roligt att få välkomna dig tillbaka till Lund och tusen tack för din fina recension.   Vi hoppas att vi snart får se dig här igen och önskar en fortsatt trevlig sommar!  Hälsningar Charlotta Olsson ",Date of stay: July 2016,"[All, languages]",421
Mette L,Jul 2016,5,Ferie,"Absolutt ett bra hotell, med svært hyggelig og serviceinnstilt personal. Meget god frokost. Flotte rom, rent og fint. Ett lite minus med heldekkende tepper som ikke er så allergi vennlig. Mulig det finnes rom uten tepper om en hadde bedt om dette. Stort pluss at en kan låne…","Response from ParkInnLund, General Manager at Radisson Blu Hotel LundResponded Aug 4, 2016","Responded Aug 4, 2016","Hej Mette,  Tack för att ni har bott hos oss på Park Inn by Radisson Lund! Vad roligt att ni tyckte om hotellet och vår personal. Vi har både rum med matta och med trägolv för våra gäster att välja mellan så säg till nästa gång så ordnar vi ett rum med trägolv åt er.   Varmt Välkomna tillbaka!  Hälsningar Charlotta Olsson ",Date of stay: July 2016,"[All, languages]",421
Ikki34,Jul 2016,5,Très bien ,Hôtel moderne et Propre. Chambre spacieuse. Service poli et professionnel. Très bon accueil. Buffet du petit déjeuner copieux et varié. Un peu en dehors de la ville. Nécessite une voiture. Parking en face de l'hôtel payant mais pas très cher.,"Response from ParkInnLund, General Manager at Radisson Blu Hotel LundResponded Aug 5, 2016","Responded Aug 5, 2016",Merci pour vos recommandations excellentes. On espère de vous revoir chez nos. Charlotta Olsson ,Date of stay: July 2016,"[All, languages]",421
Johan T,Jul 2016,5,"Rent, stort och lyxig känsla.",Vi stannade en natt för att vila upp oss. Rummet var rymligt och vi hade en fin utsikt över Lund. Allt kändes nytt och lyxigt. Frukosten var generös och det var ingenting vi saknade. Parkeringen var inte gratis vilket den lätt kunde ha varit. Däremot kändes bilen säkert parkerad…,"Response from ParkInnLund, General Manager at Radisson Blu Hotel LundResponded Aug 4, 2016","Responded Aug 4, 2016","Hej Johan,  Stort tack för din fina Review! Vad roligt att höra att ni trivdes hos oss. Vi hoppas att vi snart får välkomna er tillbaka igen.  Varmt Välkomna!  Hälsningar Charlotta Olsson ",Date of stay: June 2016,"[All, languages]",421
marinob306,Jul 2016,4,Trip to Lund,"Everything is new with very modern and comfortable rooms . The food is a disasters, low quality and expensive. To Avoid to have a meal there. It's Far from the city's center, at least they provide bikes. In general it's…","Response from ParkInnLund, General Manager at Radisson Blu Hotel LundResponded Aug 4, 2016","Responded Aug 4, 2016","Thank you very much for staying with us at Park Inn by Radisson Lund. We hope to welcome you back soon again!  Kind Regards, Charlotta Olsson  ",Date of stay: July 2016,"[All, languages]",421
Paul Erik I,Jul 2016,5,Dejligt hotel med fin service,"Dejligt roligt hotel i udkanten af Lund. Hurtig og nem indtjekning, meget fine værelser dem dejlig udsigt. mulighed for at leje cykler (hvilket vi dog ikke benyttede)  Hyggelig foyer med behaglige møbler og mulighed for at spille (hotellet havde lagt spil ud på bordene. Fin…","Response from ParkInnLund, General Manager at Radisson Blu Hotel LundResponded Aug 4, 2016","Responded Aug 4, 2016","Hej Paul Erik,  Stort tack för din fina Review och för att ni bott hos oss på Park Inn by Radisson Lund. Vi hoppas på att snart få välkomna er tillbaka igen.   Varmt Välkomna!  Hälsningar Charlotta Olsson",Date of stay: March 2016,"[All, languages]",421
Kenneth S,Jul 2016,5,The best hotel in this area,I have tried the most hotel in Malmö and Lund and this hotel is far the best. It got friendly and helpful personnel in both the check in desk and the restaurant. Nice clean rooms with good view from the upper floors.,"Response from ParkInnLund, General Manager at Radisson Blu Hotel LundResponded Jul 14, 2016","Responded Jul 14, 2016","Dear Kenneth,  Thank you very much for your great review! It is always a pleasure to welcome you back.   Wish you a great summer!  Kind Regards, Charlotta Olsson ",Date of stay: July 2016,"[All, languages]",421
A TripAdvisor Member,Jul 2016,5,Park Inn Radisson Lund,"I stayed at this hotel on a business trip for a number of weeks.  The staff are very friendly and competent and Lund is a beautiful city. I recommend the hotel above the others in Lund (Finn hotel, Grand hotel etc). The food is very healthy and well prepared.","Response from ParkInnLund, General Manager at Radisson Blu Hotel LundResponded Jul 14, 2016","Responded Jul 14, 2016","Dear Martin,  Thank you very much for your fantastic recommendations! It is a pleasure to have you stay with us and we look forward to welcome you back soon again. Please let us know at any time if there is anything we can do to assist.   Kindest Regards, Charlotta Olsson ",Date of stay: June 2016,"[All, languages]",421
Johan_S_SWE,Jul 2016,4,Nybyggt och fräscht nära TetraPak,"Modernt inredda rum med många eluttag, bra vattentryck i duschen och sköna sängar. Restaurangen är bra med ett antal standardrätter som är mycket goda. Om man vill äta lite billigare så tar ca 10 minuter att gå till Hemköp, där det finns bra utbud av färdigmat.","Response from ParkInnLund, Hotelldirektör at Radisson Blu Hotel LundResponded Jul 12, 2016","Responded Jul 12, 2016",Hej!  Stort tack för att du har bott hos oss på Park Inn by Radisson Lund. Vad roligt att du uppskattar både våra rum och vår restaurang.  Hoppas att vi snart får välkomna dig tillbaka igen!  Hälsningar Charlotta Olsson ,Date of stay: February 2016,"[All, languages]",421
Scrambledeggslover,Jul 2016,4,Efficient stay at modern and fresh hotel,"I just needed a stay over close to my business meetings, and ParkInn is easy accessible from motorway (also close to bus stops and with bicycles to borrow for free). Online checkin made it easy to access without having to stand in line (popular hotel, often fully booked). Clean…","Response from ParkInnLund, General Manager at Radisson Blu Hotel LundResponded Jul 14, 2016","Responded Jul 14, 2016","I am very happy to hear you like the hotel and our facilities and we hope to welcome you back soon again!  Kind Regards, Charlotta Olsson ",Date of stay: June 2016,"[All, languages]",421
Fredrik M,Jul 2016,4,Bra hotell i utkanten av Lund,"Bra och tysta rum trots närheten till motorvägen. Rummen var mycket fräscha. Parkering finns för 75:- per dygn. Det är ca: 30 min promenad till stan, men hotellet har cyklar för utlåning om man vill. Det finns tillgång till gym i hotellet. Frukosten var enkel men av god kvalité. ","Response from ParkInnLund, General Manager at Radisson Blu Hotel LundResponded Jul 14, 2016","Responded Jul 14, 2016","Hej Fredrik,  Tack för att du har bott hos oss på Park Inn by Radisson Lund! Vad roligt att höra att du har haft en bra vistelse.   Vi hoppas att vi snart får välkomna dig tillbaka igen!  Vänliga Hälsningar Charlotta Olsson ",Date of stay: July 2016,"[All, languages]",421
A TripAdvisor Member,Jul 2016,5,Queen size,"Крайне удивлена, что в отеле может быть настолько хорошо. Наличие всех необходимых удобств позволяют ехать налегке, возможность заказать такси также облегчает жизнь. Особенно порадовала возможность попить прямо в номере чай и кофе, не заказывая ничего в номер.","Response from ParkInnLund, General Manager at Radisson Blu Hotel LundResponded Jul 14, 2016","Responded Jul 14, 2016","Thank you very much for your kind review! It is great to hear you enjoyed your stay and warmly welcome back in the near future.   Kind Regards, Charlotta Olsson ",Date of stay: July 2016,"[All, languages]",421
SteveFromIsleOfWight,Jun 2016,4,Clean and efficient,"Numerous business trips in the past year have seen me staying at this hotel, relatively newly built on the outskirts of Lund, near businesses and road connections which make it very convenient.  It's modern, clean and bright with all the amenities you'd expect and welcoming…","Response from ParkInnLund, General Manager at Radisson Blu Hotel LundResponded Jul 14, 2016","Responded Jul 14, 2016","Dear Steve,  Thank you for staying at Park Inn by Radisson Lund and for your very kind review. We look much forward to welcome you back in the near future.   Kindest Regards, Charlotta Olsson ",Date of stay: June 2016,"[All, languages]",421
EmmanuelMTX,Jun 2016,4,A very good nights sleep in a pleasant hotel - but do get your dinner elsewhere!,We have stayed here several times and always been very pleased with the cleanliness and the quality of the rooms. Also hotel staff has been great. The only hick-up has been and still is the quality of the restaurant food. It really is not worth a visit. We are very sad to have…,"Response from ParkInnLund, Hotelldirektör at Radisson Blu Hotel LundResponded Jul 12, 2016","Responded Jul 12, 2016","Dear Emmanuel,  Thank you for your feedback, it is very valuable!   As much as it makes me happy to hear you really like the hotel I am sorry to hear about your experience in the restaurant. At your next stay please contact me directly and we will find a solution.   Warmly Welcome back!  Kind Regards, Charlotta Olsson  ",Date of stay: June 2016,"[All, languages]",421
DJS23,Jun 2016,5,"Excellent hotel, lovely staff.","The Park Inn is an excellent hotel in almost every way. The staff are polite, friendly and helpful, the hotel is modern and clean with a welcoming atmosphere. There is free wi-fi throughout the hotel, a fitness centre, bar, outdoor seating.  There are also board games, a pool…","Response from ParkInnLund, Hotelldirektör at Radisson Blu Hotel LundResponded Jul 12, 2016","Responded Jul 12, 2016","Thank you so much for your kind review! It makes us very happy to hear you had an excellent stay with us and we hope to welcome you back soon again. In the meantime, please do not hesitate to contact us if there is anything we can do to assist.   Kind Regards, Charlotta Olsson  ",Date of stay: June 2016,"[All, languages]",421
Ronnie W,Jun 2016,4,Modernt och trivsamt,"Ett hotell med härlig design. Smidig incheckning. Trivsamma rum. Sköna sängar. Nackdelen är duschen då vatten rinner ut över nästan hela golvet. Superbra att man får låna cyklar gratis. Hotellet ligger lite avsides, men är lugnt och tyst och ämnat för en god sömn. Frukosten var…","Response from ParkInnLund, Hotelldirektör at Radisson Blu Hotel LundResponded Jul 12, 2016","Responded Jul 12, 2016","Hej Ronnie,  Stort tack för ditt fina omdöme. Vad roligt att du trivdes hos och att du uppskattade så väl våra rum som frukost, våra cyklar och design. Duscharna kommer att göras om under hösten så jag hoppas att du kommer märka skillnad framöver.   Varmt Välkommen tillbaka!  Hälsningar Charlotta Olsson ",Date of stay: June 2016,"[All, languages]",421
Rino L,Jun 2016,5,Super hotel,Cet hotel construit il y a deux ans est situé dans une zone industrielle qui se développe mais qui reste agréable.  Malgré la nouvelle sortie d'autoroute à proximité l'hôtel reste silencieux et agréable !  L'équipe de la réception est agréable et souriante ! Les cocktails au bar…,"Response from ParkInnLund, Hotelldirektör at Radisson Blu Hotel LundResponded Jun 23, 2016","Responded Jun 23, 2016","Merci d'avoir choisi notre hôtel et pour vos recommandations! On espère avoir le plaisir de vous accueillir de nouveau très bientôt !  Amitiés,  Charlotta Olsson ",Date of stay: May 2016,"[All, languages]",421
Michaël R,May 2016,5,Parfait tout simplement,Hôtel récent au milieu d'une zone industrielle. Situation parfaite à 3 minutes à pied du siège de la société Tetra Pak et à 20 minutes du centre de Lund. Des vélos sont par ailleurs à disposition   Le petit déjeuné est un buffet chaud/froid bien garnie et varié et le restaurant…,"Response from ParkInnLund, Hotelldirektör at Radisson Blu Hotel LundResponded Jun 23, 2016","Responded Jun 23, 2016","Merci pour vos recommandations! On espère avoir le plaisir de vous accueillir de nouveau très bientôt !  Amitiés,  Charlotta Olsson ",Date of stay: June 2016,"[All, languages]",421
Vinayak T,May 2016,4,Best hotel Near Tetra Pak office,"If you happen to visit Tetra Pak Rabyholm office, this hotel is the best.  walking distance to the office, breakfast options are extensive. Its too far from downtown, however they have bicycle which can be borrowed to roam around the town. pool table, chess are the past time…","Response from ParkInnLund, Hotelldirektör at Radisson Blu Hotel LundResponded May 20, 2016","Responded May 20, 2016","Dear Mr Vinayak,  Thank you very much for staying with us! It is great to hear you had a good time and that you like the hotel.  Warmly Welcome back!  Kind Regards, Charlotta Olsson ",Date of stay: May 2016,"[All, languages]",421
063Mini,May 2016,5,Bra bemötande och fräscht!,"Mycket trevligt och fräscht, fina och moderna rum. Personalen var väldigt service minded och fixade det mesta. Om vi ska nämna något negativt så va det att det låg långt lite utanför stan. Ingen vidare utsikt. Detta var inget problem för oss med avståndet till centrum eftersom i…","Response from ParkInnLund, Hotelldirektör at Radisson Blu Hotel LundResponded May 20, 2016","Responded May 20, 2016",Hej!  Vad roligt att höra att ni trivts hos oss och att ni uppskattat hotellet och vår service.   Vi hoppas att vi snart får välkomna er tillbaka igen!  Vänliga Hälsningar Charlotta Olsson ,Date of stay: May 2016,"[All, languages]",421
Froggy3b,May 2016,5,Pleasantly surprised,"Having driven what seemed like miles out of Lund centre onto an industrial site, this hotel was a pleasant surprise.  Very warm welcome, lovely and clean spacious accommodation. Definitely would recommend this if you need a place to stay and are happy at being out of the main…","Response from ParkInnLund, Hotelldirektör at Radisson Blu Hotel LundResponded May 20, 2016","Responded May 20, 2016","Thank you very much for your recommendations and kind feedback. We are very happy to hear you had a great stay and we look forward to welcome you back soon again.  Kindest Regards, Charlotta Olsson  ",Date of stay: May 2016,"[All, languages]",421
A TripAdvisor Member,May 2016,5,Trevlig personel och god frukost,Rekommenderas! Ett litet minus på läget av hotellet annars inget att anmärka på. Finns annars cyklar för uthyrning vilket är bra. Rent och städat med en mycket trevlig och välkomnande personal.Väldigt god och innehållsrik frukost.,"Response from ParkInnLund, Hotelldirektör at Radisson Blu Hotel LundResponded May 20, 2016","Responded May 20, 2016","Hej Christian,  Stort tack för dina rekommendationer! Vad roligt att du haft det bra hos oss.   Varmt Välkommen tillbaka!  Hälsningar Charlotta Olsson ",Date of stay: May 2016,"[All, languages]",421
Mortil3oghund,May 2016,5,Fint nyt hotel i udkanten af Lund.,"Meget fint nyt hotel med gode senge og moderne lækker og praktisk indretning. Hotellet ligger i udkanten af Lund, men man kan gå ind til centrum eller låne en cykel på hotellet.  Det er nær motorvejen og derfor let at komme til med bil. Der er parkeringshus lige udenfor hotellet…","Response from ParkInnLund, General Manager at Radisson Blu Hotel LundResponded May 16, 2016","Responded May 16, 2016","Hej Anitha,  Stort tack för att ni bott hos oss och vad roligt att höra att ni trivdes.   Vi hoppas på att snart få välkomna er tillbaka igen!  Vänliga Hälsningar Charlotta Olsson ",Date of stay: April 2016,"[All, languages]",421
A TripAdvisor Member,May 2016,4,nice...,Nice clean hotel at a convenient location.  Friendly/helpful staff and a nice common area/bar.  Great view from upper floors and bikes available free of charge if you want to go into Lund or just bike around.,"Response from ParkInnLund, General Manager at Radisson Blu Hotel LundResponded May 16, 2016","Responded May 16, 2016","Dear Johan,  Thank you very much for your kind review! It is always a pleasure to welcome you back.   Kind Regards, Charlotta Olsson ",Date of stay: May 2016,"[All, languages]",421
A TripAdvisor Member,Apr 2016,4,Very comfotable,A perfekt hotel for everyone who is visiting Lund. Near the center and easy to reach by lending a bicykel just outside the hotel. A perfekt breakfast with a large buffe. Very kind staff at the reception ready to help all the time.,"Response from ParkInnLund, General Manager at Radisson Blu Hotel LundResponded May 16, 2016","Responded May 16, 2016","Dear Anders,  Thank you for staying at Park Inn by Radisson Lund and for your kind review. I am happy to hear you enjoyed the service provided as well as the breakfast buffet and our complementary bikes.  Warmly Welcome back!  Kind Regards, Charlotta Olsson ",Date of stay: April 2016,"[All, languages]",421
A TripAdvisor Member,Apr 2016,4,Nice Hotel,Very confort hotel with good services and with a good restaurant but with reduced menu and the menu remains the same for a long period of time. Not in an area close to Lund center. Lund center too distant to walk.,"Response from ParkInnLund, General Manager at Radisson Blu Hotel LundResponded May 16, 2016","Responded May 16, 2016","Dear Giorgio,  Thank you very much for your feedback and for staying with us.   We hope to welcome you back soon again!  Kind Regards, Charlotta ",Date of stay: April 2016,"[All, languages]",421
A TripAdvisor Member,Apr 2016,4,Gode familierum,"Virkeligt godt ophold.  Vi fik to rum der stødte op mod hinanden med rigtig god plads.  Gode senge og god service.  På minussiden, var der 2,5 km ind til bymidten. Men det var nemt at gå derind. Man kunne have taget bussen.","Response from ParkInnLund, Hotelldirektör at Radisson Blu Hotel LundResponded Apr 20, 2016","Responded Apr 20, 2016","Hej Nanna,  Jätteroligt att höra att ni trivts hos oss på Park Inn by Radisson Lund! Nästa gång får ni gärna även låna våra cyklar för att lätt ta er in till centrum.  Varmt Välkomna tillbaka!  Hälsningar Charlotta Olsson  ",Date of stay: April 2016,"[All, languages]",421
A TripAdvisor Member,Apr 2016,5,Kanon,Bra service Kanon fint rum och fräscht badrum. Lätt att parkera. Bra med extra säkerhet då man behöver använda  rummskortet för att åka i hissen. Frukostbuffen utbud var mycket och kan täcka allas behöv,"Response from ParkInnLund, Hotelldirektör at Radisson Blu Hotel LundResponded Apr 20, 2016","Responded Apr 20, 2016",Stort tack för din fantastiskt fina feedback! Vad roligt att höra att ni hade en kanon vistelse.   Varmt Välkommen tillbaka!  Hälsningar Charlotta Olsson ,Date of stay: April 2016,"[All, languages]",421
Fredrik H,Apr 2016,5,Väl designat med bra service,"Ett fantastiskt trevligt hotell i den mysiga staden Lund! Hotellet ligger smidigt till, nära infarten till lund fast ändå hyfsat centralt! Foajèn ger ett välkomnande uttryck och personalen var mycket trevlig. Vi bodde i en av hotellets sviter vilket jag kan rekommendera då man…","Response from ParkInnLund, Hotelldirektör at Radisson Blu Hotel LundResponded Apr 12, 2016","Responded Apr 12, 2016","Hej Fredrik,  Tack för att du bott hos oss på Park Inn by Radisson Lund och för ditt fantastiskt fina omdöme! Vad roligt att höra att du både uppskattade vår personals bemötande, din svit och vår restaurang.   Varmt Välkommen tillbaka!  Hälsningar Charlotta  ",Date of stay: April 2016,"[All, languages]",421
