Stortorget_Bar_Restaurang,d1893307,[Swedish],67,2,,4,"May 3, 2013 ",stortorget Lund,"Lund, Sweden",Härlig restaurang med mycket bra service. Enkla och lokala rätter lagade med känsla och härlig smak.
Stortorget_Bar_Restaurang,d1893307,[Swedish],67,15,6.0,4,"April 11, 2013 ",Trevlig krog med bra mat,"Karlstad, Sweden","En trevlig mindre krog med riktigt bra mat. Personalen var på ""G"" så allt fungerade utmärkt. Det fick bli ett...More"
Stortorget_Bar_Restaurang,d1893307,[Swedish],67,3,5.0,2,"December 27, 2012 ",Sorgligt förfall,,"Stortorget har varit en favoritplats för mig i nästan tjugo år, men nu kommer det att dröja innan jag äter...More"
Stortorget_Bar_Restaurang,d1893307,[Swedish],67,42,13.0,2,"November 30, 2012 ",Vad har hänt med Stortorget?,Lund,"Detta har varit ""mitt andra vardagsrum"" i ca. 15 år, men något har förändrats. Atmosfären är inte densamma. Vad hände...More"
Stortorget_Bar_Restaurang,d1893307,[Swedish],67,8,20.0,2,"July 16, 2012 ",stökigt,"Lund, Sweden","för hög ljudvolym utomhus, svårt att hitta möjlighet till pratstund"
Stortorget_Bar_Restaurang,d1893307,[Swedish],67,154,59.0,3,"May 30, 2012 ",Trevlig ställe med mysig atmosfär,"Ahus, Sweden",Enkel men god mat. Lite för lite grönsaker och för lite pommes för våra stora tonåringar.vi fick betala 70 kr...More
Stortorget_Bar_Restaurang,d1893307,[Swedish],67,175,66.0,3,"April 9, 2012 ",Stortorget gör sig helt klart bäst på sommaren,"Lund, Sweden","Härlig stämning på somrarna då uteserveringen är öppen. Helt okej mat, inget speciellt."
Stortorget_Bar_Restaurang,d1893307,[Italian],4,1501,318.0,3,"November 23, 2018 ",Veloce e conveniente ,"Trieste, Italy",Nel centro di Lund un locale affollato dove consumare un pasto semplice a prezzi convenienti. Il servizio è rapido e...More
Stortorget_Bar_Restaurang,d1893307,[Italian],4,126,29.0,4,"June 28, 2016 ",Birra!,"Marseille, France",In tre mesi abbiamo avuto la possibilità di assaggiare diverse birre. I prezzi sono medio alti - ma tutto sommato...More
Stortorget_Bar_Restaurang,d1893307,[Italian],4,240,139.0,4,"April 29, 2013 ",Pranzo veloce e abbastanza economico,"Rome, Italy",Delizioso locale che si affaccia sulla piazza principale di Lund. Buon rapporto qualità prezzo: abbiamo assaggiato uno dei piatti tipici...More
Stortorget_Bar_Restaurang,d1893307,[Italian],4,97,57.0,4,"November 20, 2012 ",Buon posto per mangiare e parlare,,"Nel centro di Lund si tratta di un ristorante che permette di mangiare e bere bene senza spendere un capitale,...More"
Stortorget_Bar_Restaurang,d1893307,[Danish],3,1,,5,"October 21, 2016 ",Bar,,Meget meget hyggeligt super betjening med smags prøver på deres øl. Vinder i atmosfære når man har siddet der lidt...More
Stortorget_Bar_Restaurang,d1893307,[Danish],3,198,77.0,2,"February 27, 2016 ",Ridser i lakken,"Espergaerde, Denmark","Sidst vi var der var i 2013, og der var der også kun tre muligheder til frokost, hvis man passerer...More"
Stortorget_Bar_Restaurang,d1893307,[Danish],3,58,19.0,4,"July 24, 2014 ",God mad til høj pris,"Copenhagen, Denmark","Maden smagte rigtigt godt. Men portionerne er ekstrem små., pizza er i børne størrelse og med den høje pris hænger...More"
Stortorget_Bar_Restaurang,d1893307,"[Chinese, (Sim.)]",1,3,,5,"April 28, 2015 ",活力、氛围很好,"Mexico City, Mexico",Main Course 不多，主要是be...More
Stortorget_Bar_Restaurang,d1893307,[French],1,112,39.0,3,"April 28, 2015 ",Plutôt un bar,"Aix-en-Provence, France","Petite salle devant la grande terrasse su bar. Ambiance étudiante. Plutôt bruyant. Service rapide pour plat simple, sans plus. Verre...More"
Stortorget_Bar_Restaurang,d1893307,[German],1,71,29.0,5,"September 18, 2016 ",Unerwartet gut.,"Mainz, Germany",Wir waren schon öfter hier und haben immer gut gegessen. Dieses Mal hatte ich Steak Tatar - das hier Råbif...More
Stortorget_Bar_Restaurang,d1893307,[Norwegian],1,56,5.0,4,"August 8, 2016 ",Nydelig burger,"Lorenskog Municipality, Norway","Hyggelig bar/cafe sentralt på torget i Lund. Gode burgere og rekesmørbrød. Hyggelig, men litt trang uteservering foran baren. Større uteservering...More"
1959_Gelateria,d15326032,[English],1,4,,5,"November 3, 2018 ","Great place for home made ice cream, coffee, waffles...",,"This place quickly become a new favorite after they opened earlier this year. The home made ice cream is top notch. Our little daugher is addicted to the cookie flavour. They also serve other things like coffee, cookies, hot chocolate and freshly baked waffles. The...More"
Restauran_Sol,d15326079,[Swedish],1,88,10.0,4,"November 26, 2018 ",Fräscht salladsbord,"Lund, Sweden",En helt ok lunchrestaurang i universitetsmiljö. Om dagens inte faller en i smaken finns det ett stort och fräscht salladsbord....More
Cafe_El_Gosto,d12716840,[Swedish],1,10,8.0,4,"August 2, 2017 ",Fräscht café med ambitioner,"Lund, Sweden",Vi blev väl bemötta av en vänlig och serviceinriktad kille i detta fräscha och nyrenoverade café. Våra goda galetter var...More
Mezaya_eLibanesisk_Buff,d15812604,[Swedish],1,15,3.0,4,3 weeks ago ,En alldeles utmärkt Libanesisk buffe med kalla sallader och varm mat.Vatten och kaffe ingår.,"Lund, Sweden",Det är nyöppnat och ganska fullt mellan 11:30 och 14:00.Men de har öppet alla dagar 11:00 till  16:00.
Restaurant_Cafe_Inspira,d12852786,[Swedish],1,1,,5,2 days ago ,Vällagat,,"Mat & service av bästa lunchklass i Lund, är ambitionen. Bricklunch & ""Affärsluncher""
Allt i såväl restaurang som café är...More"
Avokado_Fresh_Food,d11679838,[English],1,48,12.0,5,"October 18, 2017 ",I loved this place!!!!!,"New Haven, CT","Stopped in by chance to grab a bite to eat before a graduation in Lund.  I wish I remember my servers name, he was so super fantastic.  I was sold on the Rhode Island sauce he recommended, I told him I was from Connecticut, real...More"
Avokado_Fresh_Food,d11679838,[Swedish],2,67,6.0,1,"July 30, 2017 ",Skalbagge i maten.,"Landskrona, Sweden","Jag gick på Avokado för första gången för att köpa med mig en lunch.
Jag valde att plocka en egen...More"
Avokado_Fresh_Food,d11679838,[Swedish],2,22,,5,"March 8, 2017 ",Grym sallad,,Fantastiskt fräsch och god sallad. Priser går inte att klaga på heller. Rekommenderas starkt för en hälsosam lunch.
Avokado_Fresh_Food,d11679838,[Italian],1,32,8.0,4,"May 20, 2017 ",Appetitoso e giovane,"Imperia, Italy","Locale nella via prospicente la Stazione ferroviaria di Lund.
Piatti preparati ed assemblati al momento, ampia scelta di piatti vegetariani...More"
Sibylla_Getingevagen,d13132622,[Swedish],2,39,4.0,4,"October 15, 2018 ",Ännu en klassiker i Lund,"Jonkoping, Sweden",Och med god mos och korv. Hamburgare. Snabbt och lätt köra in till. Trevlig personal. Spelbutiken slog alla rekord. Finns...More
Sibylla_Getingevagen,d13132622,[Swedish],2,69,4.0,4,"November 11, 2017 ",En riktig grill i Lund ,,Finns inte så många kvar av de riktiga grillarna  Rekommenderas om du är sugen på en riktig hamburgare.
India_Dack,d5949022,[English],2,3,2.0,5,"October 20, 2015 ",Best café in Lund,"Oslo, Oslo, Norway","A very pleasant place with good coffee and a nice selection of cold beverages - e.g. club mate for a fair price. They serve some very delicious vegan toasts and soups as well as pastries and cookies.
If you are a big fan of literature...More"
India_Dack,d5949022,[English],2,1,2.0,5,"July 6, 2015 ",Arvid,"Lund, Sweden",Lunds coziest café where you can enjoy cheap coffee and diverse meals and beverages. Perfect study environment and a solid sortiment of radical leftist literature. The staff is very friendly aswell!
India_Dack,d5949022,[Swedish],2,342,161.0,1,"December 17, 2016 ",Kommunisthak,Lund,Om man inte är vänster har man inget att hämta. Övervintrande kommunister vegetarianer och alternativa. Avskyr stället. Kaffet smakar dåligt....More
India_Dack,d5949022,[Swedish],2,1,4.0,5,"November 1, 2015 ",Superbra socialistiskt café i Lund,,Det här är ett riktigt toppenställe med billig mat och härliga kamrater. Jag rekommenderar verkligen bryggkaffet som kostar tio pesetas.
Sushi_Express,d15050338,[English],1,305,64.0,4,"August 25, 2018 ",A simple but good Japanese Restaurant,"Diani Beach, Kenya",Quick service and good quality Japanese food served in a pleasant small restarant.  The food was nicely presented and very promptly.  In the summer there is a large outside seating area facing the old central part of Lund.
Sushi_Express,d15050338,[Swedish],2,1,,2,5 days ago ,Ingen bra upplevelse,"Dalby, Sweden","Jag och min vännina beställde 14 bitar sushi var. Jag beställde maki sushi med acokado,gurka och crabstick men fick med...More"
Sushi_Express,d15050338,[Swedish],2,19,2.0,4,"September 30, 2018 ",God sushi,"Lomma, Sweden","Sushin var bra och väldigt god. Fint upplagt för avhämtning. Mycket nöjd med det vilket är huvudsaken. 

Det som drar...More"
Restaurang_Flame_on_Curry,d14059613,[English],3,1,,5,today ,Best Indian food experience,"Lund, Sweden",Wonderful food and friendly service for a reasonable price. I've had both lunch as well as dinner here and the food is amazing every time. The salad buffé is a sad experience though but then again I didnt come for the salad. The lamb Tikka...More
Restaurang_Flame_on_Curry,d14059613,[English],3,274,140.0,3,"September 1, 2018 ",Mild Indian,"Lund, Sweden","Tried the set lunch at Flame on Curry and I must say that this restaurant, too, manages to avoid the real spiciness that is such a distinct feature of Indian food.
I think that always striving to meet the local taste (and Swedes are thought...More"
Restaurang_Flame_on_Curry,d14059613,[English],3,37,7.0,2,"July 10, 2018 ",Fatty food with good service,"Lund, Sweden","It's the best Indian restaurant in Lund, but that's not much of an accolade. The restaurant was entirely empty but the people were very friendly. It's a shame that the restaurant has such a bad location, I think we saw a drug deal outside the...More"
Restaurang_Flame_on_Curry,d14059613,[Swedish],6,1,,5,1 week ago ,Underbart!!,,Det här är den bästa indiska maten jag ätit på länge. Jättetrevlig personal och utmärkt service! Finns inte bättre indisk...More
Restaurang_Flame_on_Curry,d14059613,[Swedish],6,45,4.0,3,"October 28, 2018 ",ok,,"Ok mat, inget mer, inget mindre. Jag hade gärna sett lite mindre olja och lite mer kärlek i rätterna om...More"
Restaurang_Flame_on_Curry,d14059613,[Swedish],6,108,12.0,3,"August 20, 2018 ",Bra indisk mat,"Stockholm, Sweden",Resutrangen har ett bra läge i centrala lund men är lite osynlig. Maten var bra och vällagad dock är menyn...More
Restaurang_Flame_on_Curry,d14059613,[Swedish],6,1,,5,"July 16, 2018 ",Bästa indiska maten i Lund,,Åt hämtmat härifrån igår. Alla var jättenöjda med sin mat. Äter ofta indisk mat och detta är den bästa jag...More
Restaurang_Flame_on_Curry,d14059613,[Swedish],6,8,2.0,1,"June 29, 2018 ",Värsta upplevelsen Lunds kommun,,Jag gillade förra stället som var här men detta är verkligen skamligt. Det var tre andra sällskap som satt här...More
Restaurang_Flame_on_Curry,d14059613,[Swedish],6,15,3.0,4,"April 30, 2018 ",En indisk lunch buffe med lite av varje och man kan få nan bröd också.,"Lund, Sweden","Gamla Carlssons trädgård nu med indisk mat.Extra pris just nu på lunchen.
Massor av plats inomhus och en stor terrass...More"
Restaurang_Flame_on_Curry,d14059613,[Dutch],1,5,,4,"November 3, 2018 ",Vriendelijk en lekker,,Dit restaurant ligt wat afgelegen. Wellicht dat dit de reden was voor het beperkt aantal bezoekers. De bediening is heel...More
Hilbert_Cafe,d5972283,[English],1,1,,5,"March 7, 2015 ",Hilbert,,"Cheap sandwiches for lunch, 25 kr for a quite big sandwich.

5/5 would eat again. 

TripAdvisor requires reviews to be at least 100 characters long, this sentence is useless."
Alfredo_s_Pasta,d9776275,[English],4,121,24.0,4,"August 10, 2017 ",Great take-away pasta,"Lund, Sweden","This restaurant also offers really great pasta and pizza take-out in addition to dining in. Try the lasagna, it is superb!"
Alfredo_s_Pasta,d9776275,[English],4,2,,5,"February 16, 2017 ",A+,,"I had the pasta with mushrooms and meat. It was really good. Asked the personnel if I could have some more after the meal, which wasn't really included, but they were more than happy to give me another portion with some of that fine parmiggano...More"
Alfredo_s_Pasta,d9776275,[English],4,40,16.0,2,"June 20, 2016 ",A slice of pizza,"Fondi, Italy","I was there with my boyfriend and other two friends. We had a slice of pizza, that in my opinion was too expensive for its dimension and a soft drink. Generally I can affirm that the service was a bit poor and the ratio quality/price...More"
Alfredo_s_Pasta,d9776275,[English],4,338,65.0,2,"January 26, 2016 ",Disappointing,"Furulund, Sweden","There's some nice restaurants inside Lund's old Markethall, but this is not one of them. 
I got first perplexed when they added a slice of prosciutto cotto to my slice of pizza after it had come out of the oven. That is something that you...More"
Alfredo_s_Pasta,d9776275,[Swedish],6,45,4.0,4,"October 28, 2018 ",Lunda klassiker!,,Du vet vad du får och att du kommer bli mätt. Varken maten eller pizzorna är spektakulära på något vis...More
Alfredo_s_Pasta,d9776275,[Swedish],6,117,31.0,3,"July 15, 2018 ",Filkigt.,"Lund, Sweden","Ätit på detta ställe en del gånger genom åren. Relativt god mat.
Men tyvärr glömmer man ofta varför man inte...More"
Alfredo_s_Pasta,d9776275,[Swedish],6,71,11.0,5,"July 31, 2017 ",Lunch/kvällsmat,"Playa del Ingles, Spain","Jag går till Alfredo's flera ggr i veckan och är alltid lika nöjd.
Personalen alltid mycket vänlig och uppmärksam. Man...More"
Alfredo_s_Pasta,d9776275,[Swedish],6,14,5.0,5,"March 10, 2017 ",Kanonmat till McDonaldspriser. ,,Jag är en kräsen person. Ändå har jag ätit på Alfredos av och till i snart 20 år. Alfredos serverar...More
Alfredo_s_Pasta,d9776275,[Swedish],6,4,2.0,1,"December 30, 2016 ",Hemsk personal,,Fruktansvärt dåligt service och mycket otrevlig personal. Förstörde hela måltiden med tråkig attityd.
Alfredo_s_Pasta,d9776275,[Swedish],6,3,3.0,1,"March 12, 2016 ",Otrevlig personal men god lasagne ,"Lund, Sweden","Hemskt otrevlig personal. Jag bad om sås till min lasagne och fick en utskällning. Lasagnen i sig är god, men...More"
Alfredo_s_Pasta,d9776275,[Turkish],1,138,102.0,3,"November 18, 2016 ",Lezzetli ama sıradan,"Bursa, Turkey",Bir çok restoranın arasından seçmiş olduk.pişman olmazsınız. Fiyatlar şehir ortalamarında. Pizzaları ısıtarak getiriyorlar ancak makarnaları hazırdan seçtiyseniz ısıttırmakta fayda var....More
