Stortorget_Bar_Restaurang,d1893307,[English],52,2,,4,"September 17, 2016 ",Great place!,"Malmo, Sweden",Great service. Good food and nice waiters. Recommend for casual dinner and drinks. Got the blue cheese burger and it was very good.
Stortorget_Bar_Restaurang,d1893307,[English],52,4,2.0,5,"August 17, 2016 ",Really nice food,"Copenhagen, Denmark",Great location and nice atmosphere! If you like meat go for the amazing rib-eye stake. Don't miss it!
Stortorget_Bar_Restaurang,d1893307,[English],52,11,4.0,4,"August 15, 2016 ",Lunch menu,Germany,"Just five dishes and some side orders, but well prepared and handmade - no convenience food.  E.g. Caesar salad with tasty dressing."
Stortorget_Bar_Restaurang,d1893307,[English],52,163,54.0,4,"August 13, 2016 ",Nice and quiet when we arrived but soon got busy,"Adelaide, Australia","After visiting the cathedral we walked around the corner and chose this as it was empty and in the sun, it was great people watching, we had lunch which was nice, pub food and a beer.
Service was great."
Stortorget_Bar_Restaurang,d1893307,[English],52,87,38.0,4,"August 2, 2016 ",Great pubfood,"Lisse, the Netherlands",Simple but good food. Excellent service. There's not much choice but food is good. Had pizza and steak tartare. All very good. Nice terrace outside
Stortorget_Bar_Restaurang,d1893307,[English],52,155,94.0,3,"July 27, 2016 ",It's a nice hang more than anything,"Skane County, Sweden","I’m not sure what they serve is so spectacular. It’s not bad, quite good, but nothing that really sets them apart from so many other places. The thing here is location, location, location.

We didn’t eat anything during this visit. We looked at the menu...More"
Stortorget_Bar_Restaurang,d1893307,[English],52,21,5.0,3,"April 1, 2016 ",Ok,,"Went with friends at about 9pm. The food was good, had pizza and it was pretty fun to cut them with the scissors they provide.
The service is what lowers my rating, the waiter rushed us a lot since the kitchen was closing soon but...More"
Stortorget_Bar_Restaurang,d1893307,[English],52,31,10.0,5,"January 31, 2016 ",A great spot for an easy going dinner/drinks.,"Copenhagen, Denmark","I've been here several times, and every single time the food has been very good, and the service fast and attentive. The pizzas are great, and the burger has to be among the best in town (had a few where I've thought there was potential,...More"
Stortorget_Bar_Restaurang,d1893307,[English],52,60,53.0,1,"August 17, 2015 ",Not to be recommended,"Skane County, Sweden","I live here in Lund, but haven´t been to this restaurant for several years. We went here to have lunch. The staff was incredible rude, not only to us but to other customers as well. It felt like visiting Faulty Towers! 
The food was so,...More"
Stortorget_Bar_Restaurang,d1893307,[English],52,20,3.0,4,"July 14, 2015 ",Noisy but nice!,"Helsinki, Finland","The place was packed with people and quite noisy but in a nice way. The service was fast and friendly and the food was good! We had the smoked salmon with a very nice sauce and the Iberico pork dish, both were very good."
Stortorget_Bar_Restaurang,d1893307,[English],52,17,7.0,1,"July 2, 2015 ",Terrible,,"Terrible food and service, rude staff and they only survive cause of their location. Should be ashes to call themselves a restaurant"
Stortorget_Bar_Restaurang,d1893307,[English],52,2,1.0,1,"April 17, 2015 ",Low end food at high end prices,,Have frequented this place on and off for ten years. Did so again this week. It's gone really downhill over the last year or so. The menu now feels like a fast-food joint with eg a burger costing over 170 kr and at a quality...More
Stortorget_Bar_Restaurang,d1893307,[English],52,34,20.0,2,"March 29, 2015 ",Night club,Sweden,"I would never come her for the food, but its probably one of the better night clubs for non students in Lund. The staff is quite unfriendly and rude. I try not to come here often, but if I want to go out on the...More"
Stortorget_Bar_Restaurang,d1893307,[English],52,91,46.0,1,"March 10, 2015 ",Terrible,"Lundsbrunn, Sweden","They live off of their location, the prices are outrageous and the food very poor. They could do with some shaping up!"
Stortorget_Bar_Restaurang,d1893307,[English],52,613,109.0,4,"March 7, 2015 ",Good service,"Palo Alto, California",I had lunch alone and I felt very welcome. Friendly hostess and Quick service. The food itself was good but not great. Coffee and chocolate was excellent. Overall the the Place felt like a withn old style bistro. I will come back.
Stortorget_Bar_Restaurang,d1893307,[English],52,101,32.0,5,"March 1, 2015 ",Mixed drinks & food pairing!,"Macon, United States","We are all familiar with wine and food pairings, but this restaurant has a menu with old fashioned mixed drinks and food pairing. The drinks are very unusual - candied fruits, smoke, bitters...all very creative.   The food is absolutely amazing, so the drinks make the...More"
Stortorget_Bar_Restaurang,d1893307,[English],52,30,15.0,4,"July 12, 2014 ","Nice atmosphere, happy staff",London,"We had pizza and beer in the Herkules Bar of this restaurant, which is an open air bar on the main square in Lund. The pizza was freshly cooked and very tasty, and the staff knowledgable about the beer sold and very helpful. It was...More"
Stortorget_Bar_Restaurang,d1893307,[English],52,649,177.0,4,"June 17, 2014 ","A restaurant with nice atmosphere at Stortorget, Lund","Pietarsaari, Finland",During my visit to Skåne (Skania) I was visiting Lund and had a tasty “räkmacka” with beer at the bar at Stortorget Bar & Restaurang.Nice atmosphere and friendly staff.
Stortorget_Bar_Restaurang,d1893307,[English],52,14,11.0,3,"June 17, 2014 ",Nice outdoor area,"Gothenburg, Sweden","Planned to have a dinner at the restaurant, but because of the lovely weather, we sat outside, and we were thus limited to the Herkules Bar menu which has fewer options. 

We went for the burger, which seemed to be what everyone around us was...More"
Stortorget_Bar_Restaurang,d1893307,[English],52,29,12.0,3,"September 30, 2013 ",Nice restaurant/bar in the summer,"Lund, Sweden",For food this is honestly not my favorite place. I've tried the burger and some other things and I always found the meat quite dry and tasteless. I the summer the place is great for hanging out over drinks since it has a big outdoor...More
Stortorget_Bar_Restaurang,d1893307,[English],52,15,7.0,5,"September 10, 2013 ",I always return for lunch,sweden,"Good location, good service and great lunch.
It is sooo Swedish, fresh, healthy and testeful.

I have never been disappointed with fish.
Worth to visit and definetely one of the best places in Lund"
Stortorget_Bar_Restaurang,d1893307,[English],52,246,111.0,5,"July 25, 2013 ",Excellent meal,London,It's not always easy to find good vegetarian food in Sweden but this was great. The meat eaters had great food as well. It's very busy so service can be a it slow at times but it was worth the wait.
Stortorget_Bar_Restaurang,d1893307,[English],52,768,316.0,4,"July 18, 2013 ",Good lunch right on Stortorget,"Gothenburg, Sweden","I stopped at this café for lunch in July 2012. The daily special (kummel) was good, service fast and with a smile. The location is great, under trees in Stortorget. Recommended."
Stortorget_Bar_Restaurang,d1893307,[English],52,155,94.0,4,"July 14, 2013 ",Location is everything,"Skane County, Sweden","We stopped by for drinks in the outdoor part of the restaurant on a hot summer day, a Saturday in July.

We ordered a pitcher of Sangria with Cava, 1,4L for 198SEK. 1,4L may sound like a lot, but on a hot day after you've...More"
Stortorget_Bar_Restaurang,d1893307,[English],52,198,77.0,4,"March 26, 2013 ",Very tasty for lunch,"Espergaerde, Denmark","We arrived late for lunch, around 4 pm, and there were onlý three items left on the menu. Mostly this indicates that the food is made from scratch and saves you from running into leftovers from yesterday or even last week. The location is great,...More"
Stortorget_Bar_Restaurang,d1893307,[English],52,25,21.0,4,"March 3, 2013 ",Lovely in the summer,,"The food is nothing special but it does the job. The shrimp sandwich was better than expected.

The main reason we return to this spot is for it's wonderful terrace. Fabulous people-watching spot, good music. One of the few places to hang out in the...More"
Stortorget_Bar_Restaurang,d1893307,[English],52,39,15.0,3,"August 11, 2012 ","Great location, drinks and waiters","Malmo, Sweden","The a la carte at Stortorget does not give any chills, but they serve good food and prices are OK.. The hamburger is a very good choice, even if you are American. But you do not go here to have a fancy meal: you go...More"
Stortorget_Bar_Restaurang,d1893307,[English],52,8,3.0,3,"July 31, 2012 ",Ok,,"The lunch is usually really good. Dinner is mediocre. The wine ok but no more. A little to expensive for the quality, but you pay for the great location. Most of the personnel are great with a few exceptions with some that cannot smile and...More"
Stortorget_Bar_Restaurang,d1893307,[English],52,18,11.0,5,"July 17, 2012 ",Nice place,Lund,Cocktails in the inside bar and beer and more simple drinks in the outside bar. Good bartenders in general. Really nice Patio in front of the restaurant with plenty of room.
Stortorget_Bar_Restaurang,d1893307,[English],52,63,18.0,4,"July 2, 2012 ",central Lund Bar and Restaurant overlooking central square,London,Pleasant central location for a promenade cafe/restaurant in summer with good food
Stortorget_Bar_Restaurang,d1893307,[English],52,82,82.0,5,"May 2, 2012 ",Why is this place only ranked 17 ?!,"Leeds, United Kingdom",Everytime I come to Lund I find every corner has a restaurant and trust me I've found a few. I 1st came here in December 2011 and have just returned as I liked it so much the 1st time. I can't enthuse about this place...More
Stortorget_Bar_Restaurang,d1893307,[English],52,52,38.0,3,"April 16, 2012 ",In the middle of Lund,"Lund, Sweden","Here you can sit down an look on persons walking by,have a nice drink a beer or a glas of wine.They also serve food good enough,you can sit outside or inside."
Stortorget_Bar_Restaurang,d1893307,[English],52,328,113.0,5,"February 20, 2012 ",cozy atmosphere and good food,"Monza, Italy","I have been there few times already and I have tried so far a delicious burger and also some good salmon.

Good service and nice beer too!"
Stortorget_Bar_Restaurang,d1893307,[English],52,486,156.0,3,"January 7, 2012 ",ok but a bit pricy,"Lund, Sweden",The food is fine but the prices are a bit high and the portions a bit small compared to other restaurants in Lund.
Stortorget_Bar_Restaurang,d1893307,[English],52,1,,4,"November 9, 2011 ",Always very  good food and service,"Lund, Sweden","I live in Lund since a couple of years and frequently go out to eat at different restaurants in the area. Stortorget/Hercules is one of my favorite places. It's a modern restaurant/bar/night club and I've never been disappointed with the food, it has always held...More"
Stortorget_Bar_Restaurang,d1893307,[English],52,61,64.0,4,"September 13, 2011 ",Loved the hamburger,"Antwerp, Belgium",Loved the special hamburger and enjoyed the spendrups beers. Waiters are friendly and they have a nice terrace at the center square of Lund.
Stortorget_Bar_Restaurang,d1893307,[Swedish],67,22,8.0,1,4 weeks ago ,Otrevligt bemötande,"Lund, Sweden","Ceasarsallad med missfärgad romansallad. Vid påpekande till servicepersonalen fick vi ett otrevligt och nedlåtande bemötande. Kan ej rekommenderas för middag,...More"
Stortorget_Bar_Restaurang,d1893307,[Swedish],67,2,,1,4 weeks ago ,Skandal!!!!,,"Fick en hemsk sallad. Brun och ofräsch!
När vi nämde detta fick vi ett mycket otrevligt bemötande och ingen kompensation...More"
Stortorget_Bar_Restaurang,d1893307,[Swedish],67,2,1.0,5,4 weeks ago ,Som ett extra vardagsrum,,"Trivseln framför allt – hit återvänder jag gärna för att äta lunch, ta en räkmacka på kvällen, eller äta kockarnas...More"
Stortorget_Bar_Restaurang,d1893307,[Swedish],67,2,,1,"January 3, 2019 ",Sämst service ,"Malmo, Sweden","Otrevlig och hotfull personal från stunden vi kom till restaurangen. Åldersdiskriminering, behandlar yngre gäster sämre än. Stressade om stängningstid, hotar...More"
Stortorget_Bar_Restaurang,d1893307,[Swedish],67,2,,5,"December 15, 2018 ",Alltid bra och snabb service! Pålitlig kvalité på maten!,"Lund, Sweden","Vi går mycket ofta till Stortorget, och har gjort så i flera år. Det är ett bra läge mitt i...More"
Stortorget_Bar_Restaurang,d1893307,[Swedish],67,45,4.0,4,"October 28, 2018 ",Classic,,"Klassiskt hak, klassisk mat, inget märkvärdigt men allt är gott. Jag rekommenderar pommes med deras chili mayo...yes, du hörde rätt,...More"
Stortorget_Bar_Restaurang,d1893307,[Swedish],67,385,49.0,4,"October 23, 2018 ",Klassisk Lundakrog,"Lund, Sweden","Stortorget är en klassisk Lundakrog. Kanske främst sommartid med uteservering. Faktiskt satt det folk ute denna blåsig kväll också.

För...More"
Stortorget_Bar_Restaurang,d1893307,[Swedish],67,31,1.0,2,"August 14, 2018 ",Dyrt och dåligt,,"Maten och drickan är dyr, men inget märkvärdigt. Servicen är dålig eller obefintlig. Gå och lägg pengarna nån annanstans. Vill...More"
Stortorget_Bar_Restaurang,d1893307,[Swedish],67,199,24.0,4,"August 3, 2018 ",Lunch i Lund,"Gothenburg, Sweden",Trevlig restaurang mitt på Stortorget i Lund. God lunch och bra service. Det finns även andra utbud än dagens på...More
Stortorget_Bar_Restaurang,d1893307,[Swedish],67,1,,1,"July 15, 2018 ",Fruktansvärt!,"Lund, Sweden",Personalen är otroligt otrevlig och inte alls tillmötesgående. Har själv jobbat inom restaurang i många år och detta är under...More
Stortorget_Bar_Restaurang,d1893307,[Swedish],67,180,31.0,2,"July 14, 2018 ",Bra läge - kass service!,"Lund, Sweden",Tog en öl med polaren på den lilla uteserveringen närmst ingången. Tänkte äta också men vi avstod efter kass service...More
Stortorget_Bar_Restaurang,d1893307,[Swedish],67,1,,1,"May 19, 2018 ",Oförskämd personal/hemska vakter,"Malmo, Sweden",Vilken förolämpling att vi i ett sällskap på städade vuxna människor  blev avvisade och nekade att beställa mat&dryck i resaurangen...More
Stortorget_Bar_Restaurang,d1893307,[Swedish],67,1,6.0,1,"May 18, 2018 ",Förfärlig vakt,,"Var på ett överfyllt herkules, satt på armstödet på en soffa,  en vakt kom och började vifta, förstod ej utan...More"
Stortorget_Bar_Restaurang,d1893307,[Swedish],67,1,,5,"February 2, 2018 ",fantastiskt,,Jag har varit här många gånger nu både kväll och lunch och måste säga att vi har fått riktigt vällagad...More
Stortorget_Bar_Restaurang,d1893307,[Swedish],67,1,12.0,1,"December 26, 2017 ",Galen bartender,,Skulle gå ut o ta en dricka med några kompisar på juldagen. Ser en kille försöka beställa öl genom att...More
Stortorget_Bar_Restaurang,d1893307,[Swedish],67,108,12.0,5,"October 18, 2017 ",Trivsamt ställe med bra mat,"Lund, Sweden","Stortorget i Lund är verkligen ett ställe att trivas på. Trevlig lokal med flera vinklar och vrår, olika bordsutformning. Avslappnad...More"
Stortorget_Bar_Restaurang,d1893307,[Swedish],67,3,1.0,4,"September 1, 2017 ",jätte bra service,"Lund, Sweden","Jag lunchade med min kompis där med hennes bebis. Jätte kunniga och trevliga personal. 
Man fick bra hjälp och man...More"
Stortorget_Bar_Restaurang,d1893307,[Swedish],67,237,37.0,4,"August 23, 2017 ",Härligt läge,"Perstorp, Sweden",Fint läge mitt i stan. Snabb service av trevlig personal. Vi tog cheeseburgare allihopa med pomfrittes. Väldigt god burgare
Stortorget_Bar_Restaurang,d1893307,[Swedish],67,1,,4,"August 5, 2017 ",God mat ,,Familj med barn som beställde entrecote pizza och räkmacka. Maten var fantastiskt god och kom in samtidigt. God öl kanske...More
Stortorget_Bar_Restaurang,d1893307,[Swedish],67,123,23.0,3,"August 3, 2017 ",Trevlig uteservering men medel mat,"Kavlinge, Sweden",Vi var här för en lunch och fick ett trevligt bord. Bra personal men tyvärr så blev burgaren lite av...More
Stortorget_Bar_Restaurang,d1893307,[Swedish],67,7,3.0,1,"June 22, 2017 ",Patetiskt och pinsamt,"Lund, Sweden","Nej tack, hit går jag aldrig igen. Läget är ju magiskt men personalens nedlåtande snobbiga tönt-attityd sabbar allt."
Stortorget_Bar_Restaurang,d1893307,[Swedish],67,251,51.0,3,"May 27, 2017 ",Begränsad meny och bara en ölsort,"Loddekopinge, Sweden","Satt på uteserveringen en magisk kväll i maj. Mycket begränsad meny med Caesarsallad, burgare och pizza. Pizzorna var jättegoda, inget...More"
Stortorget_Bar_Restaurang,d1893307,[Swedish],67,7,6.0,2,"April 22, 2017 ",Lunchservering.,"Lund, Sweden","Har varit så bra en gång i tiden, inte längre måste jag motvilligt medge. Maten är inte mer än ok,...More"
Stortorget_Bar_Restaurang,d1893307,[Swedish],67,2,3.0,1,"April 5, 2017 ",Tänker inte komma tillbaka,,"Bra första bemötande men det va väl allt.
Otroligt dålig uppmärksamhet och de som jobba hade ett väldigt drygt sätt...More"
Stortorget_Bar_Restaurang,d1893307,[Swedish],67,3,,3,"January 1, 2017 ",Bestäm er.,"Malmo, Sweden","Bra mat, riktigt bra. Suverän service. Tyvärr spelade de musik lite väl högt. Helt ok om man står i baren,...More"
Stortorget_Bar_Restaurang,d1893307,[Swedish],67,1,11.0,1,"December 14, 2016 ",Katastrofal service,"Danderyd, Sweden","Avråder folk att gå hit. Otrevlig och okunnig personal. Maten håller en okej standard. Klart inte prisvärt.

Åt middag men...More"
Stortorget_Bar_Restaurang,d1893307,[Swedish],67,8,2.0,3,"November 29, 2016 ","Bra häng maten sådär,,,,","Lund, Sweden","Ett av Lund bästa barhäng men maten var inget speciellt, inte dålig men heller inte bra.
Trevlig personal."
Stortorget_Bar_Restaurang,d1893307,[Swedish],67,220,47.0,4,"November 15, 2016 ",Inte i en tidning!,"Kavlinge, Sweden",Måndagskväll i Lund och hungriga stegade vi in i Stortorgets Restaurang. Den lite trånga men genommysiga lokalen var som vanligt...More
Stortorget_Bar_Restaurang,d1893307,[Swedish],67,36,1.0,4,"September 22, 2016 ",Trevlig uteservering!,"Lomma, Sweden",Alltid trevligt att besöka Stortorgets uteservering. Bra utbud av öl och även hyffsat kök. Alltid mycket folk... lite av ett...More
Stortorget_Bar_Restaurang,d1893307,[Swedish],67,49,43.0,1,"September 6, 2016 ",Herkules vakter borde skämmas.,"Lund, Sweden","Var ute med mina 2 vänner & gick till Herkules nattklubb när uteserveringen stängde.
Barpersonalen är trevlig & har inget...More"
Stortorget_Bar_Restaurang,d1893307,[Swedish],67,94,7.0,4,"September 4, 2016 ",Humorkväll,"Lund, Sweden","Skön sensommar kväll på uteserveringen
Åt Cesarsalad och var supernöjd
Bra service och trevligt att sitta"
Stortorget_Bar_Restaurang,d1893307,[Swedish],67,19,9.0,2,"August 26, 2016 ",Middag,"Karon, Thailand",Det blev en besvikelse och flera! Baren och restaurangen har tidigare alltid hållt måttet. Nu har vi varit här för...More
Stortorget_Bar_Restaurang,d1893307,[Swedish],67,30,4.0,4,"August 5, 2016 ",Klassisk Lund-restaurang,,På stortorget vet man vad man får. Menyn är hyfsat liten men den är vällagad. Jag gillar laxen och ceasarsalladen....More
Stortorget_Bar_Restaurang,d1893307,[Swedish],67,118,44.0,3,"July 27, 2016 ",Tappat stinget ,"Ostersund, Sweden",Jag har besökt Stortorget resturang ett antal gånger genom åren. Jag har upplevt Stortorget R som en bra resturang med...More
Stortorget_Bar_Restaurang,d1893307,[Swedish],67,41,3.0,4,"July 27, 2016 ",Ostkaka,,"Härlig kväll, underbart väder i goda vänners sällskap.  Pizza med ost, någon åt råbiff. Suveränt god mat och ostkaka, jag...More"
Stortorget_Bar_Restaurang,d1893307,[Swedish],67,3,3.0,2,"July 16, 2016 ",Besviken,,"Varit här flertalet ggr och alltid känt att det varit en positiv upplevelse. Just därför har jag kommit tillbaka.
Idag...More"
Stortorget_Bar_Restaurang,d1893307,[Swedish],67,193,21.0,4,"June 4, 2016 ",Lördagslunch med räkmacka,"Lund, Sweden",Solen skiner och värmen stiger. Vad kan passa bättre än en räkmacka och en öl på Stortorget. Räkmackan på Stadsparkscaféet...More
Stortorget_Bar_Restaurang,d1893307,[Swedish],67,66,23.0,2,"June 3, 2016 ",uppsträckning från personalen,Sweden,"Vi firade vår sons 25 års dag. Vi fick ett bord på uteserveringen. Det var mycket folk och kö, men...More"
Stortorget_Bar_Restaurang,d1893307,[Swedish],67,64,28.0,3,"June 3, 2016 ",Medemåttigt ,"Gothenburg, Sweden","Restaurang Stortorget har funnits i många år. När restaurangen öppnade var intentionerna höga och maten av god kvalité. 

Nyhetens behag...More"
Stortorget_Bar_Restaurang,d1893307,[Swedish],67,13,3.0,4,"February 27, 2016 ",Bar häng,"Sigtuna, Sweden",Mysigt ställe bra musik. Baren väl fylld med allt dricka man kan. På fat har man wisby i alla sorter....More
Stortorget_Bar_Restaurang,d1893307,[Swedish],67,65,16.0,3,"January 18, 2016 ",Middag,"Lomma, Sweden",Bra ställe med hyfsade priser och väldigt mysig miljö. Det som hindrar ett högre betyg är att storleken på portionen...More
Stortorget_Bar_Restaurang,d1893307,[Swedish],67,226,69.0,2,"December 11, 2015 ",Högt ljud!!,"Lund, Sweden",Jag hade inte varit på Stortorget på flera år och blev tyvärr besviken. Ljudnivån var på gränsen till olidlig på...More
Stortorget_Bar_Restaurang,d1893307,[Swedish],67,11,7.0,5,"September 1, 2015 ",Bästa stället i Lund för alla!,,Tycker Stortorget har fått till helheten med allt från lunch till restaurang och nattklubb. Oerhört trevlig personal och kvalité på...More
Stortorget_Bar_Restaurang,d1893307,[Swedish],67,63,19.0,4,"August 17, 2015 ",Mysigt hak och god pizza,"Vaxjo, Sweden","Mysig krogmiljö, rätt så trångt men tyckte det bidrog till skön stämning. Supergoda pizzor, testade den med chilisalami, ruccola och...More"
Stortorget_Bar_Restaurang,d1893307,[Swedish],67,117,31.0,3,"August 2, 2015 ",Trevlig atmosfär.,"Lund, Sweden",En restaurang med trevlig atmosfär och dekor etc. Tyvärr hänger inte maten riktigt med vilket sänker betyget kraftigt. Servicen är...More
Stortorget_Bar_Restaurang,d1893307,[Swedish],67,13,4.0,3,"July 30, 2015 ",Skönt hak,"Stockholm, Sweden",Riktigt skönt hak för en pilsner eller helst många. Förvänta dig inte förmycket av maten. Bäst är att äta någon...More
Stortorget_Bar_Restaurang,d1893307,[Swedish],67,4,3.0,3,"July 29, 2015 ",Gemytlig miljö,"Gothenburg, Sweden",Trevlig uteservering och enkel men lite udda inredning. Väldigt dyr öl så även om det ligger centralt i gyttret skulle...More
Stortorget_Bar_Restaurang,d1893307,[Swedish],67,86,169.0,2,"July 14, 2015 ",Flagnad stjärna,"Lund, Sweden",Hit går man endast för att kolla på folk. Definitivt inte för att äta vällagad och prisvärd mat. Ändå hamnar...More
Stortorget_Bar_Restaurang,d1893307,[Swedish],67,34,14.0,2,"July 8, 2015 ",Ta ett glas men kanske inte mat,"Siem Reap, Cambodia",Stortorget och systerbaren  Herkules lever på sitt läge - jättemysiga sommarställen med utmärkt span. Men maten är alldeles för ojämn...More
Stortorget_Bar_Restaurang,d1893307,[Swedish],67,65,9.0,3,"May 31, 2015 ",Trevligare dryck- än matställe,"Lund, Sweden",Maten är helt ok men förhållandevis dyrt. På sommaren är det en trevlig uteservering med bra läge. Inomhus är det...More
Stortorget_Bar_Restaurang,d1893307,[Swedish],67,6,4.0,2,"May 17, 2015 ",God öl och trevlig personal räddar inte dåliga rätter.,"Malmo, Sweden","På Stortorget blev jag och mitt sällskap väl omhändertagna av den trevliga personalen. Det, tillsammans med det intressanta ölutbudet,mvar också...More"
Stortorget_Bar_Restaurang,d1893307,[Swedish],67,41,7.0,1,"April 29, 2015 ",Dåligt,,Drygt ställe.                         kanske dra till malmö istället. Sega vakter. Dåligt väl inne. Dålig kvalité på drinkarna
Stortorget_Bar_Restaurang,d1893307,[Swedish],67,3,1.0,4,"March 18, 2015 ",Sommarens mysigaste ställe,,"Uteserveringen på Stortorget är helt klart det mysigaste stället att spendera sina sommarkvällar på!
Med rolig personal, god mat och...More"
Stortorget_Bar_Restaurang,d1893307,[Swedish],67,13,4.0,4,"January 17, 2015 ",Bra burgare (obs herkules bar),"Malmo, Sweden","Riktigt bra burgare men obs på deras systerbar herkules, till vänster om själva resturangen så förväxla inte.

Har testat burgaren...More"
Stortorget_Bar_Restaurang,d1893307,[Swedish],67,146,45.0,4,"October 26, 2014 ",Rustik skön krogmiljö,"Linkoping, Sweden","Vid ca 13.30  steg jag in på denna restaurangen som ligger precis intill Stortorget. Två rätter erbjöds: salladstallrik och räkmacka,...More"
Stortorget_Bar_Restaurang,d1893307,[Swedish],67,54,20.0,4,"September 22, 2014 ",Riktigt bra lunchställe,,Vi har ätit lunch här två gånger det senaste året när vi har varit på besök i Lund. Välgjord mat...More
Stortorget_Bar_Restaurang,d1893307,[Swedish],67,58,29.0,4,"July 26, 2014 ",Mycket god mat och snabb service,"Stehag, Sweden",Jag och min sambo var på Stortorget för att äta lunch en varm och solig  lördag När vi kom till...More
Stortorget_Bar_Restaurang,d1893307,[Swedish],67,25,54.0,2,"July 12, 2014 ",Mycket små portioner och överpriser,"Malmo, Sweden",Trevlig uteservering men tyvärr förstördes upplevelsen av de extremt små portionerna till mycket höga priser. Stället håller inte den klass...More
Stortorget_Bar_Restaurang,d1893307,[Swedish],67,167,40.0,1,"March 8, 2014 ",Dåligt,"Lund, Sweden","Extremt dålig service, personalen är helt ointresserad av kunderna.Har idag ätit min sämsta Wallenbergare ,normalt en av mina favorit rätter,...More"
Stortorget_Bar_Restaurang,d1893307,[Swedish],67,2,4.0,1,"September 22, 2013 ",Urusel service och sanslösa överpriser,Lund,"Stortorget på Kulturnatten - vilken mardrömsupplevelse. Absolut ingen service - fick torka av bordet själv, beställa mat och dricka i...More"
