Melinas_Matstuga,d5952983,[English],1,1,,1,"June 14, 2018 ",Magsjuk,"Lund, Sweden","Blev magsjuk efter att ha ätit en hamburgare här. Personalen är sämst, blev dåligt bemött. Kommer aldrig att äta här...More"
Melinas_Matstuga,d5952983,[English],1,26,3.0,5,"November 22, 2017 ",Så gott!!! ,,"Riktigt god snabbmat o perfekt placerat nära sjukhuset. Trevlig personal. Rekommenderas verkligen. Dom har pommes, handburgare m.m."
Melinas_Matstuga,d5952983,[English],1,44,5.0,5,"August 26, 2016 ",So ghetto and so entertaining ,,"The service is unforgetable and food is real funny combined , odd but real funky ...... Good job . The cevapi is a bigboymultimillionaireconnoseurmagnetic"
Melinas_Matstuga,d5952983,[Swedish],2,1,,1,"June 14, 2018 ",Magsjuk,"Lund, Sweden","Blev magsjuk efter att ha ätit en hamburgare här. Personalen är sämst, blev dåligt bemött. Kommer aldrig att äta här...More"
Melinas_Matstuga,d5952983,[Swedish],2,26,3.0,5,"November 22, 2017 ",Så gott!!! ,,"Riktigt god snabbmat o perfekt placerat nära sjukhuset. Trevlig personal. Rekommenderas verkligen. Dom har pommes, handburgare m.m."
Cc_House_Restaurang_och_Konferens,d1042629,[English],1,44,5.0,5,"August 28, 2016 ",Definately My type of lunchfood,,"Ok this place May not be in The center of attention , but it sure has The food you need!
Complete buffé of veggies with rhode Island or garlic sauce . Typical swedish household cooking for only 80:-skr ."
Lundalunch,d14088700,[Swedish],1,24,3.0,5,"May 16, 2018 ",Billigt och Gott,,"Det var av en slump, vägen hade leds om via Sandgatan och när jag passerade förbi såg jag en skylt...More"
Godset_Restaurang,d814251,[English],20,24,3.0,2,"October 28, 2018 ",Avoid - much better places in the surroundings,"Vellinge, Sweden","This used to be a great restaurant. Now it isn't. I imagine there was a change of owners, but the food here is now mediocre at best, and the service makes the food seem good. I took a group from work there - booked in...More"
Godset_Restaurang,d814251,[English],20,2271,675.0,4,"May 26, 2017 ",Cheap beer and a deck on platform 1,,"The beers I had were under 70kr for a large so seemed cheaper than any others I had in Sweden, and the deck on platform 1 is both pleasant and convenient. I decided I didn't have time to order a proper meal - the salad...More"
Godset_Restaurang,d814251,[English],20,101,32.0,4,"February 11, 2017 ",Great option at Lund station,"Amsterdam, The Netherlands",This is a spacious restaurant which offers a complimentary salad buffet on top of a great choice of meals. I had the Entrecote which was a good quality meat. Lunch price was 96 SEK. Big choice of Cider and Beers. Quick service.
Godset_Restaurang,d814251,[English],20,20,4.0,2,"July 19, 2016 ",Slow and very few visitors,"Lund, Sweden","Though a great location, the place is totally empty and no staff to attend to you (tuesday). Finally somebody turns up and seems surprised to see us, alrhough we had booked a table for three. We turned and went elsewhere. I have been at this...More"
Godset_Restaurang,d814251,[English],20,12,3.0,3,"June 1, 2016 ",Cool building with average food,,The old building has a very nice and convenient location near the train station which makes it perfekt for a beer just before one goes for a travel. In the summer time the veranda is nice to sit and soak up the sun. The food...More
Godset_Restaurang,d814251,[English],20,284,103.0,4,"April 28, 2016 ",Lunch deal,"Lund, Sweden","The restaurant changed management/ownership and style often. We used to take guests there, maybe 10 years ago, but have not been bac recently. Walked past today and was suprised to see a blackboard of lunch specials for under SEK100. Order and pay at the bar...More"
Godset_Restaurang,d814251,[English],20,36,14.0,3,"September 18, 2015 ",Has gone from a true destination to just be a good restaurant.,"San Francisco, California","Has gone from a destiny The likable atmosphere is still here but the white linen restaurant seems gone to be a more average lunch restaurant with good food. But were have the attention to details and service gone. I’m might be too harsh, but the...More"
Godset_Restaurang,d814251,[English],20,501,147.0,5,"June 26, 2015 ",Fantastic,"Cambridge, United Kingdom","What a lovely burger is amazing with a real surprise crime brûlée was exceptional, good selection of wines would love to return place amazing food fantastic waitress really good fun. The crime brûlée fantastic I hope I can return someday."
Godset_Restaurang,d814251,[English],20,102,28.0,3,"October 21, 2014 ",Dinner with friends,Chicago,Had dinner with 12 friends. Seating upstairs is nice and allows group conversation. Good range of food choices. OK food quality. Service is not that great - the waitress seemed annoyed when there was little bit of confusion when food arrived. Seemed to be just...More
Godset_Restaurang,d814251,[English],20,224,86.0,4,"October 4, 2014 ",Good place for a dinner,"Rheinfelden, Switzerland",It is a little unusual to get such good food that close to a train station - normally it is fastfood what is served - but not here! The menue offers a good selection of different swedish dishes and pasta. All is freshly prepared and...More
Godset_Restaurang,d814251,[English],20,9,2.0,2,"July 8, 2014 ",The most uninterested waiter ever,"Stockholm, Sweden","I had three hours to waste and thought a starter, a main course and one or two glasses of wine would be great. However, I was greatly disappointed as the waiter totally ignored me as a guest after taking my order. She brought the starter...More"
Godset_Restaurang,d814251,[English],20,486,156.0,2,"January 4, 2014 ",terrible service!!!,"Lund, Sweden","A group of ladies wanted to have a nice lunch out.  We made a reservation but when we arrived, they didn't seem to be ready.  We had to get our own glasses, water, silverware, etc. and our food came out and VERY different times and...More"
Godset_Restaurang,d814251,[English],20,153,162.0,3,"May 26, 2013 ",Perfectly adequate - but no more,Weston-super-mare,Attached to the station and platforms. There is a quiet atmosphere and the food was ok - nothing stunning but adequate. Service was good.
Godset_Restaurang,d814251,[English],20,15,1.0,1,"October 7, 2012 ",Terrible food and poor service,Lund,"Ordered their steaks - dry meet, dry potatoes, tasteless sause and sallad like in a ""gatukök"". Low prices do not make up foor the lousy experience."
Godset_Restaurang,d814251,[English],20,657,161.0,3,"September 20, 2012 ",Typical student restaurant,"Stockholm, Sweden","Went here with my daughter, recently moved to Lund. Good service. Food average. Low price. Calm atmosphere. Good beer."
Godset_Restaurang,d814251,[English],20,73,18.0,4,"September 12, 2012 ",good meals,Sondalo,"Simple and traditional meals, I enjoyed my staying there. There is a big clock in the entrance and is close to the railway station. Soups and meats it is what I recommend."
Godset_Restaurang,d814251,[English],20,30,17.0,3,"February 1, 2012 ",Over priced,"Lund, Sweden",Staff are excellent but the food is fairly uninspiring amd way overpriced. There are better options in Lund.
Godset_Restaurang,d814251,[English],20,342,161.0,3,"January 23, 2012 ",Not worth the money,Lund,This restaurant located in an old station building could be a very nice place but there is something wrong with it. Several proprietors have tryed to run the place without success. The place could have been nice but the decor is very amateurish. Food is...More
Godset_Restaurang,d814251,[English],20,197,50.0,4,"August 11, 2011 ",Very nice dining at the train station,"San Francisco, California","Took a group of business colleagues for dinner, and enjoyed it very much.  Nice, comfortable decor, courteous service, good food, and good portions.  Nobody walked away hungry."
Godset_Restaurang,d814251,[English],20,1,1.0,4,"January 7, 2008 ",Provides nice lunch and...,"Lund, Sweden",Provides nice lunch and a cosy atmosphere. Still have to try the a la carte though.
Godset_Restaurang,d814251,[Swedish],31,98,16.0,2,"December 21, 2017 ",Medelmåttig buffé,"Lund, Sweden",Godset brukade servera helt ok luncher med möjlighet att dricka öl eller vin till. Nu har dom bara en enkel...More
Godset_Restaurang,d814251,[Swedish],31,43,3.0,1,"July 20, 2017 ",Laxsallad,"El Albir, Spain",Absolut sämsta laxsallad jag någonsin ätit. Dålig smak på allt utom avocadon. Rekommenderas inte! Välj annan restaurang om möjligt.
Godset_Restaurang,d814251,[Swedish],31,5,3.0,5,"June 2, 2017 ",Alltid lika bra!,,Har inte lagt märke till godset på 7 år men ätit där i 1 år i rad nu.. väldigt god...More
Godset_Restaurang,d814251,[Swedish],31,2,1.0,5,"May 28, 2017 ",God morsdagsmiddag,,"Trevlig tillmötesgående personal.
Åt teryaki-laxen vilken var fantastiskt god. 
Mycket mat, prisvärt och bra centralt läge. 
Kommer gärna tillbaka"
Godset_Restaurang,d814251,[Swedish],31,14,1.0,2,"March 13, 2017 ",Ordinär krogmat,,"Trevlig AW,ofta med tacotema.
Pittoresk uteservering på trädäck längs järnvägsspåret
Övrig mat av medelkvalite"
Godset_Restaurang,d814251,[Swedish],31,1,,5,"February 24, 2017 ",Lunch,,"Åt en väldigt god Lasagne där.
Trevlig personal och fin miljö
Ligger centralt vid järnvägsstationen.
Passar bra som landningsplats efter...More"
Godset_Restaurang,d814251,[Swedish],31,101,15.0,4,"January 14, 2017 ",God lunch,"Helsingborg, Sweden","Ätit här flera gånger. Gärna bra kvalité på den mat vi fått. Bra service, bra miljö. Har både ätit Snitzel,...More"
Godset_Restaurang,d814251,[Swedish],31,79,15.0,4,"January 2, 2017 ",Bra lunch,"Lund, Sweden","Bra mat till bra pris, mysig miljö i en ombyggd godslokal, mycket centralt läge alldeles intill centralstationen o gångavstånd till...More"
Godset_Restaurang,d814251,[Swedish],31,128,33.0,2,"November 4, 2016 ","Kall ""rödvinsås"" botten betyg tyvärr ","Lund, Sweden","Kunde varit ett bra ställe, placering o miljö passar men tyvärr inte maten.
Hur man kan ""misshandla"" en ryggbiff så...More"
Godset_Restaurang,d814251,[Swedish],31,45,2.0,5,"October 18, 2016 ",Gourmémat,,"Otroligt god mat och fina faciliteter. Närheten til Centralstationen och Busshållplats gör det lätt att nå restaurangen 
och trevlig personal...More"
Godset_Restaurang,d814251,[Swedish],31,9,2.0,2,"July 8, 2014 ",The most uninterested waiter ever,"Stockholm, Sweden","I had three hours to waste and thought a starter, a main course and one or two glasses of wine would be great. However, I was greatly disappointed as the waiter totally ignored me as a guest after taking my order. She brought the starter...More"
Godset_Restaurang,d814251,[Swedish],31,486,156.0,2,"January 4, 2014 ",terrible service!!!,"Lund, Sweden","A group of ladies wanted to have a nice lunch out.  We made a reservation but when we arrived, they didn't seem to be ready.  We had to get our own glasses, water, silverware, etc. and our food came out and VERY different times and...More"
Godset_Restaurang,d814251,[Swedish],31,153,162.0,3,"May 26, 2013 ",Perfectly adequate - but no more,Weston-super-mare,Attached to the station and platforms. There is a quiet atmosphere and the food was ok - nothing stunning but adequate. Service was good.
Godset_Restaurang,d814251,[Swedish],31,15,1.0,1,"October 7, 2012 ",Terrible food and poor service,Lund,"Ordered their steaks - dry meet, dry potatoes, tasteless sause and sallad like in a ""gatukök"". Low prices do not make up foor the lousy experience."
Godset_Restaurang,d814251,[Swedish],31,657,161.0,3,"September 20, 2012 ",Typical student restaurant,"Stockholm, Sweden","Went here with my daughter, recently moved to Lund. Good service. Food average. Low price. Calm atmosphere. Good beer."
Godset_Restaurang,d814251,[Swedish],31,73,18.0,4,"September 12, 2012 ",good meals,Sondalo,"Simple and traditional meals, I enjoyed my staying there. There is a big clock in the entrance and is close to the railway station. Soups and meats it is what I recommend."
Godset_Restaurang,d814251,[Swedish],31,30,17.0,3,"February 1, 2012 ",Over priced,"Lund, Sweden",Staff are excellent but the food is fairly uninspiring amd way overpriced. There are better options in Lund.
Godset_Restaurang,d814251,[Swedish],31,342,161.0,3,"January 23, 2012 ",Not worth the money,Lund,This restaurant located in an old station building could be a very nice place but there is something wrong with it. Several proprietors have tryed to run the place without success. The place could have been nice but the decor is very amateurish. Food is...More
Godset_Restaurang,d814251,[Swedish],31,197,50.0,4,"August 11, 2011 ",Very nice dining at the train station,"San Francisco, California","Took a group of business colleagues for dinner, and enjoyed it very much.  Nice, comfortable decor, courteous service, good food, and good portions.  Nobody walked away hungry."
Godset_Restaurang,d814251,[Swedish],31,1,1.0,4,"January 7, 2008 ",Provides nice lunch and...,"Lund, Sweden",Provides nice lunch and a cosy atmosphere. Still have to try the a la carte though.
Godset_Restaurang,d814251,[French],1,18,9.0,4,"April 17, 2015 ",Un endroit calme près de la gare,"Huisseau-sur-Cosson, France","Nous y avons mangé deux fois lors de notre séjour à Lund.
A chaque fois l'accueil y était agréable, et...More"
Godset_Restaurang,d814251,[Italian],1,7,11.0,4,"February 27, 2011 ","Buon cibo, posto carino","Genoa, Italy","E' davvero un posto carino dove cenare. Il posto è in una posizione facile da trovare, vicino alla stazione del...More"
DJ_Burgare,d5949345,[English],1,95,32.0,1,"May 17, 2017 ",Improvised service,"Malmo, Sweden","DJ Burger used to have a kind of cult status because of its supply of exotic and spicy sausages. But those days are long gone now. The latest owner have refurbished the place and improved the sitting area. However, the treatment of the food leaves...More"
DJ_Burgare,d5949345,[Swedish],2,45,4.0,5,"October 29, 2018 ",Rest in pieces!,,"KG's lokala hak, först försvann macken och nu gick DJ B upp i lågor, tråkigt men som tur det är...More"
DJ_Burgare,d5949345,[Swedish],2,72,20.0,4,"December 8, 2017 ",Var mycket bra men finns inte längre,"Lund, Sverige",Hade stans bästa utbud av ungerska korvar.  Tyvärr brann den ner i början av december och finns inte längre.  Ev....More
Restaurang_Ninar,d13565181,[English],1,215,59.0,3,"August 27, 2018 ",Just a buffet,"Lund, Sweden","I was having higher expectations as someone recommended me this place, but I was a bit disappointed.
The first thing that caught my attention was that the atmosphere was a bit strange. I felt out of place.
The buffet was quite varied and the food...More"
Restaurang_Ninar,d13565181,[Swedish],1,15,3.0,4,"February 22, 2018 ",En stor orientalisk buffe till bra pris.,"Lund, Sweden","Lugn restaurang med lite musik ibland.Det finns sallad,kött,fisk,kyckling och vegetariskt.Idag en god kaka till kaffet.Turkiskt the finns också."
Subway,d5943779,[English],6,312,124.0,4,"January 6, 2017 ",Always a reliable sandwich.,"Zaventem, Belgium",Another American type sandwich shop that provides hot and cold subs.  Many selections to choose from.  Can eat in or take away.  Prices are reasonable and place clean.
Subway,d5943779,[English],6,19,1.0,4,"August 3, 2016 ",A good sandwich with all you can think of!,"Lund, Sweden","Nice offer for good price.
You can get your sub heated in the oven - warm and nice cheese sub or just as it is. Many options to choose italian salami, ham, tuna,chicken,  olives, onion, lettuce, mustard, oil & vinegar, two types of cheese, tomato,...More"
Subway,d5943779,[English],6,72,20.0,2,"July 25, 2016 ","""Sub""-standard Subway ","Lund, Sverige",A franchise restaurant like Subway relies heavily on the restaurant holding to an expected standard.  This applies to recipes as well as using fresh ingredients. This restaurant used to have this standard but something has gone wrong recently.  Perhaps is it an attempt to save...More
Subway,d5943779,[English],6,76,30.0,2,"July 1, 2016 ",Subway is the McDonalds of sandwiches,"Lund, Sweden","Quite pricey, soggy bread and often a mish mash of cold cuts and other ingredients. I like my food fresh and genuine, this is definately not a place for me."
Subway,d5943779,[English],6,178,33.0,4,"March 6, 2016 ",Fresh and nice.,,A healthier kind of fastfood. Great variety of sandwiches (subs). Get a long one If you're really hungry or take a half If you just want a snack. Fast and tasty.
Subway,d5943779,[English],6,486,156.0,3,"January 4, 2014 ",good price and you know what you get,"Lund, Sweden","go for the sub of the day, it\s a bit cheaper.  The place just across from the train station is conveniently located if you want to take a sandwich with you on the train."
Subway,d5943779,[Swedish],7,60,120.0,3,"August 20, 2018 ",Man vet vad man får,Sweden,"Särskilt då jag hittat min favorit, Chicken Teryaki, med allt som går stoppa i , utom sallad och med en...More"
Subway,d5943779,[Swedish],7,128,33.0,2,"February 27, 2018 ",Ta hand om alla,"Lund, Sweden","Era Subs är helt okej,
Vi reagerade dock på att en av er idag avvisade en pojke som inte hade...More"
Subway,d5943779,[Swedish],7,338,26.0,3,"August 21, 2016 ",Helt ok Subwah,"Svalov, Sweden","Subway är som McD, likadant oavsett var du kommer. Och man blir aldrig besviken. Bra mackor till riktigt bra pris....More"
Subway,d5943779,[Swedish],7,3,,2,"May 17, 2016 ",Vanligt ställe utan charm,"Lund, Sweden","Lika spännande som alltid, men man vet vad man får. Men ett schysst subway i alla fall. Inget vidare mysigt...More"
Subway,d5943779,[Swedish],7,3,1.0,4,"October 29, 2015 ",Bra snabbmat,,"Ett bra snabbmatshak. Fräscha mackor, gjorda på beställning. Bra med sittplatser. Välstädat och rent."
Subway,d5943779,[Swedish],7,20,4.0,5,"September 6, 2015 ",En hundring för mättande smörgås,"Lund, Sweden",Lite dyrt men gillar man smörgåsar så är det helt okej. För en hundring blir du mätt o personalen är...More
Subway,d5943779,[Swedish],7,264,56.0,4,"August 12, 2015 ",Fräscht med goda mackor,"Lund, Sweden",Fräscht ställe med pigg och glad personal och goda mackor. Subway tycker jag generellt är ett säkert kort när man...More
Subway,d5943779,[Russian],1,71,24.0,4,"December 5, 2015 ",Стандартный сабвей,"Lund, Sweden",Свежие сендвичи и безалкогольные напитки. В Швеции очень популярен острый итальянский сендвич. Овощи всегда можно попросить положить побольше
Grillstation,d7248003,[English],1,192,58.0,4,"October 11, 2014 ",way better than award winning falafel!,"Ostrava, Czech Republic","Me and friend of mine had a lunch in this place and we absolutely loved it. We tried falafel for the first time in Malmö in Falafel #1, which was supposed to be an award winning restaurant. Falafel in this place, however, was way better!...More"
Grillstation,d7248003,[Swedish],3,58,23.0,3,"February 17, 2017 ",Döm inte hunden efter håren,,"Från utsidan ser Grillstation inte mycket ut för världen, men såväl kebaben som falafeln är bra och många gånger blir...More"
Grillstation,d7248003,[Swedish],3,17,5.0,4,"December 5, 2016 ",Smakfullt o fräscht,"Malmo, Sweden","Mycket god mat och väl tilltagna portioner.
Rekommenderar kebaben!
Pizzorna stora, välfyllda och goda."
Grillstation,d7248003,[Swedish],3,192,58.0,4,"October 11, 2014 ",Mycket bättre än prisbelönta falafelhak!,"Ostrava, Czech Republic",Jag och vän till mig hade en lunch på detta ställe och vi älskade det. Vi försökte falafel för första...More
Grillstation,d7248003,[Japanese],1,1412,403.0,3,"September 27, 2016 ",ドネルケバブなどが食べられる店,"Maebashi, Japan",ルンドを観光していて時間が無い時には手軽にドネルケバブなど食べられるこの店がおすすめです。ドネルケバブは６００円程度でし...More
Amazing_Thai_Restaurang_in_Lund,d5952943,[English],6,1,,2,"August 1, 2017 ",Not tasty,,It didn't feel that it was fresh food and the made it that day. We skipped one of the dishes and tried to pick eatable parts which was not smelling old.
Amazing_Thai_Restaurang_in_Lund,d5952943,[English],6,125,93.0,4,"July 29, 2017 ",Reasonable ,"Abergele, United Kingdom","Reasonably good food at a good price, could do with having an English menu however the pictures on the menu were really helpful."
Amazing_Thai_Restaurang_in_Lund,d5952943,[English],6,27,7.0,5,"February 9, 2017 ",Best Thai in Lund,"Baltimore, Maryland",I have eaten Thai food all over the world including Thailand. Amazing Thai has the best Thai food in Lund. If you order online you get big portions and also they deliver directly to the apartment door.
Amazing_Thai_Restaurang_in_Lund,d5952943,[English],6,2,,2,"November 6, 2016 ",Terrible service ,,I've been here a couple times and the service is always below par. The people working in the front of the house don't seem to care that you are there and help you at there convince. The food is good but never ready on time....More
Amazing_Thai_Restaurang_in_Lund,d5952943,[English],6,44,5.0,5,"September 18, 2016 ","Thaifood at its best , aroy aroy",,"Nice food for a Big brother ! Like every other thai place theres a great dilemma . If you eat ala carte youll never be satified ... Too little food and if you eat buffé it makes you too heavy !
But taste is awesome...More"
Amazing_Thai_Restaurang_in_Lund,d5952943,[English],6,215,59.0,2,"January 29, 2016 ",A quite forgettable lunch,"Lund, Sweden","We went for having lunch here on the recommendation of a friend and I was not very thrilled by what I ate.
The place itself is nothing fancy, quite small and not incredibly cleaned. But I could live with that if the food would have...More"
Amazing_Thai_Restaurang_in_Lund,d5952943,[Swedish],18,1,,2,4 weeks ago ,"God mat, dålig service",,"God mat men dålig service! Hemsidan stämmer inte överens med vad resuatutangen faktiskt har på menyn. Priserna stämmer inte heller,...More"
Amazing_Thai_Restaurang_in_Lund,d5952943,[Swedish],18,1,,1,"August 22, 2018 ","Sämsta servicen jag varit med om, gå aldrig dit",,Jag gick in och beställde en grön curry att ta med. Efter en rimlig tid på 10-15 min kommer dom...More
Amazing_Thai_Restaurang_in_Lund,d5952943,[Swedish],18,10,2.0,2,"June 14, 2018 ",Så där...,,"Personalen har ingenting att göra med thai, maten inte heller...höga priser:-( man måste betala 25kr extra om man äter på...More"
Amazing_Thai_Restaurang_in_Lund,d5952943,[Swedish],18,1,,5,"January 8, 2018 ",Amazing thai,,"Har varit här under lunch tid på buffén och på kvällen, alltid lika bra. Personalen har alltid varit lika trevliga."
Amazing_Thai_Restaurang_in_Lund,d5952943,[Swedish],18,1,1.0,1,"June 4, 2017 ",Gå inte ditt,,Fick vänta i över en 1 timme på att få maten och blev inte väl bemöt av personalen som ignorerade...More
Amazing_Thai_Restaurang_in_Lund,d5952943,[Swedish],18,251,51.0,3,"June 3, 2017 ",Lunchbuffé utan knorr,"Loddekopinge, Sweden",Har varit här ett par gånger och ätit lunchbuffé. God mat föralldel men inte särskilt spännande. Kunde ha varit lite...More
Amazing_Thai_Restaurang_in_Lund,d5952943,[Swedish],18,2,2.0,1,"January 17, 2017 ","Vegetarianer, se upp!",,"Käkat har några gånger, bra mat och trevlig personal men efter kvällens vegetariska beställning av en pad thai med spår...More"
Amazing_Thai_Restaurang_in_Lund,d5952943,[Swedish],18,9,11.0,5,"October 12, 2016 ",Trevlig lunch!,,"Har lunchat här några gånger... God mat samt mkt trevlig personal!
Ända negativa anmärkning är att dem kunde renovera upp...More"
Amazing_Thai_Restaurang_in_Lund,d5952943,[Swedish],18,38,6.0,5,"October 5, 2016 ",Lunds bästa lunchbuffé,"Lund, Sweden","Riktigt god lunchbuffé till ett förmånligt pris! Har både thai, sushi och dumplings. Dessutom riktigt trevlig och tillmötesgående personal. Lever...More"
Amazing_Thai_Restaurang_in_Lund,d5952943,[Swedish],18,32,3.0,5,"August 5, 2016 ",Super god lunchbuffé ,"Lund, Sweden","Mitt favoritställe, de har supergod sushi, friterad kyckling, lökringar, vårrullar, grytor. Ett måste om du har vägarna förbi Lund och...More"
Amazing_Thai_Restaurang_in_Lund,d5952943,[Swedish],18,141,56.0,5,"March 28, 2016 ",God Thaimat till bra pris,"Lund, Sweden","Amazing Thai ligger nära centralstationen i Lund, på den sidan som inte vätter mot staden. Det fungerar därför perfekt att...More"
Amazing_Thai_Restaurang_in_Lund,d5952943,[Swedish],18,44,17.0,5,"March 22, 2016 ",Fantastisk thai-mat,"Lund, Sweden",Supergott och man får otroligt mycket mat. Trevlig personal. Lokalen är inte den finaste men köper ändå oftast take away....More
Amazing_Thai_Restaurang_in_Lund,d5952943,[Swedish],18,1,,4,"December 7, 2015 ",Catering,"Lund, Sweden",Otroligt bra service och bemötande. Vi fick riktigt god mat och mycket mat för det vi beställde till vårt bröllop....More
Amazing_Thai_Restaurang_in_Lund,d5952943,[Swedish],18,3,,1,"October 27, 2015 ",Julia,,Maten smakade bättre förr i tid. Nu smakar den inget. Dessutom mycket sämre utbud och det räcker inte till alla....More
Amazing_Thai_Restaurang_in_Lund,d5952943,[Swedish],18,5,,3,"May 30, 2015 ",Helt ok thai. ,,Bra lunchställe som avviker något från de vanliga thai/Kina/sushi-lunchställena. Buffén är inte jättestor men fullt tillräcklig. God mat och trevlig...More
Amazing_Thai_Restaurang_in_Lund,d5952943,[Swedish],18,1,,5,"December 30, 2014 ",Bäst,,"Bäst thai mat i Lund, värd och besöka den igen!! Älskar deras sushi. Personal var trevliga och gästvänliga."
Amazing_Thai_Restaurang_in_Lund,d5952943,[Swedish],18,11,6.0,4,"October 10, 2014 ",Sushi mums,"Landskrona, Sweden","Har ätit sushi härifrån (take away) och den är riktigt god, kan starkt rekommenderas!! Även den thailändska maten är god...More"
